Title,Year,Source title,Link,Abstract,Author Keywords,Index Keywords
"Beyond anaylytical categories of difference: Or, the case for 'strategic essentialism'",2008,"Academy of Management 2008 Annual Meeting: The Questions We Ask, AOM 2008",https://www.scopus.com/inward/record.uri?eid=2-s2.0-85087999638&doi=10.5465%2fambpp.2008.33625414&partnerID=40&md5=c061386fd18fd1c602dad0f30e01e630,"Management scholars habitually invoke analytical categories of difference responding to issues of systemic inequalities in organizational life. Poststructuralists and other critical theorists have cited the myriad of trajectories through which categories of difference reinscribe dichotomous modes of thinking and ignore the idiosyncrasies in processes of human identification and behavior. Extending from a poststructuralist standpoint, this paper uses the question of sexual identity to advocate for the astute mobilization of 'strategic essentialism' as a means through which critical management scholars can engage with the research and the discourse that is reliant upon identity binaries, yet, without reifying ideologically bifurcated identity classes.",Organizational research; Poststructuralist theory; Sexual orientation,Human identification; In-process; Organizational research; Poststructuralist theory; Sexual orientations; Behavioral research
Highlighting change motors at play in organizational progress toward corporate social responsibility,2008,"Academy of Management 2008 Annual Meeting: The Questions We Ask, AOM 2008",https://www.scopus.com/inward/record.uri?eid=2-s2.0-85088339096&doi=10.5465%2fambpp.2008.33649802&partnerID=40&md5=5715cd17f9e3c5c12e5579284affc3e5,"Organizational progress toward corporate social responsibility (CSR) often appears as a level-by-level process in which the firm's combination of capabilities, applied to societal issues, drives its development. By combining CSR and organizational change theories, this research underscores key CSR cultural integration phases and emphasizes the interplay among ideal-type theories of social change to provide an extensive explanation of organizational development toward CSR. Depending on the unit of analysis and timing in the organizational progress toward CSR, the primary framework we propose considers different approaches as helpful for understanding the rationale and processes at play behind the development of a CSR orientation. More especially, we underscore that organizational development toward CSR can be represented by a tri-motor theory where three of the four motors emphasized by Van de Ven and Poole (1995) - i.e. life-cycle, teleological and dialectical - operate interdependently according to the CSR cultural integration phase that characterizes the company. Together, these elements contribute to a compelling perspective on the implementation of a CSR orientation within organizations and provide extensive opportunities for further research and refined conceptualizations.",Corporate social responsibility; Organizational change; Organizational culture,Corporate social responsibilities (CSR); Integration phase; Motor theories; Organizational change; Organizational cultures; Organizational development; Societal issues; Unit of analysis; Life cycle
Developing the processual analysis of institutionalization: The case of Resource Planning systems innovation,2008,"Academy of Management 2008 Annual Meeting: The Questions We Ask, AOM 2008",https://www.scopus.com/inward/record.uri?eid=2-s2.0-85088000773&doi=10.5465%2fambpp.2008.34146237&partnerID=40&md5=036c2b09b3530d3d49a925e4899f98b0,"This paper contributes to the growing interest in the institutionalization of innovation. Drawing on the work of Barley and Tolbert (1997), the paper develops a processual approach to institutionalization which emphasizes the interplay between local level adoption of innovations, and their field-level diffusion. This interplay is seen linked to the emergence of key mechanisms of institutionalization, including role specialization, boundary-spanning activities and the production of discourse. The paper develops this processual approach through an historical, multi-level account of the evolution and spread of Resource Planning systems innovation, from the 1960's to the present-day culminating in the current generation of Enterprise Resource Planning (ERP) systems. This empirical account allows us explore the coevolution of key institutionalizing mechanisms and relate them to the development of the technologies involved. In particular, the relationship between field-level shifts in technology and the expanding scope, and challenges, of their use at local level are analysed in terms of a process of disembedding and embedding organizational and technological forms of knowledge. The resulting analysis helps us to account for the apparent contradiction between the widespread acceptance of ERP systems innovation and the chronic problems experienced in the use of such innovation. It leads to the view that RP systems innovation has become institutionalized within business practice in part because of, and not despite, the frequent failures associated with its adoption.",ERP; Innovation; Institutionalization,Resource allocation; Adoption of innovations; Boundary spanning; Business practices; Current generation; Dis-embedding; Enterprise resource planning systems; Institutionalization; Resource planning system; Enterprise resource planning
"Navigating the emotional battlefield: Gender, power and emotion in entrepreneurial relationships",2008,"Academy of Management 2008 Annual Meeting: The Questions We Ask, AOM 2008",https://www.scopus.com/inward/record.uri?eid=2-s2.0-85087244953&doi=10.5465%2fambpp.2008.33650220&partnerID=40&md5=77d66a73a6ca745686ae16f1bca28ca7,"We offer a theoretical account of how gender and emotion combine to influence the effectiveness and development of power in entrepreneurial relationships. Applying a psychological framework on the politics of emotion to the workplace, we examine the unique challenges female entrepreneurs face in managing the emotional landscape of their work relationships. We illustrate how the gendering of emotion shapes emotional displays and creates emotional double standards and double binds that create and sustain gender differences in power in work relationships. We argue that this process is amplified for female entrepreneurs and posit that male entrepreneurs can leverage emotion into power in ways that are unavailable to women. We then offer a model of an emotional episode, and drawing on the emotional intelligence, emotional learning and relational maintenance literatures, identify three core emotional competencies that female entrepreneurs can use to successfully navigate the emotional battlefields of their work relationships. Implications and areas for future research are discussed.",Emotion; Entrepreneurship; Gender,Emotion; Emotional learning; Entrepreneurship; Female entrepreneurs; Gender; Gender differences; Emotional intelligence
Strategic impulses for innovation in supply chains,2008,"Academy of Management 2008 Annual Meeting: The Questions We Ask, AOM 2008",https://www.scopus.com/inward/record.uri?eid=2-s2.0-85088186971&doi=10.5465%2fambpp.2008.33664532&partnerID=40&md5=131eef51e530a07c97f144da8bf5e39c,"Innovation is a strategic issue which needs to be aligned not only internally with overall business goals but as well externally with the environment. Suppliers particularly are confronted with manufactures' presettings related to product and process objectives, frame specifications, and target prices. We refer to those aspects as supply-chain rigidities towards innovation. This study aims to explore the complex setting for strategic impulses for innovation. We clarify how suppliers' innovation strategies and their hereby created internal capabilities cope with different degrees of supply-chain rigidity and support market success. A survey on 241 small and mid-sized companies in the high-tech sector reveals that a strategic design towards innovation increases market performance both directly and through the achievement of ""hard"" and ""soft"" innovation goals. Performance effects are dependent on the supply chain integration. A deliberate strategy seems suitable for high levels of supply chain rigidity, i.e. clear product/technology requirements and interfaces between the different tier-levels of the supply chain. An emergent strategy supports market performance through intra-firm innovation orientation under high ambiguity of supply chain requirements. Our results may assist firms in finding the right innovation planning with respect to their overall setting in the supply chain.",Innovation; Strategy; Supply chain,Commerce; Rigidity; Emergent strategies; Innovation strategy; Market performance; Performance effect; Strategic issues; Strategy; Supply chain requirements; Supply-chain integration; Supply chains
Time-consuming technology development: How imitation and spillovers affect competitive dynamics,2008,"Academy of Management 2008 Annual Meeting: The Questions We Ask, AOM 2008",https://www.scopus.com/inward/record.uri?eid=2-s2.0-85088338288&doi=10.2139%2fssrn.1151032&partnerID=40&md5=9af0fa297447778fb8efeafd16205558,"While economics oriented scholars have extensively studied R&D, they have predominantly focused on the uncertain nature of research activities. In contrast, this paper examines the time-consuming and costly - but more certain - process of technology development. We analyze the effect of imitation strategies and spillovers from technology leaders to technology followers on competitive dynamics. In particular, our model helps characterize competitive outcomes such as the rate of technology diffusion in an industry, the sustainability of technology-based competitive advantages, and relative financial performance. Our results challenge the widely accepted view that inter-firm spillovers are always beneficial to technology followers but detrimental to technology leaders. We show that leaders may have incentives to increase spillovers to induce followers to switch from concurrent to imitative technology development strategies. Conversely, follower firms may be worse off with more spillovers from technology leaders. With high spillovers, leaders expect to be imitated faster and have fewer incentives to develop a new technology, which delays its diffusion into the industry. Finally, we examine firms' differential motivations to invest in technology development capabilities. Our model derives testable relationships between important competitive and financial variables that are often empirically observable.",Imitation; Spillovers; Time-based competition,Competitive advantage; Financial performance; Imitation; Spillovers; Technology development; Technology diffusion; Technology followers; Time-based competition; Competition
"National values, performance appraisal practices, and organizational performance: A study across 21 countries",2008,"Academy of Management 2008 Annual Meeting: The Questions We Ask, AOM 2008",https://www.scopus.com/inward/record.uri?eid=2-s2.0-85088337952&doi=10.5465%2fambpp.2008.33650213&partnerID=40&md5=19ad375a5098e066dd47a37cfb78c34b,"This study focused on two complementary issues: (a) the influence of national values on performance appraisal (PA) practices adopted by organizations; and (b) the interactive effects of national values and PA practices on organizational performance indicators (absenteeism, turnover, level of productivity, innovation and service quality). In analyzing these two issues we controlled for key organizational characteristics (size, technological level, sector, service and globalization level). Data from 5,991 organizations in 21 countries were obtained for this study, using the database of CRANET (Cross-country HRM research). Data on cultural values were taken from the GLOBE (Global Leadership and Organizational Effectiveness) study and assigned to the organizations respectively. Results showed that national values explained PA strategies, confirming all related study hypotheses. Generally, values such as power distance, future orientation, uncertainty avoidance and collectivism explained the use of different PA systems. Organizational characteristics were also related to PA. In addition, we found interactions between national values and PA programs on organizational outcomes that supported the study's hypotheses. The results have strong implications for organizations operating in different cultures on how to maximize the fit between a particular culture and PA strategies in order to enhance organizational performance.",National values; Organizational outcomes; Performance appraisal,National values; Organizational characteristics; Organizational effectiveness; Organizational outcomes; Organizational performance; Organizational performance indicators; Performance appraisal; Uncertainty avoidance; Public address systems
The influence of debt on acquisition performance,2008,"Academy of Management 2008 Annual Meeting: The Questions We Ask, AOM 2008",https://www.scopus.com/inward/record.uri?eid=2-s2.0-85088185485&doi=10.5465%2fambpp.2008.33716834&partnerID=40&md5=8ba84d2d053da406c508d7aada948e58,"The prevailing perspective is that higher debt levels should positively influence acquisition performance because debt disciplines managers by limiting their ability to allocate financial resources to unproductive uses and by motivating them to work harder. However, an alternative perspective, based on the availability of critical resources and management risk balancing, suggests a negative relationship. We develop this alternative perspective and test it with a very large sample of acquisitions over a long time frame. We find that pre-announcement acquirer leverage and post-acquisition change in combined leverage are both detrimental to post-acquisition performance.",Debt; Mergers and acquisitions; Performance,Acquisition performance; Critical resources; Debt; Debt levels; Financial resources; Management risk; Performance; Post-acquisition performance; Mergers and acquisitions
An integrated framework for MNE ethical decisions: Tying MNE configuration strategy TO ISCT,2008,"Academy of Management 2008 Annual Meeting: The Questions We Ask, AOM 2008",https://www.scopus.com/inward/record.uri?eid=2-s2.0-85088186270&doi=10.5465%2fambpp.2008.33622596&partnerID=40&md5=2ecdb2732f0893e796eb3f1a4873ed0e,"In this paper, we explore the overlap between a multinational enterprise's (MNEs) strategy and ethics. We suggest that integrated social contract theory (ISCT) may not be sufficient under its current construction to address the difficult decisions that international organizations have to make as they operate in different parts of the world. We propose an integrated framework that links a firm's configuration strategy (multidomestic, global or transnational) with ISCT thus causing modifications to both theories. In doing so, we address a fundamental question in today's global environment world: Should an MNE's strategy and ethics be compatible and if so how? We also suggest that integrating the ideas of ISCT and configuration strategy opens the door for future research that can aid the wide range of multinational organization that must face conflicts as they operate in different parts of the world.",Configuration strategy; Ethics; ISCT,Configuration strategy; Current construction; Ethics; Integrated frameworks; International organizations; ISCT; Multinational enterprise; Multinational organizations; Philosophical aspects
When silence isn't golden: Measuring ostracism in the workplace,2008,"Academy of Management 2008 Annual Meeting: The Questions We Ask, AOM 2008",https://www.scopus.com/inward/record.uri?eid=2-s2.0-85087583531&doi=10.5465%2fambpp.2008.33725266&partnerID=40&md5=4ce8b934b4b5b5462841bf409d765517,"The present study outlines the development of a 10-item measure of workplace ostracism. Using five samples (including multi-source and multi-wave data), we developed a reliable scale with a unidimensional factor structure which replicated across three separate samples. The scale possessed both convergent and discriminant validity, and the scale's criterion-related validity was demonstrated through its relation with basic needs, well-being, job attitudes, job performance, and withdrawal. Overall, the present study suggests the workplace ostracism scale is a reliable and valid measure, and the workplace ostracism construct has important implications for both individuals and organizations.",Ostracism,Factor structure; Job attitudes; Job performance; Multi-Sources; Ostracism; Wave data; Well being
Towards a behavioral theory of corporate ownership and shareholder activism,2008,"Academy of Management 2008 Annual Meeting: The Questions We Ask, AOM 2008",https://www.scopus.com/inward/record.uri?eid=2-s2.0-85087583131&doi=10.5465%2fambpp.2008.33718573&partnerID=40&md5=859fe70b8a590565cef0e2dd7cf607e9,"Shareholder activism is traditionally rooted in agency theory and based on the notion of financial incentives. We argue that economic approaches to corporate ownership and property rights provide only a partial explanation for shareholder activism and that in order to understand shareholder activism in its full breadth and depth a more cognitive and emotional approach to corporate ownership is necessary. We juxtapose legal and psychological ownership to develop propositions regarding the forms and tactics of activism shareholders are likely to adopt. We propose that shareholders holding varying levels of legal and psychological ownership develop disparate relationships with the organization, place emphasis on different objectives and, thus, use different forms of activism (exit, voice, loyalty) each associated with a different degree of publicity.",Corporate ownership; Psychological ownership; Shareholder activism,Agency theory; Behavioral theory; Corporate ownership; Economic approach; Financial incentives; Property right; Psychological ownership; Shareholder activisms; Shareholders
All in the family: Network ties as determinants of reputation and identity in NCAA basketball,2008,"Academy of Management 2008 Annual Meeting: The Questions We Ask, AOM 2008",https://www.scopus.com/inward/record.uri?eid=2-s2.0-85087997801&doi=10.5465%2fambpp.2008.33622323&partnerID=40&md5=d9591ffe9c4e7a45408f73ad8693a9b4,"In this article I investigate the role of social network ties as determinants of the reputation and identity of individuals. In an extension of research on cognitive factors of social network ties, I propose that an individual's ego-network composition affects his or her career advancement and career resiliency through the mechanisms of reputation and identity. Additionally, I focus on individuals affiliated with a common institution or focal individual who have come to identify themselves as ""family members."" This form of identification is separate from identification with a formal institution and persists through an individual's subsequent career positions at different institutions with different colleagues. Examples include individuals who worked at Fairchild Semiconductor who identified themselves as ""Fairchildren"" long after leaving Fairchild for positions at other organizations (Pollack, 1988). I utilize a network perspective to investigate recognized ""family"" groups of affiliated coaches in NCAA Division I Men's basketball. I propose that coaches affiliated with ""coaching families"" experience greater career opportunity and exhibit greater resiliency due to external image benefits and internal identity benefits derived from the use of family language. I first analyze all head coaching position changes (n=285) between 2001 and 2007 and find that recognition as a ""family member"" is a positive predictor of career advancement. I next analyze the subsequent career moves of all coaches that were fired (n=155) between 2001 and 2007 and find that ""family membership"" and network connectivity to other active coaches are positive predictors of a coach's exhibited career resiliency.",Family metaphor; Organizational identification; Social network analysis,Social networking (online); Career advancement; Career opportunities; Cognitive factors; Ego networks; Fairchild semiconductor; Family metaphor; Network connectivity; Organizational identifications; Sports
"Thinking globally, leading locally: Chinese, Indian, and western leadership",2008,"Academy of Management 2008 Annual Meeting: The Questions We Ask, AOM 2008",https://www.scopus.com/inward/record.uri?eid=2-s2.0-85087585557&doi=10.5465%2fambpp.2008.33718452&partnerID=40&md5=503fa9e76970787b3532dab44e17a83a,"This study compares leadership capabilities across samples of Chinese, Indian, and Western CEOs and senior executives. Qualitative and quantitative data from a total of 91 CEOs offer rich detail to better understand leadership characteristics and behavior in different business contexts in an increasingly globalized world. We found that while there are some common characteristics in outstanding CEOs, such as adaptive thinking and social responsibility, there are also other distinctive competencies manifested in the three cultures. While Indian CEOs show ""inner strength"" or consideration of the welfare of India in business decisions as well as emotional wisdom, Chinese CEOs uniquely display a preference for influencing for mutual benefit as well as self-criticizing. We aim to contribute to the theory and practice of leadership development in a global context.",Cross-cultural leadership; Leadership; Leadership competencies,Adaptive thinking; Business decisions; Cross-cultural leadership; Leadership; Leadership competencies; Leadership development; Social responsibilities; Theory and practice
"Working alone or together? Individual motivation, group identification and the development of TMS",2008,"Academy of Management 2008 Annual Meeting: The Questions We Ask, AOM 2008",https://www.scopus.com/inward/record.uri?eid=2-s2.0-85088000562&doi=10.5465%2fambpp.2008.33725598&partnerID=40&md5=612079c7e1a0bb3adb9a223378355f8d,"Although research shows that teams with well-developed transactive memory systems (TMS) outperform teams lacking such memory systems, we know little about how teams develop TMS. In particular, we do not know how individual motivation affects the development of interdependent knowledge structures such as TMS. Using data from management teams engaged in a realistic business simulation, we examine the relationships among individual motivation, TMS, social identity, cohesion, and team performance. We discover that individual motivation to achieve group goals has a negative effect on the development of TMS in teams where both social identity and cohesion are low and do not direct the efforts of team members towards working together. Only when group identification, driven by social identity and cohesion, encourages team members to work together, does individual motivation stimulate the development of interdependent specialized structures of knowledge such as TMS. Moreover, findings show that, as predicted, TMS positively influence team performance. The study extends our understanding of the development of TMS by investigating the effects of motivation and group identification on team knowledge structures and the effects of those knowledge structures on performance.",Motivation; Social identity; Transactive memory systems,Motivation; Technology transfer; Business simulation; Group identification; Knowledge structures; Management team; Social identity; Team knowledge; Team performance; Transactive memory systems; Human resource management
The effect of national corporate responsibility environment on Japanese MNCs' location choice,2008,"Academy of Management 2008 Annual Meeting: The Questions We Ask, AOM 2008",https://www.scopus.com/inward/record.uri?eid=2-s2.0-85087998463&doi=10.2139%2fssrn.1957441&partnerID=40&md5=c7716c078d9565b90224fe77f42b760b,"We examine the relationship between MNC location choice across countries and the three dimensions (internal, external and environmental) of the national corporate responsibility index (NCRI) using corporate social responsibility (CSR) and international business theories. Based on multidimensional analysis using data from AccountAbility, Toyo Keizai and other sources, we find that Japanese MNCs are: (1) more likely to locate their subsidiaries in countries with higher levels of corporate governance, ethical practices, and human capital development (the internal dimension), and this relationship is stronger for developed countries; and (2) less likely to locate their subsidiaries in developed countries with higher levels of civil society development (the external dimension), but this relationship is not significant for developing countries; and (3) the relationship between MNCs?location choice and the environmental dimension is not significant in either developed or developing countries. There exist complicated interactions among the three dimensions and a country's development stage in determining MNCs?location choice. The theoretical and practical implications of these findings are discussed in terms of extending CSR theories and attracting MNCs.",Corporate social responsibility; Institutional theory; Location choice,Developing countries; Economic and social effects; Corporate governance; Corporate responsibility; Corporate social responsibilities (CSR); Human capital development; Institutional theory; International business; Location choice; Multi-dimensional analysis; Location
