Title,Year,Source title,Link,Abstract,Author Keywords,Index Keywords
Bringing the heart and soul back in: Collaborative inquiry and the DBA,2019,Academy of Management Learning and Education,https://www.scopus.com/inward/record.uri?eid=2-s2.0-85065151076&doi=10.5465%2famle.2017.0020&partnerID=40&md5=7db376c41f31436f653c8c5122e26413,"Waddock and Lozano (2013) propose that there is an urgent need to bring the “heart and soul” back into management education. Indeed, its absence has also been implicated in the plethora of recent scandals and the global financial crisis. We suggest that such issues are, in part, attributable to a continued overreliance on a scientific and detached form of knowing that displaces particular “human characteristics” and in so doing, downplays our inherent connections to others. In contrast, we identify the importance of embracing a supplementary form of knowing, collaborative inquiry, which potentially restores our connections to others in ways that provide opportunities for a more heartfelt and soulful management practice. Specifically, we extend Van de Ven and Johnson’s (2006) notion of collaborative inquiry to consider how it is mobilized in the context of a U.K. DBA program and in turn we examine the impact this move accomplishes. Drawing upon a detailed analysis of 20 students’ reflective journals, we illustrate the ways in which they develop a form of empathy. Crucially, we found that this was one important means for (re)connecting to others in ways that begin to bring a sense of heart and soul back into management education. © Academy of Management Learning & Education.",,
Management and business education in Africa: A post-colonial perspective of international accreditation,2019,Academy of Management Learning and Education,https://www.scopus.com/inward/record.uri?eid=2-s2.0-85065142172&doi=10.5465%2famle.2016.0086&partnerID=40&md5=539017473951cfa826880bbf6b273cff,"Business schools throughout the world are pursuing national and international validation by seeking accreditation such as AACSB, EQUIS, and/or AMBA. The issue of accreditation of African universities, in general, and of business schools, in particular, is only now beginning to be addressed on a continental level. There is also a growing concern about the quality of higher education in Africa. We examine international business school accreditation from a post-colonial theory perspective. We argue that simply applying Western accreditation standards in a post-colonial context does not address relevant African business problems, nor does it examine educational needs in this environment. Our discussion focuses on these issues as well as on recommendations to assist many, if not most, African business schools in meeting the needs of their stakeholders given the socioeconomic and cultural realities of Africa. © Academy of Management Learning & Education.",,
Who built maslow’s pyramid? A history of the creation of management studies’ most famous symbol and its implications for management education,2019,Academy of Management Learning and Education,https://www.scopus.com/inward/record.uri?eid=2-s2.0-85061675188&doi=10.5465%2famle.2017.0351&partnerID=40&md5=1c2f4ff4f2ae9feaff7a0c8208d2a1a4,"Abraham Maslow’s theory of motivation, the idea that human needs exist in a hierarchy that people strive to satisfy progressively, is regarded as a fundamental approach to understanding and motivating people at work. It is one of the first and most remembered models encountered by students of management. Despite gaining little support in empirical studies and being criticized for promoting an elitist, individualistic view of management, Maslow’s theory remains popular, underpinned by its widely recognized pyramid form. However, Maslow never created a pyramid to represent the hierarchy of needs. We investigated how it came to be and draw on this analysis to call for a rethink of how Maslow is represented in management studies. We also challenge management educators to reflect critically on what are taken to be the historical foundations of management studies and the forms in which those foundations are taught to students. © Academy of Management Learning & Education.",,
Reading the TED talk genre: Contradictions and pedagogical pleasures in spreading ideas about management,2019,Academy of Management Learning and Education,https://www.scopus.com/inward/record.uri?eid=2-s2.0-85082135449&doi=10.5465%2famle.2017.0323&partnerID=40&md5=5a2a2c2c3ff6e8667a61c8d3548b6483,"Technology, Entertainment, Design (TED) talks have become a powerful way of communicating management ideas to global audiences. This raises questions about how management educators should engage with TED talks. We use literary theory to understand TED talks as a distinct genre to explore how students “read” TED talks and the pleasures they gain from this. Based on an analysis of TED talks, books about TED talks, focus groups and interviews with management students, we identify three contradictions in the genre: (1) freedom to learn, (2) authenticity of speakers and texts, and (3) emotional connection as a source of pleasure. The kind of reading pleasure that TED talks encourage is characterized by plaisir, an easygoing enjoyment which does not challenge readers’ assumptions and supports surface learning. This is contrasted with jouissance, a pleasure that produces disturbance and leaves the subject altered. We suggest that management educators can work to enable students to become critical, reflexive readers who understand the importance of these new genres in producing meaning. By exposing the contradictory nature of reading TED talks, we contribute to understanding the storied nature of scientific knowledge and the role of power in communicating ideas about management. © Academy of Management Learning & Education",,
Toward a non-essentialist approach to management education: Philosophical underpinnings from phenomenography,2019,Academy of Management Learning and Education,https://www.scopus.com/inward/record.uri?eid=2-s2.0-85082135455&doi=10.5465%2famle.2017.0401&partnerID=40&md5=f988afdd50212515296ee5749471c701,"The classic approach to management education is managercentric and assumes an essential nature to management. Drawing on ideas from interpretivist epistemologies, the social construction of leadership, phenomenography, and variation theory, we discuss the implications for management education of taking a non-essentialist approach and regarding the nature of management as unknown and unknowable. We focus on phenomenography for two reasons: First, when applied to the task of defining management, it is built on interpretivist roots where the knowledge and understanding of the observer is paramount. Second, it is also a theory of learning with direct application to management research and teaching. Building on these insights, we highlight the importance of students becoming active investigators of management and offer practical teaching implications on how students might be encouraged to engage in experiences that identify variations in the ways that management is conceptualized and performed. We also consider how such an approach brings a fresh perspective on what management education is about, the role of the educator, and how it informs the ongoing debates relating to the institutional pressures that business schools face. © Academy of Management Learning & Education",,
How the multimedia communication of strategy can enable more effective recall and learning,2019,Academy of Management Learning and Education,https://www.scopus.com/inward/record.uri?eid=2-s2.0-85082103517&doi=10.5465%2famle.2018.0066&partnerID=40&md5=60b5d0b23c26f773d00e3a5053354ffc,"Many claims have been made about the learning benefits of communicating strategies in multimedia picture-plus-text formats, rather than monomedia text-only formats. However, there is little theorization and empirical evidence to support these claims. Drawing upon cognitive load theory to develop learning-related hypotheses, this manuscript reports on a multicountry experiment that tests the effects of different modes of strategy communication on student learning. The results show the learning benefits to students of multimedia presentations of strategy and suggests how strategy professors should further encourage students to draw strategies in class. © Academy of Management Learning & Education",,
Executive coaching outcome research in a field setting: A near-randomized controlled trial study in a global healthcare corporation,2019,Academy of Management Learning and Education,https://www.scopus.com/inward/record.uri?eid=2-s2.0-85082122440&doi=10.5465%2famle.2018.0158&partnerID=40&md5=ed7e2cbc5c70ea78052772e1e721bc3e,"Executive coaching is widely used as a tool to develop leaders and organizations. However, despite the popularity of coaching, the effect of coaching on relevant leadership performance measures remains unclear. We report on the development of a model for coaching effectiveness predicting that aspects common to all approaches are the main active ingredients, mediated by the working alliance as the single-best predicting common aspect. To test this model, we conducted a (waiting-list) randomized controlled trial within a global healthcare corporation, involving 180 coachees, 66 coaches, and 140 line managers of the coachees, which we contend is the largest randomized controlled trial in executive coaching to date. The study demonstrated substantial impact with effect sizes up to d 5 1.1. We also tested several aspects that are common to coaching contracts and found more evidence for the central importance of the strength of the working alliance as seen from both the coachee and (to a lesser extent) the coach perspectives, which mediated the effects for coachee well-being and perceived social support. In addition, we found some significant impact for coachee self-efficacy, resilience and “bright side” personality aspects. Finally, we found some first significant indications that personality and career derailment aspects may show demonstrable improvement through coaching. We discuss the implications of these findings for coaching theory and practice. Overall, our study demonstrates the effectiveness of coaching in an organizational setting, the importance of the working alliance, and that coaching may mitigate the risks of leaders derailing in large organizations. Copyright of the Academy of Management, all rights reserved.",,
"Blackboard collaborate Ultra: An online, interactive teaching tool",2019,Academy of Management Learning and Education,https://www.scopus.com/inward/record.uri?eid=2-s2.0-85082100947&doi=10.5465%2famle.2019.0027&partnerID=40&md5=03438aed96775965df1e37368964a021,[No abstract available],,
Understanding the rise of faculty–student coaching: An academic capitalism perspective,2019,Academy of Management Learning and Education,https://www.scopus.com/inward/record.uri?eid=2-s2.0-85082122062&doi=10.5465%2famle.2017.0200&partnerID=40&md5=ff0342c1dc439cd547b2172d7c3f8836,"We examine the rise of coaching within management education to support student learning. We question the assumption that faculty–student coaching (FSC) is beneficial and propose that there may be some limitations in the use of FSC that have yet to be adequately acknowledged and discussed in the literature. In particular, we propose that there is currently insufficient evidence to conclude that coaching can produce knowledge acquisition, and therefore, ask why we persist in the use of FSC when we have limited evidence of its efficacy in delivering a core education outcome. We suggest that the theory of academic capitalism provides a useful, critical lens through which to view the growing trend in FSC, identifying that FSC may be utilized as a method of increasing student satisfaction, perceptions of value for money, and as a useful marketing tool for business schools competing for students. However, academic capitalism may also explain the use of coaching via its ability to enhance the skills and attitudes of students, providing outcomes that are valued by students, employers, and governments. We conclude our essay by providing recommendations to mitigate these proposed dangers and consequently maximize the effectiveness of coaching as a development tool in management education. © Academy of Management Learning & Education",,
A more feminine scholarship: Relational practice for setting a good example,2019,Academy of Management Learning and Education,https://www.scopus.com/inward/record.uri?eid=2-s2.0-85070371227&doi=10.5465%2famle.2019.0032&partnerID=40&md5=90b5395a69e53cc0a18d683a912eb924,[No abstract available],,
Confronting the crisis of confidence in management studies: Why senior scholars need to stop setting a bad example,2019,Academy of Management Learning and Education,https://www.scopus.com/inward/record.uri?eid=2-s2.0-85070371653&doi=10.5465%2famle.2018.0107&partnerID=40&md5=f6fa4288885338d46b6d60f52c88cb23,"There is an emerging crisis of confidence in management studies. This is expressed in growing disquiet about the lack of value in our research outputs and increasing frustration about the nature of teaching in business schools. This crisis of confidence can be understood as a response to a series of developments, including an apparent lack of practical or academic impact from most published research, a narrowing of focus in the field, increases in unethical behavior, the downgrading of teaching, and increased pressure in both publishing and teaching. Traditional academic values are coming into conflict with processes of rationalization in business schools and universities. The changes driving these outcomes are long-term and reflect powerful institutional pressures, rendering them difficult to change. Nonetheless, established management studies scholars have a responsibility to address them. One way they can show leadership in this regard is by setting a good example. Three suggestions can be made about how to do this: rejecting the fiction that what we do is analogous to laboratory science; rejecting the myth of what this essay calls “the heroic workaholic publishing machine;” and refusing to promote flawed approaches to assessing academic success. © Academy of Management Learning & Education.",,
"Of possums, hogs, and horses: Capturing the duality of student engagement in elearning",2019,Academy of Management Learning and Education,https://www.scopus.com/inward/record.uri?eid=2-s2.0-85066881071&doi=10.5465%2famle.2018.0029&partnerID=40&md5=19741826c335fd74fd11a58265efaec1,"The current preoccupation with activity and interactivity in pedagogical research on eLearning precariously elevates the importance of students’ behavioral engagement and insufficiently accounts for other forms of productive involvement in learning. We argue that theoretical developments on the concept of student engagement offer a critical opportunity to revise this stance and problematize online activity. Through the lens of engagement, we depict online engagement as a multidimensional concept that encompasses behavior, emotion, and cognition. We further argue that the focus of online engagement may be dual in nature: Engagement with online pedagogies, and separately, with the substantive knowledge being acquired. Our study draws on qualitative data from postgraduate management research students in an online research methods course. To tease out the complexity of engagement, we use evidence of online activity to categorize learners into three distinct types: hogs, possums, and horses. We juxtapose these behavioral categories against narrative accounts of engagement in eLearning to reveal a rich set of textures as well as misalignment among behavior, emotion, and cognition. The findings seem to question the privileged status of interactivity in online pedagogy and tentatively suggest the possibility that online disengagement may not be detrimental to learning. © Academy of Management Learning & Education",,
"Reflections on academic career choices: What might have been, what is, and what may yet be",2019,Academy of Management Learning and Education,https://www.scopus.com/inward/record.uri?eid=2-s2.0-85070398310&doi=10.5465%2famle.2019.0024&partnerID=40&md5=ae7f857ee48413381dc8b89c3b20b90b,[No abstract available],,
Clearing the hurdles in the entrepreneurial race: The role of resilience in entrepreneurship education,2019,Academy of Management Learning and Education,https://www.scopus.com/inward/record.uri?eid=2-s2.0-85076022596&doi=10.5465%2famle.2016.0377&partnerID=40&md5=aa1a409163f0a4321bfcfd4d12ca8da2,"Entrepreneurship education equips students with competencies to manage the challenging circumstances inherent in entrepreneurial activity. One such competency is resilience, the capacity to address, adapt to, and overcome adversity, uncertainty, and change. Drawing upon the theory of planned behavior, we examine one specific entrepreneurship education intervention designed to increase resilience and investigate its effect on entrepreneurial intention. Using a quasi-experimental design, we find that our intervention has an indirect effect on entrepreneurial intention through resilience and the antecedents of intention (perceived behavioral control, attitude, and subjective norm). This study contributes new ideas for learning methods to foster resilience and entrepreneurial intention, such as the design-thinking approach or learning from failure. © 2019 George Washington University. All rights reserved.",,
Isolation in globalizing academic fields: A collaborative autoethnography of early career researchers,2019,Academy of Management Learning and Education,https://www.scopus.com/inward/record.uri?eid=2-s2.0-85070404561&doi=10.5465%2famle.2017.0329&partnerID=40&md5=99746d6d10febac8e1198f9b7cee48dd,"This study examines academic isolation—an involuntary perceived separation from the academic field to which one aspires to belong, associated with a perceived lack of agency in terms of one’s engagement with the field—as a key challenge for researchers in increasingly globalized academic careers. While prior research describes early career researchers’ isolation in their institutions, we theorize early career researchers’ isolation in their academic fields and reveal how they attempt to mitigate isolation to improve their career prospects. Using a collaborative autoethnographic approach, we generate and analyze a dataset focused on the experiences of 10 early career researchers in a globalizing business academic field known as consumer culture theory. We identify bricolage practices, polycentric governance practices, and integration mechanisms that work to enhance early career researchers’ perceptions of agency, and consequently, mitigate their academic isolation. Our findings extend discussions on isolation and its role in new academic careers. Early career researchers, in particular, can benefit from a deeper understanding of practices that can enable them to mitigate isolation and reclaim agency as they engage with global academic fields. © Academy of Management Learning & Education.",,
Boundaryless careers or career boundaries? The impact of language barriers on academic careers in international business schools,2019,Academy of Management Learning and Education,https://www.scopus.com/inward/record.uri?eid=2-s2.0-85062693150&doi=10.5465%2famle.2017.0236&partnerID=40&md5=a11c14d0baab13bfce93d94b9e0779ac,"Following the globalization of higher management education and the view of academics as autonomous professionals, academic careers in business schools are deemed to typify the boundaryless careers of the 21st century. We scrutinize the validity of this assumption, focusing on the language barriers internationally mobile management scholars are facing. Based on qualitative interviews with foreign faculty working at leading business schools in Finland, Japan, Spain, and the United States, we investigate how careers in different national academic systems are bounded by the dual challenge to speak both English and the local language. In revealing different degrees of linguistic challenges across national academic systems, we contribute to career research by presenting language barriers as an impediment to global careers in business schools and by establishing “knowing where” as a previously neglected career competency. Our study also maps the process of academic “Englishization,” shows that different career antecedents are influenced by different types of language barriers, and suggests a classification scheme for national academic systems according to their “linguistic difficulty level” for foreigners. On this basis, we develop important practical recommendations for internationally mobile management scholars and business schools aiming to attract international faculty. © Academy of Management Learning & Education.",,
"Academic arrhythmia: Disruption, dissonance, and conflict in the early-career rhythms of CMS academics",2019,Academy of Management Learning and Education,https://www.scopus.com/inward/record.uri?eid=2-s2.0-85070369086&doi=10.5465%2famle.2017.0340&partnerID=40&md5=e1f377a673fe5799b2d5bd6ac62c6b42,"Starting a career on the margins of the neoliberal business school is becoming increasingly challenging. We contribute to the understanding of the problems involved and to potential solutions by developing a theoretically informed approach to the rhythms of academic life and drawing on interviews with 32 critical management studies (CMS) early-career academics (ECAs) in 14 countries. Bringing together Lefebvre’s rhythmanalysis (and his concepts of polyrhythmia, eurhythmia, and arrhythmia); Zerubavel’s sociology of time; and identity construction literature, we examine the rhythm-identity implications of the recent higher education changes. We show how the dynamics between the broader pressures, institutional strategies, and our interviewees’ attempts to reassert themselves are creating a vicious circle of arrhythmia: a debilitating condition characterized by rhythmic disruption, dissonance, and conflict. Within the circle, identity insecurity and regulation, CMS ECAs’ identity work, and arrhythmia are mutually co-constructive, so that it is hard for individuals to break out. We consider the possibilities and limitations of individual coping strategies, and drawing out lessons for business schools, advocate for more collective and structural solutions. In so doing, we contribute to the reimagining of business schools as more eurhythmically polyrhythmic places where ECAs of all intellectual orientations have the time to learn and develop. © Academy of Management Learning & Education.",,
An investigation of academic career success: The new tempo of academic life,2019,Academy of Management Learning and Education,https://www.scopus.com/inward/record.uri?eid=2-s2.0-85070364112&doi=10.5465%2famle.2017.0391&partnerID=40&md5=355515e92838a493868523fa7994b102,"Recognizing the environmental changes and challenges that have impacted academics over the past 20 years, we develop a model of academic career success from a job demands-resources perspective. We define career success in terms of salary and career satisfaction. We link work stressors (family-to-work conflict and role overload), positive career shocks, and negative career shocks to academic career success through work engagement. We test the hypothesized model controlling for a number of alternative predictors and with survey data collected from an international sample of 1,644 Academy of Management members. Results reveal that family-to-work conflict indirectly, negatively relates to career satisfaction through work engagement; role overload (negatively), directly relates to career satisfaction, and positively to salary. Several positive and negative career shocks indirectly relate to career satisfaction through work engagement, and relate directly to salary. We also explore differences by career stage and for nontenure track faculty. Our findings extend the predictors of academic career success to include various job demands (stressors and negative shocks) and resources (positive shocks), extend the generalizability of previous findings on the predictors of academic career success to academics outside the US, and empirically validate Arthur Bedeian’s advice in his essay in the Rhythms of Academic Life. Copyright of the Academy of Management, all rights reserved.",,
Rejoinder to “Confronting the crisis of confidence in management studies: Why senior scholars need to stop setting a bad example” from the Asian perspective,2019,Academy of Management Learning and Education,https://www.scopus.com/inward/record.uri?eid=2-s2.0-85070417379&doi=10.5465%2famle.2018.0297&partnerID=40&md5=46d1c6c47decadcd68aad2154e2f01ae,[No abstract available],,
What is academic success anyway? A rejoinder to “confronting the crisis of confidence in management studies”,2019,Academy of Management Learning and Education,https://www.scopus.com/inward/record.uri?eid=2-s2.0-85070388696&doi=10.5465%2famle.2018.0339&partnerID=40&md5=596761275a508815fb21cb1798a97625,[No abstract available],,
