Title,Year,Source title,Link,Abstract,Author Keywords,Index Keywords
The case for competition: Learning about evidence-based management through case competition,2014,Academy of Management Learning and Education,https://www.scopus.com/inward/record.uri?eid=2-s2.0-84907448775&doi=10.5465%2famle.2013.0187&partnerID=40&md5=81c503239a8a06e2bdbea5cd7549e643,"Over the last century, business cases have developed into a centerpiece of management education (Hammond, 1976; Mesney, 2013). More recently, the use of cases in business schools has extended beyond the classroom setting. Students around the world invest considerable time and energy to prepare for and compete in case competitions. We argue that an annual case competition should be established that embodies an evidence-based management (EBMgt) perspective. We extend previous suggestions about adapting case-based teaching to better support EBMgt (e.g., Goodman & O'Brien, 2012; Rousseau & McCarthy, 2007), recognizing that such a shift requires a fundamental change to how many business educators use cases (Mesney, 2013). We believe an EBMgt-focused case competition can promote greater awareness and use of the EBMgt concept, benefiting students and other stakeholders. Copyright of the Academy of Management, all rights reserved.",,
Reading evidence-based management: The possibilities of interpretation,2014,Academy of Management Learning and Education,https://www.scopus.com/inward/record.uri?eid=2-s2.0-84907435227&doi=10.5465%2famle.2013.0244&partnerID=40&md5=1486d48cf263cb48b6d663d9503ba372,"An important consequence of moving evidence-based management into the classroom is that through our students we are exposed to the effects of reading academic research on those who are not part of the academic community. An academic text - the write-up of academic research whether in book or journal article form - is at center stage in evidence-based management (EBMgt) and in virtually all forms of evidence-based practice; yet, we know little about how academic work is read. Starting from the assumption that all scholarship is inherently rhetorical, I argue for the usefulness of rhetorical criticism - particularly reader response theory - to opening conversations between academics and practitioners - including our students who will be practitioners - on the use and limits of academic research. © Academy of Management Learning & Education.",,
"Evidence-based management and the trustworthiness of our cumulative scientific knowledge: Implications for teaching, research, and practice",2014,Academy of Management Learning and Education,https://www.scopus.com/inward/record.uri?eid=2-s2.0-84907911606&doi=10.5465%2famle.2013.0193&partnerID=40&md5=051a8f21550cfaeb79e72f89058e0d94,"The promise of evidence-based management (EBMgt) is that educators and practitioners can access cumulative scientific information to guide their teaching and decision making. We argue that the EBMgt movement may be unable to live up to this promise to the extent that our cumulative scientific knowledge is not trustworthy. We review why the management discipline may not have trustworthy evidence and how this widens the divide among educators, practitioners, and researchers. Next, we review the implications of untrustworthy cumulative knowledge, focusing on how educators can critically assess evidence and teach this process in the classroom. We close with recommendations for improving the trustworthiness of our literature to enhance teaching and practice from an evidence-based perspective. Suggestions include increasing the reproducibility and replication of primary studies, changing the editorial review process, and focusing on the production and dissemination of practically relevant and actionable knowledge. © Academy of Management Learning & Education, 2014.",,
Bibliographic search training for evidence-based management education: A review of relevant literatures,2014,Academy of Management Learning and Education,https://www.scopus.com/inward/record.uri?eid=2-s2.0-84907427967&doi=10.5465%2famle.2013.0188&partnerID=40&md5=762b0c30bf931edab815c86b372263f0,"While evidence-based management training is a recent addition to management education, there is a longer history of teaching and studying evidence-based instruction in the domain of medicine. We review relevant literatures from information sciences and medical education to examine the lessons learned and explore how they can inform the design and practice of evidence-based management education. We focus our review specifically on bibliographic search training because searching academic literatures to locate the best available research evidence is central to the practice of evidence-based management. Research shows that searchers often have great difficulty developing effective search strategies and retrieving relevant information from electronic databases. Despite wide variation in research designs and training programs, studies examining the effectiveness of bibliographic search training show that training typically enhances search quality. Although the extant research is informative, on its own it provides insufficient guidance for the design of bibliographic search training. Therefore, we use a combination of our findings from the literature reviewed and Goodman and O'Brien's (2012) evidence-based instructional strategies to develop a set of recommendations for designing bibliographic search training for evidence-based management education. We also provide suggestions for future research intended to yield more precise instructional design recommendations. Copyright of the Academy of Management, all rights reserved.",,
Increasing personal initiative in small business managers or owners leads to entrepreneurial success: A theory-based controlled randomized field intervention for evidence-based management,2014,Academy of Management Learning and Education,https://www.scopus.com/inward/record.uri?eid=2-s2.0-84907914446&doi=10.5465%2famle.2013.0234&partnerID=40&md5=3f504491bd9df66f08ac032f2e2d3887,"We seek to contribute to evidence-based teaching for management by providing an example of translating a theory into an evidence-based intervention by developing action principles; moreover, our work here shows how such an intervention affects the success of firms by way of changing managers' actions. The concept of action principle is central to this intervention, and we describe this concept with the help of action regulation theory. We conducted a randomized controlled field intervention with a theory-based 3-day program to increase personal initiative (using a pretest-posttest design and a randomized waiting control group). The sample consists of 100 small business owners in Africa (Kampala, Uganda). The intervention increased personal initiative behavior and entrepreneurial success over a 12-month period after the intervention. An increase in personal initiative behavior was responsible for the increase of entrepreneurial success (full mediation). Thus, the training led to an entrepreneurial mind-set and to an active approach toward entrepreneurial tasks. © Academy of Management Learning & Education.",,
From passively received wisdom to actively constructed knowledge: Teaching systematic review skills as a foundation of evidence-based management,2014,Academy of Management Learning and Education,https://www.scopus.com/inward/record.uri?eid=2-s2.0-84907438688&doi=10.5465%2famle.2013.0222&partnerID=40&md5=ba9cc7421c96ffc6f9029a9fb4911162,"One of the four sources of evidence used in evidence-based management (EBMgt) is academic research. However, rather than taking evidence from single studies or arbitrarily selected studies, EBMgt uses findings from systematic reviews that methodically summarize the body of evidence relevant to a specific question. This allows for conclusions to be drawn about the quantity, quality, relevance, and meaning of the available evidence. Although conducting such reviews is important for EBMgt and academically, the skills required are rarely taught. Drawing on our experiences of teaching courses on conducting rapid systematic reviews to a range of students, we include four goals here. First, we describe the nature and purposes of systematic reviews and consider the multiple benefits of teaching students how to perform them. Second, we describe a course on rapid systematic reviews delivered to a group of master's students. Third, we report students' reactions to different aspects of the course and the outcomes for students and teachers. Last, we discuss the implications of these experiences for teaching systematic review skills across business school curricula and how they may in the future play a more prominent role in developing EBMgt skills in students and in management education more generally. © Academy of Management Learning & Education.",,
The development of the global manager: An empirical study on the role of academic international sojourns,2014,Academy of Management Learning and Education,https://www.scopus.com/inward/record.uri?eid=2-s2.0-84903313720&doi=10.5465%2famle.2012.0289&partnerID=40&md5=3a49c0b203031358b35fa08ff0eba6c2,"Student mobility is highly popular among the educational efforts directed at developing global competencies in management education. Yet, research that corroborates the assumed learning outcomes, particularly with respect to advancing multicultural competence, is inconclusive. Null-to-small effect sizes are often reported and are based on unidimensional assessments of multicultural competence that have limited our knowledge of the benefits of academic work abroad. Building on Earley and Ang's (2003) conceptualization of cultural intelligence (CQ), we test the effect of studying abroad on the metacognitive, cognitive, motivational, and behavioral dimensions of multicultural competence. Following a pretest-posttest design, we tracked 84 business students who completed academic coursework abroad. To isolate the effect of the sojourn, we controlled for individual and contextual variables that might influence learning outcomes. Results confirm the multidimensional nature of our dependent variable and indicate that studying abroad acts differently on its dimensions. While participants exhibited development of the cognitive-based components of the competence, studying abroad was innocuous in advancing participants' motivational and behavioral cultural intelligence. We discuss the theoretical implications of these outcomes in light of existing conceptualizations of multicultural competence, as well as their practical implications for academic efforts that seek to advance global competencies in management education. © 2014 Academy of Management Learning & Education.",,
Look on the bright side: A comparison of positive and negative role models in business ethics education,2014,Academy of Management Learning and Education,https://www.scopus.com/inward/record.uri?eid=2-s2.0-84903309854&doi=10.5465%2famle.2012.0251&partnerID=40&md5=f0f11b72177b6031e2ddab21f2c978d9,"This study explores how positive and negative role models (PRMs and NRMs) of business affect students' attitudes, expectations, and behavioral intentions relating to their future business behavior. A thematic analysis of student reflections (N = 96) based on their experience of material presented in their Business Ethics/Corporate Social Responsibility modules, interpreted through the framework of Ajzen's theory of planned behavior, revealed that while negative role models led to intentions to avoid unethical behavior and engage in ethical practices such as ethical purchasing, they also increased cynicism and undermined students' self-efficacy in the ethical business domain. Exposure to positive role models offset the negative consequences arising from negative role models, protecting against reduced selfefficacy by showing that unethical behavior is neither necessary nor inevitable in business, thus undermining the common justification for unethical behavior that ""everybody does it."" PRMs increased awareness that business can be both ethical and profitable and provided inspirational role models that led to increased intentions to engage in ethical business practices. With reference to social-psychological literature, these results suggest that positive role models are necessary to counter the impression created by negative role models that ethical business is unachievable or unlikely, as such beliefs can become self-fulfilling. © 2014 Academy of Management Learning & Education.",,
Incorporating evidence-based management into management curricula: A conversation with Gary Latham,2014,Academy of Management Learning and Education,https://www.scopus.com/inward/record.uri?eid=2-s2.0-84907442896&doi=10.5465%2famle.2013.0364&partnerID=40&md5=fe8633379e284456ce2d39a260d08099,[No abstract available],,
Introduction: Reflecting on epistemological beliefs and dialogical pedagogy in management education,2014,Academy of Management Learning and Education,https://www.scopus.com/inward/record.uri?eid=2-s2.0-84903274380&doi=10.5465%2famle.2014.0142&partnerID=40&md5=b08fad4772e4fb38f8e17fa25aa214ed,[No abstract available],,
Developing the future workforce: An approach for integrating interpersonal skills into the MBA classroom,2014,Academy of Management Learning and Education,https://www.scopus.com/inward/record.uri?eid=2-s2.0-84903272097&doi=10.5465%2famle.2011.0138&partnerID=40&md5=b4077da1544e9ec9152a91568bb272ad,"Interpersonal skills (IPS) are crucial in today's business environment. As collaboration is the foundation of business operations, executives consistently rank interpersonal skills as a critical competency for a successful workforce. Yet, relying on training and development efforts after hiring is not enough-especially when funding for ""soft skills"" training is being cut across work domains. Because organizations need to select interpersonally competent individuals who can successfully engage in interactions immediately upon hire, students must acquire effective interpersonal skills before entering the workforce. To help achieve this goal, we utilize a taxonomy of interpersonal skills derived from a comprehensive review of the literature to recommend educational techniques that instructors can use to add interpersonal skills training in their teaching. The overarching goal of our work here is to use the science of training as a steppingstone to facilitate instructors' integration of interpersonal skills into existing MBA courses. © 2014 Academy of Management Learning & Education.",,
In Search of phronesis: Leadership and the art of judgment,2014,Academy of Management Learning and Education,https://www.scopus.com/inward/record.uri?eid=2-s2.0-84903279682&doi=10.5465%2famle.2013.0201&partnerID=40&md5=34daf92a84528cb2a790e674dcc88de3,"We explore the process through which people in organizations, especially those in leadership positions, in circumstances marked by ambiguity, surprise, and conflicting values, come to, or arrive at, judgment. Briefly reviewing the (somewhat limited) literature on judgment in management studies, we conclude that its mainly rationalist orientation prevents us (scholars and practitioners alike) from properly grasping important features of the hermeneutical- developmental process involved in coming to a judgment. In particular, the role of emotions, moral agency, language use, and, especially, the selective and integrative nature of perceptual processes, are far too easily ignored. We make the case for a particular notion of judgment understood as Aristotelian ""phronesis"" (practical wisdom). Phronetic leaders, we argue, are people who, in their search for a way out of their difficulties, have developed a refined capacity to intuitively grasp salient features of ambiguous situations and to constitute a ""landscape"" of possible paths of response, while driven by the pursuit of the notion of the common good. We seek to shed light on how this is accomplished, by drawing on neo-Aristotelian, phenomenological, and Wittgensteinian philosophy. © 2014 Academy of Management Learning & Education.",,
From the editors: Lessons learned from dance-cross-training as a tool for moving forward in our discipline,2014,Academy of Management Learning and Education,https://www.scopus.com/inward/record.uri?eid=2-s2.0-84903303457&doi=10.5465%2famle.2014.0074&partnerID=40&md5=0ce83a9522b69ac9a7032cad3134f1a7,[No abstract available],,
Teaching evidence-based management with a focus on producing local evidence,2014,Academy of Management Learning and Education,https://www.scopus.com/inward/record.uri?eid=2-s2.0-84907430659&doi=10.5465%2famle.2013.0197&partnerID=40&md5=2e423f585dff4e9f822fc60c806dbbed,"We present an approach to teaching evidence-based management (EBMgt) that trains future managers how to produce local evidence, causally interpretable data that is collected on-site in companies to address a specific business problem. Our teaching method is a variant of problem-based learning, a method originally developed to teach evidence-based medicine. Following this method, students learn an evidence-based problem-solving cycle for addressing business cases. In executing this cycle, students use and produce scientific evidence through literature searches and the design of local, experimental tests of causal hypotheses. We argue the value of teaching EBMgt with a focus on producing local evidence, how it can be taught, and what can be taught. We conclude by outlining our contribution to the literature on teaching EBMgt and by discussing limitations of our approach. © Academy of Management Learning & Education.",,
Focusing on teams in crisis management education: An integration and simulation-based approach,2014,Academy of Management Learning and Education,https://www.scopus.com/inward/record.uri?eid=2-s2.0-84903315822&doi=10.5465%2famle.2012.0337&partnerID=40&md5=1e432540d55cbbf7c5a285497e0571b2,"Crisis management teams occupy central roles in many normative models of crisis management; however, management education generally addresses neither the nature of such teams nor the capabilities necessary for them to be effective. To help address this situation, we integrate information from phase-based crisis management models with team dynamics theories and suggest which team capabilities play key roles for crisis management teams as they face emergent crises. Using this integration, we then explore simulation-based training as a means to teach and assess crisis management team capabilities. We describe the design, development, and implementation of a simulation for crisis management teams, and discuss future applications of simulation-based training for crisis management education. © 2014 Academy of Management Learning & Education.",,
Teaching evidence-based practice: Lessons from the pioneers: An interview with Amanda Burls and Gordon Guyatt,2014,Academy of Management Learning and Education,https://www.scopus.com/inward/record.uri?eid=2-s2.0-84907443793&doi=10.5465%2famle.2014.0136&partnerID=40&md5=78980570983a085de26868688476954c,[No abstract available],,
Introduction: Practicing moral judgment,2014,Academy of Management Learning and Education,https://www.scopus.com/inward/record.uri?eid=2-s2.0-84903269746&doi=10.5465%2famle.2014.0075&partnerID=40&md5=775c09c34c7dbcdc8a037b04bdced8eb,[No abstract available],,
Between person and person: Dialogical pedagogy in authentic leadership development,2014,Academy of Management Learning and Education,https://www.scopus.com/inward/record.uri?eid=2-s2.0-84903270881&doi=10.5465%2famle.2012.0367&partnerID=40&md5=87e5c0ab9f3246a7398d42d6b58beeb9,"This paper is a critique of the dominant functionalist discourse in authentic leadership theory, which shapes the manner in which we perceive authentic leadership development. As an alternative, I offer adopting dialogical philosophy as a theoretical lens for conceptualizing authentic leadership development. Drawing on various dialogical communication works, I explore how dialogical pedagogy can be used to improve authentic leadership development. I suggest eight components of dialogical pedagogy that can be adopted in authentic leadership development: self-exposure, openmindedness, empathy, care, respect, critical thinking, contact, and mutuality. The advantages, limitations, and implications of dialogical pedagogy for authentic leadership development are then discussed. © 2014 Academy of Management Learning & Education.",,
Epistemological beliefs and cultural diversity matters in management education and learning: A critical review and future directions,2014,Academy of Management Learning and Education,https://www.scopus.com/inward/record.uri?eid=2-s2.0-84903268326&doi=10.5465%2famle.2012.0063&partnerID=40&md5=16645e4367634f347b0f1fabc085136e,"Global business environments and the internationalization of education have positioned management education as a global phenomenon. However, the cultural mixing effects of globalization are complex, with the increasing mobility of academics and students in higher education programs offered by different countries, virtual environments, and global organizations. This presents challenges as to how we can best make our programs, pedagogic efforts, and learning environments responsive to multiple cultures given that they are largely imbued with Western or Anglo- American values tied to business schools. We argue that these matters bring into focus the impact of culture on individual beliefs about knowledge and learning behaviors. Our contention is that important insights can be distilled from the wellestablished field of research on culture and epistemological beliefs. We synthesize the extant research, and building on this synthesis, we analyze the potential of this scholarly work to augment culture and management learning, education, and development (MLED) research and point toward promising areas for future research. © 2014 Academy of Management Learning & Education.",,
Social loafing tendencies and team performance: The compensating effect of agreeableness and conscientiousness,2014,Academy of Management Learning and Education,https://www.scopus.com/inward/record.uri?eid=2-s2.0-84898615162&doi=10.5465%2famle.2012.0191&partnerID=40&md5=dd5f8b614435c430d659b1dec34146fb,"Although it is often assumed that team member's tendency to social loaf is detrimental to team performance, I propose that this relationship is not always negative. Drawing from theories on social loafing, social compensation, and trait activation, I propose that both the level of conscientiousness and agreeableness in teams could compensate for social loafing tendencies, in terms of team performance. In a study among newly formed student teams (N = 209 teams; n = 644 persons) working on a complex task that exceeded their current skill level, I found support for this idea. Consistent with predictions, social loafing tendencies were positively related to team performance when the level of conscientiousness was high rather than low. A significant 3-way interaction between social loafing tendencies, conscientiousness, and agreeableness in predicting team performance indicated that especially if there is a high degree of conscientiousness and agreeableness within the team, team members will compensate for social loafingtendencies, and performance will stay up to par. If there is little tendency to social loaf, the level of conscientiousness becomes less important, while agreeableness stays important for team performance. Given the extensive use of team projects in business schools, the implications of these findings are discussed. © of the Academy of Management, all rights reserved.",,
Institutional logic of business bubbles: Lessons from the dubai business school mania,2014,Academy of Management Learning and Education,https://www.scopus.com/inward/record.uri?eid=2-s2.0-84898631762&doi=10.5465%2famle.2012.0036&partnerID=40&md5=297bbccf0ec0ae9e9418cd2dc1eee7ef,"In this essay, we integrate institutional and business bubble perspectives to build a theoretical explanation for the growth and subsequent decline of the business school sector in Dubai during the period 2002-2012. The motivation for our research-based essay stems from the question: ""How is it possible that the world's top business schools simultaneously judged the market so badly and collectively invested in activities that, in retrospect, were far from economically rational and more closely resembled euphoria and mania?"" Furthermore, we ask: ""Why did business school leaders decide to enter the overcrowded Dubai market in particular, precipitating its boom-and-bust cycle? Our novel integration of institutional logics and bubble literatures produces a detailed theoretical understanding of why business school bubbles have emerged in the past and may emerge again in the future. From a practical perspective, we also indicate that business schools are not immune to business cycles or to bubbles and bursts. Business schools can even create their own bubbles and bursts. © of the Academy of Management, all rights reserved.",,
From the editors: Honoring the legacy of chris argyris by devoting attention to how managers learn,2014,Academy of Management Learning and Education,https://www.scopus.com/inward/record.uri?eid=2-s2.0-84898639023&doi=10.5465%2famle.2013.0369&partnerID=40&md5=b9e581fab02b4fa4a73a9c791048a820,[No abstract available],,
Introduction: Lessons from zombies and cockroaches-learning from our past as we create paths forward into the future,2014,Academy of Management Learning and Education,https://www.scopus.com/inward/record.uri?eid=2-s2.0-84898631413&doi=10.5465%2famle.2014.0016&partnerID=40&md5=dd9b07d1946e65793696caf5ad568c80,[No abstract available],,
