Title,Year,Source title,Link,Abstract,Author Keywords,Index Keywords
The effect of hierarchical level on the content and structure of managers' mental models,2008,"Academy of Management 2008 Annual Meeting: The Questions We Ask, AOM 2008",https://www.scopus.com/inward/record.uri?eid=2-s2.0-85085780793&doi=10.5465%2fambpp.2008.33716567&partnerID=40&md5=f60df077aae32887e3487eb793fdb0f1,"Managers' mental models influence their decision-making and performance in organizations. The antecedents that might determine managers' mental models, however, have received scant empirical attention. In our study we examine the effect of hierarchical level on the content and structure of mental models of management dyads, consisting of executives and their subordinate team managers. The repertory grid technique was applied to elicit mental models of the respondents. Our pattern of results indicates that both content and structure of mental models are partly impacted by hierarchical level. While the content of managers' mental models does not vary between hierarchical level, the relevance of the content for decision-making does differ between executives and team managers. Regarding the structure of mental models, managers from different hierarchical levels mentioned the same number of content attributes, but executives' mental models exhibit higher cognitive integration than their subordinate team managers. The implications of hierarchical level as an antecedent of mental models are discussed and suggestions for future research are made.",Hierarchy; Mental model; Repertory grid technique,Cognitive systems; Decision making; Managers; Content and structure; Hierarchical level; Hierarchy; Mental model; Repertory grid technique; Human resource management
Psychological change climate as a crucial catalyst of readiness for change,2008,"Academy of Management 2008 Annual Meeting: The Questions We Ask, AOM 2008",https://www.scopus.com/inward/record.uri?eid=2-s2.0-85085400061&doi=10.5465%2fambpp.2008.33661178&partnerID=40&md5=321fedf222ad0c2d2aea2b605c9f3f08,"The aim of this inquiry was to explore the relationship between psychological change climate (i.e. trust in top management, history of change, participation in decision making, and quality of change communication) and readiness for change. By means of a large scale survey administered in 53 Flemish public and private sector organizations, we collected in total 1,559 responses. Structural equation modeling was used to test the hypotheses. A positively perceived change history, participation in decision making and high quality change communication had positive correlations with trust in top management. Trust in top management did not mediate the relationships between those three change climate dimensions and the outcome variables (i.e. emotional, cognitive and intentional readiness for change). In addition, it was found that history of change and quality of change communication shaped organizational members' emotional and cognitive readiness for change. The complex interplay between people's cognitions, feelings, and their intentions about organizational change confirms the need to consider readiness for change as a multidimensional construct. To conclude, this paper elaborates on how these findings match the extant literature on organizational development and change.",Context and process factors of change; Psychological change climate; Readiness for change,Behavioral research; Decision making; Context and process factors of changes; Organizational change; Organizational development; Positive correlations; Psychological change climate; Public and private sector; Readiness for change; Structural equation modeling; Climate change
Innovation tensions and organizational ambidexterity: Toward a collective paradox frame,2008,"Academy of Management 2008 Annual Meeting: The Questions We Ask, AOM 2008",https://www.scopus.com/inward/record.uri?eid=2-s2.0-85085399945&doi=10.5465%2fambpp.2008.33649824&partnerID=40&md5=0caa01af0680685e1f989fe66bd599f9,"Coping with contradictory logics of exploration and exploitation demands organizational ambidexterity. While a mindset of experimentation and imagination fuels radical innovation, specialization and incremental improvements help leverage existing products, respectively. Yet most studies of ambidexterity investigate supportive structures and strategies, rather than underlying mindsets. Cognition research stresses that such tensions pose cognitive conflict, but rarely examines how actors frame tensions. To bridge this gap, we conducted an inductive study of five, ambidextrous firms. Examining the language of innovation throughout and across these leading product design firms, we identified two, robust patterns. First, actors embraced nested innovation tensions, valuing breakthroughs and profit, individuality and collaboration, and passion and discipline as synergistic and energizing. Second, a healthy fear seemed to revolve around dangers of single-mindedness. In sum, we theorize that a shared paradox frame may enable ambidextrous exploration and exploitation, and we pose directions for future research.",Cognition; Innovation; Organizational ambidexterity,Cognition; Exploration and exploitation; Incremental improvements; Organizational ambidexterity; Radical innovation; Robust patterns; Product design
Does business school research add economic value for students?,2008,"Academy of Management 2008 Annual Meeting: The Questions We Ask, AOM 2008",https://www.scopus.com/inward/record.uri?eid=2-s2.0-85085782619&doi=10.5465%2fambpp.2008.33641680&partnerID=40&md5=5105feb01e00efcf0d1bcfba9be1f4e6,"Recently, a special forum in the Academy of Management Journal (AMJ) has issued a major challenge that raises serious questions about the fundamental focus of management research and its very impact and relevance. Specifically, is our field so obsessed with theory that our research is incapable of adding value to practice, perhaps placing our very legitimacy at risk? As we approach the 50 year anniversaries of both the Academy of Management and the Ford and Carnegie foundation reports that spurred management to become a scientific discipline, the timing may be more than appropriate to examine this challenge. In this study, we test whether academic research adds value for the graduates of our business schools. Our findings from a 6 year sample of panel data of 155 major ranked business schools suggest that business school research generally enhances the long-term earnings prospects for students. However, significant curvilinearity characterized this relationship, such that the highest levels of research intensity may fail to add value for students. We conclude that balance in business school research activities may be warranted, and that a potential resolution to the challenge may be to offer businesses research benefits that are more direct such as more descriptive research on managerial processes, analysis of the potential causes of business failures, as well as prescriptive research on differentiation strategies.",Business schools; Rankings; Research,Plant shutdowns; Research; Academic research; Business schools; Differentiation strategies; Management journals; Management research; Rankings; Research activities; Scientific discipline; Students
"Communication in virtual worlds, group identity, collective orientation, and cooperation",2008,"Academy of Management 2008 Annual Meeting: The Questions We Ask, AOM 2008",https://www.scopus.com/inward/record.uri?eid=2-s2.0-85085781926&doi=10.5465%2fambpp.2008.33652653&partnerID=40&md5=80758cb282019ac26cc62630159e5e4b,"Communication, close social distance, and a collectivistic orientation seem to be important antecedents for fostering cooperation. However, empirical results regarding the impact of strategically irrelevant communication (or 'cheap talk') on cooperation are mixed. This paper reports the results of a controlled 2×2 lab experiment which studies the effects of strategically irrelevant cheap talk communication via a 3D-world, as well as the effects of social distance and collective orientation on cooperation. The results indicate that persons in a situ-ational setting that allows them to hope that the partner will respond in a cooperative manner, show a higher degree of cooperation when communicating in a personal way and interacting with someone from their own group. Furthermore, external stimuli (communication and group membership) mainly affect individually-oriented persons (i.e. those who have a low degree of collective orientation). Furthermore, in comparison with the literature on face-to-face communi-cation, these results demonstrate that the effects are less with avatar based communication.",Avatar; Communication; Virtual worlds,Communication; Interactive computer graphics; Virtual reality; Avatar; Collective orientation; External stimulus; Face to face; Group identities; Group memberships; Social distance; Virtual worlds; Cooperative communication
When does my relationship with my manager matter most? The moderating role of coworkers' LMX,2008,"Academy of Management 2008 Annual Meeting: The Questions We Ask, AOM 2008",https://www.scopus.com/inward/record.uri?eid=2-s2.0-85085781806&doi=10.5465%2fambpp.2008.33725259&partnerID=40&md5=6c921d13da266e2dec201f0a7679b1c9,"Drawing on leader-member exchange (LMX) and social comparison theories, we examine a boundary condition of LMX effects within work groups. Consistent with the theoretically-derived hypotheses, results from three field studies (N's = 209, 904, and 455) reveal that the relationship between individual LMX and a variety of outcomes (e.g., job satisfaction, organizational commitment, member competence, group identification, OCB, deviance, and performance) is moderated by coworkers' LMX, such that the relationships are stronger when coworkers' LMX is high than when coworkers' LMX is low. These findings highlight the role of social comparison processes in work groups and the importance of examining the social context when studying LMX.",Leader-member exchange; Relational processes; Social comparison,Job satisfaction; Field studies; Group identification; Leader-member exchanges; Organizational Commitment; Social comparison; Social comparison theory; Social context; Workgroups; Professional aspects
What is corporate deviance? Exploring negative and positive deviant firm behavior,2008,"Academy of Management 2008 Annual Meeting: The Questions We Ask, AOM 2008",https://www.scopus.com/inward/record.uri?eid=2-s2.0-85086494107&doi=10.5465%2fambpp.2008.33725196&partnerID=40&md5=77b22decc39bb8e436e5d00ea4e80fb0,"Organizations are said to be limited in their strategic actions by external constraints and institutional pressures toward conformity. Yet, these arguments do not explain why, how and when some organizations intentionally deviate from established industry norms in a significant manner. Prior research on deviance has also focused almost exclusively on negative deviant behavior at the individual level, however recent developments in Positive Organizational Scholarship are working to shift the discourse to include positive deviance in and at the organizational level as well. Herein I expand the concept of deviant behavior to the firm level and develop the construct of corporate deviance by looking at both negative and positive firm level deviant behavior. Institutional pressures and environmental antecedents that both constrain and encourage corporate deviance are explored.",Corporate deviance; Industry norms; Positive organizational scholarship,Corporate deviance; External constraints; Individual levels; Industry norms; Institutional pressures; Organizational levels; Positive organizational scholarship
Better with age? Tie longevity and the performance implications of bridging and closure,2008,"Academy of Management 2008 Annual Meeting: The Questions We Ask, AOM 2008",https://www.scopus.com/inward/record.uri?eid=2-s2.0-85086493656&doi=10.5465%2fambpp.2008.33625391&partnerID=40&md5=0dbf1ce5a870744b9256a4cef7c8bc72,"We examine the dependence of the performance effects of firms' network positions on the ages of the ties comprising them. Our analysis of Canadian investment banks' underwriting syndicate ties indicates that the performance benefits of closure increase with tie age, while benefits of bridging decrease with tie age. We also find that benefits yielded by hybrid network positions combining elements of both closure and bridging are greatest when old closure ties are combined with either very young or very old bridging ties. Our findings support the idea that the advantages firms gain (or do not) from their network positions depend on the character of the ties (e.g., age) comprising them, highlighting the risk of theorizing structural network effects without also considering the qualities of the ties through which particular structural benefits accrue.",Networks; Performance,Networks (circuits); Hybrid network; Investment bank; Performance; Performance benefits; Performance effect; Structural networks; Investments
Divestment as a real option: Firm choices under conditions of uncertainty,2008,"Academy of Management 2008 Annual Meeting: The Questions We Ask, AOM 2008",https://www.scopus.com/inward/record.uri?eid=2-s2.0-85086494464&doi=10.5465%2fambpp.2008.33640703&partnerID=40&md5=6c5e038a3f01ea6999b4e639cac02363,"This study shifts the focus of real options theory from investment decisions to divestment decisions. The key implications of the theory are developed and tested for business unit divestments as 'put' options on real assets. The results show that uncertainty in a business unit's environment is negatively related with the decision to divest. Further, this negative relationship remains when environmental uncertainty increases and disappears when environmental uncertainty falls. Together, these results suggest that firms' decisions to divest may be driven by option considerations when the environment of the business unit is uncertain.",Divestments; Real options; Uncertainty,Business units; Divestments; Environmental uncertainty; Investment decisions; Real Options; Real options theory; Uncertainty; Investments
Buyers' search for new market ties with strangers,2008,"Academy of Management 2008 Annual Meeting: The Questions We Ask, AOM 2008",https://www.scopus.com/inward/record.uri?eid=2-s2.0-85085399272&doi=10.5465%2fambpp.2008.33628774&partnerID=40&md5=b930f57a2afd5f93954e57480ca780c1,"Much is now known about the role of repeated ties in network evolution processes, but we know less about the establishment of ties with strangers. In this paper, we add to the literature on network dynamics by examining the patterns of buyers' search for new ties with partners in vertical relations that they have had no direct tie with in the past. Our hypothesis is that buyers favor previously unknown new partners that have specific network, social, and market characteristics. Our longitudinal analysis of supplier network formation in the Japanese automobile industry shows that a searching buyer favors strangers that have higher network centrality, ties with other buyers with which it has more shared bridges and similar product lines, and lower multimarket contact as new partners.",Dynamics; Network; Stranger,Automotive industry; Commerce; Dynamics; Networks (circuits); Higher networks; Longitudinal analysis; Market characteristics; Multi-market contacts; Network dynamics; Product-lines; Stranger; Supplier networks; Sales
"Habitus, symbolic violence and opportunity constitution in the Canadian cable industry",2008,"Academy of Management 2008 Annual Meeting: The Questions We Ask, AOM 2008",https://www.scopus.com/inward/record.uri?eid=2-s2.0-85085782321&doi=10.5465%2fambpp.2008.33645120&partnerID=40&md5=842275857c7fbca96cfb46e3dad0cf32,"Do entrepreneurs simply recognize and act on opportunities or do they create opportunities? This question has been identified as a central issue in entrepreneurship research (Shane & Venkataraman, 2000b). In this paper I use data from the emergence of the cable industry in Canada to theorize the social processes by which some early cable entrepreneurs came to recognize the opportunity to apply cable technology for the distribution of television services and how a subset proceeded to successfully transform the initial recognition into the creation of profit generating opportunities. The theorization of opportunity constitution frequently implies that it is a socially frictionless process. The analysis presented in this paper attempts to redress this oversight by introducing social processes into the conceptualization of opportunity. I argue that potential entrepreneurs must make a substantial investment in institutional work (Lawrence & Suddaby, 2006) to overcome the subjective, social and institutional barriers that impede the successful constitution of a new opportunity. Using the concepts of habitus, symbolic violence (Bourdieu, 1985; 1989; 1998) and structuration (Giddens, 1984) I theorize opportunity constitution as a social process. I conclude that opportunity recognition/creation is not an individual event but a multi-stage social process with at least a subjective moment and a moment of action, and in some cases, a collective moment and a public moment; a process that frequently unintentionally or intentionally de-institutionalizes the institutional and social structures of previously established fields.",Bourdieu; Entrepreneurship; Opportunity recognition,Bourdieu; Cable industry; Entrepreneurship; Institutional barriers; Opportunity recognition; Social process; Social structure; Substantial investments; Cables
Investigation of the underlying structure of Personal Web Usage in the workplace,2008,"Academy of Management 2008 Annual Meeting: The Questions We Ask, AOM 2008",https://www.scopus.com/inward/record.uri?eid=2-s2.0-85085782564&doi=10.5465%2fambpp.2008.33649965&partnerID=40&md5=0ee0a06c4e00ff66df9e6a2251e91ded,"We set out to empirically uncover the underlying structure of Personal Web Usage (PWU) in the workplace. We grounded our exploration in the psychological contract theory. We asked three hundred and thirty nine part-time MBA students about their personal web usage at work to develop a list of PWU activities. A second sample of MBA students then judged the behaviors to identify similarities among the activities. Similar PWU activities grouped together in a matrix and we analyzed this matrix using multidimensional scaling techniques and cluster analysis to identity common dimensions among the PWU activities. The results suggest four clusters of PWU activities: work/family, hedonic, self-development, and citizenship. Using a third sample of web users, we confirmed the PWU cluster labels and corresponding definitions. The results of this study support the argument that there are multiple categories of PWU, some of which have the potential for individual and organizational benefits.",Psychological contract; Web usage,Multidimensional scaling techniques; Personal web usage; Psychological contracts; Web usage; Web users; Cluster analysis
CEO duality and board attention to monitoring and control,2008,"Academy of Management 2008 Annual Meeting: The Questions We Ask, AOM 2008",https://www.scopus.com/inward/record.uri?eid=2-s2.0-85077344463&doi=10.5465%2fambpp.2008.33629941&partnerID=40&md5=4ba78591e5c1e5283e1ab6358b4ff7f0,"This study examines the influence of CEO duality on board attention to monitoring and control role. We draw upon agency theory and the attention based view to argue that CEO-chairs are able to utilize their formal authority to direct the board of director's attention away from monitoring and control issues. The theory developed in this study was tested on a longitudinal sample of 183 firms from the furniture manufacturing, rubber and plastics, and electronics industries. The results suggest that when faced with the threat of poor performance CEO-chairs act to reduce board attention to monitoring and control. Moreover, our results generally suggest that CEO-chairs utilize their control over board meeting location and board meeting agenda detail as entrenchment mechanisms to focus board attention on issues other than monitoring and control.",Board of directors; CEO duality; Corporate governance,Furniture manufacture; Agency theory; Attention-based views; Board of directors; CEO duality; Corporate governance; Furniture manufacturing; Monitoring and control; Poor performance; Rubber applications
Consequences of social network characteristics for expatriate adjustment & performance in overseas assignments: An empirical investigation of managers in Asia,2008,"Academy of Management 2008 Annual Meeting: The Questions We Ask, AOM 2008",https://www.scopus.com/inward/record.uri?eid=2-s2.0-85086491191&doi=10.5465%2fambpp.2008.33633336&partnerID=40&md5=d926d64b619fbbfcfd28aae2459bf6d9,"This study investigates the effects of expatriates' social network characteristics on performance on overseas assignments. We compare the predictions from social capital theories and social learning theories of expatriates' social networks. Using matched data from 158 expatriates working in Singapore and performance ratings by their supervisors we find that the number of host country nationals in the expatriates' network and the frequency of contact with them predicts supervisor performance ratings. This effect is mediated by the expatriate's interaction adjustment. The authors discuss implications of these findings for theory and research on social networks of expatriates, as well as for managerial practice.",Expatriate adjustment; Expatriate performance; Social network,Social networking (online); Empirical investigation; Expatriate adjustment; Expatriate performance; Managerial practices; Network characteristics; Overseas assignments; Performance ratings; Social learning theory; Managers
What I like about you: Director characteristics and shareholder approval,2008,"Academy of Management 2008 Annual Meeting: The Questions We Ask, AOM 2008",https://www.scopus.com/inward/record.uri?eid=2-s2.0-85085780668&doi=10.5465%2fambpp.2008.33725192&partnerID=40&md5=4ea465c699d1ad1c034335db1fc44571,"The vast majority of corporate governance research is grounded in agency theory and focuses on the relationships between various governance configurations and firm performance. Empirical results, however, are largely unsupportive. This has led researchers to consider alternative and multi-theoretical lenses and outcome measures. Consistent with this emerging tradition, we compare insights from agency and resource dependence theories to examine the elections of over 2,000 Fortune 500 directors. By studying actual voting behaviors, we provide new perspective to understanding director elections as a governance process. Employing a multi-level approach, we find support for relationships between several director characteristics and shareholder opposition to directors up for (re-)election to the board.",Boards of directors; Director election; Shareholder votes,Agency theory; Boards of directors; Corporate governance; Director election; Firm Performance; Multilevels; Outcome measures; Resource dependences; Shareholders
Does nationality matter in transnational teams? Conceptualizing barriers to knowledge seeking,2008,"Academy of Management 2008 Annual Meeting: The Questions We Ask, AOM 2008",https://www.scopus.com/inward/record.uri?eid=2-s2.0-85085399937&doi=10.5465%2fambpp.2008.33641684&partnerID=40&md5=203b99b6885a3cf80f7265b63ec1e559,"In contrast to prevailing theories that emphasize the importance of nationality differences in transnational teams, we argue that there are multiple differences that can hinder collaboration among transnational team members. Distinguishing person-based from position-based differences, we theorize that nationality differences impede knowledge seeking across cultures as well as geographies, due to biases that deter knowledge seeking from team members who are different. Beyond nationality differences, however, we propose that demographic differences and structural differences also create barriers to knowledge seeking within transnational teams. While prior research has examined diversity among transnational team members at the group level of analysis, we use hierarchical linear modeling to study 13,540 dyadic interactions among 2,059 members of 276 teams in a large multinational corporation. Our findings reveal that cultural, geographic, and demographic differences all matter, but that structural differences create the greatest barriers to knowledge seeking among team members. The results further show that working together on a previous team can mitigate the negative effects of member differences, indicating that increased mutual knowledge can reduce the biases that deter knowledge seeking. Our discussion emphasizes that formal organizational structure shapes collaboration more fundamentally than the distinctive cultural and geographic features of transnational teams that preoccupy most current studies, and we address additional implications for theory and research.",Knowledge sharing; Multinational organizations; Transnational teams,Dyadic interaction; Hierarchical linear modeling; Knowledge-sharing; Multi-national corporations; Multinational organizations; Organizational structures; Structural differences; Transnational teams; Population statistics
