Title,Year,Source title,Link,Abstract,Author Keywords,Index Keywords
"On the folly of rewarding A+, while only needing a: The tradeoff between Jacks of all trades and masters of one",2008,"Academy of Management 2008 Annual Meeting: The Questions We Ask, AOM 2008",https://www.scopus.com/inward/record.uri?eid=2-s2.0-85088752963&doi=10.5465%2fambpp.2008.33652874&partnerID=40&md5=20f4a8cdfb1cccd4b64205c90b78f79e,"The paper extends the proposition of Kerr's (1975) seminal observations about distorted incentives in organizations. Many organizational reward systems are biased because organizations do not always tie pay closely to performance (Lawler, 1971). The current research theoretically and empirically identifies another important bias of distorted rewards, namely, the folly of rewarding A+, whiling only needing A. Specifically, we propose that because of biased perceptions of generalists, decision makers may overlook their real organizational needs and both recruit and overcompensate redundant personnel. Three studies demonstrate this judgment bias in the context of both corporate HR functions and the National basketball Association (NBA). Study 1 demonstrated that large companies assigned multiple functional duties to their HR specialists and inefficiently placed generalists in their workforce. Study 2 showed that NBA teams failed to tie three point specialists' salaries to their specialized expertise. Survey in Study 3 revealed a similar generalist bias among the basketball fans, who distinctly favored the all-around players even when their team was in need of three point shooters. The fans demonstrated a moderate improvement in their decisions, however, when they evaluated the specialist and the generalist separately.",Compensation; Distorted incentives; Judgment and decision making,Compensation (personnel); Sports; Decision makers; Distorted incentives; Judgment and decision makings; Large companies; National basketball associations; Reward systems; Decision making
"Who are all these people? Managing expansion, change, and success in the public sector a preliminary assessment",2008,"Academy of Management 2008 Annual Meeting: The Questions We Ask, AOM 2008",https://www.scopus.com/inward/record.uri?eid=2-s2.0-85088717800&doi=10.5465%2fambpp.2008.33725331&partnerID=40&md5=a8488bf81c98cfc346ba73aa36612b80,"How do public agencies manage sudden and rapid infusions of new employees? How rapidly can new employees find mentors, expand their contacts in the agency, and become ""effective"" when many others are also attempting to integrate themselves concurrently? How does a large public organization socialize large cohorts of new workers? This paper follows the efforts of New York's Office of State Comptroller (OSC) to integrate a large cohort of new auditors and managers hired after a major school finance scandal in 2005. Using longitudinal, ego-centric network data we study the advice, information, friendship, and role model networks 22 auditors and 15 promoted managers created during their first year on the job in order to identify factors determining the effective acquisition of task-relevant and organizational information and to develop strategies to promote successful integration. In addition, we follow the networks of 6 experienced managers as a comparison group. This study presents preliminary findings based on three of the four waves of data collection. We have found clear differentiation in the structure of the four types of networks. Each has a characteristic structure that reflects differentiation in purpose of the networks. These differences are not related to gender. We have also found that some efforts by OSC to proactively shape the structure of these four networks have not been instantiated in the structure of the resulting ego-nets. The paper concludes with a discussion of implications for public managers.",Social networks; Socialization; Succession planning,Social networking (online); Comparison group; Data collection; Ego-centric networks; Organizational information; Preliminary assessment; Public organizations; Socialization; Succession planning; Managers
The adoption of a foreign group subsidiary: An institutional multiplicity perspective,2008,"Academy of Management 2008 Annual Meeting: The Questions We Ask, AOM 2008",https://www.scopus.com/inward/record.uri?eid=2-s2.0-84858405733&partnerID=40&md5=521bfe6b785a3896aeb3a27bb6be7382,"Drawing on institutional theory and using the context of MNCs, this study developed a new framework to explore the multiple institutional pressures faced by MNC subsidiaries in their decision to adopt a foreign group subsidiary in an emerging economy. We distinguished between coercive and mimetic isomorphism mechanisms and discriminated between the origins of imitation pressures. The study highlighted the coercive isomorphic pressures from local government inducement, the mimetic isomorphic influences from global peers, and most important of all, the critical roles of an MNC¡̄s local business group partners in the interorganizational imitation process. It points to the importance of these key institutional isomorphic influences on the adoption of an organizational practice by MNCs operating in emerging economies, which is not only interesting from an academic perspective, but also has important practitioner implications.",Emerging economy; Institutional isomorphism; MNC,Decision theory; Group theory; Set theory; Emerging economies; Imitation process; Institutional isomorphism; Institutional theory; Local business; Local government; MNC; Organizational practices; Societies and institutions
Words of action: The centrist and pragmatic discourse of sustainable development reporting,2008,"Academy of Management 2008 Annual Meeting: The Questions We Ask, AOM 2008",https://www.scopus.com/inward/record.uri?eid=2-s2.0-85088748190&doi=10.5465%2fambpp.2008.33725371&partnerID=40&md5=b457ffb6f85deb473f7b67b9b6fa9c72,"Purpose - This paper aims to examine language use and (re)presentations within the business context around the concept of sustainable development. In doing this we consider how a representation of a phenomena constructs our understanding of that phenomena and how context, in terms of a business association for sustainable development, is important in this construction process. We argue that such representations are constitutive of the way that business has come to 'know' and 'do' sustainable development and these constrain and enable particular actions and developments. Design/methodology/approach - Using a New Zealand-based study, this study draws on two main sources of materials: a corpus of written and presentational materials produced by a business association and eight of its members' first publicly available triple bottom line reports. The coding and analytic process involved a close interpretive examination of the documents to uncover meanings rather than document the volume of disclosure. The content of the reports and pronouncements is framed and analysed within a wider paradigmatic debate on sustainable development. Findings - The business association and its members' reports are shown to present a pragmatic and middle-way discourse on business and the environment. Through the use of rhetorical claims to pragmatism and action, the discourse suggests businesses are ""doing sustainability"". The association and its members are shown to present a narrow, largely economic and instrumental approach to the natural environment. Such a discourse we argue runs contrary to claims of reform and transformation, and instead reinforces the status quo of traditional interests of business-as-usual over the natural environment. Originality/value - This paper will be of value to researchers interested in business and sustainable development. By taking an interpretive approach and extending the analysis to a business association, we illustrate the ideological role communication plays in the organised construction of a dominant and potentially unassailable approach to the natural environment. Key words Sustainable Development, Corporate Reporting, Business Association, Discourse Analysis; New Zealand.",Corporate reporting; Discourse analysis; Sustainable development,Planning; Business associations; Construction process; Corporate reporting; Design/methodology/approach; Discourse analysis; Instrumental approach; Interpretive approaches; Natural environments; Sustainable development
Is experience valuable in international strategic alliances,2008,"Academy of Management 2008 Annual Meeting: The Questions We Ask, AOM 2008",https://www.scopus.com/inward/record.uri?eid=2-s2.0-84858422862&partnerID=40&md5=bed0779a21065a2200c19d60bda29bc5,"This study investigates whether firms benefit from accumulation of prior experiences in non-equity involved international strategic alliances (ISAs). Previous studies on the issue of experiential learning in the domain of international alliances have mostly focused on equity involved joint venture, while non-equity involved alliance, the other type of international cooperations, is conversely left under researched about its experience effect. Given the mixed evidences of experience effect in international joint ventures, investigating the experience issue against non-equity alliances will yield a new insight on this topic. In contrast to previous studies most of which simply concentrate on quantity increase of alliance experience to address its benefits, we visit the issue with a finer picture, asking the question that if experience similarity enhances firm performance, and further, under what condition that such specific learning most influential. With 629 non-equity involved international alliances formed by US firms, our results basically confirm the benefits of prior experiences in ISAs. Experience in general, and that specific to activity type and partner¡s country are documented beneficial. However, such experiential learning is not equivalent which effect is greatly moderated by the level of alliance complexity. Experiences under great uncertainty, in terms of cooperations on techniques or/and with partners from developing countries, are found specifically imperative for alliance partnering firms. We derive the above argument from both ex ante market¡s evaluation of alliance announcement and ex post firm¡s operating performance. Findings from this research may help further our understanding on the issue of inter-firm experiential learning in the domain of international alliances.",Experience; International alliance; Non-equity,Developing countries; International cooperation; Experience; Experiential learning; Firm Performance; International alliance; International joint ventures; International strategic alliance; Joint ventures; Non-equity; Operating performance; Prior experience; Specific learning; Industry
Board information advantage: A study of board capital and absorptive capacity,2008,"Academy of Management 2008 Annual Meeting: The Questions We Ask, AOM 2008",https://www.scopus.com/inward/record.uri?eid=2-s2.0-84858374208&partnerID=40&md5=d612c92935c73a11bb67a11a509c36ab,"This study examines how board capital and absorptive capacity improve board strategic task performance. It uses an argument from a recent information processing model, which advocates using unique information in a diverse group. A distinction between static and dynamic resources is made where the static dimension addresses board capital and the dynamic one the absorptive capacity. Board capital is discussed in terms of information diversity, while absorptive capacity in terms of three practices that tap unique information. Structural Equation Modeling is applied with survey data collected in years 2003 and 2005. The results suggest different effects of board capital and absorptive capacity on board strategic task performance. Board capital seems to enhance the board's future strategic task performance, while absorptive capacity the board's current strategic task performance.",Absorptive capacity; Board capital; Board strategic task performance,Absorptive capacity; Board capital; Different effects; Information processing models; Static and dynamic; Structural equation modeling; Survey data; Task performance; Data processing
Operations and maintenance practices and their impact on power plant performance,2008,"Academy of Management 2008 Annual Meeting: The Questions We Ask, AOM 2008",https://www.scopus.com/inward/record.uri?eid=2-s2.0-84858421254&partnerID=40&md5=5cbe2599e325e374a18be16b1ced082a,"The aim of the study was to examine the impact of Operations and Maintenance (O&M) practices, individually and collectively, on power plant performance. Data were collected from more than 100 power plants in Australia and Malaysia. The reliability and validity (content, construct, and criterion) of the practice and performance measures were evaluated. Our study showed that the relationship between O&M practices and plant performance is significant and positive in a cross-sectional sense. Both people-oriented ""soft"" as well technically-oriented as ""hard"" practices were found to be positive and significant predictors of plant performance. This is consistent with literature on socio-technical systems theory that both ""soft"" and ""hard"" practices are required to complement each other to produce and sustain high performance. Among the practices, executive commitment and TPM-orientation are the strongest significant predictors of plant performance. Our findings also highlight the impact of maintenance practices on plant performance compared to other practices such as long-term planning, customer focus, knowledge management, and employee involvement. Based on our study we conclude that Total Quality Management (TQM) and maintenance philosophies are sources of sustainable competitive advantage in the power generation sector.",Performance; TPM; TQM,Knowledge management; Philosophical aspects; Power plants; Total quality management; Australia; Customer focus; Employee involvement; Long term planning; Maintenance practices; Malaysia; Operations and maintenance; Performance; Performance measure; Plant performance; Power plant performance; Reliability and validity; Sociotechnical systems theory; Sustainable competitive advantages; TPM; Maintenance
The contingent value of political ties in evolving environments: Exit of domestic firms following competitive foreign entry,2008,"Academy of Management 2008 Annual Meeting: The Questions We Ask, AOM 2008",https://www.scopus.com/inward/record.uri?eid=2-s2.0-84858397666&partnerID=40&md5=9b4f8712121c71fc4d3928bc26126d10,"This paper evaluates the impact of managerial ties to political agencies on domestic firms' exit decisions in response to foreign firms' entry into evolving markets. We propose that political ties retain its value on domestic firms' exit in evolving environment, and the impact varies with the nature of ties, firm strategy and environmental factors. We study the exit decisions of a sample of TV manufacturing firms following the sudden and substantial entry of multinationals in the evolving Chinese economy from 1993 to 2003. Results show that (1) political ties remain an important influence on domestic firms' exit following substantial foreign entry, reducing firms' likelihood of dissolution, and increasing their likelihood of being acquired; (2) political ties increase the risk of firms being acquired immediately following foreign entry, and reduce dissolution risks in the longer term; and (3) the value of these ties varies over time, with the exact nature of the variation depending on contextual factors and types of ties and strategy.",,Dissolution; Social sciences; Chinese economy; Contextual factors; Domestic firms; Environmental factors; Exit decision; Firm strategy; Foreign firms; Manufacturing firms; Industry
Person-centered work environments in health care: Preliminary test of a theoretical framework,2008,"Academy of Management 2008 Annual Meeting: The Questions We Ask, AOM 2008",https://www.scopus.com/inward/record.uri?eid=2-s2.0-85088754190&doi=10.5465%2fambpp.2008.33659871&partnerID=40&md5=81d47dac9e92e80b03623a6df1e087c2,"Much attention has been paid in recent years to improving the quality of care patients receive in the hospital. Many experts, including the Institute of Medicine, are now starting to propose that the working environment for health care staff has an important impact on the care and safety of patients, through its impact on staff morale and commitment (Page, 2004). The present study tested a theoretical framework that proposes three person-centered dimensions in the health care work environment are necessary for positive outcomes: (1) a climate for patient-centered care; (2) a climate for continuous quality improvement; and (3) a benevolent ethical climate. A work environment that includes higher levels of these climates is hypothesized to predict positive outcomes for staff, such as commitment, and engagement, and as well, positive outcomes for patients, such as patient safety. The model proposes that positive psychological states among care providers mediate relationships between the work environment and outcomes. As a preliminary test of the model, survey data from 252 clinical care providers working in a large urban hospital were analyzed. Structural equations modeling analyses found partial support for the model, in that care providers' psychological safety partially mediated the relationships between the work environment and care provider commitment. Direct relationships also existed between some of the work environment climates and care provider well-being and patient safety outcomes. Implications and limitations are discussed.",Patient centered care; Staff morale; Work environments,Employment; Health care; Hospitals; Continuous quality improvement; Patient-centered care; Psychological safety; Psychological state; Staff morale; Structural equations modeling; Theoretical framework; Work environments; Human engineering
Money and fame: Vividness effects in the National Basketball Association,2008,"Academy of Management 2008 Annual Meeting: The Questions We Ask, AOM 2008",https://www.scopus.com/inward/record.uri?eid=2-s2.0-85088749449&doi=10.5465%2fambpp.2008.33650185&partnerID=40&md5=854bcab1ce3ecc92368d119974e3b4af,"In his widely reprinted article ""On the Folly of Rewarding A, While Hoping for B"", Kerr (1975) argued that vividness was one of the major reasons for distorted rewards. Using both archival and survey data, the present paper directly tests Kerr's proposal by investigating whether, how and why highly visible behaviors are over-rewarded and less visible, but at least equally important behaviors are under-rewarded. The National Basketball Association (NBA) was chosen as the domain of this study because scoring is particularly vivid. In the NBA, both non-scoring performance and scoring performance are critical for winning games (Chatterjee, Campbell & Wiseman, 1994; Hofler & Payne, 2004). However, findings from four studies demonstrated that the scoring performance of NBA players was weighed more heavily than their non-scoring performance because of its vividness. Scorers were rewarded with higher salaries and received more support in the NBA All-Star balloting than defenders, even though they might not necessarily make more contribution than their teammates. This pattern of findings suggests that the vividness effect may lead to pronounced differences in people's judgments especially when they are overwhelmed with abundant real-world information with similar validity.",Compensation; Judgment and decision making; Vividness,Behavioral research; Compensation (personnel); Decision making; Campbell; Judgment and decision makings; National basketball associations; Real-world information; Scoring performance; Survey data; Vividness; Sports
Transferability of the venture capital model to the corporate venture unit context,2008,"Academy of Management 2008 Annual Meeting: The Questions We Ask, AOM 2008",https://www.scopus.com/inward/record.uri?eid=2-s2.0-85088745245&doi=10.5465%2fambpp.2008.33720704&partnerID=40&md5=6464d4cbcb36617a5f21fee6a3f98b3b,"While recent literature has advocated the transfer of venture capital (VC) practices and structures to corporate venture (CV) units, the wisdom of this advice has not been subject to rigorous empirical scrutiny. We test the implications of the VC model for CV unit performance using a longitudinal database (combining survey, archival and survival data) on 95 CV units. Overall, adopting central elements the VC model was associated with higher CV unit performance. Critically, however, different elements of the VC model predicted strategic versus financial performance in CV units - the impact on financial dimensions of performance also being somewhat more pronounced. Specifically, horizontal autonomy, communication with the VC community, and relatedness of investments each positively influence the strategic performance of the CV unit. Likewise, behaving like a VC in terms of compensation, syndication centrality and relatedness of investments (inverted U shape) also positively influences the financial performance of the CV unit. In addition, survival of the CV unit was strongly associated with adopting the VC model (mediated, in part, by the enhanced performance of the CV unit when adopting the VC model).",Best practice; Corporate venture unit; Venture capital,Best practices; Corporate venture units; Corporate ventures; Financial performance; Inverted u shapes; Survival data; Venture Capital; Investments
CEO dismissal: The role of investment analysts as an external control mechanism,2008,"Academy of Management 2008 Annual Meeting: The Questions We Ask, AOM 2008",https://www.scopus.com/inward/record.uri?eid=2-s2.0-85088743347&doi=10.5465%2fambpp.2008.33629770&partnerID=40&md5=41762c04b133f845c62a953ec462cf16,"While poor performance and internal agency conditions (e.g., board power and CEO power) have been shown to be predictors of CEO dismissal, little is known about the role of the firm's external constituents in CEO dismissal. In this study, we argue that investment analysts, through their reports and ratings, serve an important external monitoring role over corporate behavior. Therefore, we expect that investment analysts can influence the board's evaluation of the firm and its leadership. We find that board dismissal of the CEO occurs more frequently for firms with more negative investment analyst ratings, providing strong support for their external monitoring role.",Analysts; CEO dismissal; Governance,Analysts; CEO dismissal; Corporate behavior; External control; Governance; Investment analysts; Poor performance; Investments
Strawman: The reconfiguration of Max Weber in management textbooks and why it matters,2008,"Academy of Management 2008 Annual Meeting: The Questions We Ask, AOM 2008",https://www.scopus.com/inward/record.uri?eid=2-s2.0-85088746610&doi=10.5465%2fambpp.2008.33664565&partnerID=40&md5=095b532b05b812ffff0b8d4f8e5cf9d7,"History has never figured prominently in conventional management textbooks, and when it is covered its superficial treatment largely goes unquestioned by instructors and students. To illustrate, this paper analyses the representation of Max Weber in management texts. Using a set of Foucauldian methods we find their representation of Weber over the past 30 years to be highly dubious, a reflection of a peculiar perspective that emerged in the middle of the 20th century, and driven more by a desire to justify the latest 'one best way' than an accurate reflection of anything that Weber actually said. We reflect on the negative consequences of this sort of history for management education and offer some ideas as to how such a problematic treatment of history could be overcome.",Management history; Max Weber; Michel foucault,20th century; Management education; Management history; Max Weber; Michel Foucault; Paper analysis; Superficial treatments; Textbooks
Valuation biases and the persistence of international joint ventures,2008,"Academy of Management 2008 Annual Meeting: The Questions We Ask, AOM 2008",https://www.scopus.com/inward/record.uri?eid=2-s2.0-84858412307&partnerID=40&md5=2051953977041408da9a0ab2044e7c31,"Investors often retain their initial set-up of an international joint venture (IJV) even when more beneficial alternatives have emerged. Such persistence appears inconsistent with rational decision-making. We analyze this persistence to advance the theoretical analysis of strategic decisions in international business with a focus on switches of ownership modes. More specifically, we propose a model that explains how cognitive biases may affect managerial valuations and thus decision-making regarding IJVs.",Biases; International joint venture; Persistence,Biases; Cognitive bias; International business; International joint ventures; Persistence; Strategic decisions; Decision making
