Title,Year,Source title,Link,Abstract,Author Keywords,Index Keywords
Transformational leadership and turnover: The roles of LMX and organizational commitment,2008,"Academy of Management 2008 Annual Meeting: The Questions We Ask, AOM 2008",https://www.scopus.com/inward/record.uri?eid=2-s2.0-84858425909&partnerID=40&md5=fb90b7929f9011f1aba306e8e7118052,"In this study, we developed a social exchange model to explicate the psychological process in which transformational leadership influences followers¡ withdrawal cognitions and their actual turnover over a 1-year period. The model was tested using a sample of 490 full-employees from a large telecommunication company in China. Hierarchical regression results provide support for the hypothesized model whereby transformational leadership influenced followers¡ withdrawal cognitions through the differential mediating effects of leader-member exchange (LMX), organizational commitment. Logistic regression results also support the model of transformational leadership and actual turnover behavior over time. Implications of our model for theory and practice are discussed and future research directions are outlined.",LMX; Transformational leadership; Turnover,Future research directions; Hierarchical regression; LMX; Logistic regressions; Mediating effect; Organizational Commitment; Psychological process; Social exchange; Telecommunication companies; Theory and practice; Transformational leadership; Turnover; Logistics
"Corporate social responsibility, applicants' ethical predispositions and organization attraction",2008,"Academy of Management 2008 Annual Meeting: The Questions We Ask, AOM 2008",https://www.scopus.com/inward/record.uri?eid=2-s2.0-84863373088&partnerID=40&md5=ddaefd5a844b4a4816ea25f76554ae60,"This policy-capturing study examines the impact of corporate social responsibility (CSR) on applicant attraction to organizations. In a sample of 201 graduating business students, we found that each aspect of CSR, i.e., economic, legal, and ethical responsibility, had a unique effect on organizational attraction and probability of accepting offer. The participants also combined these three types of information in an interactive configural manner. Applicants with different ethical predispositions were affected by CSR to different extents. Future research needs and practical implications are discussed.",Applicant attraction; Corporate social responsibility; Person-organization fit,Applicant attraction; Corporate social responsibilities (CSR); Ethical responsibility; Person-organization fit; Research needs; Philosophical aspects
Contracting capacity and performance in government: Nonlinear effects and the role of time,2008,"Academy of Management 2008 Annual Meeting: The Questions We Ask, AOM 2008",https://www.scopus.com/inward/record.uri?eid=2-s2.0-84863359215&partnerID=40&md5=a62547ec997cd9e5ed68cd64e1bbdca9,"Contracting-out has become a popular strategy in public service delivery, but it remains uncertain whether and how government can ensure contracting performance. As a result, a growing literature starts to emphasize the importance of governments' contracting capacities. Yet very few studies have empirically assessed how contracting capacities relate to contracting performance. This article identifies four types of contracting capacities in terms of agenda setting, contract formulation, contract implementation, and contract evaluation, relating them to three performance dimensions including cost, efficiency, and quality. Drawing from a manager survey, the article shows that the relationships between the capacities and the performance indicators are not always straightforward or linear, and the relationships are complicated by the role of time. The results suggest that contracting capacities have both benefits and costs, and the solutions.",Capacity; Contracting; Time,Benchmarking; Agenda settings; Benefits and costs; Capacity; Contracting; Contracting capacity; Nonlinear effect; Performance dimensions; Performance indicators; Public services; Time; Managers
Family control and stock market reactions to announcements of corporate venturing,2008,"Academy of Management 2008 Annual Meeting: The Questions We Ask, AOM 2008",https://www.scopus.com/inward/record.uri?eid=2-s2.0-84863379582&partnerID=40&md5=f6207d37ff724e37b5fe7e109d398000,"This study investigates whether family control affects the stock market reactions of new venturing. We found that with greater family control experienced more negative stock market reactions to venturing announcements. The results further indicated that the divergence of cash flow and voting rights was strongly and negatively correlated with announcement-period abnormal returns. The findings also indicated that institutional ownership had a significantly positive moderating effect suggesting that participation of institutional investors mitigated the negative influence of family control. The conclusions were robust under various measures of family control, and remained valid after controlling other influential factors for stock market reactions to venturing announcements.",,Investments; Abnormal returns; Cash flow; Corporate venturing; Influential factors; Moderating effect; Negative influence; Stock market; Commerce
Institutional and cultural influences on joint venture control: Evidence from China,2008,"Academy of Management 2008 Annual Meeting: The Questions We Ask, AOM 2008",https://www.scopus.com/inward/record.uri?eid=2-s2.0-84863385465&partnerID=40&md5=f3d1161be522f73239e6560778cc8f66,"This study examines the effects of institutional and cultural factors on three types of joint venture control C strategic, operational, and informal. Using survey data on joint ventures in China, we found that the multinational partners¡̄ strategic and operational controls were susceptible to government restrictions, state-ownership of local partners, and cultural distance, while informal control was less likely to be affected by those factors. The results also demonstrated that the relationships between multinational partners¡̄ control and their satisfaction with joint ventures were moderated by perceived venture importance and goal incongruence between partners. The findings may provide important implications for the design and implementation of effective joint venture governance.",China; Institutional factors; Joint venture governance,China; Cultural factors; Cultural influences; Informal controls; Institutional factors; Joint venture governance; Joint ventures; Operational control; Survey data
"Legitimacy and private entrepreneurship in China's transitional economy, 1978-1996",2008,"Academy of Management 2008 Annual Meeting: The Questions We Ask, AOM 2008",https://www.scopus.com/inward/record.uri?eid=2-s2.0-84863373805&partnerID=40&md5=d43517c922af020ffaaf42a88139330a,"A long-standing insight in social sciences holds that social values affect individuals' entry into entrepreneurship. This paper presents the first systematic empirical examination of how the legitimation of entrepreneurship at societal level dynamically shapes the entrepreneurial entry of individuals from different social strata. Analyzing a nationally representative life history data of the citizens of the People's Republic of China from 1978 to 1996, we find that high-status individuals (cadres and college-educated) are less likely to become private entrepreneurs before the field achieves full-fledged legitimacy, but they are faster in becoming private entrepreneurs as the field becomes more legitimate. We find that the entrepreneurial entry of individuals in regions with local entrepreneurial culture is less influenced by the regulative or cognitive legitimation processes at national level. Moreover, we find that cadres' entry into private entrepreneurship is amplified only by the regulative legitimation process at national level; Junior and senior high school graduates' entry into private entrepreneurship is amplified only by local entrepreneurial culture; college graduates' entry into the field is amplified by both the regulative and cognitive legitimation processes at national level and local entrepreneurial culture. The implications of the findings for entrepreneurship, neoinstitutional theory, and the market transition literature are discussed.",Entrepreneurship; Institution; Legitimacy,College graduates; Empirical examination; Entrepreneurial cultures; Entrepreneurship; High school; Legitimacy; Life history; National level; People's Republic of China; Social values; Transitional economies; Societies and institutions
Beyond transaction efficiency: The effect of knowledge interdependence on firms' R&D scope decisions,2008,"Academy of Management 2008 Annual Meeting: The Questions We Ask, AOM 2008",https://www.scopus.com/inward/record.uri?eid=2-s2.0-84863376237&partnerID=40&md5=628f102ffae381ff261df778d08e1156,"Uncertainty has long been understood as a stimulus for firms to manage their boundaries, i.e., to define the scope of their activities. In the extant literature, however, predictions exists that firms would increase or decrease their scope of activities when facing uncertainty. To reconcile these conflicting positions, we propose a model in which the system-level knowledge property interdependence moderates the effect of technological uncertainty on firms' R&D scope decisions. To test our model empirically, we develop a new set of measures for knowledge interdependence and technological uncertainty, and collect 33 years of data (1967-2000) on patenting activity and firm boundary location from the automotive airbag industry. The results of our analysis suggest that firm boundary decisions for knowledge-intensive activities such as R&D tend to be more impacted by considerations of the underlying knowledge structure than transaction efficiency. We discuss the implications of these findings for managerial practice and future research.",Knowledge interdependence; Modularity; Technological uncertainty,Firm boundaries; Knowledge interdependence; Knowledge structures; Managerial practices; Modularity; System levels; Technological uncertainty; Industry
Social network and opportunity recognition: A cultural perspective,2008,"Academy of Management 2008 Annual Meeting: The Questions We Ask, AOM 2008",https://www.scopus.com/inward/record.uri?eid=2-s2.0-84863371349&partnerID=40&md5=53d1e8a89e167f4d0ba1a387faee1c25,"Opportunity recognition has become a key concept in the field of entrepreneurship. While social networks have been regarded as critical for opportunity recognition, previous research has been constrained within certain cultural values. We investigated the moderating effect of the individualism-collectivism dimension on the relationship between social networks and opportunity recognition. Data obtained from Taiwan, Japan, and the U.S. supported our hypotheses, specifically, that culture moderates the relationship between tie strength and opportunity recognition. In addition, the results indicate that bridging ties facilitate opportunity recognition regardless of cultural difference or tie strength. The implications of the results and future research directions are discussed.",Individualism-collectivism; Opportunity recognition; Social network,Cultural difference; Cultural value; Future research directions; Individualism-collectivism; Moderating effect; Opportunity recognition; Social Networks; Social networking (online)
Conduits of innovation or imitation? Assessing the effect of alliances on the persistence of profits,2008,"Academy of Management 2008 Annual Meeting: The Questions We Ask, AOM 2008",https://www.scopus.com/inward/record.uri?eid=2-s2.0-84889720228&partnerID=40&md5=1f4b13480fad60f722642c635ce2af0d,"There has been growing interest in the determinants of sustainable competitive advantage-profits that are consistently above the average of a given industry for a certain period of time. We contribute to this debate by examining one particular factor that has been neglected in that literature: the extent of which firms engage in alliances with other actors. As it turns out, there are conflicting perspectives on how alliances might affect persistence. On the one hand, alliances provide firms with access to external resources and continuously innovate, thereby leading to increased persistence of competitive advantage. On the other hand, widespread use of alliances may be negatively associated with the ability to protect and develop internal resources. Thus, alliances may become conduits of knowledge leakage and imitation. Based on a sample of firms in the United States, we test these two competing views by observing the persistence of performance (in our case, return on assets) for firms exhibiting competitive advantage (profits above the norm) and disadvantage (profits below the norm). Our results support the positive view of alliances as mechanisms to sustain competitive advantage and escape from competitive disadvantage through improved access to external, valuable resources held by other firms.",Alliance; Competitive advantage; Persistence,Competition; Profitability; Alliance; Competitive advantage; External resources; Internal resources; Persistence; Return on assets; Industry
Disciplined project management: The key to process improvement program success,2008,"Academy of Management 2008 Annual Meeting: The Questions We Ask, AOM 2008",https://www.scopus.com/inward/record.uri?eid=2-s2.0-84863349129&partnerID=40&md5=788e173b5ed0aeeb6c98e200a3909000,"This research study is based on the premise that process improvement programs such as Six Sigma, Lean, and Lean Sigma are very important and deserve serious academic research, but that definitional problems make it very difficult to study any specific type of process improvement program. Therefore, this study defines two organizational level program management factors: Strategic Project Selection (SPS) and Disciplined Project Management (DPM). Guided by the internal fit theory, this research empirically examines both the direct effect of SPS and DPM on organizational performance and the impact of the fit between SPS and DPM on organizational performance. Using empirical data collected from 53 plants, this research reveals that at the organization level, SPS partially mediates the relationship between DPM and organizational performance. This insight contributes to both theory development and practice, suggesting that a viable strategy for a process improvement program's success is to focus on DPM in order to enhance SPS and ultimately achieve organizational performance.",Disciplined project management; Quality management; Strategic project selection,Quality management; Research; Work simplification; Academic research; Empirical data; Organizational levels; Organizational performance; Process Improvement; Program management; Project selection; Research studies; Six Sigma; Theory development; Project management
"Hegemony or pluralism? The role of the state in Taiwan's FDI deregulations in China, 1996-2001",2008,"Academy of Management 2008 Annual Meeting: The Questions We Ask, AOM 2008",https://www.scopus.com/inward/record.uri?eid=2-s2.0-84863347227&partnerID=40&md5=8eb2476ace35fd75d86c362a29e8c26e,"Understanding the role of the state in regulatory change is important because both the state and regulatory change greatly affect an organization's behavior and outcome. However, the prevailing theories of regulation tended to view the role of the state in regulatory change as neutral or passive. In this paper, we propose a state-centered approach to analyze how a state actively seizes political opportunities and mobilizes resources to influence regulatory change. By drawing from theories of social movements and political sociology, our empirical analysis of Taiwan's outward foreign direct investments (FDI) regulations in China from 1996 to 2001 shows that the ability of the Taiwanese state to sustain its FDI regulations in China across 37 industries depended upon its relative capacity in an industry, political party competition, resources of both industry proponents and opponents, and embeddedness between the state and industry.",Regulatory change; Social movements; The state,Industry; Embeddedness; Empirical analysis; Foreign direct investments; Political parties; Regulatory change; Social movements; The state; Competition
The consequents of organizer ecologies: A logical formalization,2008,"Academy of Management 2008 Annual Meeting: The Questions We Ask, AOM 2008",https://www.scopus.com/inward/record.uri?eid=2-s2.0-84863362128&partnerID=40&md5=99241af77eee94bdfc4cc5c672d205f4,"Density delay theory, which predicts that higher levels of competition at founding will lead organizations to have persistently higher failure rates throughout their existence, has traditionally been among the least contested theories in organizational ecology. A growing number of empirical studies, however, have failed to support the theory's predictions, suggesting that density delay in its current form apparently does not apply to all populations in all conditions. Rather than discarding the theory altogether, we apply insights from the burgeoning literature on pre-entry ecologies to make sense of this empirical anomaly and use logical formalization to synthesize arguments of both theory fragments in a single, logically sound framework. Our results suggest that the nature of the density delay effect depends to a large extent on the chosen observation window, and, possibly, a confounding with the number of organizers concurrently present in the pre-entry stages. In addition, we derive a number of testable hypotheses that should strengthen research on both density delay and pre-entry ecologies.",Density delay; Formalization; Organizational ecology,Delay effects; Empirical studies; Failure rate; Formalization; Logical formalization; Observation window; Organizational ecology; Ecology
"A longitudinal study of positive affect, organization changes, and career satisfaction",2008,"Academy of Management 2008 Annual Meeting: The Questions We Ask, AOM 2008",https://www.scopus.com/inward/record.uri?eid=2-s2.0-84858432954&partnerID=40&md5=7c1173450a7f0ba24db28aae528f8141,"This study examined relationships among dispositional positive affect, organization changes, and career satisfaction using a longitudinal sample of MBA graduates. Results show that employees higher in positive affect worked for more organizations in the four years following graduation than employees lower in positive affect. Those who changed organizations more frequently in the first four years after graduation did not, however, report greater satisfaction eight years after graduation. In contrast, for employees higher in positive affect, changing organizations more frequently led to lower overall career satisfaction and the perception that their current job was less close to their ideal job. These finding are interpreted from a psychological expectations perspective.",Career satisfaction; Goal striving; Positive affect,Career satisfaction; Goal striving; Longitudinal study; Positive affects; Societies and institutions
"Socialization tactics, FIT, and expatriate outcomes",2008,"Academy of Management 2008 Annual Meeting: The Questions We Ask, AOM 2008",https://www.scopus.com/inward/record.uri?eid=2-s2.0-84858425231&partnerID=40&md5=38d7bbd6a6d2a13b89abe40062ec4f83,"Drawing on the organizational socialization literature, we examine the direct effects of institutionalized socialization tactics on expatriate organizational and group fit and the indirect effects on organizational commitment and job performance by using a 3-wave longitudinal design. Results from a sample of Native-speaking English Teachers (NET) and their principals revealed that both organizational and group fit mediate the relationships between institutionalized socialization tactics and organizational commitment. Fit to group partially mediates the relationship between institutionalized socialization tactics and job performance in terms of how NETs collaborate with their colleagues to share teaching insights. Limitations of our study, suggestions of future research, and managerial implications are discussed.",Expatriate; Fit; Socialization,Expatriate; Fit; Indirect effects; Job performance; Longitudinal designs; Managerial implications; Organizational Commitment; Socialization; Social sciences
Should I do it or not? An initial model of cognitive processes predicting voice behaviors,2008,"Academy of Management 2008 Annual Meeting: The Questions We Ask, AOM 2008",https://www.scopus.com/inward/record.uri?eid=2-s2.0-84858425960&partnerID=40&md5=3169daf53fa4d9fd430002e6d9fbe5e6,"In this theoretical paper, we advance the idea that organizational citizenship behaviors (OCBs) are discretionary and, as a result, employees engage in decisional processes before acting. Emphasizing conceptual differences in affiliative OCBs, such as helping, compared to challenging OCBs, such as voice, we propose that voice is a function of more elaborate cognitive processes than helping. Extending this idea, our primary objective is to develop a conceptual model that explicates cognitive processes as antecedents to employee voice behavior. We draw on work in social psychology with an emphasis on dual process decision making theories (e.g., systematic vs. heuristic processing: see Smith & DeCoster, 2000, for a review) to guide our model. We aim to stimulate research on voice and other comparatively neglected forms of challenging OCB (e.g., personal initiative, taking charge) as well as research on decision processes that should enhance our ability to predict and encourage these important citizenship behaviors.",Cognitive processes; Organizational citizenship behavior; Proactive behavior/voice,Human resource management; Cognitive process; Conceptual model; Decision process; Dual process; Organizational citizenship behaviors; Primary objective; Proactive behavior; Social psychology; Cognitive systems
The social construction of competitive advantage and the origin of global capitalism: The case of the Dutch East India company,2008,"Academy of Management 2008 Annual Meeting: The Questions We Ask, AOM 2008",https://www.scopus.com/inward/record.uri?eid=2-s2.0-84858430762&partnerID=40&md5=5de73b7cde738dd0b71588200b36442f,"This paper takes the shape of a historical case study to examine the origin and the evolution of the competitive advantage of the Dutch East India company (VOC) in the seventeenth century. The most striking feature of the case lies in how managerial and political action combined in order to create and preserve a competitive advantage, not by means of a traditional, purposeful accumulation of resources, but by reshaping the organization's institutional landscape. The theoretical and practical relevance of the case are discussed at the end of the paper.",Competitive advantage; Dutch East India company (VOC); Institutions,Industry; Societies and institutions; Competitive advantage; Dutch East India company (VOC); Political actions; Competition
Roots and wings: Glocalized networks and transnational entrepreneurship,2008,"Academy of Management 2008 Annual Meeting: The Questions We Ask, AOM 2008",https://www.scopus.com/inward/record.uri?eid=2-s2.0-84863374204&partnerID=40&md5=93449200780bd2079058d6f990194cc7,"This work aims to develop a systematic understanding of how glocalized networks of intensive local embeddedness and far-flung global connections facilitate transnational entrepreneurship. We used mixed methods to triangulate qualitative and quantitative data. The interview data reveal that glocalized networks enable entrepreneurs to discover and enact on opportunities across geographic boundaries. These findings are supported by the survey data that the geographic configuration of networks has distinct impact on transnational entrepreneurship, independent of brokerage, network closure, and weak ties. The research demonstrates the potential of glocalized networks for understanding border-crossing economic action such as transnational and international entrepreneurship.",Glocalized networks; International entrepreneurship; Transnational entrepreneurship,Embeddedness; Geographic boundaries; International entrepreneurship; Mixed method; Quantitative data; Survey data; Transnational entrepreneurship; Weak ties
The dynamics of R&D internationalization: An S-Curve hypothesis,2008,"Academy of Management 2008 Annual Meeting: The Questions We Ask, AOM 2008",https://www.scopus.com/inward/record.uri?eid=2-s2.0-84863349147&partnerID=40&md5=1936bdcc85b4fd8bc63f9f614ebd4f5c,"This article examines the effects of R&D internationalization and organizational slack on innovation performance. We suggest that there is an S-shaped relationship between R&D internationalization and innovation performance. Moreover, the moderating role of organizational slack was recognized according to literature. Longitudinal data on 305 Taiwanese firms in IT sector was collected to test the hypotheses. The findings support our prediction. Innovation performance increase while firms decentralizing their R&D activities, decrease while transition, then increase again during the recentralization. Organizational slack have a negative and linear moderating effect on the S-shaped relationship. Managerial implications and future research directions are discussed.",Organizational slack; R&D internationalization,Future research directions; Innovation performance; Longitudinal data; Managerial implications; Moderating effect; Organizational slack; Recentralization; S-curve; S-shaped; Industry
