Title,Year,Source title,Link,Abstract,Author Keywords,Index Keywords
An Analysis of the Ingredients for Learning Interpretable Symbolic Regression Models with Human-in-The-loop and Genetic Programming,2024,ACM Transactions on Evolutionary Learning and Optimization,https://www.scopus.com/inward/record.uri?eid=2-s2.0-85187802221&doi=10.1145%2f3643688&partnerID=40&md5=0bae125cc568ddd03928ccdc26bd391f,"Interpretability is a critical aspect to ensure a fair and responsible use of machine learning (ML) in high-stakes applications. Genetic programming (GP) has been used to obtain interpretable ML models because it operates at the level of functional building blocks: if these building blocks are interpretable, there is a chance that their composition (i.e., the entire ML model) is also interpretable. However, the degree to which a model is interpretable depends on the observer. Motivated by this, we study a recently-introduced human-in-The-loop system that allows the user to steer GP's generation process to their preferences, which shall be online-learned by an artificial neural network (ANN). We focus on the generation of ML models as analytical functions (i.e., symbolic regression) as this is a key problem in interpretable ML, and propose a two-fold contribution. First, we devise more general representations for the ML models for the ANN to learn upon, to enable the application of the system to a wider range of problems. Second, we delve into a deeper analysis of the system's components. To this end, we propose an incremental experimental evaluation, aimed at (1) studying the effectiveness by which an ANN can capture the perceived interpretability for simulated users, (2) investigating how the GP's outcome is affected across different simulated user feedback profiles, and (3) determining whether humans participants would prefer models that were generated with or without their involvement. Our results pose clarity on pros and cons of using a human-in-The-loop approach to discover interpretable ML models with GP. © 2024 Copyright held by the owner/author(s). Publication rights licensed to ACM.",active learning; deep learning; evolutionary algorithms; evolutionary computation; Explainable artificial intelligence; explainable evolutionary computation; genetic programming; interpretable machine learning; neural networks,Deep learning; Functional programming; Genetic algorithms; Learning systems; Neural networks; Regression analysis; Reinforcement learning; Active Learning; Deep learning; Explainable artificial intelligence; Explainable evolutionary computation; Human-in-the-loop; Interpretable machine learning; Machine learning models; Machine-learning; Neural-networks; Symbolic regression; Genetic programming
Exploring the Explainable Aspects and Performance of a Learnable Evolutionary Multiobjective Optimization Method,2024,ACM Transactions on Evolutionary Learning and Optimization,https://www.scopus.com/inward/record.uri?eid=2-s2.0-85187787516&doi=10.1145%2f3626104&partnerID=40&md5=548573e92cb5dbdc4a70b0c4293a9686,"Multiobjective optimization problems have multiple conflicting objective functions to be optimized simultaneously. The solutions to these problems are known as Pareto optimal solutions, which are mathematically incomparable. Thus, a decision maker must be employed to provide preferences to find the most preferred solution. However, decision makers often lack support in providing preferences and insights in exploring the solutions available.We explore the combination of learnable evolutionary models with interactive indicator-based evolutionary multiobjective optimization to create a learnable evolutionary multiobjective optimization method. Furthermore, we leverage interpretable machine learning to provide decision makers with potential insights about the problem being solved in the form of rule-based explanations. In fact, we show that a learnable evolutionary multiobjective optimization method can offer advantages in the search for solutions to a multiobjective optimization problem. We also provide an open source software framework for other researchers to implement and explore our ideas in their own works.Our work is a step toward establishing a new paradigm in the field on multiobjective optimization: explainable and learnable multiobjective optimization. We take the first steps toward this new research direction and provide other researchers and practitioners with necessary tools and ideas to further contribute to this field. © 2024 Copyright held by the owner/author(s).",Additional Key Words and PhrasesMultiobjective optimization; evolutionary multiobjective optimization; explainable artificial intelligence; learnable evolutionary models,Artificial intelligence; Computer programming; Decision making; Open source software; Open systems; Pareto principle; Additional key word and phrasesmultiobjective optimization; Decision makers; Evolutionary models; Evolutionary multiobjective optimization; Explainable artificial intelligence; Key words; Learnable evolutionary model; Multiobjective optimization problems; Optimisations; Optimization method; Multiobjective optimization
Multi-objective Feature Attribution Explanation for Explainable Machine Learning,2024,ACM Transactions on Evolutionary Learning and Optimization,https://www.scopus.com/inward/record.uri?eid=2-s2.0-85178998217&doi=10.1145%2f3617380&partnerID=40&md5=6c10d48012f5c2fd5d1aabf2df2f5afe,"The feature attribution-based explanation (FAE) methods, which indicate how much each input feature contributes to the model's output for a given data point, are one of the most popular categories of explainable machine learning techniques. Although various metrics have been proposed to evaluate the explanation quality, no single metric could capture different aspects of the explanations. Different conclusions might be drawn using different metrics. Moreover, during the processes of generating explanations, existing FAE methods either do not consider any evaluation metric or only consider the faithfulness of the explanation, failing to consider multiple metrics simultaneously. To address this issue, we formulate the problem of creating FAE explainable models as a multi-objective learning problem that considers multiple explanation quality metrics simultaneously. We first reveal conflicts between various explanation quality metrics, including faithfulness, sensitivity, and complexity. Then, we define the considered multi-objective explanation problem and propose a multi-objective feature attribution explanation (MOFAE) framework to address this newly defined problem. Subsequently, we instantiate the framework by simultaneously considering the explanation's faithfulness, sensitivity, and complexity. Experimental results comparing with six state-of-The-Art FAE methods on eight datasets demonstrate that our method can optimize multiple conflicting metrics simultaneously and can provide explanations with higher faithfulness, lower sensitivity, and lower complexity than the compared methods. Moreover, the results have shown that our method has better diversity, i.e., it provides various explanations that achieve different tradeoffs between multiple conflicting explanation quality metrics. Therefore, it can provide tailored explanations to different stakeholders based on their specific requirements. © 2024 Copyright held by the owner/author(s). Publication rights licensed to ACM.",Explainable machine learning; feature attribution explanations; multi-objective evolutionary algorithms; multi-objective learning,Evolutionary algorithms; Learning algorithms; Quality control; Datapoints; Explainable machine learning; Feature attribution explanation; Input features; Machine-learning; Model outputs; Multi objective; Multi-Objective Evolutionary Algorithm; Multi-objective learning; Quality metrices; Machine learning
A Multi-Objective Evolutionary Approach to Discover Explainability Tradeoffs when Using Linear Regression to Effectively Model the Dynamic Thermal Behaviour of Electrical Machines,2024,ACM Transactions on Evolutionary Learning and Optimization,https://www.scopus.com/inward/record.uri?eid=2-s2.0-85187793818&doi=10.1145%2f3597618&partnerID=40&md5=e6baafe449b07e18ace438eca9ff4481,"Modelling and controlling heat transfer in rotating electrical machines is very important as it enables the design of assemblies (e.g., motors) that are efficient and durable under multiple operational scenarios. To address the challenge of deriving accurate data-driven estimators of key motor temperatures, we propose a multi-objective strategy for creating Linear Regression (LR) models that integrate optimised synthetic features. The main strength of our approach is that it provides decision makers with a clear overview of the optimal tradeoffs between data collection costs, the expected modelling errors and the overall explainability of the generated thermal models. Moreover, as parsimonious models are required for both microcontroller deployment and domain expert interpretation, our modelling strategy contains a simple but effective step-wise regularisation technique that can be applied to outline domain-relevant mappings between LR variables and thermal profiling capabilities. Results indicate that our approach can generate accurate LR-based dynamic thermal models when training on data associated with a limited set of load points within the safe operating area of the electrical machine under study.  © 2024 Copyright held by the owner/author(s).",cost vs accuracy; Data-driven thermal models; electrical machines; explainability; linear regression; NSGA-II; problem formalisation,Commerce; Decision making; Evolutionary algorithms; Heat transfer; Thermography (temperature measurement); Cost vs accuracy; Data driven; Data-driven thermal model; Electrical machine; Explainability; Formalisation; Multi-objective evolutionary; NSGA-II; Problem formalization; Thermal model; Linear regression
Model-based Gradient Search for Permutation Problems,2023,ACM Transactions on Evolutionary Learning and Optimization,https://www.scopus.com/inward/record.uri?eid=2-s2.0-85181020536&doi=10.1145%2f3628605&partnerID=40&md5=779d1e5d2140f097f714d5498899d4d0,"Global random search algorithms are characterized by using probability distributions to optimize problems. Among them, generative methods iteratively update the distributions by using the observations sampled. For instance, this is the case of the well-known Estimation of Distribution Algorithms. Although successful, this family of algorithms iteratively adopts numerical methods for estimating the parameters of a model or drawing observations from it. This is often a very time-consuming task, especially in permutation-based combinatorial optimization problems. In this work, we propose using a generative method, under the model-based gradient search framework, to optimize permutation-coded problems and address the mentioned computational overheads. To that end, the Plackett–Luce model is used to define the probability distribution on the search space of permutations. Not limited to that, a parameter-free variant of the algorithm is investigated. Conducted experiments, directed to validate the work, reveal that the gradient search scheme produces better results than other analogous competitors, reducing the computational cost and showing better scalability. © 2023 Copyright held by the owner/author(s).",combinatorial problem; Gradient search; permutation; probability distribution; self-adaptive,Combinatorial optimization; Evolutionary algorithms; Iterative methods; Numerical methods; Parameter estimation; Combinatorial problem; Generative methods; Gradient search; Model-based OPC; Permutation; Permutation problems; Probability: distributions; Random search algorithm; Self-adaptive; Using probabilities; Probability distributions
Evolving Software: Combining Online Learning with Mutation-Based Stochastic Search,2023,ACM Transactions on Evolutionary Learning and Optimization,https://www.scopus.com/inward/record.uri?eid=2-s2.0-85181047159&doi=10.1145%2f3597617&partnerID=40&md5=cefc2144f573144c1032ed085660adab,"Evolutionary algorithms and related mutation-based methods have been used in software engineering, with recent emphasis on the problem of repairing bugs. In this work, programs are typically not synthesized from a random start. Instead, existing solutions—which may be flawed or inefficient—are taken as starting points, with the evolutionary process searching for useful improvements. This approach, however, introduces a challenge for the search algorithm: what is the optimal number of neutral mutations that should be combined? Too much is likely to introduce errors and break the program while too little hampers the search process, inducing the classic tradeoff between exploration and exploitation. In the context of software improvement, this work considers MWRepair, an algorithm for enhancing mutation-based searches, which uses online learning to optimize the tradeoff between exploration and exploitation. The aggressiveness parameter governs how many individual mutations should be applied simultaneously to an individual between fitness evaluations. MWRepair is evaluated in the context of automated program repair problems, where the goal is repairing software bugs with minimal human involvement. The article analyzes the search space for automated program repair induced by neutral mutations, finding that the greatest probability of finding successful repairs often occurs when many neutral mutations are applied to the original program. Moreover, repair probability follows a characteristic, unimodal distribution. MWRepair uses online learning to leverage this property, finding both rare and multi-edit repairs to defects in the popular Defects4J benchmark set of buggy Java programs. © 2023 Copyright held by the owner/author(s).",automated program repair; multiplicative weights update; Neutral mutations; software mutational robustness,Automation; Computer software; Defects; E-learning; Evolutionary algorithms; Probability distributions; Program debugging; Repair; Automated program repair; Exploration and exploitation; Multiplicative weight update; Neutral mutation; Online learning; Software mutational robustness; Stochastic search; Synthesised; Weight update; Work programs; Stochastic systems
A Species-based Particle Swarm Optimization with Adaptive Population Size and Deactivation of Species for Dynamic Optimization Problems,2023,ACM Transactions on Evolutionary Learning and Optimization,https://www.scopus.com/inward/record.uri?eid=2-s2.0-85181002907&doi=10.1145%2f3604812&partnerID=40&md5=a5ff8af935740061f5ad9886cbf16828,"Population clustering methods, which consider the position and fitness of individuals to form sub-populations in multi-population algorithms, have shown high efficiency in tracking the moving global optimum in dynamic optimization problems. However, most of these methods use a fixed population size, making them inflexible and inefficient when the number of promising regions is unknown. The lack of a functional relationship between the population size and the number of promising regions significantly degrades performance and limits an algorithm’s agility to respond to dynamic changes. To address this issue, we propose a new species-based particle swarm optimization with adaptive population size and number of sub-populations for solving dynamic optimization problems. The proposed algorithm also benefits from a novel systematic adaptive deactivation component that, unlike the previous deactivation components, adapts the computational resource allocation to the sub-populations by considering various characteristics of both the problem and the sub-populations. We evaluate the performance of our proposed algorithm for the Generalized Moving Peaks Benchmark and compare the results with several peer approaches. The results indicate the superiority of the proposed method. © 2023 Copyright held by the owner/author(s).",Computational resource allocation; Evolutionary dynamic optimization; Particle swarm optimization; Single-objective dynamic optimization problems; Tracking moving global optimum,Benchmarking; Cluster analysis; Particle swarm optimization (PSO); Population statistics; Computational resource allocation; Computational resources; Dynamic optimization; Evolutionary dynamic optimization; Evolutionary dynamics; Globaloptimum; Optimization problems; Particle swarm; Particle swarm optimization; Resources allocation; Single objective; Single-objective dynamic optimization problem; Swarm optimization; Tracking moving global optimum; Resource allocation
Multi-Objective Hyperparameter Optimization in Machine Learning—An Overview,2023,ACM Transactions on Evolutionary Learning and Optimization,https://www.scopus.com/inward/record.uri?eid=2-s2.0-85180962513&doi=10.1145%2f3610536&partnerID=40&md5=1569222b3a2d2bd4245d33deaca7267d,"Hyperparameter optimization constitutes a large part of typical modern machine learning (ML) workflows. This arises from the fact that ML methods and corresponding preprocessing steps often only yield optimal performance when hyperparameters are properly tuned. But in many applications, we are not only interested in optimizing ML pipelines solely for predictive accuracy; additional metrics or constraints must be considered when determining an optimal configuration, resulting in a multi-objective optimization problem. This is often neglected in practice, due to a lack of knowledge and readily available software implementations for multi-objective hyperparameter optimization. In this work, we introduce the reader to the basics of multi-objective hyperparameter optimization and motivate its usefulness in applied ML. Furthermore, we provide an extensive survey of existing optimization strategies from the domains of evolutionary algorithms and Bayesian optimization. We illustrate the utility of multi-objective optimization in several specific ML applications, considering objectives such as operating conditions, prediction time, sparseness, fairness, interpretability, and robustness. © 2023 Copyright held by the owner/author(s).",Bayesian optimization; Multi-objective hyperparameter optimization; neural architecture search,Evolutionary algorithms; Multiobjective optimization; Bayesian optimization; Hyper-parameter optimizations; Large parts; Machine-learning; Modern machines; Multi objective; Multi-objective hyperparameter optimization; Neural architecture search; Neural architectures; Work-flows; Machine learning
"Editorial to the ""Evolutionary Reinforcement Learning"" Special Issue",2023,ACM Transactions on Evolutionary Learning and Optimization,https://www.scopus.com/inward/record.uri?eid=2-s2.0-85174249498&doi=10.1145%2f3624559&partnerID=40&md5=eb1da4b0fcd3335485729d757031f502,[No abstract available],,Reinforcement learnings; Reinforcement learning
Curiosity Creates Diversity in Policy Search,2023,ACM Transactions on Evolutionary Learning and Optimization,https://www.scopus.com/inward/record.uri?eid=2-s2.0-85174310488&doi=10.1145%2f3605782&partnerID=40&md5=eec9e3e7b625d19af577154578ff667b,"When searching for policies, reward-sparse environments often lack sufficient information about which behaviors to improve upon or avoid. In such environments, the policy search process is bound to blindly search for reward-yielding transitions and no early reward can bias this search in one direction or another. A way to overcome this is to use intrinsic motivation in order to explore new transitions until a reward is found. In this work, we use a recently proposed definition of intrinsic motivation, Curiosity, in an evolutionary policy search method. We propose Curiosity-ES,1 an evolutionary strategy adapted to use Curiosity as a fitness metric. We compare Curiosity-ES with other evolutionary algorithms intended for exploration, as well as with Curiosity-based reinforcement learning, and find that Curiosity-ES can generate higher diversity without the need for an explicit diversity criterion and leads to more policies which find reward.  © 2023 Copyright held by the owner/author(s). Publication rights licensed to ACM.",evolutionary strategies; neural networks; policy search; quality diversity; Reinforcement learning,Evolutionary algorithms; Motivation; Evolutionary strategies; Intrinsic motivation; Neural-networks; Policy search; Quality diversity; Reinforcement learnings; Search method; Search process; Sparse environments; algorithm; artificial neural network; machine learning; policy making; Reinforcement learning
Combining Evolution and Deep Reinforcement Learning for Policy Search: A Survey,2023,ACM Transactions on Evolutionary Learning and Optimization,https://www.scopus.com/inward/record.uri?eid=2-s2.0-85174077008&doi=10.1145%2f3569096&partnerID=40&md5=54ae477603391b40d6ff7b9374ba6a82,"Deep neuroevolution and deep Reinforcement Learning have received a lot of attention over the past few years. Some works have compared them, highlighting their pros and cons, but an emerging trend combines them so as to benefit from the best of both worlds. In this article, we provide a survey of this emerging trend by organizing the literature into related groups of works and casting all the existing combinations in each group into a generic framework. We systematically cover all easily available papers irrespective of their publication status, focusing on the combination mechanisms rather than on the experimental results. In total, we cover 45 algorithms more recent than 2017. We hope this effort will favor the growth of the domain by facilitating the understanding of the relationships between the methods, leading to deeper analyses, outlining missing useful comparisons and suggesting new combinations of mechanisms.  © 2023 Association for Computing Machinery.",Evolutionary algorithms,Deep learning; Evolutionary algorithms; Combination mechanisms; Emerging trends; Generic frameworks; Neuro evolutions; Policy search; Reinforcement learnings; algorithm; comparative study; machine learning; Reinforcement learning
"P2P Energy Trading through Prospect Theory, Differential Evolution, and Reinforcement Learning",2023,ACM Transactions on Evolutionary Learning and Optimization,https://www.scopus.com/inward/record.uri?eid=2-s2.0-85174285752&doi=10.1145%2f3603148&partnerID=40&md5=bd6c3996575594de8a167b7880eb28f1,"Peer-to-peer (P2P) energy trading is a decentralized energy market where local energy prosumers act as peers, trading energy among each other. Existing works in this area largely overlook the importance of user behavioral modeling and assume users' sustained active participation and full compliance in the decision-making process. To overcome these unrealistic assumptions, and their deleterious consequences, in this article, we propose an automated P2P energy-trading framework that specifically considers the users' perception by exploiting prospect theory. We formalize an optimization problem that maximizes the buyers' perceived utility while matching energy production and demand. We prove that the problem is NP-hard and we propose a Differential Evolution-based Algorithm for Trading Energy (DEbATE) heuristic. Additionally, we propose two automated pricing solutions to improve the sellers' profit based on reinforcement learning. The first solution, named Pricing mechanism with Q-learning and Risk-sensitivity (PQR), is based on Q-learning. Additionally, given the scalability issues of PQR, we propose a Deep Q-Network-based algorithm called ProDQN that exploits deep learning and a novel loss function rooted in prospect theory. Results based on real traces of energy consumption and production, as well as realistic prospect theory functions, show that our approaches achieve 26% higher perceived value for buyers and generate 7% more reward for sellers, compared to recent state-of-the-art approaches. © 2023 Copyright held by the owner/author(s). Publication rights licensed to ACM.",Deep Q-Network; differential evolution; dynamic pricing; non-linear optimization; Peer-to-peer energy trading; prospect theory; Q-learning,Behavioral research; Costs; Decision making; Deep learning; Energy utilization; Evolutionary algorithms; Nonlinear programming; Power markets; Deep Q-network; Differential Evolution; Dynamic pricing; Energy trading; Non-linear optimization; Peer to peer; Peer-to-peer energy trading; Prospect theory; Q-learning; Reinforcement learnings; algorithm; artificial neural network; automation; energy market; machine learning; optimization; Reinforcement learning
