Title,Year,Source title,Link,Abstract,Author Keywords,Index Keywords
Sampling Graphlets of Multiplex Networks: A Restricted Random Walk Approach,2021,ACM Transactions on the Web,https://www.scopus.com/inward/record.uri?eid=2-s2.0-85110422773&doi=10.1145%2f3456291&partnerID=40&md5=732b85d2e39e0a8f370fc18a77171df9,"Graphlets are induced subgraph patterns that are crucial to the understanding of the structure and function of a large network. A lot of effort has been devoted to calculating graphlet statistics where random walk-based approaches are commonly used to access restricted graphs through the available application programming interfaces (APIs). However, most of them merely consider individual networks while overlooking the strong coupling between different networks. In this article, we estimate the graphlet concentration in multiplex networks with real-world applications. An inter-layer edge connects two nodes in different layers if they actually belong to the same node. The access to a multiplex network is restrictive in the sense that the upper layer allows random walk sampling, whereas the nodes of lower layers can be accessed only through the inter-layer edges and only support random node or edge sampling. To cope with this new challenge, we define a suit of two-layer graphlets and propose novel random walk sampling algorithms to estimate the proportion of all the three-node graphlets. An analytical bound on the sampling steps is proved to guarantee the convergence of our unbiased estimator. We further generalize our algorithm to explore the tradeoff between the estimated accuracy of different graphlets when the sample budget is split into different layers. Experimental evaluation on real-world and synthetic multiplex networks demonstrates the accuracy and high efficiency of our unbiased estimators.  © 2021 Association for Computing Machinery.",graph sampling; Graphlets; multiplex network; random walk; unbiased estimation,Application programming interfaces (API); Budget control; Analytical bounds; Different layers; Experimental evaluation; Individual network; Induced subgraphs; Multiplex networks; Sampling algorithm; Unbiased estimator; Random processes
Categorizing Sexism and Misogyny through Neural Approaches,2021,ACM Transactions on the Web,https://www.scopus.com/inward/record.uri?eid=2-s2.0-85110474136&doi=10.1145%2f3457189&partnerID=40&md5=b44ac8864c70800a6eb5b0ae4d021ec7,"Sexism, an injustice that subjects women and girls to enormous suffering, manifests in blatant as well as subtle ways. In the wake of growing documentation of experiences of sexism on the web, the automatic categorization of accounts of sexism has the potential to assist social scientists and policymakers in studying and thereby countering sexism. The existing work on sexism classification has certain limitations in terms of the categories of sexism used and/or whether they can co-occur. To the best of our knowledge, this is the first work on the multi-label classification of sexism of any kind(s).1 We also consider the related task of misogyny classification. While sexism classification is performed on textual accounts describing sexism suffered or observed, misogyny classification is carried out on tweets perpetrating misogyny. We devise a novel neural framework for classifying sexism and misogyny that can combine text representations obtained using models such as Bidirectional Encoder Representations from Transformers with distributional and linguistic word embeddings using a flexible architecture involving recurrent components and optional convolutional ones. Further, we leverage unlabeled accounts of sexism to infuse domain-specific elements into our framework. To evaluate the versatility of our neural approach for tasks pertaining to sexism and misogyny, we experiment with adapting it for misogyny identification. For categorizing sexism, we investigate multiple loss functions and problem transformation techniques to address the multi-label problem formulation. We develop an ensemble approach using a proposed multi-label classification model with potentially overlapping subsets of the category set. Proposed methods outperform several deep-learning as well as traditional machine learning baselines for all three tasks.  © 2021 Association for Computing Machinery.",machine learning; misogyny classification; misogyny detection; multi-label classification; neural networks; Sexism classification; text classification,Recurrent neural networks; Automatic categorization; Ensemble approaches; Flexible architectures; Multi label classification; Multi-label problems; Problem transformations; Recurrent components; Text representation; Classification (of information)
Identifying and Evaluating Anomalous Structural Change-based Nodes in Generalized Dynamic Social Networks,2021,ACM Transactions on the Web,https://www.scopus.com/inward/record.uri?eid=2-s2.0-85110430153&doi=10.1145%2f3457906&partnerID=40&md5=87120379e76fc59561737f9a141a72ce,"Recently, dynamic social network research has attracted a great amount of attention, especially in the area of anomaly analysis that analyzes the anomalous change in the evolution of dynamic social networks. However, most of the current research focused on anomaly analysis of the macro representation of dynamic social networks and failed to analyze the nodes that have anomalous structural changes at a micro level. To identify and evaluate anomalous structural change-based nodes in generalized dynamic social networks that only have limited structural information, this research considers undirected and unweighted graphs and develops a multiple-neighbor superposition similarity method (), which mainly consists of a multiple-neighbor range algorithm () and a superposition similarity fluctuation algorithm (). introduces observation nodes, characterizes the structural similarities of nodes within multiple-neighbor ranges, and proposes a new multiple-neighbor similarity index on the basis of extensional similarity indices. Subsequently, maximally reflects the structural change of each node, using a new superposition similarity fluctuation index from the perspective of diverse multiple-neighbor similarities. As a result, based on and , not only identifies anomalous structural change-based nodes by detecting the anomalous structural changes of nodes but also evaluates their anomalous degrees by quantifying these changes. Results obtained by comparing with state-of-the-art methods via extensive experiments show that can accurately identify anomalous structural change-based nodes and evaluate their anomalous degrees well.  © 2021 Copyright held by the owner/author(s). Publication rights licensed to ACM.",Anomalous structural change-based node; generalized dynamic social network; structural similarity,Graph algorithms; Anomaly analysis; Dynamic social networks; Micro level; Similarity indices; State-of-the-art methods; Structural information; Structural similarity; Unweighted graphs; Graph theory
Who Has the Last Word? Understanding How to Sample Online Discussions,2021,ACM Transactions on the Web,https://www.scopus.com/inward/record.uri?eid=2-s2.0-85126351552&doi=10.1145%2f3452936&partnerID=40&md5=ee555bb51f938fb76cf6b40c6f6a3cc4,"In online debates, as in offline ones, individual utterances or arguments support or attack each other, leading to some subset of arguments (potentially from different sides of the debate) being considered more relevant than others. However, online conversations are much larger in scale than offline ones, with often hundreds of thousands of users weighing in, collaboratively forming large trees of comments by starting from an original post and replying to each other. In large discussions, readers are often forced to sample a subset of the arguments being put forth. Since such sampling is rarely done in a principled manner, users may not read all the relevant arguments to get a full picture of the debate from a sample. This article is interested in answering the question of how users should sample online conversations to selectively favour the currently justified or accepted positions in the debate. We apply techniques from argumentation theory and complex networks to build a model that predicts the probabilities of the normatively justified arguments given their location in idealised online discussions of comments and replies, which we represent as trees. Our model shows that the proportion of replies that are supportive, the distribution of the number of replies that comments receive, and the locations of comments that do not receive replies (i.e., the ""leaves""of the reply tree) all determine the probability that a comment is a justified argument given its location. We show that when the distribution of the number of replies is homogeneous along the tree length, for acrimonious discussions (with more attacking comments than supportive ones), the distribution of justified arguments depends on the parity of the tree level, which is the distance from the root expressed as number of edges. In supportive discussions, which have more supportive comments than attacks, the probability of having justified comments increases as one moves away from the root. For discussion trees that have a non-homogeneous in-degree distribution, for supportive discussions we observe the same behaviour as before, while for acrimonious discussions we cannot observe the same parity-based distribution. This is verified with data obtained from the online debating platform Kialo. By predicting the locations of the justified arguments in reply trees, we can therefore suggest which arguments readers should sample, to grasp the currently accepted opinions in such discussions. Our models have important implications for the design of future online debating platforms. © 2021 Copyright held by the owner/author(s). Publication rights licensed to ACM.",Argumentation theory; graph sampling; Kialo; online discussions; probabilistic analysis,Complex networks; Probability distributions; Social networking (online); Argumentation theory; As numbers; Graph samplings; In-degree distribution; Kialo; Non-homogeneous; Offline; Online discussions; Probabilistic analysis; Tree level; Location
Cookie Banners and Privacy Policies: Measuring the Impact of the GDPR on the Web,2021,ACM Transactions on the Web,https://www.scopus.com/inward/record.uri?eid=2-s2.0-85110434456&doi=10.1145%2f3466722&partnerID=40&md5=fed64a3ba26606594d371d4fc0814977,"The General Data Protection Regulation (GDPR) is in effect since May of 2018. As one of the most comprehensive pieces of legislation concerning privacy, it sparked a lot of discussion on the effect it would have on users and providers of online services in particular, due to the large amount of personal data processed in this context. Almost three years later, we are interested in revisiting this question to summarize the impact this new regulation has had on actors in the World Wide Web. Using Scopus, we obtain a vast corpus of academic work to survey studies related to changes on websites since and around the time the GDPR went into force. Our findings show that the emphasis on privacy increased w.r.t. online services, but plenty potential for improvements remains. Although online services are on average more transparent regarding data processing practices in their public data policies, a majority of these policies still either lack information required by the GDPR (e.g., contact information for users to file privacy inquiries) or do not provide this information in a user-friendly form. Additionally, we summarize that online services more often provide means for their users to opt out of data processing, but regularly obstruct convenient access to such means through unnecessarily complex and sometimes illegitimate interface design. Our survey further details that this situation contradicts the preferences expressed by users both verbally and through their actions, and researchers have proposed multiple approaches to facilitate GDPR-conform data processing without negatively impacting the user experience. Thus, we compiled reoccurring points of criticism by privacy researchers and data protection authorities into a list of four guidelines for service providers to consider.  © 2021 Copyright held by the owner/author(s). Publication rights licensed to ACM.",Cookies; fingerprinting; GDPR; privacy; privacy legislation; web,Information use; Laws and legislation; Surveys; User experience; Academic work; General data protection regulations; Interface designs; Large amounts; On-line service; Privacy policies; Service provider; User friendly; Privacy by design
Semantic Table Retrieval Using Keyword and Table Queries,2021,ACM Transactions on the Web,https://www.scopus.com/inward/record.uri?eid=2-s2.0-85128575245&doi=10.1145%2f3441690&partnerID=40&md5=f6ca29131552bf1a46ac785191af9f54,"Tables on the Web contain a vast amount of knowledge in a structured form. To tap into this valuable resource, we address the problem of table retrieval: answering an information need with a ranked list of tables. We investigate this problem in two different variants, based on how the information need is expressed: as a keyword query or as an existing table (""query-by-table""). The main novel contribution of this work is a semantic table retrieval framework for matching information needs (keyword or table queries) against tables. Specifically, we (i) represent queries and tables in multiple semantic spaces (both discrete sparse and continuous dense vector representations) and (ii) introduce various similarity measures for matching those semantic representations. We consider all possible combinations of semantic representations and similarity measures and use these as features in a supervised learning model. Using two purpose-built test collections based on Wikipedia tables, we demonstrate significant and substantial improvements over state-of-the-art baselines. © 2021 Association for Computing Machinery.",table retrieval; Table search,Information retrieval; Semantic Web; Semantics; Vector spaces; Keyword queries; Matchings; Retrieval frameworks; Semantic representation; Semantic Space; Semantic tables; Similarity measure; Table retrieval; Table search; Vector representations; Taps
"Dynamic, Incremental, and Continuous Detection of Cyberbullying in Online Social Media",2021,ACM Transactions on the Web,https://www.scopus.com/inward/record.uri?eid=2-s2.0-85171695534&doi=10.1145%2f3448014&partnerID=40&md5=c8065b1eecac46098432b754f93e55f6,"The potentially detrimental effects of cyberbullying have led to the development of numerous automated, data-driven approaches, with emphasis on classification accuracy. Cyberbullying, as a form of abusive online behavior, although not well-defined, is a repetitive process, i.e., a sequence of aggressive messages sent from a bully to a victim over a period of time with the intent to harm the victim. Existing work has focused on harassment (i.e., using profanity to classify toxic comments independently) as an indicator of cyberbullying, disregarding the repetitive nature of this harassing process. However, raising a cyberbullying alert immediately after an aggressive comment is detected can lead to a high number of false positives. At the same time, two key practical challenges remain unaddressed: (i) detection timeliness, which is necessary to support victims as early as possible, and (ii) scalability to the staggering rates at which content is generated in online social networks. In this work, we introduce CONcISE, a novel approach for timely and accurate Cyberbullying detectiON in online social media SEssions. CONcISE is a two-stage online approach designed to reduce the time to raise a cyberbullying alert by sequentially examining comments as they become available over time, and minimizing the number of feature evaluations necessary for a decision to be made for each comment. Extensive experiments on a real-world Instagram dataset with users and comments demonstrate the effectiveness, scalability, and timeliness of our approach and its benefits over existing methods. Additional experiments using a Twitter dataset offer evidence in support of the potential generalizability of CONcISE to other social media platforms. © 2021 Association for Computing Machinery.",Classification; cyberharassment; optimization; sequential selection; social networks,Computer crime; Social networking (online); Automated data; Continuous detections; Cyber bullying; Cyber-harassment; Dynamic detection; Dynamic incremental; Online social medias; Optimisations; Sequential selection; Social network; Scalability
Welcome Message from the New Editor-in-Chief,2021,ACM Transactions on the Web,https://www.scopus.com/inward/record.uri?eid=2-s2.0-85174074585&doi=10.1145%2f3456294&partnerID=40&md5=f128e5b710103aefc32214c5f0c5b751,[No abstract available],,
Review Summary Generation in Online Systems: Frameworks for Supervised and Unsupervised Scenarios,2021,ACM Transactions on the Web,https://www.scopus.com/inward/record.uri?eid=2-s2.0-85108456543&doi=10.1145%2f3448015&partnerID=40&md5=a08d204818f07a7870551085f32cf690,"In online systems, including e-commerce platforms, many users resort to the reviews or comments generated by previous consumers for decision making, while their time is limited to deal with many reviews. Therefore, a review summary, which contains all important features in user-generated reviews, is expected. In this article, we study ""how to generate a comprehensive review summary from a large number of user-generated reviews.""This can be implemented by text summarization, which mainly has two types of extractive and abstractive approaches. Both of these approaches can deal with both supervised and unsupervised scenarios, but the former may generate redundant and incoherent summaries, while the latter can avoid redundancy but usually can only deal with short sequences. Moreover, both approaches may neglect the sentiment information. To address the above issues, we propose comprehensive Review Summary Generation frameworks to deal with the supervised and unsupervised scenarios. We design two different preprocess models of re-ranking and selecting to identify the important sentences while keeping users' sentiment in the original reviews. These sentences can be further used to generate review summaries with text summarization methods. Experimental results in seven real-world datasets (Idebate, Rotten Tomatoes Amazon, Yelp, and three unlabelled product review datasets in Amazon) demonstrate that our work performs well in review summary generation. Moreover, the re-ranking and selecting models show different characteristics. © 2021 Association for Computing Machinery.",review summary generation; supervised and unsupervised scenarios; text summarization; User-generated review,Decision making; Text processing; Commerce platforms; E- commerces; Re-ranking; Review summary generation; Summary generation; Supervised and unsupervised scenario; System framework; Text Summarisation; User-generated; User-generated review; Online systems
"An integrated approach for improving brand consistency of web content: Modeling, analysis, and recommendation",2021,ACM Transactions on the Web,https://www.scopus.com/inward/record.uri?eid=2-s2.0-85106972129&doi=10.1145%2f3450445&partnerID=40&md5=f48a4902e8aa26f1ab458e05847116f2,"A consumer-dependent (business-to-consumer) organization tends to present itself as possessing a set of human qualities, which is termed the brand personality of the company. The perception is impressed upon the consumer through the content, be it in the form of advertisement, blogs, or magazines, produced by the organization. A consistent brand will generate trust and retain customers over time as they develop an affinity toward regularity and common patterns. However, maintaining a consistent messaging tone for a brand has become more challenging with the virtual explosion in the amount of content that needs to be authored and pushed to the Internet to maintain an edge in the era of digital marketing. To understand the depth of the problem, we collect around 300K web page content from around 650 companies. We develop trait-specific classification models by considering the linguistic features of the content. The classifier automatically identifies the web articles that are not consistent with the mission and vision of a company and further helps us to discover the conditions under which the consistency cannot be maintained. To address the brand inconsistency issue, we then develop a sentence ranking system that outputs the top three sentences that need to be changed for making a web article more consistent with the company’s brand personality. © 2021 Copyright held by the owner/author(s). Publication rights licensed to ACM.",Brand personality; Online reputation management; Sentence ranking; Text classification,Linguistics; Websites; Business to Consumer; Classification models; Digital marketing; Integrated approach; Linguistic features; Ranking system; Web content; Classification (of information)
A two phases self-healing framework for service-oriented systems,2021,ACM Transactions on the Web,https://www.scopus.com/inward/record.uri?eid=2-s2.0-85106972873&doi=10.1145%2f3450443&partnerID=40&md5=b4b8132cab73189799a4767c88c2bcba,"Service-Oriented Architectures (SOA) enable the automatic creation of business applications from independently developed and deployed Web services. As Web services are inherently a priori unknown, how to deliver reliable Web services compositions is a significant and challenging problem. Services involved in an SOA often do not operate under a single processing environment and need to communicate using different protocols over a network. Under such conditions, designing a fault management system that is both efficient and extensible is a challenging task. In this article, we propose SFSS, a self-healing framework for SOA fault management. SFSS is predicting, identifying, and solving faults in SOAs. In SFSS, we identified a set of high-level exception handling strategies based on the QoS performances of different component services and the preferences articled by the service consumers. Multiple recovery plans are generated and evaluated according to the performance of the selected component services, and then we execute the best recovery plan. We assess the overall user dependence (i.e., the service is independent of other services) using the generated plan and the available invocation information of the component services. Due to the experiment results, the given technique enhances the service selection quality by choosing the services that have the highest score and betters the overall system performance. The experiment results indicate the applicability of SFSS and show improved performance in comparison to similar approaches. © 2021 Association for Computing Machinery.",Exception handling; Fault management; QoS; Selection tree; Self-healing; Semantic attribute; Similarity module; SOA,Failure analysis; Information services; Quality of service; Self-healing materials; Service oriented architecture (SOA); Websites; Automatic creations; Business applications; Different protocols; Exception handling; Fault management system; Processing environments; Service Oriented Systems; Web services composition; Web services
Utilizing web trackers for sybil defense,2021,ACM Transactions on the Web,https://www.scopus.com/inward/record.uri?eid=2-s2.0-85106985389&doi=10.1145%2f3450444&partnerID=40&md5=ad2440d076e426c56537ff080dfd5421,"User tracking has become ubiquitous practice on the Web, allowing services to recommend behaviorally targeted content to users. In this article, we design Alibi, a system that utilizes such readily available personalized content, generated by recommendation engines in real time, as a means to tame Sybil attacks. In particular, by using ads and other tracker-generated recommendations as implicit user “certificates,” Alibi is capable of creating meta-profiles that allow for rapid and inexpensive validation of users’ uniqueness, thereby enabling an Internet-wide Sybil defense service. We demonstrate the feasibility of such a system, exploring the aggregate behavior of recommendation engines on the Web and demonstrating the richness of the meta-profile space defined by such inputs. We further explore the fundamental properties of such meta-profiles, i.e., their construction, uniqueness, persistence, and resilience to attacks. By conducting a user study, we show that the user meta-profiles are robust and show important scaling effects. We demonstrate that utilizing even a moderate number of popular Web sites empowers Alibi to tame large-scale Sybil attacks. © 2021 Association for Computing Machinery.",Recommendation engines; Sybil attacks; User tracking,Engines; Network security; Recommender systems; Aggregate behavior; Defense services; Fundamental properties; Personalized content; Scaling effects; Sybil attack; User study; User tracking; Computer crime
