Title,Year,Source title,Link,Abstract,Author Keywords,Index Keywords
An empirical investigation of ecommerce-reputation-escalation-as-A-service,2017,ACM Transactions on the Web,https://www.scopus.com/inward/record.uri?eid=2-s2.0-85019617751&doi=10.1145%2f2983646&partnerID=40&md5=fdbebd7c0162c3f8add9a10515a4c9c8,"In online markets, a store's reputation is closely tied to its profitability. Sellers' desire to quickly achieve a high reputation has fueled a profitable underground business that operates as a specialized crowdsourcing marketplace and accumulates wealth by allowing online sellers to harness human laborers to conduct fake transactions to improve their stores' reputations. We term such an underground market a seller-reputationescalation (SRE) market. In this article, we investigate the impact of the SRE service on reputation escalation by performing in-depth measurements of the prevalence of the SRE service, the business model and market size of SRE markets, and the characteristics of sellers and offered laborers. To this end, we have infiltrated five SRE markets and studied their operations using daily data collection over a continuous period of 2 months. We identified more than 11,000 online sellers posting at least 219,165 fake-purchase tasks on the five SRE markets. These transactions earned at least $46,438 in revenue for the five SRE markets, and the total value of merchandise involved exceeded $3,452,530. Our study demonstrates that online sellers using the SRE service can increase their stores' reputations at least 10 times faster than legitimate ones while about 25% of them were visibly penalized. Even worse, we found a much stealthier and more hazardous service that can, within a single day, boost a seller's reputation by such a degree that would require a legitimate seller at least a year to accomplish. Armed with our analysis of the operational characteristics of the underground economy, we offer some insights into potential mitigation strategies. Finally, we revisit the SRE ecosystem 1 year later to evaluate the latest dynamism of the SRE markets, especially the statuses of the online stores once identified to launch fake-transaction campaigns on the SRE markets. We observe that the SRE markets are not as active as they were 1 year ago and about 17% of the involved online stores become inaccessible likely because they have been forcibly shut down by the corresponding E-commerce marketplace for conducting fake transactions.",E-commerce; Fake transaction; Reputation manipulation,Commerce; Economics; Profitability; Business modeling; Depth measurements; Empirical investigation; Fake transaction; Mitigation strategy; Online markets; Operational characteristics; Reputation manipulation; Electronic commerce
Value and misinformation in collaborative investing platforms,2017,ACM Transactions on the Web,https://www.scopus.com/inward/record.uri?eid=2-s2.0-85019866460&doi=10.1145%2f3027487&partnerID=40&md5=06c0b4eb12948ea3bf4d442f7d783ce6,"It is often difficult to separate the highly capable ""experts"" from the average worker in crowdsourced systems. This is especially true for challenge application domains that require extensive domain knowledge. The problem of stock analysis is one such domain, where even the highly paid, well-educated domain experts are prone to make mistakes. As an extremely challenging problem space, the ""wisdom of the crowds"" property that many crowdsourced applications rely on may not hold. In this article, we study the problem of evaluating and identifying experts in the context of SeekingAlpha and StockTwits, two crowdsourced investment services that have recently begun to encroach on a space dominated for decades by large investment banks. We seek to understand the quality and impact of content on collaborative investment platforms, by empirically analyzing complete datasets of SeekingAlpha articles (9 years) and StockTwits messages (4 years). We develop sentiment analysis tools and correlate contributed content to the historical performance of relevant stocks. While SeekingAlpha articles and StockTwits messages provide minimal correlation to stock performance in aggregate, a subset of experts contribute more valuable (predictive) content. We show that these authors can be easily identified by user interactions, and investments based on their analysis significantly outperform broader markets. This effectively shows that even in challenging application domains, there is a secondary or indirect wisdom of the crowds. Finally, we conduct a user survey that sheds light on users' views of SeekingAlpha content and stock manipulation. We also devote efforts to identify potential manipulation of stocks by detecting authors controlling multiple identities. © 2017 ACM.",Crowdsourcing; sentiment analysis; stock market,Commerce; Crowdsourcing; Data mining; Financial markets; Crowdsourced systems; Domain knowledge; Historical performance; Multiple identities; Sentiment analysis; Stock performance; User interaction; Wisdom of the crowds; Investments
Periodicity in user engagement with a search engine and its application to online controlled experiments,2017,ACM Transactions on the Web,https://www.scopus.com/inward/record.uri?eid=2-s2.0-85018623399&doi=10.1145%2f2856822&partnerID=40&md5=c85097d9973f50bb51418f4c344a51cf,"Nowadays, billions of people use the Web in connection with their daily needs. A significant part of these needs are constituted by search tasks that are usually addressed by search engines. Thus, daily search needs result in regular user engagement with a search engine. User engagement with web services was studied in various aspects, but there appears to be little work devoted to its regularity and periodicity. In this article, we study periodicity of user engagement with a popular search engine through applying spectrum analysis to temporal sequences of different engagement metrics. First, we found periodicity patterns of user engagement and revealed classes of users whose periodicity patterns do not change over a long period of time. In addition, we give an exhaustive analysis of the stability and quality of identified clusters. Second, we used the spectrum series as key metrics to evaluate search quality. We found that the novel periodicity metrics outperform the state-of-the-art quality metrics both in terms of significance level ( p-value) and sensitivity to a large set of larges-scale A/B experiments conducted on real search engine users. © 2017 ACM.",A/B test; Amplitude; DFT; Discrete Fourier transform; Frequency domain; Key metric; OAC; OEC; Online controlled experiment; Overall acceptance criterion; Overall evaluation criterion; Periodicity; Quality metrics; Search engine; Spectrum analysis; User engagement,Acceptance tests; Design for testability; Discrete Fourier transforms; Frequency domain analysis; Search engines; Spectrum analysis; Web services; Acceptance criteria; Amplitude; Evaluation criteria; Frequency domains; Key metric; Online controlled experiments; Periodicity; Quality metrics; User engagement; Quality control
Analyzing the adoption and cascading process of OSN-based gifting applications: An empirical study,2017,ACM Transactions on the Web,https://www.scopus.com/inward/record.uri?eid=2-s2.0-85018657264&doi=10.1145%2f3023871&partnerID=40&md5=104b4a124b9f823050143847fd757681,"To achieve growth in the user base of online social networks - (OSN) based applications, word-of-mouth diffusion mechanisms, such as user-to-user invitations, are widely used. This article characterizes the adoption and cascading process of OSN-based applications that grow via user invitations. We analyze a detailed large-scale dataset of a popular Facebook gifting application, iHeart, that contains more than 2 billion entries of user activities generated by 190 million users during a span of 64 weeks. We investigate (1) how users invite their friends to an OSN-based application, (2) how application adoption of an individual user can be predicted, (3) what factors drive the cascading process of application adoptions, and (4) what are the good predictors of the ultimate cascade sizes. We find that sending or receiving a large number of invitations does not necessarily help to recruit new users to iHeart. We also find that the average success ratio of inviters is the most important feature in predicting an adoption of an individual user, which indicates that the effectiveness of inviters has strong predictive power with respect to application adoption. Based on the lessons learned from our analyses, we build and evaluate learning-based models to predict whether a user will adopt iHeart. Our proposed model that utilizes additional activity information of individual users from other similar types of gifting applications can achieve high precision (83%) in predicting adoptions in the target application (i.e., iHeart). We next identify a set of distinctive features that are good predictors of the growth of the application adoptions in terms of final population size. We finally propose a prediction model to infer whether a cascade of application adoption will continue to grow in the future based on observing the initial adoption process. Results show that our proposed model can achieve high precision (over 80%) in predicting large cascades of application adoptions. We believe our work can give an important implication in resource allocation of OSN-based product stakeholders, for example, via targeted marketing. © 2017 ACM.",Application adoption; Cascade; Computational social science; Facebook; Human behavior; Information diffusion; Online social networks; Prediction,Cascades (fluid mechanics); Forecasting; Population statistics; Social networking (online); Social sciences; Computational social science; Facebook; Human behaviors; Information diffusion; On-line social networks; Behavioral research
Nonlinear dynamics of information diffusion in social networks,2017,ACM Transactions on the Web,https://www.scopus.com/inward/record.uri?eid=2-s2.0-85018839618&doi=10.1145%2f3057741&partnerID=40&md5=a665a3eca6db5745cb4377d5a5c2c84e,"The recent explosion in the adoption of search engines and new media such as blogs and Twitter have facilitated the faster propagation of news and rumors. How quickly does a piece of news spread over these media? How does its popularity diminish over time? Does the rising and falling pattern follow a simple universal law? In this article, we propose SPIKEM, a concise yet flexible analytical model of the rise and fall patterns of information diffusion. Our model has the following advantages. First, unification power: it explains earlier empirical observations and generalizes theoretical models including the SI and SIR models. We provide the threshold of the take-off versus die-out conditions for SPIKEMand discuss the generality of our model by applying it to an arbitrary graph topology. Second, practicality: it matches the observed behavior of diverse sets of real data. Third, parsimony: it requires only a handful of parameters. Fourth, usefulness: it makes it possible to perform analytic tasks such as forecasting, spotting anomalies, and interpretation by reverse engineering the system parameters of interest (quality of news, number of interested bloggers, etc.). We also introduce an efficient and effective algorithm for the real-Time monitoring of information diffusion, namely SPIKESTREAM, which identifies multiple diffusion patterns in a large collection of online event streams. Extensive experiments on real datasets demonstrate that SPIKEM accurately and succinctly describes all patterns of the rise and fall spikes in social networks. © 2017 ACM.",Information diffusion; Nonlinear modeling; Social networks,Reverse engineering; Search engines; Social networking (online); Arbitrary graphs; Diffusion patterns; Effective algorithms; Event streams; Information diffusion; Non-linear model; Real data sets; Real time monitoring; Topology
On obstructing obscenity obfuscation,2017,ACM Transactions on the Web,https://www.scopus.com/inward/record.uri?eid=2-s2.0-85018851058&doi=10.1145%2f3032963&partnerID=40&md5=2c3f905428ba1c00e8ba127b0f99852e,"Obscenity (the use of rude words or offensive expressions) has spread from informal verbal conversations to digital media, becoming increasingly common on user-generated comments found inWeb forums, newspaper user boards, social networks, blogs, and media-sharing sites. The basic obscenity-blocking mechanism is based on verbatim comparisons against a blacklist of banned vocabulary; however, creative users circumvent these filters by obfuscating obscenity with symbol substitutions or bogus segmentations that still visually preserve the original semantics, such as writing shit as $ht or s.h.i.t or even worse mixing them as $.h...t. The number of potential obfuscated variants is combinatorial, yielding the verbatim filter impractical. Here we describe a method intended to obstruct this anomaly inspired by sequence alignment algorithms used in genomics, coupled with a tailor-made edit penalty function. The method only requires to set up the vocabulary of plain obscenities; no further training is needed. Its complexity on screening a single obscenity is linear, both in runtime and memory, on the length of the user-generated text. We validated the method on three different experiments. The first one involves a new dataset that is also introduced in this article; it consists of a set of manually annotated real-life comments in Spanish, gathered from the news user boards of an online newspaper, containing this type of obfuscation. The second one is a publicly available dataset of comments in Portuguese from a sports Web site. In these experiments, at the obscenity level, we observed recall rates greater than 90%, whereas precision rates varied between 75% and 95%, depending on their sequence length (shorter lengths yielded a higher number of false alarms). On the other hand, at the comment level, we report recall of 86%, precision of 91%, and specificity of 98%. The last experiment revealed that the method is more effective in matching this type of obfuscation compared to the classical Levenshtein edit distance. We conclude discussing the prospects of the method to help enforcing moderation rules of obscenity expressions or as a preprocessing mechanism for sequence cleaning and/or feature extraction in more sophisticated text categorization techniques. © 2017 ACM.",Obscenity obfuscation dataset; String deobfuscation; User-generated content moderation,Digital storage; Feature extraction; Newsprint; Semantics; Text processing; Blocking mechanisms; Deobfuscation; Levenshtein edit distance; Number of false alarms; Obscenity obfuscation dataset; Sequence alignments; Text categorization; User-generated content; Information dissemination
Toward automated online photo privacy,2017,ACM Transactions on the Web,https://www.scopus.com/inward/record.uri?eid=2-s2.0-85017191949&doi=10.1145%2f2983644&partnerID=40&md5=684e361fdb3deb8ae0f4134d75f401e6,"Online photo sharing is an increasingly popular activity for Internet users. More and more users are now constantly sharing their images in various social media, from social networking sites to online communities, blogs, and content sharing sites. In this article, we present an extensive study exploring privacy and sharing needs of users' uploaded images. We develop learning models to estimate adequate privacy settings for newly uploaded images, based on carefully selected image-specific features. Our study investigates both visual and textual features of images for privacy classification. We consider both basic image-specific features, commonly used for image processing, as well as more sophisticated and abstract visual features. Additionally, we include a visual representation of the sentiment evoked by images. To our knowledge, sentiment has never been used in the context of image classification for privacy purposes. We identify the smallest set of features, that by themselves or combined together with others, can perform well in properly predicting the degree of sensitivity of users' images. We consider both the case of binary privacy settings (i.e., public, private), as well as the case of more complex privacy options, characterized by multiple sharing options. Our results show that with few carefully selected features, one may achieve high accuracy, especially when high-quality tags are available. © 2017 ACM.",Image analysis; Machine learning; Privacy; Social networks,Abstracting; Data privacy; Image analysis; Image classification; Image processing; Learning systems; Websites; Degree of sensitivity; On-line communities; Online Photo Sharing; Privacy classifications; Privacy Settings; Social networking sites; Textual features; Visual representations; Social networking (online)
MultiWiki: Interlingual text passage alignment in wikipedia,2017,ACM Transactions on the Web,https://www.scopus.com/inward/record.uri?eid=2-s2.0-85017197222&doi=10.1145%2f3004296&partnerID=40&md5=2159e06c416c0b41a392585e97b66418,"In this article, we address the problem of text passage alignment across interlingual article pairs in Wikipedia. We develop methods that enable the identification and interlinking of text passages written in different languages and containing overlapping information. Interlingual text passage alignment can enable Wikipedia editors and readers to better understand language-specific context of entities, provide valuable insights in cultural differences, and build a basis for qualitative analysis of the articles. An important challenge in this context is the tradeoff between the granularity of the extracted text passages and the precision of the alignment. Whereas short text passages can result in more precise alignment, longer text passages can facilitate a better overview of the differences in an article pair. To better understand these aspects from the user perspective, we conduct a user study at the example of the German, Russian, and English Wikipedia and collect a user-Annotated benchmark. Then we propose MultiWiki, a method that adopts an integrated approach to the text passage alignment using semantic similarity measures and greedy algorithms and achieves precise results with respect to the user-defined alignment. The MultiWiki demonstration is publicly available and currently supports four language pairs. © 2017 ACM 1559-1131/2017/04-ART6 $15.00.",Interlingual text alignment; Wikipedia,Semantics; Cultural difference; Integrated approach; Overlapping information; Precise alignments; Qualitative analysis; Semantic similarity measures; Text alignments; Wikipedia; Alignment
"Spam mobile apps: Characteristics, detection, and in the wild analysis",2017,ACM Transactions on the Web,https://www.scopus.com/inward/record.uri?eid=2-s2.0-85017168765&doi=10.1145%2f3007901&partnerID=40&md5=1623c49eb0c2be3ef24bbe51b365a854,"The increased popularity of smartphones has attracted a large number of developers to offer various applications for the different smartphone platforms via the respective app markets. One consequence of this popularity is that the app markets are also becoming populated with spam apps. These spam apps reduce the users' quality of experience and increase the workload of app market operators to identify these apps and remove them. Spam apps can come in many forms such as apps not having a specific functionality, those having unrelated app descriptions or unrelated keywords, or similar apps being made available several times and across diverse categories. Market operators maintain antispam policies and apps are removed through continuous monitoring. Through a systematic crawl of a popular app market and by identifying apps that were removed over a period of time, we propose a method to detect spam apps solely using app metadata available at the time of publication. We first propose a methodology to manually label a sample of removed apps, according to a set of checkpoint heuristics that reveal the reasons behind removal. This analysis suggests that approximately 35% ofthe apps being removed are very likely tobe spam apps. We then map the identified heuristics to several quantifiable features and show how distinguishing these features are for spam apps. We build an Adaptive Boost classifier for early identification of spam apps using only the metadata of the apps. Our classifier achieves an accuracy of over 95% with precision varying between 85% and 95% and recall varying between 38% and 98%. We further show that a limited number of features, in the range of 10-30, generated from app metadata is sufficient to achieve a satisfactory level of performance. On a set of 180,627 apps that were present at the app market during our crawl, our classifier predicts 2.7% of the apps as potential spam. Finally, we perform additional manual verification and show that human reviewers agree with 82% of our classifier predictions. © 2017 ACM.",Android; Mobile apps; Spam; Spam apps,Heuristic methods; Metadata; Quality of service; Smartphones; Android; Anti-spam; Continuous monitoring; Market operators; Mobile apps; Quality of experience (QoE); Spam; Commerce
MyAdChoices: Bringing transparency and control to online advertising,2017,ACM Transactions on the Web,https://www.scopus.com/inward/record.uri?eid=2-s2.0-85015616780&doi=10.1145%2f2996466&partnerID=40&md5=a872129b6706af4260e99db7e6c7ecd6,"The intrusiveness and the increasing invasiveness of online advertising have, in the last few years, raised serious concerns regarding user privacy andWeb usability. As a reaction to these concerns, we have witnessed the emergence of a myriad of ad-blocking and antitracking tools, whose aim is to return control to users over advertising. The problem with these technologies, however, is that they are extremely limited and radical in their approach: users can only choose either to block or allow all ads. With around 200 million people regularly using these tools, the economic model of the Web-in which users get content free in return for allowing advertisers to show them ads-is at serious peril. In this article, we propose a smart Web technology that aims at bringing transparency to online advertising, so that users can make an informed and equitable decision regarding ad blocking. The proposed technology is implemented as a Web-browser extension and enables users to exert fine-grained control over advertising, thus providing them with certain guarantees in terms of privacy and browsing experience, while preserving the Internet economic model. Experimental results in a real environment demonstrate the suitability and feasibility of our approach, and provide preliminary findings on behavioral targeting from real user browsing profiles. © 2017 ACM.",Ad-blocking; Behavioral targeting; Online advertising; User profiling; Web tracking; Web transparency,Transparency; Web browsers; Web crawler; Ad-blocking; Behavioral targeting; Economic modeling; Fine-grained control; Internet economics; Online advertising; Real environments; User profiling; Marketing
Effort mediates access to information in online social networks,2017,ACM Transactions on the Web,https://www.scopus.com/inward/record.uri?eid=2-s2.0-85015658170&doi=10.1145%2f2990506&partnerID=40&md5=4094ea87612615b43d17c566d11df282,"Individuals' access to information in a social network depends on how it is distributed and where in the network individuals position themselves. In addition, individuals vary in how much effort they invest in managing their social connections. Using data from a social media site, we study how the interplay between effort and network position affects social media users' access to diverse and novel information. Previous studies of the role of networks in information access were limited in their ability to measure the diversity of information. We address this problem by learning the topics of interest to social media users from the messages they share online with followers.We use the learned topics to measure the diversity of information users receive from the people they follow online. We confirm that users in structurally diverse network positions, which bridge otherwise disconnected regions of the follower network, tend to be exposed to more diverse and novel information.We also show that users who investmore effort in their activity on the site are not only located in more structurally diverse positions within the network than the less engaged users but also receive more novel and diverse information when in similar network positions. These findings indicate that the relationship between network structure and access to information in networks is more nuanced than previously thought. © 2017 ACM.",Information in networks; Probabilistic topic models; Social media; Social networks,Statistics; In networks; Information access; Information users; Network structures; On-line social networks; Probabilistic topic models; Social connection; Social media; Social networking (online)
