Title,Year,Source title,Link,Abstract,Author Keywords,Index Keywords
Characterizing Web-based video sharing workloads,2011,ACM Transactions on the Web,https://www.scopus.com/inward/record.uri?eid=2-s2.0-80052058388&doi=10.1145%2f1961659.1961662&partnerID=40&md5=ea87c33668d4f899d460fe30a6bb266f,"Video sharing services that allow ordinary Web users to upload video clips of their choice and watch video clips uploaded by others have recently become very popular. This article identifies invariants in video sharing workloads, through comparison of the workload characteristics of four popular video sharing services. Our traces contain metadata on approximately 1.8 million videos which together have been viewed approximately 6 billion times. Using these traces, we study the similarities and differences in use of several Web 2.0 features such as ratings, comments, favorites, and propensity of uploading content. In general, we find that active contribution, such as video uploading and rating of videos, is much less prevalent than passive use. While uploaders in general are skewed with respect to the number of videos they upload, the fraction of multi-time uploaders is found to differ by a factor of two between two of the sites. The distributions of lifetime measures of video popularity are found to have heavy-tailed forms that are similar across the four sites. Finally, we consider implications for system design of the identified invariants. To gain further insight into caching in video sharing systems, and the relevance to caching of lifetime popularity measures, we gathered an additional dataset tracking views to a set of approximately 1.3 million videos from one of the services, over a twelve-week period. We find that lifetime popularity measures have some relevance for large cache (hot set) sizes (i.e., a hot set defined according to one of these measures is indeed relatively ""hot""), but that this relevance substantially decreases as cache size decreases, owing to churn in video popularity. © 2011 ACM.",Power law; Social interaction; User-generated content; Video sharing; Workload characterization,Metadata; Systems analysis; Video cameras; World Wide Web; Power law; Social interactions; User-generated content; Video sharing; Workload characterization; User interfaces
Cost-aware strategies for query result caching in Web search engines,2011,ACM Transactions on the Web,https://www.scopus.com/inward/record.uri?eid=2-s2.0-80052055790&doi=10.1145%2f1961659.1961663&partnerID=40&md5=8f4a3c58ff4635109b3da616ac724f00,"Search engines and large-scale IR systems need to cache query results for efficiency and scalability purposes. Static and dynamic caching techniques (as well as their combinations) are employed to effectively cache query results. In this study, we propose cost-aware strategies for static and dynamic caching setups. Our research is motivated by two key observations: (i) query processing costs may significantly vary among different queries, and (ii) the processing cost of a query is not proportional to its popularity (i.e., frequency in the previous logs). The first observation implies that cache misses have different, that is, nonuniform, costs in this context. The latter observation implies that typical caching policies, solely based on query popularity, can not always minimize the total cost. Therefore, we propose to explicitly incorporate the query costs into the caching policies. Simulation results using two large Web crawl datasets and a real query log reveal that the proposed approach improves overall system performance in terms of the average query execution time. © 2011 ACM.",Query result caching; Web search engines,Costs; Information retrieval; Search engines; User interfaces; Cache Miss; Caching policy; Data sets; Processing costs; Query costs; Query execution time; Query logs; Query results; Simulation result; Static and dynamic; Total costs; World Wide Web
A survey of requirements specification in model-driven development of web applications,2011,ACM Transactions on the Web,https://www.scopus.com/inward/record.uri?eid=2-s2.0-80052053136&doi=10.1145%2f1961659.1961664&partnerID=40&md5=f7525e6ce12adf64719f19295576e35c,"Model-driven development has become more and more important in the last few years. In the context of web application development, many web Engineering methods that propose model-driven development processes have appeared. However, earlier stages of these processes are seldom considered and few of these methods rigorously face the problems of specifying web application requirements and translating them into the proper conceptual model. However, it is widely recognized that requirements engineering activities are essential to obtain quality software products. This article surveys Model-driven web engineering methods in a comparative study and analyzes the techniques proposed for specifying functional, data and navigational requirements as well as the mechanisms provided for automatically translating these requirements into conceptual models. Our main goal is to provide a critical view of the support that is provided by these methods for handling web application requirements in order to show their current limitations and strengths. © 2011 ACM.",Model-driven development; Requirements engineering; Survey; Web applications; Web engineering,Models; Requirements engineering; Surveys; World Wide Web; Comparative studies; Conceptual model; Current limitation; Model driven development; Model-driven; Quality software; Requirements specifications; WEB application; Web application development; Web engineering; User interfaces
Host-based P2P flow identification and use in real-time,2011,ACM Transactions on the Web,https://www.scopus.com/inward/record.uri?eid=2-s2.0-80052074576&doi=10.1145%2f1961659.1961661&partnerID=40&md5=35dbf2ba67b4e95e8a0a28786db58400,"Data identification and classification is a key task for any Internet Service Provider (ISP) or network administrator. As port fluctuation and encryption become more common in P2P applications wishing to avoid identification, new strategies must be developed to detect and classify their flows. This article introduces a method of separating P2P and standard web traffic that can be applied as part of an offline data analysis process, based on the activity of the hosts on the network. Heuristics are analyzed and a classification system proposed that focuses on classifying those ""long"" flows that transfer most of the bytes across a network. The accuracy of the system is then tested using real network traffic from a core Internet router showing misclassification rates as low as 0.54% of flows in some cases. We expand on this proposed strategy to investigate its relevance to real-time, early classification problems. New proposals are made and the results of real-time experiments are compared to those obtained in the offline analysis. It is shown that classification accuracies in the real-time strategy are similar to those achieved in offline analysis with a large portion of the total web and P2P flows correctly identified. © 2011 ACM.",Classification; Host based; P2P,Data reduction; Internet service providers; Telecommunication networks; User interfaces; World Wide Web; Classification accuracy; Classification system; Core Internet; Data identification; Host-based; Misclassification rates; New strategy; Off-line analysis; Offline data; OR-networks; P2P; P2P applications; Real networks; Real time strategies; Real-time experiment; Web traffic; Peer to peer networks
Recommending friends and locations based on individual location history,2011,ACM Transactions on the Web,https://www.scopus.com/inward/record.uri?eid=2-s2.0-78650617680&doi=10.1145%2f1921591.1921596&partnerID=40&md5=3a61344f707eefbc177d8e4c27d3db35,"The increasing availability of location-acquisition technologies (GPS, GSM networks, etc.) enables people to log the location histories with spatio-temporal data. Such real-world location histories imply, to some extent, users' interests in places, and bring us opportunities to understand the correlation between users and locations. In this article, we move towards this direction and report on a personalized friend and location recommender for the geographical information systems (GIS) on theWeb. First, in this recommender system, a particular individual's visits to a geospatial region in the real world are used as their implicit ratings on that region. Second, we measure the similarity between users in terms of their location histories and recommend to each user a group of potential friends in a GIS community. Third, we estimate an individual's interests in a set of unvisited regions by involving his/her location history and those of other users. Some unvisited locations that might match their tastes can be recommended to the individual. A framework, referred to as a hierarchical-graph-based similarity measurement (HGSM), is proposed to uniformly model each individual's location history, and effectively measure the similarity among users. In this framework, we take into account three factors: 1) the sequence property of people's outdoor movements, 2) the visited popularity of a geospatial region, and 3) the hierarchical property of geographic spaces. Further, we incorporated a content-based method into a user-based collaborative filtering algorithm, which uses HGSM as the user similarity measure, to estimate the rating of a user on an item. We evaluated this recommender system based on the GPS data collected by 75 subjects over a period of 1 year in the real world. As a result, HGSM outperforms related similarity measures, namely similarity-by-count, cosine similarity, and Pearson similarity measures. Moreover, beyond the item-based CF method and random recommendations, our system provides users with more attractive locations and better user experiences of recommendation. © 2011 ACM.",Collaborative filtering; GeoLife; GPS trajectories; Location history; Recommender system; Spatio-temporal data mining; User similarity,Data mining; Geographic information systems; Signal filtering and prediction; Collaborative filtering; GeoLife; GPS trajectories; Spatio-temporal data mining; User similarity; Recommender systems
Introduction to special issue on recommender systems,2011,ACM Transactions on the Web,https://www.scopus.com/inward/record.uri?eid=2-s2.0-79951859636&doi=10.1145%2f1921591.1921592&partnerID=40&md5=96bf19b124b006a18ca3ba0ba802e433,[No abstract available],,
A specialized search assistant for learning objects,2011,ACM Transactions on the Web,https://www.scopus.com/inward/record.uri?eid=2-s2.0-80455130030&doi=10.1145%2f2019643.2019648&partnerID=40&md5=ec9b9616f25d611e93c8bd3d4f0d64fc,"The Web holds a great quantity of material that can be used to enhance classroom instruction. However, it is not easy to retrieve this material with the search engines currently available. This study produced a specialized search assistant based on Google that significantly increases the number of instances in which teachers find the desired learning objects as compared to using this popular public search engine directly. Success in finding learning objects by study participants went from 80% using Google alone to 96% when using our search assistant in one scenario and, in another scenario, from a 40% success rate with Google alone to 66% with our assistant. This specialized search assistant implements features such as bilingual search and term suggestion which were requested by teacher participants to help improve their searches. Study participants evaluated the specialized search assistant and found it significantly easier to use and more useful than the popular search engine for the purpose of finding learning objects. © 2011 ACM 1559-1131/2011/10-ART21 $10.00.",Bilingual search; Search assistant; Web search interfaces; WWW,Search engines; World Wide Web; Bilingual search; Classroom instruction; Learning objects; Search assistant; Term suggestion; Web search interfaces; Teaching
Using external aggregate ratings for improving individual recommendations,2011,ACM Transactions on the Web,https://www.scopus.com/inward/record.uri?eid=2-s2.0-79951873230&doi=10.1145%2f1921591.1921594&partnerID=40&md5=f65408548a48e9c3c351bcd14c8ce03b,"This article describes an approach for incorporating externally specified aggregate ratings information into certain types of recommender systems, including two types of collaborating filtering and a hierarchical linear regression model. First, we present a framework for incorporating aggregate rating information and apply this framework to the aforementioned individual rating models. Then we formally show that this additional aggregate rating information provides more accurate recommendations of individual items to individual users. Further, we experimentally confirm this theoretical finding by demonstrating on several datasets that the aggregate rating information indeed leads to better predictions of unknown ratings. We also propose scalable methods for incorporating this aggregate information and test our approaches on large datasets. Finally, we demonstrate that the aggregate rating information can also be used as a solution to the cold start problem of recommender systems. © 2011 ACM.",Aggregate ratings; Cold-start problem; Collaborative filtering; Hierarchical linearmodels; Predictive models; Recommender systems,Aggregates; Distributed computer systems; Hierarchical systems; Linear regression; Predictive control systems; Rating; Scalability; Signal filtering and prediction; Cold start problems; Collaborative filtering; Data sets; Hierarchical linearmodels; Large datasets; Linear regression models; Predictive models; Rating information; Rating model; Scalable methods; Recommender systems
Automatic tag recommendation algorithms for social recommender systems,2011,ACM Transactions on the Web,https://www.scopus.com/inward/record.uri?eid=2-s2.0-79951867458&doi=10.1145%2f1921591.1921595&partnerID=40&md5=1de648653607870d6e0373fc9ef93bbf,"The emergence of Web 2.0 and the consequent success of social network Web sites such as Del.icio.us and Flickr introduce us to a new concept called social bookmarking, or tagging. Tagging is the action of connecting a relevant user-defined keyword to a document, image, or video, which helps the user to better organize and share their collections of interesting stuff. With the rapid growth of Web 2.0, tagged data is becoming more and more abundant on the social network Web sites. An interesting problem is how to automate the process of making tag recommendations to users when a new resource becomes available. In this article, we address the issue of tag recommendation from a machine learning perspective. From our empirical observation of two large-scale datasets, we first argue that the user-centered approach for tag recommendation is not very effective in practice. Consequently, we propose two novel document-centered approaches that are capable ofmaking effective and efficient tag recommendations in real scenarios. The first, graph-based, method represents the tagged data in two bipartite graphs, (document, tag) and (document, word), then finds document topics by leveraging graph partitioning algorithms. The second, prototypebased, method aims at finding the most representative documents within the data collections and advocates a sparse multiclass Gaussian process classifier for efficient document classification. For both methods, tags are ranked within each topic cluster/class by a novel ranking method. Recommendations are performed by first classifying a new document into one or more topic clusters/classes, and then selecting the most relevant tags from those clusters/classes as machine-recommended tags. Experiments on real-world data from Del.icio.us, CiteULike, and BibSonomy examine the quality of tag recommendation as well as the efficiency of our recommendation algorithms. The results suggest that our document-centered models can substantially improve the performance of tag recommendations when compared to the user-centered methods, as well as topic models LDA and SVM classifiers. © 2011 ACM.",Gaussian processes; Graph partitioning; Mixture model; Multi-label classification; Prototype selection; Tagging system,Algorithms; Classifiers; Gaussian distribution; Gaussian noise (electronic); Graph theory; Models; Recommender systems; Thesauri; User interfaces; World Wide Web; Gaussian Processes; Graph Partitioning; Mixture model; Multi-label; Prototype selection; Tagging system; Information retrieval systems
"Comparison of collaborative filtering algorithms: Limitations of current techniques and proposals for scalable, high-performance recommender systems",2011,ACM Transactions on the Web,https://www.scopus.com/inward/record.uri?eid=2-s2.0-79951865393&doi=10.1145%2f1921591.1921593&partnerID=40&md5=7fc564cd293207c8006d5044089b8049,"The technique of collaborative filtering is especially successful in generating personalized recommendations. More than a decade of research has resulted in numerous algorithms, although no comparison of the different strategies has been made. In fact, a universally accepted way of evaluating a collaborative filtering algorithm does not exist yet. In this work, we compare different techniques found in the literature, and we study the characteristics of each one, highlighting their principal strengths and weaknesses. Several experiments have been performed, using the most popular metrics and algorithms. Moreover, two new metrics designed to measure the precision on good items have been proposed. The results have revealed the weaknesses of many algorithms in extracting information from user profiles especially under sparsity conditions. We have also confirmed the good results of SVD-based techniques already reported by other authors. As an alternative, we present a new approach based on the interpretation of the tendencies or differences between users and items. Despite its extraordinary simplicity, in our experiments, it obtained noticeably better results than more complex algorithms. In fact, in the cases analyzed, its results are at least equivalent to those of the best approaches studied. Under sparsity conditions, there is more than a 20% improvement in accuracy over the traditional user-based algorithms, while maintaining over 90% coverage. Moreover, it is much more efficient computationally than any other algorithm, making it especially adequate for large amounts of data. © 2011 ACM.",Collaborative filtering; Recommender systems,Algorithms; Experiments; Signal filtering and prediction; Collaborative filtering; Collaborative filtering algorithms; Complex algorithms; Current techniques; Extracting information; Large amounts of data; New approaches; Other algorithms; Personalized recommendation; User profile; Recommender systems
Learning deterministic regular expressions for the inference of schemas from XML data,2010,ACM Transactions on the Web,https://www.scopus.com/inward/record.uri?eid=2-s2.0-77958075803&doi=10.1145%2f1841909.1841911&partnerID=40&md5=11b4dbfebdeef08b98fd8e0f7809d894,"Inferring an appropriate DTD or XML Schema Definition (XSD) for a given collection of XML documents essentially reduces to learning deterministic regular expressions from sets of positive example words. Unfortunately, there is no algorithm capable of learning the complete class of deterministic regular expressions from positive examples only, as we will show. The regular expressions occurring in practical DTDs and XSDs, however, are such that every alphabet symbol occurs only a small number of times. As such, in practice it suffices to learn the subclass of deterministic regular expressions in which each alphabet symbol occurs at most k times, for some small k. We refer to such expressions as k-occurrence regular expressions (k-OREs for short). Motivated by this observation, we provide a probabilistic algorithm that learns k-OREs for increasing values of k, and selects the deterministic one that best describes the sample based on a Minimum Description Length argument. The effectiveness of the method is empirically validated both on real world and synthetic data. Furthermore, the method is shown to be conservative over the simpler classes of expressions considered in previous work. © 2010 ACM.",Regular expressions; Schema inference; XML,Alphabet symbols; Minimum description length; Positive examples; Probabilistic algorithm; Regular expressions; Schema inference; Schemas; Synthetic data; XML data; Xml schema definitions; XML
Mining historic query trails to label long and rare search engine queries,2010,ACM Transactions on the Web,https://www.scopus.com/inward/record.uri?eid=2-s2.0-77958031519&doi=10.1145%2f1841909.1841912&partnerID=40&md5=30d147d9361746dbb4c70097607751cc,"Web search engines can perform poorly for long queries (i.e., those containing four or more terms), in part because of their high level of query specificity. The automatic assignment of labels to long queries can capture aspects of a user's search intent that may not be apparent from the terms in the query. This affords search result matching or reranking based on queries and labels rather than the query text alone. Query labels can be derived from interaction logs generated from many users' search result clicks or from query trails comprising the chain of URLs visited following query submission. However, since long queries are typically rare, they are difficult to label in this way because little or no historic log data exists for them. A subset of these queries may be amenable to labeling by detecting similarities between parts of a long and rare query and the queries which appear in logs. In this article, we present the comparison of four similarity algorithms for the automatic assignment of Open Directory Project category labels to long and rare queries, based solely on matching against similar satisfied query trails extracted from log data. Our findings show that although the similarity-matching algorithms we investigated have tradeoffs in terms of coverage and accuracy, one algorithm that bases similarity on a popular search result ranking function (effectively regarding potentially-similar queries as ""documents"") outperforms the others. We find that it is possible to correctly predict the top label better than one in five times, even when no past query trail exactly matches the long and rare query. We show that these labels can be used to reorder top-ranked search results leading to a significant improvement in retrieval performance over baselines that do not utilize query labeling, but instead rank results using content-matching or click-through logs. The outcomes of our research have implications for search providers attempting to provide users with highly-relevant search results for long queries. © 2010 ACM.",Long queries; Query labeling,Algorithms; Information retrieval; Natural language processing systems; Search engines; Automatic assignment; Click-through; Log data; Long queries; Open directory projects; Query labeling; Query submission; Ranking functions; Re-ranking; Retrieval performance; Search results; Similarity algorithm; Similarity-matching; Web search engines; World Wide Web
Fast and compact web graph representations,2010,ACM Transactions on the Web,https://www.scopus.com/inward/record.uri?eid=2-s2.0-77958035555&doi=10.1145%2f1841909.1841913&partnerID=40&md5=63bd9927c8d4dd2edbc3fbef7811e75a,"Compressed graph representations, in particular for Web graphs, have become an attractive research topic because of their applications in the manipulation of huge graphs in main memory. The state of the art is well represented by the WebGraph project, where advantage is taken of several particular properties of Web graphs to offer a trade-off between space and access time. In this paper we show that the same properties can be exploited with a different and elegant technique that builds on grammar-based compression. In particular, we focus on Re-Pair and on Ziv-Lempel compression, which, although cannot reach the best compression ratios of WebGraph, achievemuch faster navigation of the graph when both are tuned to use the same space. Moreover, the technique adapts well to run on secondary memory and in distributed scenarios. As a byproduct, we introduce an approximate Re-Pair version that works efficiently with severely limited main memory. © 2010 ACM.",Compression; Data structures; Web graph,Data structures; Access time; Compression; Compression ratios; Grammar-based compression; Graph representation; Main memory; Research topics; Secondary memories; State of the art; Web graphs; Data compression
