Title,Year,Source title,Link,Abstract,Author Keywords,Index Keywords
Genetic Improvement of Routing Protocols for Delay Tolerant Networks,2021,ACM Transactions on Evolutionary Learning and Optimization,https://www.scopus.com/inward/record.uri?eid=2-s2.0-85136333465&doi=10.1145%2f3453683&partnerID=40&md5=b6259e49944a63d737d703c27a5c45f8,"Routing plays a fundamental role in network applications, but it is especially challenging in Delay Tolerant Networks (DTNs). These are a kind of mobile ad hoc networks made of, e.g., (possibly, unmanned) vehicles and humans where, despite a lack of continuous connectivity, data must be transmitted while the network conditions change due to the nodes' mobility. In these contexts, routing is NP-hard and is usually solved by heuristic ""store and forward""replication-based approaches, where multiple copies of the same message are moved and stored across nodes in the hope that at least one will reach its destination. Still, the existing routing protocols produce relatively low delivery probabilities. Here, we genetically improve two routing protocols widely adopted in DTNs, namely, Epidemic and PRoPHET, in the attempt to optimize their delivery probability. First, we dissect them into their fundamental components, i.e., functionalities such as checking if a node can transfer data, or sending messages to all connections. Then, we apply Genetic Improvement (GI) to manipulate these components as terminal nodes of evolving trees. We apply this methodology, in silico, to six test cases of urban networks made of hundreds of nodes and find that GI produces consistent gains in delivery probability in four cases. We then verify if this improvement entails a worsening of other relevant network metrics, such as latency and buffer time. Finally, we compare the logics of the best evolved protocols with those of the baseline protocols, and we discuss the generalizability of the results across test cases. © 2021 Association for Computing Machinery.",Ad hoc network; delay tolerant networks; epidemic routing; genetic improvement; genetic programming; PRoPHET,Delay tolerant networks; Genetic algorithms; Mobile ad hoc networks; Routing protocols; Ad-hoc networks; Delay-Tolerant Network; Delivery probabilities; Epidemic routing; Genetic improvements; In networks; PRoPHET; Routing-protocol; Routings; Test case; computer simulation; epidemic; genetic algorithm; probability density function; tolerance; Genetic programming
On Steady-State Evolutionary Algorithms and Selective Pressure: Why Inverse Rank-Based Allocation of Reproductive Trials Is Best,2021,ACM Transactions on Evolutionary Learning and Optimization,https://www.scopus.com/inward/record.uri?eid=2-s2.0-85114954001&doi=10.1145%2f3427474&partnerID=40&md5=067125c0feb9dc08fa32dbba696d483d,"We analyse the impact of the selective pressure for the global optimisation capabilities of steady-state evolutionary algorithms (EAs). For the standard bimodal benchmark function TwoMax, we rigorously prove that using uniform parent selection leads to exponential runtimes with high probability to locate both optima for the standard (+1) EA and (+1) RLS with any polynomial population sizes. However, we prove that selecting the worst individual as parent leads to efficient global optimisation with overwhelming probability for reasonable population sizes. Since always selecting the worst individual may have detrimental effects for escaping from local optima, we consider the performance of stochastic parent selection operators with low selective pressure for a function class called TruncatedTwoMax, where one slope is shorter than the other. An experimental analysis shows that the EAs equipped with inverse tournament selection, where the loser is selected for reproduction and small tournament sizes, globally optimise TwoMax efficiently and effectively escape from local optima of TruncatedTwoMax with high probability. Thus, they identify both optima efficiently while uniform (or stronger) selection fails in theory and in practice. We then show the power of inverse selection on function classes from the literature where populations are essential by providing rigorous proofs or experimental evidence that it outperforms uniform selection equipped with or without a restart strategy. We conclude the article by confirming our theoretical insights with an empirical analysis of the different selective pressures on standard benchmarks of the classical MaxSat and multidimensional knapsack problems. © 2021 Association for Computing Machinery.",(μ+1) EA; diversity; parent selection; Randomised search heuristics; TwoMax,Cell proliferation; Combinatorial optimization; Computation theory; Global optimization; Heuristic algorithms; Inverse problems; Population statistics; Stochastic systems; (μ+1) evolutionary algorithm; Diversity; High probability; Parent selection; Randomized search; Randomized search heuristic; Search heuristics; Selective pressure; Steady state; Twomax; algorithm; empirical analysis; experimental study; heuristics; population size; pressure; steady-state equilibrium; Evolutionary algorithms
ACM Transactions on Evolutionary Learning and Optimization Inaugural Issue Editorial,2021,ACM Transactions on Evolutionary Learning and Optimization,https://www.scopus.com/inward/record.uri?eid=2-s2.0-85177847611&doi=10.1145%2f3449277&partnerID=40&md5=8d09a285c63152ac436308454dbe793a,[No abstract available],,Evolutionary Learning; Evolutionary optimizations
Feature Construction for Meta-heuristic Algorithm Recommendation of Capacitated Vehicle Routing Problems,2021,ACM Transactions on Evolutionary Learning and Optimization,https://www.scopus.com/inward/record.uri?eid=2-s2.0-85131394281&doi=10.1145%2f3447540&partnerID=40&md5=caaead69a2952911cf7aedfc5e84603b,"The algorithm recommendation is attracting increasing attention in solving real-world capacitated vehicle routing problems (CVRPs), due to the fact that existing meta-heuristic algorithms often show different performances on different CVRPs. To effectively perform algorithm recommendation for CVRPs, it becomes vital to extract suitable features to characterize the CVRPs accurately. To this end, in this article three groups of penetrating features are proposed to capture the characteristics of CVRPs. The first group consists of some basic features of CVRPs, where several features are suggested to capture the distribution of customer demand, the relationship between customer demand and vehicle capacity, besides some common attributes widely used in CVRPs. The second group is composed of the features extracted from some CVRP solutions generated by local search, where in addition to the feasible and better solutions, the worse solutions and the distribution of travel cost are also used to measure the sensitivity of CVRPs to local search operations. The third group is made up of image features obtained by depicting CVRP instances through images, which is first introduced by us to enhance the generalization of algorithm recommendation. Furthermore, based on the three groups of features, an algorithm recommendation method called ARM-I is built on the basis of a KNN classifier to recommend suitable algorithm for CVRPs. Experimental results on several selected benchmarks demonstrate the effectiveness of the designed features. More interestingly, the proposed ARM-I shows high generalization on real-world instances. © 2021 Association for Computing Machinery.",algorithm recommendation; Capacitated vehicle routing problem; CVRP features; image features; meta-heuristic algorithms,Heuristic algorithms; Image enhancement; Local search (optimization); Routing algorithms; Vehicles; Algorithm recommendation; Capacitated vehicle routing problem; Capacitated vehicle routing problem feature; Customer demands; Feature construction; Generalisation; Image features; Meta-heuristics algorithms; Real-world; accuracy assessment; algorithm; experimental study; feasibility study; heuristics; meta-analysis; performance assessment; traffic management; Vehicle routing
Greed Is Good: Exploration and Exploitation Trade-offs in Bayesian Optimisation,2021,ACM Transactions on Evolutionary Learning and Optimization,https://www.scopus.com/inward/record.uri?eid=2-s2.0-85177855490&doi=10.1145%2f3425501&partnerID=40&md5=583b576071e5aa22ac2a670c804bbc84,"The performance of acquisition functions for Bayesian optimisation to locate the global optimum of continuous functions is investigated in terms of the Pareto front between exploration and exploitation. We show that Expected Improvement (EI) and the Upper Confidence Bound (UCB) always select solutions to be expensively evaluated on the Pareto front, but Probability of Improvement is not guaranteed to do so and Weighted Expected Improvement does so only for a restricted range of weights. We introduce two novel -greedy acquisition functions. Extensive empirical evaluation of these together with random search, purely exploratory, and purely exploitative search on 10 benchmark problems in 1 to 10 dimensions shows that -greedy algorithms are generally at least as effective as conventional acquisition functions (e.g., EI and UCB), particularly with a limited budget. In higher dimensions, -greedy approaches are shown to have improved performance over conventional approaches. These results are borne out on a real-world computational fluid dynamics optimisation problem and a robotics active learning problem. Our analysis and experiments suggest that the most effective strategy, particularly in higher dimensions, is to be mostly greedy, occasionally selecting a random exploratory solution. © 2021 Copyright held by the owner/author(s). Publication rights licensed to ACM.",acquisition function; Bayesian optimisation; exploration-exploitation trade-off; infill criteria; ϵ-greedy,Budget control; Economic and social effects; Mergers and acquisitions; Acquisition function; Bayesian optimization; Expected improvements; Exploration and exploitation; Exploration-exploitation trade-off; Exploration/exploitation; Infill criteria; Performance; Trade off; Ε-greedy; Bayesian analysis; mineral exploration; mineral resource; multicriteria analysis; optimization; Computational fluid dynamics
"Introduction to the ""Best of GECCO 2022"" Special Issue: Part II",2024,ACM Transactions on Evolutionary Learning and Optimization,https://www.scopus.com/inward/record.uri?eid=2-s2.0-85196634184&doi=10.1145%2f3665797&partnerID=40&md5=d5572e4884c183cb5726c2a58ad88f71,[No abstract available],,
Marginal Probability-Based Integer Handling for CMA-ES Tackling Single- and Multi-Objective Mixed-Integer Black-Box Optimization,2024,ACM Transactions on Evolutionary Learning and Optimization,https://www.scopus.com/inward/record.uri?eid=2-s2.0-85185374309&doi=10.1145%2f3632962&partnerID=40&md5=3b432edf24887b05c5145ded69919b4a,"This study targets the mixed-integer black-box optimization (MI-BBO) problem where continuous and integer variables should be optimized simultaneously. The covariance matrix adaptation evolution strategy (CMA-ES), our focus in this study, is a population-based stochastic search method that samples solution candidates from a multivariate Gaussian distribution (MGD), which shows excellent performance in continuous black-box optimization. The parameters of MGD, mean and (co)variance, are updated based on the evaluation value of candidate solutions in the CMA-ES. If the CMA-ES is applied to the MI-BBO with straightforward discretization, however, the variance corresponding to the integer variables becomes much smaller than the granularity of the discretization before reaching the optimal solution, which leads to the stagnation of the optimization. In particular, when binary variables are included in the problem, this stagnation more likely occurs because the granularity of the discretization becomes wider, and the existing integer handling for the CMA-ES does not address this stagnation. To overcome these limitations, we propose a simple integer handling for the CMA-ES based on lower-bounding the marginal probabilities associated with the generation of integer variables in the MGD. The numerical experiments on the MI-BBO benchmark problems demonstrate the efficiency and robustness of the proposed method. Furthermore, to demonstrate the generality of the idea of the proposed method, in addition to the single-objective optimization case, we incorporate it into multi-objective CMA-ES and verify its performance on bi-objective mixed-integer benchmark problems. © 2024 Copyright held by the owner/author(s).",Covariance matrix adaptation evolution strategy; mixed-integer black-box optimization,Benchmarking; Evolutionary algorithms; Integer programming; Multiobjective optimization; Numerical methods; Stochastic systems; Black-box optimization; Covariance matrix adaptation evolution strategies; Discretizations; Integer variables; Marginal probability; Mixed integer; Mixed-integer black-box optimization; Multi objective; Multivariate Gaussian Distributions; Performance; Covariance matrix
Generating Cheap Representative Functions for Expensive Automotive Crashworthiness Optimization,2024,ACM Transactions on Evolutionary Learning and Optimization,https://www.scopus.com/inward/record.uri?eid=2-s2.0-85196745502&doi=10.1145%2f3646554&partnerID=40&md5=5e544e73958577526d0f9ed269d4f3ef,"Solving real-world engineering optimization problems, such as automotive crashworthiness optimization, is extremely challenging, because the problem characteristics are oftentimes not well understood. Furthermore, typical hyperparameter optimization (HPO) approaches that require a large function evaluation budget are computationally hindered, if the function evaluation is expensive, for example, requires finite element (FE) simulation runs. In this article, we propose an approach to characterize real-world expensive black-box optimization problems using the exploratory landscape analysis (ELA). Based on these landscape characteristics, we can identify test functions that are fast-to-evaluate and representative for HPO purposes. Focusing on 20 problem instances from automotive crashworthiness optimization, our results reveal that these 20 crashworthiness problems exhibit landscape features different from classical optimization benchmark test suites, such as the widely-used black-box optimization benchmarking (BBOB) problem set. In fact, these 20 problem instances belong to problem classes that are distinct from the BBOB test functions based on the clustering results. Further analysis indicates that, as far as the ELA features concern, they are most similar to problem classes of tree-based test functions. By analyzing the performance of two optimization algorithms with different hyperparameters, namely the covariance matrix adaptation evolutionary strategy (CMA-ES) and Bayesian optimization (BO), we show that the tree-based test functions are indeed representative in terms of predicting the algorithm performances. Following this, such scalable and fast-to-evaluate tree-based test functions have promising potential for automated design of an optimization algorithm for specific real-world problem classes. © 2024 Copyright held by the owner/author(s).",Automotive crashworthiness; black-box optimization; exploratory landscape analysis; representative functions; single-objective,Accidents; Benchmarking; Budget control; Clustering algorithms; Covariance matrix; Evolutionary algorithms; Function evaluation; Optimization; Statistical tests; Trees (mathematics); Automotive crashworthiness; Automotives; Black-box optimization; Crashworthiness optimization; Exploratory landscape analyse; Landscape analysis; Representative function; Single objective; Test-functions; Tree-based; Crashworthiness
Iterated Local Search with Linkage Learning,2024,ACM Transactions on Evolutionary Learning and Optimization,https://www.scopus.com/inward/record.uri?eid=2-s2.0-85196533871&doi=10.1145%2f3651165&partnerID=40&md5=a8ea3416b3f8d9d376cc01315065a4f7,"In pseudo-Boolean optimization, a variable interaction graph represents variables as vertices, and interactions between pairs of variables as edges. In black-box optimization, the variable interaction graph may be at least partially discovered by using empirical linkage learning techniques. These methods never report false variable interactions, but they are computationally expensive. The recently proposed local search with linkage learning discovers the partial variable interaction graph as a side-effect of iterated local search. However, information about the strength of the interactions is not learned by the algorithm. We propose local search with linkage learning 2, which builds a weighted variable interaction graph that stores information about the strength of the interaction between variables. The weighted variable interaction graph can provide new insights about the optimization problem and behavior of optimizers. Experiments with NK landscapes, knapsack problem, and feature selection show that local search with linkage learning 2 is able to efficiently build weighted variable interaction graphs. In particular, experiments with feature selection show that the weighted variable interaction graphs can be used for visualizing the feature interactions in machine learning. Additionally, new transformation operators that exploit the interactions between variables can be designed. We illustrate this ability by proposing a new perturbation operator for iterated local search. © 2024 Copyright held by the owner/author(s).",feature interaction; Iterated local search; linkage learning; variable interaction graph,Feature Selection; Graphic methods; Learning systems; Local search (optimization); Black-box optimization; Feature interactions; Features selection; Interaction graphs; Iterated local search; Linkage learning; Local search; Pseudo-Boolean optimization; Variable interaction; Variable interaction graph; Combinatorial optimization
Multiobjective Evolutionary Component Effect on Algorithm Behaviour,2024,ACM Transactions on Evolutionary Learning and Optimization,https://www.scopus.com/inward/record.uri?eid=2-s2.0-85196723600&doi=10.1145%2f3612933&partnerID=40&md5=79f647bc45cefc4bdc39d11409251d1b,"The performance of multiobjective evolutionary algorithms (MOEAs) varies across problems, making it hard to develop new algorithms or apply existing ones to new problems. To simplify the development and application of new multiobjective algorithms, there has been an increasing interest in their automatic design from their components. These automatically designed metaheuristics can outperform their human-developed counterparts. However, it is still unknown what are the most influential components that lead to performance improvements. This study specifies a new methodology to investigate the effects of the final configuration of an automatically designed algorithm. We apply this methodology to a tuned Multiobjective Evolutionary Algorithm based on Decomposition (MOEA/D) designed by the iterated racing (irace) configuration package on constrained problems of 3 groups: (1) analytical real-world problems, (2) analytical artificial problems and (3) simulated real-world. We then compare the impact of the algorithm components in terms of their Search Trajectory Networks (STNs), the diversity of the population, and the anytime hypervolume values. Looking at the objective space behavior, the MOEAs studied converged before half of the search to generally good HV values in the analytical artificial problems and the analytical real-world problems. For the simulated problems, the HV values are still improving at the end of the run. In terms of decision space behavior, we see a diverse set of the trajectories of the STNs in the analytical artificial problems. These trajectories are more similar and frequently reach optimal solutions in the other problems. © 2024 Copyright held by the owner/author(s). Publication rights licensed to ACM.",Algorithm analysis; automatic algorithm configuration; continuous optimization; multiobjective optimization,Evolutionary algorithms; Trajectories; Algorithm analysis; Algorithm configurations; Artificial problems; Automatic algorithm configuration; Automatic algorithms; Continuous optimization; Multi-Objective Evolutionary Algorithm; Multi-objectives optimization; Multiobjective evolutionary algorithms; Performance; Multiobjective optimization
The Influence of Noise on Multi-parent Crossover for an Island Model Genetic Algorithm,2024,ACM Transactions on Evolutionary Learning and Optimization,https://www.scopus.com/inward/record.uri?eid=2-s2.0-85196502849&doi=10.1145%2f3630638&partnerID=40&md5=39a1184450bf1c6dbec8261675e7d5de,"Many optimization problems tackled by evolutionary algorithms are not only computationally expensive but also complicated, with one or more sources of noise. One technique to deal with high computational overhead is parallelization. However, though the existing literature gives good insight about the expected behavior of parallelized evolutionary algorithms, we still lack an understanding of their performance in the presence of noise. This article considers how parallelization might be leveraged together with multi-parent crossover in order to handle noisy problems. We present a rigorous running time analysis of an island model with weakly connected topology tasked with hill climbing in the presence of general additive noise (i.e., noisy OneMax). Our proofs yield insights into the relationship between the noise intensity and number of required parents. We translate this into positive and negative results for two kinds of multi-parent crossover operators. We then empirically analyze and extend this framework to investigate the tradeoffs between noise impact, optimization time, and limits of computation power to deal with noise.  © 2024 Copyright held by the owner/author(s). Publication rights licensed to ACM.",Island model; noisy optimization; runtime analysis,Additive noise; Genetic algorithms; Noise pollution; Computational overheads; Island model; Island model genetic algorithm; Multi-parent crossover; Noisy optimization; Optimization problems; Parallelizations; Performance; Run-time analysis; Running time analysis; Topology
On the Use of Quality Diversity Algorithms for the Travelling Thief Problem,2024,ACM Transactions on Evolutionary Learning and Optimization,https://www.scopus.com/inward/record.uri?eid=2-s2.0-85196757439&doi=10.1145%2f3641109&partnerID=40&md5=b1f730d6bd590231580a4f0c2d39e675,"In real-world optimisation, it is common to face several sub-problems interacting and forming the main problem. There is an inter-dependency between the sub-problems, making it impossible to solve such a problem by focusing on only one component. The travelling thief problem (TTP) belongs to this category and is formed by the integration of the travelling salesperson problem (TSP) and the knapsack problem (KP). In this paper, we investigate the inter-dependency of the TSP and the KP by means of quality diversity (QD) approaches. QD algorithms provide a powerful tool not only to obtain high-quality solutions but also to illustrate the distribution of high-performing solutions in the behavioural space.We introduce a multi-dimensional archive of phenotypic elites (MAP-Elites) based evolutionary algorithm using well-known TSP and KP search operators, taking the TSP and KP score as the behavioural descriptor. MAP-Elites algorithms are QD-based techniques to explore high-performing solutions in a behavioural space. Afterwards, we conduct comprehensive experimental studies that show the usefulness of using the QD approach applied to the TTP. First, we provide insights regarding high-quality TTP solutions in the TSP/KP behavioural space. Afterwards, we show that better solutions for the TTP can be obtained by using our QD approach, and it can improve the best-known solution for a number of TTP instances used for benchmarking in the literature. © 2024 Copyright held by the owner/author(s). Publication rights licensed to ACM.",MAP-Elites; Quality diversity; travelling thief problem,Combinatorial optimization; High-quality solutions; Inter-dependencies; Knapsack problems; Multi dimensional; Multi-dimensional archive of phenotypic elite; Quality diversity; Real-world optimization; Sub-problems; Traveling salesperson problem; Traveling thief problem; Evolutionary algorithms
Introduction to the Special Issue on Explainable AI in Evolutionary Computation,2024,ACM Transactions on Evolutionary Learning and Optimization,https://www.scopus.com/inward/record.uri?eid=2-s2.0-85187920673&doi=10.1145%2f3649144&partnerID=40&md5=09b9f6273154c6e38bb0a6bc7c100ad4,[No abstract available],,
