Title,Year,Source title,Link,Abstract,Author Keywords,Index Keywords
Analysis and solution of CSS-sprite packing problem,2015,ACM Transactions on the Web,https://www.scopus.com/inward/record.uri?eid=2-s2.0-84953325162&doi=10.1145%2f2818377&partnerID=40&md5=62dce5aae6e46547f4e505ff555d1ebf,"A CSS-sprite packing problem is considered in this article. CSS-sprite is a technique of combining many pictures of a web page into one image for the purpose of reducing network transfer time. The CSS-sprite packing problem is formulated here as an optimization challenge. The significance of geometric packing, image compression and communication performance is discussed. A mathematical model for constructing multiple sprites and optimization of load time is proposed. The impact of PNG-sprite aspect ratio on file size is studied experimentally. Benchmarking of real user web browsers communication performance covers latency, bandwidth, number of concurrent channels as well as speedup from parallel download. Existing software for building CSS-sprites is reviewed. A novel method, called Spritepack, is proposed and evaluated. Spritepack outperforms current software. © 2015 ACM.",CSS image sprites; Heuristics; Image compression; JPEG; Load time reduction; PNG; Rectangle packing; Web engineering; Web optimization,Aspect ratio; Benchmarking; Electronic guidance systems; Image compression; Optimization; Websites; CSS image sprites; Heuristics; JPEG; PNG; Rectangle packing; Time reduction; Web engineering; Web browsers
Diversionary comments under blog posts,2015,ACM Transactions on the Web,https://www.scopus.com/inward/record.uri?eid=2-s2.0-84942744945&doi=10.1145%2f2789211&partnerID=40&md5=58396a2f9746b03c85d1b10143c9e276,"There has been a recent swell of interest in the analysis of blog comments. However, much of the work focuses on detecting comment spam in the blogsphere. An important issue that has been neglected so far is the identification of diversionary comments. Diversionary comments are defined as comments that divert the topic from the original post. A possible purpose is to distract readers from the original topic and draw attention to a new topic. We categorize diversionary comments into five types based on our observations and propose an effective framework to identify and flag them. To the best of our knowledge, the problem of detecting diversionary comments has not been studied so far. We solve the problem in two different ways: (i) rank all comments in descending order of being diversionary and (ii) consider it as a classification problem. Our evaluation on 4,179 comments under 40 different blog posts from Digg and Reddit shows that the proposed method achieves the high mean average precision of 91.9% when the problem is considered as a ranking problem and 84.9% of F-measure as a classification problem. Sensitivity analysis indicates that the effectiveness of the method is stable under different parameter settings. © 2015 ACM.",Classification; Coreference resolution; Diversionary comments; Extraction from Wikipedia; Hierarchical Dirichlet process; Latent Dirichlet allocation; Ranking; Spam; Topic model,Classification (of information); Sensitivity analysis; Statistics; Co-reference resolutions; Diversionary comments; Hierarchical Dirichlet process; Latent Dirichlet allocation; Ranking; Spam; Topic Modeling; Wikipedia; Blogs
Fona: Quantitative metric to measure focus navigation on rich internet applications,2015,ACM Transactions on the Web,https://www.scopus.com/inward/record.uri?eid=2-s2.0-84942801559&doi=10.1145%2f2812812&partnerID=40&md5=5ebac8caa1c579f56a3084ec802970b1,"The Web 2.0 brought new requirements to the architecture of web systems. Web applications' interfaces are becoming more and more interactive. However, these changes are severely impacting how disabled users interact through assistive technologies with the web. In order to deploy an accessible web application, developers can use WAI-ARIA to design an accessible web application, which manually implements focus and keyboard navigation mechanisms. This article presents a quantitative metric, named Fona, which measures how the Focus Navigation WAI-ARIA requirement has been implemented on the web. Fona counts JavaScript mouse event listeners, HTML elements with role attributes, and TabIndex attributes in the DOM structure of webpages. Fona's evaluation approach provides a narrow analysis of one single accessibility requirement. But it enables monitoring this accessibility requirement in a large number of webpages. This monitoring activity might be used to give insights about how Focus Navigation and ARIA requirements have been considered by web development teams. Fona is validated comparing the results of a set of WAI-ARIA conformant implementations and a set of web pages formed by Alexa's 349 top most popular websites. The analysis of Fona's value for Alexa's websites highlights that many websites still lack the implementation of Focus Navigation through their JavaScript interactive content. © 2015 ACM.",ARIA; Focus navigation; Web accessibility,High level languages; Mammals; Navigation; Web services; Accessibility requirements; ARIA; Assistive technology; Evaluation approach; Interactive contents; Monitoring activities; Rich Internet Applications; Web accessibility; Websites
Improving researcher homepage classification with unlabeled data,2015,ACM Transactions on the Web,https://www.scopus.com/inward/record.uri?eid=2-s2.0-84946055462&doi=10.1145%2f2767135&partnerID=40&md5=5da805ddaa7f8050cd38d08d507d08c2,"A classifier that determines if a webpage is relevant to a specified set of topics comprises a key component for focused crawling. Can a classifier that is tuned to perform well on training datasets continue to filter out irrelevant pages in the face of changing content on the Web? We investigate this question in the context of identifying researcher homepages. We show experimentally that classifiers trained on existing datasets of academic homepages underperform on ""non-homepages"" present on current-day academic websites. As an alternative to obtaining labeled datasets to retrain classifiers for the new content, in this article we ask the following question: ""How can we effectively use the unlabeled data readily available from academic websites to improve researcher homepage classification?"" We design novel URL-based features and use them in conjunction with content-based features for representing homepages. Within the co-training framework, these sets of features can be treated as complementary views enabling us to effectively use unlabeled data and obtain remarkable improvements in homepage identification on the current-day academic websites. We also propose a novel technique for ""learning a conforming pair of classifiers"" that mimics co-training. Our algorithm seeks to minimize a loss (objective) function quantifying the difference in predictions from the two views afforded by co-training. We argue that this loss formulation provides insights for understanding co-training and can be used even in the absence of a validation dataset. Our next set of findings pertains to the evaluation of other state-of-the-art techniques for classifying homepages. First, we apply feature selection (FS) and feature hashing (FH) techniques independently and in conjunction with co-training to academic homepages. FS is a well-known technique for removing redundant and unnecessary features from the data representation, whereas FH is a technique that uses hash functions for efficient encoding of features. We show that FS can be effectively combined with co-training to obtain further improvements in identifying homepages. However, using hashed feature representations, a performance degradation is observed possibly due to feature collisions. Finally, we evaluate other semisupervised algorithms for homepage classification. We show that although several algorithms are effective in using information from the unlabeled instances, co-training that explicitly harnesses the feature split in the underlying instances outperforms approaches that combine content and URL features into a single view. © 2015 ACM 1559-1131/2015/10-ART17 $15.00.",Co-training; Conforming classifiers; Researcher homepage classification; Unlabeled data,Function evaluation; Hash functions; Websites; Co-training; Content-based features; Feature representation; Homepage; Performance degradation; Semi-supervised algorithm; State-of-the-art techniques; Unlabeled data; Classification (of information)
Estimating clustering coefficients and size of social networks via random walk,2015,ACM Transactions on the Web,https://www.scopus.com/inward/record.uri?eid=2-s2.0-84942778903&doi=10.1145%2f2790304&partnerID=40&md5=dfca57b9a88e8854b9b09488ac82c33b,"This work addresses the problem of estimating social network measures. Specifically, the measures at hand are the network average and global clustering coefficients and the number of registered users. The algorithms at hand (1) assume no prior knowledge about the network and (2) access the network using only the publicly available interface. More precisely, this work provides (a) a unified approach for clustering coefficients estimation and (b) a new network size estimator. The unified approach for the clustering coefficients yields the first external access algorithm for estimating the global clustering coefficient. The new network size estimator offers improved accuracy compared to prior art estimators. Our approach is to view a social network as an undirected graph and use the public interface to retrieve a random walk. To estimate the clustering coefficient, the connectivity of each node in the random walk sequence is tested in turn. We show that the error drops exponentially in the number of random walk steps. For the network size estimation we offer a generalized view of prior art estimators that in turn yields an improved estimator. All algorithms are validated on several publicly available social network datasets. © 2015 ACM.",Clustering coefficient; Estimation; Sampling; Social network,Clustering algorithms; Estimation; Random processes; Sampling; Social networking (online); Clustering coefficient; Global clustering; Network measures; Network size; Prior knowledge; Random Walk; Undirected graph; Unified approach; Arts computing
Detection of political manipulation in online communities through measures of effort and collaboration,2015,ACM Transactions on the Web,https://www.scopus.com/inward/record.uri?eid=2-s2.0-84932620171&doi=10.1145%2f2767134&partnerID=40&md5=375ecb0b5f05a38c955b4576f00b78d5,"Online social media allow users to interact with one another by sharing opinions, and these opinions have a critical impact on the way readers think and behave. Accordingly, an increasing number of manipulators deliberately spread messages to influence the public, often in an organized manner. In particular, political manipulation-manipulation of opponents to win political advantage-can result in serious consequences: antigovernment riots can break out, leading to candidates' defeat in an election. A few approaches have been proposed to detect such manipulation based on the level of social interaction (i.e., manipulators actively post opinions but infrequently befriend and reply to other users). However, several studies have shown that the interactions can be forged at a low cost and thus may not be effective measures of manipulation. To go one step further, we collect a dataset for real, large-scale political manipulation, which consists of opinions found on Internet forums. These opinions are divided into manipulators and nonmanipulators. Using this collection, we demonstrate that manipulators inevitably work hard, in teams, to quickly influence a large audience. With this in mind, it could be said that a high level of collaborative efforts strongly indicates manipulation. For example, a group of manipulators may jointly post numerous opinions with a consistent theme and selectively recommend the same, well-organized opinion to promote its rank. We show that the effort measures, when combined with a supervised learning algorithm, successfully identify greater than 95% of the manipulators. We believe that the proposed method will help system administrators to accurately detect manipulators in disguise, significantly decreasing the intensity of manipulation. © 2015 ACM.",Machine learning; Online social media; Opinion manipulation; Political manipulation,Artificial intelligence; Learning algorithms; Learning systems; Manipulators; Social sciences; Effective measures; Help systems; Internet forums; On-line communities; Online social medias; Opinion manipulation; Political manipulation; Social interactions; Social networking (online)
A supervised learning approach to protect client authentication on the web,2015,ACM Transactions on the Web,https://www.scopus.com/inward/record.uri?eid=2-s2.0-84932631843&doi=10.1145%2f2754933&partnerID=40&md5=e1db7b0977edc884d9eabb0becf8c435,"Browser-based defenses have recently been advocated as an effective mechanism to protect potentially insecure web applications against the threats of session hijacking, fixation, and related attacks. In existing approaches, all such defenses ultimately rely on client-side heuristics to automatically detect cookies containing session information, to then protect them against theft or otherwise unintended use. While clearly crucial to the effectiveness of the resulting defense mechanisms, these heuristics have not, as yet, undergone any rigorous assessment of their adequacy. In this article, we conduct the first such formal assessment, based on a ground truth of 2,464 cookies we collect from 215 popular websites of the Alexa ranking. To obtain the ground truth, we devise a semiautomatic procedure that draws on the novel notion of authentication token, which we introduce to capture multiple web authentication schemes. We test existing browser-based defenses in the literature against our ground truth, unveiling several pitfalls both in the heuristics adopted and in the methods used to assess them. We then propose a new detection method based on supervised learning, where our ground truth is used to train a set of binary classifiers, and report on experimental evidence that our method outperforms existing proposals. Interestingly, the resulting classifiers, together with our hands-on experience in the construction of the ground truth, provide new insight on how web authentication is actually implemented in practice. © 2015 ACM.",Authentication cookies; Classification; Web security,Classification (of information); Heuristic methods; Social networking (online); Supervised learning; Authentication token; Client authentication; Effective mechanisms; Experimental evidence; Semi-automatic procedures; Supervised learning approaches; Web authentication; WEB security; Authentication
Reliable and resilient trust management in distributed service provision networks,2015,ACM Transactions on the Web,https://www.scopus.com/inward/record.uri?eid=2-s2.0-84932627100&doi=10.1145%2f2754934&partnerID=40&md5=f48e227e45d8bd57a0dcbc473778d5d5,"Distributed service networks are popular platforms for service providers to offer services to consumers and for service consumers to acquire services from unknown parties. eBay and Amazon are two well-known examples of enabling and hosting such service networks to connect service providers to service consumers. Trust management is a critical component for scaling such distributed service networks to a large and growing number of participants. In this article, we present ServiceTrust++, a feedback quality-sensitive and attack resilient trust management scheme for empowering distributed service networks with effective trust management capability. Compared with existing trust models, ServiceTrust++ has several novel features. First, we present six attack models to capture both independent and colluding attacks with malicious cliques, malicious spies, and malicious camouflages. Second, we aggregate the feedback ratings based on the variances of participants' feedback behaviors and incorporate feedback similarity as weight into the local trust algorithm. Third, we compute the global trust of a participant by employing conditional trust propagation based on the feedback similarity threshold. This allows ServiceTrust++ to control and prevent malicious spies and malicious camouflage peers from boosting their global trust scores by manipulating the feedback ratings of good peers and by taking advantage of the uniform trust propagation. Finally, we systematically combine a trust-decaying strategy with a threshold value-based conditional trust propagation to further strengthen the robustness of our global trust computation against sophisticated malicious feedback. Experimental evaluation with both simulation-based networks and real network dataset Epinion show that ServiceTrust++ is highly resilient against all six attack models and highly effective compared to EigenTrust, the most popular and representative trust propagation model to date. © 2015 ACM.",Attack resilience; Distributed service network; Feedback rating quality; Reliability; Trust,Computer networks; Reliability; Attack resiliences; Critical component; Distributed service; Experimental evaluation; Rating quality; Similarity threshold; Trust; Trust computations; Internet
Sampling content from online social networks: Comparing random vs. expert sampling of the Twitter stream,2015,ACM Transactions on the Web,https://www.scopus.com/inward/record.uri?eid=2-s2.0-84931270016&doi=10.1145%2f2743023&partnerID=40&md5=04ba217a14b10f5a6091a3a1f69c6932,"Analysis of content streams gathered from social networking sites such as Twitter has several applications ranging from content search and recommendation, news detection to business analytics. However, processing large amounts of data generated on these sites in real-time poses a difficult challenge. To cope with the data deluge, analytics companies and researchers are increasingly resorting to sampling. In this article, we investigate the crucial question of how to sample content streams generated by users in online social networks. The traditional method is to randomly sample all the data. For example, most studies using Twitter data today rely on the 1% and 10% randomly sampled streams of tweets that are provided by Twitter. In this paper, we analyze a different sampling methodology, one where content is gathered only from a relatively small sample (<1%) of the user population, namely, the expert users. Over the duration of a month, we gathered tweets from over 500,000 Twitter users who are identified as experts on a diverse set of topics, and compared the resulting expert sampled tweets with the 1% randomly sampled tweets provided publicly by Twitter. We compared the sampled datasets along several dimensions, including the popularity, topical diversity, trustworthiness, and timeliness of the information contained within them, and on the sentiment/opinion expressed on specific topics. Our analysis reveals several important differences in data obtained through the different sampling methodologies, which have serious implications for applications such as topical search, trustworthy content recommendations, breaking news detection, and opinion mining. © 2015 ACM.",Random sampling; Sampling content streams; Sampling from experts; Twitter; Twitter lists,Data mining; Importance sampling; Websites; Business analytics; Content recommendations; Large amounts of data; On-line social networks; Random sampling; Social networking sites; Twitter; Twitter lists; Social networking (online)
A UI-centric approach for the End-User Development of multidevice mashups,2015,ACM Transactions on the Web,https://www.scopus.com/inward/record.uri?eid=2-s2.0-84932646098&doi=10.1145%2f2735632&partnerID=40&md5=3b7ceef7f26876f2726b94ad9f5a8fa9,"In recent years, models, composition paradigms, and tools for mashup development have been proposed to support the integration of information sources, services and APIs available on the Web. The challenge is to provide a gate to a ""programmable Web,"" where end users are allowed to construct easily composite applications that merge content and functions so as to satisfy the long tail of their specific needs. The approaches proposed so far do not fully accommodate this vision. This article, therefore, proposes a mashup development framework that is oriented toward the End-User Development. Given the fundamental role of user interfaces (UIs) as a medium easily understandable by the end users, the proposed approach is characterized by UI-centric models able to support a WYSIWYG (What You See Is What You Get) specification of data integration and service orchestration. It, therefore, contributes to the definition of adequate abstractions that, by hiding the technology and implementation complexity, can be adopted by the end users in a kind of ""democratic"" paradigm for mashup development. This article also shows how model-to-code generative techniques translate models into application schemas, which in turn guide the dynamic instantiation of the composite applications at runtime. This is achieved through lightweight execution environments that can be deployed on the Web and on mobile devices to support the pervasive use of the created applications. © 2015 ACM.",Data fusion; End-User Development; Mashups; Model-driven mashup development; Multidevice mashups; Personal information management; Web interfaces,Data fusion; Data integration; Information management; Mobile devices; Social networking (online); User interfaces; End user development; Mash-up; Mashups; Personal information management; Web interface; Human computer interaction
Integrating transactions into BPEL service compositions: An aspect-based approach,2015,ACM Transactions on the Web,https://www.scopus.com/inward/record.uri?eid=2-s2.0-84930935860&doi=10.1145%2f2757288&partnerID=40&md5=6ac01d353956fd7059bba12a5fe7ef3f,"The concept of software as a service has been increasingly adopted to develop distributed applications. Ensuring the reliability of loosely coupled compositions is a challenging task because of the open, dynamic, and independent nature of composable services; this is especially true when the execution of a service-based process relies on independent but correlated services. Transactions are the prototypical case of compositions spanning across multiple services and needing properties to be valid throughout the whole execution. Although transaction protocols and service composition languages have been proposed inthe past decade,atrue viable and effective solution is still missing. In this article, we propose a systematic aspect-based approach to integrating transactions into service compositions, taking into account the well-known protocols: Web Service Transaction and Business Process Execution Language (BPEL). In our approach, transaction policies are first defined as a set of aspects. They are then converted to standard BPEL elements. Finally, these transaction-related elements and the original BPEL process are weaved together, resulting in a transactional executable BPEL process. At runtime, transaction management is the responsibility of a middleware, which implements the coordination framework and transaction protocols followed by the transactional BPEL process and transaction-aware Web services. To automate the proposed approach, we developed a supporting platform called Salan to aid the tasks of defining, validating, and weaving aspect-based transaction policies, and of deploying the transactional BPEL processes. By means of a case study, we demonstrate the proposed approach and evaluate the performance of the supporting platform. Experimental results show that this approach is effective in producing reliable business processes while reducing the need for direct human involvement. © 2015 ACM.",Aspect-oriented programming; Business process execution language; Transaction management; Web services,Application programs; Aspect oriented programming; Computational linguistics; Internet protocols; Middleware; Social networking (online); Software as a service (SaaS); Websites; Business Process Execution Language; Composable services; Coordination frameworks; Distributed applications; Service compositions; Supporting platform; Transaction management; Transaction protocol; Web services
