"Link","Author Keywords","Index Keywords"
"https://www.scopus.com/inward/record.uri?eid=2-s2.0-85094206734&doi=10.1007%2fs40745-018-0151-6&partnerID=40&md5=bff88eb4712c42b7d716a48e50cb1ff8","ARCH; EGARCH; Forecasting; GJR-GARCH model; Volatility; Volatility clustering","Arches; International trade; Investments; Knowledge management; Normal distribution; Students; EGARCH; Exchange rates; Forecasting performance; GARCH-type models; GJR-GARCH models; Performance criterion; Realized volatility; T distribution; Volatility; Volatility clustering; Forecasting"
"https://www.scopus.com/inward/record.uri?eid=2-s2.0-85041413589&doi=10.1007%2fs40745-017-0115-2&partnerID=40&md5=89155af67b34bf7dc31da0ea80539be9","Conditional moments; Generalized exponential distribution; Maximum likelihood estimators; Stochastic ordering","Covariance matrix; Stochastic systems; Conditional moments; Generalized exponential distribution; Generating functions; Maximum likelihood estimator; Mean deviation; Order-statistics; Parameter distributions; Property; Stochastic orderings; Three parameters; Maximum likelihood estimation"
"https://www.scopus.com/inward/record.uri?eid=2-s2.0-85077794589&doi=10.1007%2fs40745-017-0105-4&partnerID=40&md5=1be31b1a91aed20fdde0a1f041121015","Classification; Cox model; Decision tree; Non-linear survival model; Non-Parametric model; Proportional hazard","Classification (of information); Data mining; Hazards; Intelligent systems; Monte Carlo methods; Cox model; Cox regression; Data mining methods; Hazard modeling; Model classification; Non linear; Non-linear survival model; Non-parametric model; Proportional hazards; Survival model; Decision trees"
"https://www.scopus.com/inward/record.uri?eid=2-s2.0-85081106739&doi=10.1007%2fs40745-017-0124-1&partnerID=40&md5=37a305a8bfb13771ce5f6afcf7446765","Array based string matching model; DNA; Parallel matching; String matching; String matching with butterfly model; String matching with divide and conquer model","Character recognition; Data mining; DNA sequences; Gene encoding; Text processing; Array based string matching model; Butterfly model; Divide-and-conquer; Matching models; Matchings; Parallel matching; String matching; String matching with butterfly model; String matching with divide and conquer model; String searching algorithms"
"https://www.scopus.com/inward/record.uri?eid=2-s2.0-85086640286&doi=10.1007%2fs40745-018-0141-8&partnerID=40&md5=6dd321870516f0ff2af6328d512fb431","Big Data Mining; Hadoop; Mahout; Modbus; SCADA attacks","Big data; Classification (of information); Computer software; Decision trees; Gas plants; Industrial water treatment; K-means clustering; Malware; Network security; Personal computing; SCADA systems; Big data mining; Data framework; Hadoop; Mahout; Modbus; Monitor and control; Supervisory control and data acquisition; Supervisory control and data acquisition attack; System control; Systems monitor; Data mining"
"https://www.scopus.com/inward/record.uri?eid=2-s2.0-85040930746&doi=10.1007%2fs40745-017-0119-y&partnerID=40&md5=30f0d9272f6f973b9e9805d270f33b4e","k-Medoids; Least common ancestor; Local landmark embedding; Local search; Query optimization","Errors; Optimization; Distance estimation; Embedding technique; Embeddings; K-medoids; K-medoids clustering; Large-scale network; Least common ancestors; Local landmark embedding; Local search; Queries optimization; Computational complexity"
"https://www.scopus.com/inward/record.uri?eid=2-s2.0-85052850496&doi=10.1007%2fs40745-018-0146-3&partnerID=40&md5=8701310818c35edd801631c35588d5e1","Artificial neural network; Energy analysis; Learning algorithm; Multi-layer perceptron; Scaled conjugate gradient; Solar air heater","Air preheaters; Collector efficiency; Conjugate gradient method; Heating equipment; Learning algorithms; Solar heating; Artificial neural network modeling; Energy analysis; Levenberg-Marquardt; Multilayers perceptrons; Performance; Scaled conjugate gradients; Solar air heater; Thermal Performance; Thermal-efficiency; Training algorithms; Multilayer neural networks"
"https://www.scopus.com/inward/record.uri?eid=2-s2.0-85094203723&doi=10.1007%2fs40745-016-0096-6&partnerID=40&md5=5ba387e9f5e48a414f23339995822bb6","Big data body of knowledge; Big data paradigm; Big data privacy; Big data security; Exponential weibull trend; Kappa interrater agreement; Literature review","Big data; Weibull distribution; Big data body of knowledge; Big data paradigm; Big data privacy; Big data security; Body of knowledge; Exponential weibull trend; Exponential-Weibull; Inter-rater agreements; Kappa interrater agreement; Literature reviews; Data privacy"
"https://www.scopus.com/inward/record.uri?eid=2-s2.0-85058092508&doi=10.1007%2fs40745-017-0112-5&partnerID=40&md5=f784179153c6057160f3359a49b91825","Artificial intelligence; Goods; Internet of things; Real-time decision making; Servgoods; Services","Big data; Data handling; Decision making; Deep learning; Speech recognition; Web services; Advanced technology; Customizable; Good; Physical sensors; Real time decision-making; Real-time analytics; Real-time decision making; Servgood; Service; Service Oriented; Internet of things"
"https://www.scopus.com/inward/record.uri?eid=2-s2.0-85072340858&doi=10.1007%2fs40745-019-00193-9&partnerID=40&md5=ae5dc8d568afdeb4b05fa3a4fe673ea4","Best linear unbiased estimator; Double moment; Order statistics; Power Lindley distribution; Single moment; Type-II right censoring","Intelligent systems; Monte Carlo methods; Best linear unbiased estimator; Double moment; Order-statistics; Power; Power lindley distribution; Right censoring; Single moment; Type II; Type-II right censoring; Unbiased estimator; Higher order statistics"
"https://www.scopus.com/inward/record.uri?eid=2-s2.0-85094173224&doi=10.1007%2fs40745-019-00192-w&partnerID=40&md5=754633901d77e6efe1a1587c63ac9431","Bayes estimators; GELF; LINEX; MLEs; PT-II CBRs; SELF; Step-stress partially accelerated test","Bayesian networks; Inference engines; Statistical tests; Accelerated tests; Bayes estimator; GELF; LINEX; Maximum likelihood estimator; PT-II CBR; Rayleigh distributions; SELF; Step-stress; Step-stress partially accelerated test; Maximum likelihood estimation"
"https://www.scopus.com/inward/record.uri?eid=2-s2.0-85094101336&doi=10.1007%2fs40745-018-00187-z&partnerID=40&md5=286cafb53a17385fa0557558878505da","Kumaraswamy half logistic distribution; Maximum likelihood method; Order statistics","Maximum likelihood estimation; Exponential models; Half-logistic distribution; Kumaraswamy half logistic distribution; Mathematical properties; Maximum likelihood methods; Order-statistics; Probability weighted moments; Quantile functions; Special models; Type II; Estimation"
"https://www.scopus.com/inward/record.uri?eid=2-s2.0-85080145789&doi=10.1007%2fs40745-018-00190-4&partnerID=40&md5=be9ea872551f53df6430e797b0e85e3a","Bayesian estimation; Bivariate distributions; Gumbel-G family of distributions; Maximum likelihood estimation; Simulation","Maximum likelihood estimation; Mean square error; Bayesian; Bayesian and non-Bayesian estimations; Bayesian estimations; Bivariate; Bivariate distribution; Gumbel-G family of distribution; Marginal distribution; Maximum-likelihood estimation; Simulation; Statistical properties; Bayesian networks"
"https://www.scopus.com/inward/record.uri?eid=2-s2.0-85094191336&doi=10.1007%2fs40745-017-0133-0&partnerID=40&md5=33877089174b27e88f575171ed378b5c","Average run length (ARL); Conventional EWMA chart; Heteroscedasticity; Instance verification; Validity","Average run length; Average run lengths; Conventional EWMA chart; Detection performance; EWMA chart; Heteroscedasticity; Instance verification; Performance; Validity"
"https://www.scopus.com/inward/record.uri?eid=2-s2.0-85094079251&doi=10.1007%2fs40745-018-0176-x&partnerID=40&md5=25e4c7063712edd3769d675a7c28783c","Beta-G family; Maximum likelihood estimation; Order statistics; Truncated Poisson distribution","Estimation; Functions; Poisson distribution; Reliability analysis; Beta distributions; Beta-G family; Generating functions; Mathematical properties; Maximum-likelihood estimation; Mean deviation; Moment functions; Order-statistics; Quantile functions; Truncated poisson distribution; Maximum likelihood estimation"
"https://www.scopus.com/inward/record.uri?eid=2-s2.0-85094204300&doi=10.1007%2fs40745-018-0138-3&partnerID=40&md5=1b7e1ae29ec9f1f75592fea605ea8be0","Anemia; Bivariate probit; Malaria; Seemingly unrelated bivariate probit","Economic and social effects; Anemia; Bivariate probit; Health centers; Prevention strategies; Probit models; Seemingly unrelated bivariate probit; Sex education; Social and economic development; Diseases"
"https://www.scopus.com/inward/record.uri?eid=2-s2.0-85069465093&doi=10.1007%2fs40745-017-0120-5&partnerID=40&md5=eec690977327c8dd4b0738bd6422df15","Chen distribution; Gibbs sampler; Load-sharing system model; Metropolis-Hasting algorithm; Simulation","Failure rate; Parameter estimation; Reliability analysis; Statistical methods; Chen distribution; Component loads; Gibbs samplers; Load-sharing System models; Maximum-likelihood estimate; Metropolis-Hastings algorithm; Multicomponents; Reliability estimation; Simulation; Standard errors; Maximum likelihood estimation"
"https://www.scopus.com/inward/record.uri?eid=2-s2.0-85094212390&doi=10.1007%2fs40745-017-0103-6&partnerID=40&md5=516226a52df0a2d8106315813693e5dd","Bidding record; Influencing factors; Online P2P lending; Success rate","Linear regression; Peer to peer networks; Bidding record; Influencing factor; Multiple linear regression models; Network methods; Online P2P lending; Social capitals; Soft information; Success rate; Finance"
"https://www.scopus.com/inward/record.uri?eid=2-s2.0-85050007419&doi=10.1007%2fs40745-016-0092-x&partnerID=40&md5=c2f6e26ea47a1beefb309cc056a98b9c","PDM; PDM-string matching; STEP; XML-ontology","Hypertext systems; Interoperability; Natural resources management; Ontology; Product design; Resource allocation; Semantics; Engineering enterprise; Frame-work; Ontology's; Product Data Management; Product data management-string matching; Resource management; Standard for exchange of product; String matching; XML-ontology; XML"
"https://www.scopus.com/inward/record.uri?eid=2-s2.0-85072724027&doi=10.1007%2fs40745-018-00189-x&partnerID=40&md5=e13ac8808fb15a71a7289d8f713786f1","Classification; Data mining; Features selection; Machine learning; NBA; Prediction; Sports analytics","Classification (of information); Data mining; Decision trees; Machine learning; Neural networks; Sports; Feature analysis; Features selection; Features sets; Financial transactions; Machine learning methods; Machine-learning; National basketball associations; Outcome prediction; Performance; Sport analytic; Forecasting"
"https://www.scopus.com/inward/record.uri?eid=2-s2.0-85094198361&doi=10.1007%2fs40745-018-0164-1&partnerID=40&md5=23d40669666b657723ca399e3ec0133f","AdEater; Artificial intelligence; Association rules; Classification trees; Data mining; k-means clustering; Machine learning; Silhouette; Support vector machine","Classification (of information); Data mining; Image classification; K-means clustering; Trees (mathematics); Websites; Adeater; Classification methods; Classification trees; Data-mining techniques; Image Classifiers; K-means++ clustering; Silhouette; Support vectors machine; Training data; Web-page; Support vector machines"
"https://www.scopus.com/inward/record.uri?eid=2-s2.0-85053284102&doi=10.1007%2fs40745-017-0101-8&partnerID=40&md5=15204d6ff2934da08b78c0c35f402a53","Adaptive Type-II progressive hybrid censoring; Burr Type-XII distribution; Maximum likelihood estimation; Progressive Type-I hybrid censoring scheme","Fisher information matrix; Intelligent systems; Learning algorithms; Mean square error; Monte Carlo methods; Parameter estimation; Testing; Accelerated life tests; Acceleration factors; Adaptive type-II progressive hybrid censoring; Hybrid censoring; Maximum-likelihood estimation; Progressive type-I hybrid censoring scheme; Step-stress; Test models; Type II; Maximum likelihood estimation"
"https://www.scopus.com/inward/record.uri?eid=2-s2.0-85094184877&doi=10.1007%2fs40745-018-0154-3&partnerID=40&md5=67f6dd37ecad626e8882d8955d55183e","Exponentiated power Lindley distribution; Logarithmic distributions; Model selection criteria","Closed-form expression; Cumulative distribution; Exponentiated power lindley distribution; Life-time distribution; Logarithmic distribution; Logarithmic models; Model application; Model properties; Model selection criteria; Power; Maximum likelihood estimation"
"https://www.scopus.com/inward/record.uri?eid=2-s2.0-85089816997&doi=10.1007%2fs40745-018-0171-2&partnerID=40&md5=642868243d71638718b9f84a62f48442","Generalized Burr XII distribution; Geometric distribution; Maximum likelihood estimation; Moments; Power series distribution","Generalized burr XII distribution; Geometric distribution; Maximum likelihood estimation method; Maximum-likelihood estimation; Modeling parameters; Moment; Power series; Power series distribution; Property; Real data sets; Maximum likelihood estimation"
"https://www.scopus.com/inward/record.uri?eid=2-s2.0-85094217686&doi=10.1007%2fs40745-016-0081-0&partnerID=40&md5=bfcccd9cdccc4f530f4be26b4bec54cb","DEMATEL; Fuzzy logic; Intellectual capital; Intellectual capital management","Decision making; Fuzzy logic; Petrochemicals; Capital management; Causal relations; Customer capital; DEMATEL; Fuzzy-Logic; Human capitals; Intellectual capital; Intellectual capital management; Petrochemical company; Knowledge management"
"https://www.scopus.com/inward/record.uri?eid=2-s2.0-85094197942&doi=10.1007%2fs40745-018-0147-2&partnerID=40&md5=310c8c83f8ad326289c563f411bc8e0e","Central point analysis; Multivariate statistics; Principal component analysis; ℓ<sub>1</sub>-Norm","Constrained optimization; Multivariant analysis; Numerical methods; Central point; Central point analyse; Data clouds; Multivariate statistics; Novel methods; Principal-component analysis; Radial datum; Real-life applications; Technical notes; ℓ1-norm; Principal component analysis"
"https://www.scopus.com/inward/record.uri?eid=2-s2.0-85094206955&doi=10.1007%2fs40745-016-0090-z&partnerID=40&md5=2b832955af511288975b2d37fe2b2c56","Balance optimization; Product recommendation; Subset selection","Balance optimization; Mailing lists; Mean ratings; Netflix; Optimization approach; Product recommendation; Random selection; Subset selection; Targeted advertisements; Targeted marketing; Sales"
"https://www.scopus.com/inward/record.uri?eid=2-s2.0-85094191686&doi=10.1007%2fs40745-017-0106-3&partnerID=40&md5=6b071c22bb6a899a8251a9b10d05c0f4","Binary PSO; Classifications; Feature selection; Microarray gene expression; Rough set theory","Classification (of information); Clustering algorithms; Computation theory; Diseases; Gene expression; Rough set theory; Binary PSO; Binary PSO algorithm; Curse of dimensionality; Data noise; Feature selection and classification; Features selection; Gene Expression Data; High dimensional data; Microarray gene expression; Objective functions; Feature extraction"
"https://www.scopus.com/inward/record.uri?eid=2-s2.0-85094204496&doi=10.1007%2fs40745-018-0140-9&partnerID=40&md5=87c25f6f7a6eb83f7ca5b9388adac7ec","Optimal training sample; Predictive discriminant analysis; Statistically optimal hit rate; Winsorization","Discriminant analysis; Classification accuracy; Hit rate; New approaches; Optimal training; Optimal training sample; Predictive discriminant analyse; Real life datasets; Statistically optimal hit rate; Training sample; Winsorization; Sampling"
"https://www.scopus.com/inward/record.uri?eid=2-s2.0-85073246584&doi=10.1007%2fs40745-018-0136-5&partnerID=40&md5=14ea370fee2bc69ae31761c43839e718","Classification algorithms; Comparison of algorithms; Machine learning; Ranking algorithms; Statistical tests; TOPSIS","Learning algorithms; Machine learning; Statistics; Stochastic systems; Case-studies; Classification algorithm; Comparison of algorithm; Mean and standard deviations; Mean standard deviation; Multiple algorithms; Performance; Ranking algorithm; Technique for order preference by similarities to ideal solutions; Statistical tests"
"https://www.scopus.com/inward/record.uri?eid=2-s2.0-85084200313&doi=10.1007%2fs40745-018-00188-y&partnerID=40&md5=5348cbc0f1c4d567eac45caefbe70d64","Cubic transmutation; Maximum likelihood estimation; Moments; Order statistics; Reliability analysis; Weibull distribution","Maximum likelihood estimation; Reliability analysis; Cubic transmutation; Distribution applications; Distribution property; Maximum-likelihood estimation; Moment; Order-statistics; Parameter inference; Parameters estimation; Simulation studies; Statistical properties; Weibull distribution"
"https://www.scopus.com/inward/record.uri?eid=2-s2.0-85082982950&doi=10.1007%2fs40745-018-0162-3&partnerID=40&md5=a2d389db14b54ff1fe7fb8768186c900","Breast-cancer; Classification; Histopathological image; Neural Network; Random Forest","Classification (of information); Decision trees; Diseases; Image analysis; Medical imaging; Active area; Breast Cancer; Histopathological images; Images classification; Neural network techniques; Neural-networks; Normalisation; Performance; Random forest algorithm; Random forests; Image classification"
"https://www.scopus.com/inward/record.uri?eid=2-s2.0-85072247223&doi=10.1007%2fs40745-017-0108-1&partnerID=40&md5=03f61ac0bc2e0d5fff778ae0568ab7cc","Cone-cutting; Gravity sliding path; Projection calculation; Strongly polynomial algorithm; Structural adjustment","Vectors; Cone-cutting; Constraint planes; Feasible regions; Gravity sliding; Gravity sliding path; Linear-programming; Projection calculation; Sliding motions; Strongly polynomial algorithm; Structural adjustment; Linear programming"
"https://www.scopus.com/inward/record.uri?eid=2-s2.0-85094198552&doi=10.1007%2fs40745-017-0125-0&partnerID=40&md5=21233f1e4762cd1f9d2385b90cf807be","Bayes estimates; Highest posterior density interval; Lindley approximation method; Maximum likelihood estimates; Metropolis–Hastings algorithm","Approximation algorithms; Approximation theory; Inverse problems; Numerical methods; Weibull distribution; Approximation methods; Bayes estimates; Exponential distributions; High posterior density interval; Lindley approximation method; Lindley's approximations; Maximum-likelihood estimate; Metropolis-Hastings algorithm; Reliability properties; Weibull; Maximum likelihood estimation"
"https://www.scopus.com/inward/record.uri?eid=2-s2.0-85094186968&doi=10.1007%2fs40745-018-0181-0&partnerID=40&md5=d203165686fc3ed7e739e4678c7d0af3","Hazard rate function; Least square estimation; Maximum likelihood estimation; Method of maximum product spacing; Transmuted extended exponential distribution","Intelligent systems; Least squares approximations; Monte Carlo methods; Normal distribution; Exponential distributions; Generalisation; Hazard rate function; Hazard rates; Least squares estimation; Life-time distribution; Maximum-likelihood estimation; Method of maximum product spacing; Rate functions; Transmuted extended exponential distribution; Maximum likelihood estimation"
"https://www.scopus.com/inward/record.uri?eid=2-s2.0-85094214563&doi=10.1007%2fs40745-016-0089-5&partnerID=40&md5=74734b6085afe023d00253670aea5cd7","Anaesthesia; Big data; Data mining; Machine learning; Physiological data; Virtual reality","Anesthesiology; Artificial intelligence; Big data; Data handling; E-learning; Learning algorithms; Learning systems; Personnel training; Virtual reality; Clinical data; Clinical skills; Immersive; Knowledge learning; Learning performance; Machine learning techniques; Physiological data; Time-consuming tasks; Training platform; Virtual-reality environment; Data mining"
"https://www.scopus.com/inward/record.uri?eid=2-s2.0-85094213626&doi=10.1007%2fs40745-018-00185-1&partnerID=40&md5=50df57f4ecfdb5c673703c924c3f70de","Emotional intelligence; Machine learning; Neural networks; Regression; Trait Meta Mood Scale","Corrective measures; Emotional intelligence; Flexible system; Large datasets; Machine-learning; Measurements of; Missing data; Missing values; Neural-networks; Trait meta mood scale; Machine learning"
"https://www.scopus.com/inward/record.uri?eid=2-s2.0-85094197337&doi=10.1007%2fs40745-017-0117-0&partnerID=40&md5=b040d683e676951512b14822d525d930","Maximum subarrays; Sequence alignment; String matching","Dynamic programming; Approximate string matching; Gap penalties; Global alignment; Global score; K methods; Maximum subarray; Sequence alignments; String alignment; String matching; Subarray; Alignment"
"https://www.scopus.com/inward/record.uri?eid=2-s2.0-85094208681&doi=10.1007%2fs40745-016-0095-7&partnerID=40&md5=e221b4e5eee1cd6f2f5ca683ad85c64b","Dynamic programming; Human resource demand forecasting; Scientific research management","Decision making; Decision support systems; Forecasting; Human resource management; Information management; Resource allocation; Data driven; Decision makers; Demand forecasting; Dynamic programming model; Human resource demand forecasting; Rapid growth; Research management; Resource demands; Scientific research management; Scientific researches; Dynamic programming"
"https://www.scopus.com/inward/record.uri?eid=2-s2.0-85094107178&doi=10.1007%2fs40745-017-0135-y&partnerID=40&md5=2c1dc0908cf3cc65394c13f6ed06c67f","Heterogeneous data; Multiview; Non-negative matrix factorization; Probabilistic topic model","Clustering algorithms; Data mining; Matrix algebra; Probability distributions; Statistics; Data feature; Datapoints; Dates and time; Heterogeneous data; Internet technology; Multi-views; Nonnegative matrix factorization; Probabilistic topic models; Sensors technique; Topic Modeling; Non-negative matrix factorization"
"https://www.scopus.com/inward/record.uri?eid=2-s2.0-85086133541&doi=10.1007%2fs40745-017-0128-x&partnerID=40&md5=6501bd4e151752d0bba89bc6336abbf9","Estimation; Hazard rate; Kumaraswamy distribution; MLE; Moment generating function; Moments","Estimation; Functions; Generating functions; Hazard rates; Kumaraswamy distribution; Mathematical properties; Moment; Moment generating function; Ordinary moments; Probability weighted moments; Quantile functions; Renyi's entropy; Maximum likelihood estimation"
"https://www.scopus.com/inward/record.uri?eid=2-s2.0-85094176650&doi=10.1007%2fs40745-017-0129-9&partnerID=40&md5=9d27e0e417dad8ac86ec353c07281ced","Big data; Big data framework; Chinese government; Data opening; Data service; Data sharing","Big data framework; Chinese Government; Data framework; Data opening; Data platform; Data services; Data Sharing; Open datum; Scientific community; United kingdom; Big data"
"https://www.scopus.com/inward/record.uri?eid=2-s2.0-85042524472&doi=10.1007%2fs40745-017-0109-0&partnerID=40&md5=be07a3ce04f3d5d1c0e53d32828260e4","Intelligence grades; Intelligence quotient of artificial intelligence; Standard intelligence model","Intelligent robots; Artificial intelligence systems; Google+; Input-output; Intelligence grade; Intelligence models; Intelligence quotient of artificial intelligence; Intelligence quotients; Potential threats; Scientific researches; Standard intelligence model; Intelligent systems"
"https://www.scopus.com/inward/record.uri?eid=2-s2.0-85091779397&doi=10.1007%2fs40745-017-0123-2&partnerID=40&md5=66c8cffd34d12c13838d8dbdd22a9271","Gaussian mixture model; Histogram of oriented gradients; Support vector machine","Classification (of information); Face recognition; Gaussian distribution; Graphic methods; Image segmentation; Monitoring; Security systems; Gaussian Mixture Model; Histogram of oriented gradient features; Histogram of oriented gradients; Human Tracking; Novel algorithm; Public places; Support vectors machine; Surveillance cameras; Surveillance video; Video surveillance systems; Support vector machines"
"https://www.scopus.com/inward/record.uri?eid=2-s2.0-85079781016&doi=10.1007%2fs40745-018-0150-7&partnerID=40&md5=06e8f724bc247f96f8feee820d514579","Cervical cancer; Parametric frailty; Proportional hazard; Survival Data Analysis; Survival time","Gaussian distribution; Hazards; Hospitals; Normal distribution; Tobacco; Weibull distribution; Cancer patients; Cervical cancers; Frailty models; Log-normal; Parametric frailty; Proportional hazards; Risk factors; Survival data; Survival data analyse; Survival time; Diseases"
"https://www.scopus.com/inward/record.uri?eid=2-s2.0-85094124132&doi=10.1007%2fs40745-018-0148-1&partnerID=40&md5=b57ff8f38241ed190bec9c4321f69a24","Complex event processing; Data stream management; Semantic reasoning; Situation awareness","Data handling; Information management; Semantic Web; Complex event processing; Complex events; Data fusion technique; Data stream; Data stream management; Event Processing; Semantic reasoning; Semantic Web technology; Situation awareness; Situational awareness; Data fusion"
"https://www.scopus.com/inward/record.uri?eid=2-s2.0-85090002875&doi=10.1007%2fs40745-018-0166-z&partnerID=40&md5=049b3c2c0b4d60af653fc09bf0125ec6","AIC; Exponentiated generalized distribution; K–S test; LR test; Marshall–Olkin distribution; Maximum likelihood","Distribution functions; Probability density function; AIC; Exponentiated generalized distribution; Generalized distribution; K-S test; LR-test; Ma ximum likelihoods; Marshalls; Marshal–olkin distribution; Maximum-likelihood; Property; Maximum likelihood estimation"
