"Link","Author Keywords","Index Keywords"
"https://www.scopus.com/inward/record.uri?eid=2-s2.0-85089920094&doi=10.1007%2fs40745-019-00199-3&partnerID=40&md5=44eb34fa826bd026726c0e8d6b1de354","Bayesian estimation; Bayesian prediction intervals; Generalized progressive hyprid censored samples; Gompertz distribution; Maximum likelihood estimation","Forecasting; Intelligent systems; Maximum likelihood estimation; Monte Carlo methods; Bayesian estimations; Bayesian prediction interval; Bayesian predictions; Censored data; Censored samples; Estimation and predictions; Generalized progressive hyprid censored sample; Gompertz distributions; Maximum-likelihood estimation; Prediction interval; Bayesian networks"
"https://www.scopus.com/inward/record.uri?eid=2-s2.0-85101849594&doi=10.1007%2fs40745-021-00322-3&partnerID=40&md5=6dd69a501fef8b0fcbb0a9701d61075c","Asymptotic variance; Flattened generalized logistic distribution; L-moment; order statistics; Quantile function; Skewness-invariant kurtosis","Asymptotic variance; Flattened generalized logistic distribution; Generalisation; Generalized logistic distributions; L-moments; Logistic distributions; Order-statistics; Property; Quantile functions; Skewness-invariant kurtosis; Higher order statistics"
"https://www.scopus.com/inward/record.uri?eid=2-s2.0-85094146691&doi=10.1007%2fs40745-019-00223-6&partnerID=40&md5=f691b77a5525ef7b0d2ade7167db2643","Bayes Net; Data analytics; Data processing; Hospitalisation; Machine learning; Patient discharge; Random Forest","Data handling; Decision trees; Hospitals; Machine learning; Bayes net; Data analytics; Financial pressure; General practitioners; Health facilities; Machine learning techniques; Medical providers; Patient discharge; Patient education; Random forests; Data Analytics"
"https://www.scopus.com/inward/record.uri?eid=2-s2.0-85094195413&doi=10.1007%2fs40745-019-00200-z&partnerID=40&md5=75ed9a46fc1051ecb08a93351284c95c","Bayesian method; Hazard rate; Lifetime distribution","Hyperbolic functions; Maximum likelihood estimation; Parameter estimation; Statistical methods; Bayesian methods; Exponential distributions; Exponentials; Hazard function; Hazard rates; Life-time distribution; Order-statistics; Property; Quantile functions; Survival Function; Bayesian networks"
"https://www.scopus.com/inward/record.uri?eid=2-s2.0-85094205998&doi=10.1007%2fs40745-018-0180-1&partnerID=40&md5=0c544ce0819831525890199547715024","BINAR(1); COM-Poisson; First half and second half goals; GQL; Non-stationary","Arsenals; Time series; BINAR(1); Bivariate time series; COM-poisson; First half and second half goal; GQL; Nonstationary; Times series models; Sports"
"https://www.scopus.com/inward/record.uri?eid=2-s2.0-85126814151&doi=10.1007%2fs40745-022-00379-8&partnerID=40&md5=1ed2c575b7899985231583bc9aa6f8b9","Anti-phishing; Cybersecurity; Hybrid feature; Hyperlink feature; Machine learning; Phishing detection; URL feature; XG Boost","Classification (of information); Computer crime; Cybersecurity; Feature extraction; Heuristic methods; Hypertext systems; Real time systems; Search engines; Websites; Anti-phishing; Cyber security; Feature-based; Hybrid features; Hyperlink feature; Hyperlinks; Phishing detections; Phishing websites; URL feature; XG boost; Machine learning"
"https://www.scopus.com/inward/record.uri?eid=2-s2.0-85094107150&doi=10.1007%2fs40745-019-00206-7&partnerID=40&md5=b4eddf607b9593908d769dcb9119bee5","Archimedean copula; Elliptical copula; Forecast; Macroeconomic variables; Nigeria; Probability distributions","Commerce; Financial markets; Value engineering; Archimedean copula; Elliptical copula; Exchange rates; Macroeconomic variables; Market returns; Nigeria; Probability: distributions; Risk estimates; Times series; Value at Risk; Probability distributions"
"https://www.scopus.com/inward/record.uri?eid=2-s2.0-85094218493&doi=10.1007%2fs40745-018-0184-x&partnerID=40&md5=bdb5c73ca5dff253fc17eb9ad3abf3d3","Count data; Discrete generalized inverse Weibull distribution; Index of dispersion; Medical sciences; Monte Carlo simulation","Intelligent systems; Weibull distribution; Count datum; Discrete generalized inverse weibull distribution; Distribution applications; Distribution property; Generalized inverse; Index of dispersions; Inverse weibull distribution; Medical science; Monte Carlo's simulation; Three parameters; Monte Carlo methods"
"https://www.scopus.com/inward/record.uri?eid=2-s2.0-85094213088&doi=10.1007%2fs40745-020-00268-y&partnerID=40&md5=2e7f556cf552013f44216d2ce9a6dc89","Distribution center’s location; Post supply chain network; Supply chain management","Integer programming; Supply chain management; Warehouses; Distribution center’s location; Distribution centres; Distribution process; Distribution sales; Distribution services; Final elements; Mixed integer programming model; Post supply chain network; Supply chain network; Transport networks; Location"
"https://www.scopus.com/inward/record.uri?eid=2-s2.0-85094140579&doi=10.1007%2fs40745-020-00301-0&partnerID=40&md5=d25a902250e45c30c52011c11f8a5282","Graph patterns; Graph processing; Spectral algorithms; Steaming graph analysis","Pattern recognition; Singular value decomposition; Continuous-flow; Extreme scale; Graph analysis; Graph patterns; Graph processing; Interaction information; Spectral algorithm; Steaming graph analyse; Streaming algorithm; Streaming data; Graphic methods"
"https://www.scopus.com/inward/record.uri?eid=2-s2.0-85094100873&doi=10.1007%2fs40745-020-00270-4&partnerID=40&md5=46e29422ec0a6358b5bdf1e7ababca9e","Bayes estimation; Interval estimations; Maximum likelihood estimation; Power generalized Weibull distribution; Progressive type-II censoring; Simulation study; Step-stress model","Electron emission; Testing; Weibull distribution; Bayes estimation; Generalized Weibull distributions; Interval estimation; Maximum-likelihood estimation; Power; Power generalized weibull distribution; Progressive type II censoring; Simulation studies; Step-stress; Step-stress models; Maximum likelihood estimation"
"https://www.scopus.com/inward/record.uri?eid=2-s2.0-85094148865&doi=10.1007%2fs40745-019-00201-y&partnerID=40&md5=0601db1f8ffff07e6df20af5639d22ac","Hazard rate; Maximum likelihood; Power function; Zero-truncated Poisson","Hazards; Poisson distribution; Closed form; Hazard rates; Ma ximum likelihoods; Maximum-likelihood; Parameter distributions; Power function distribution; Power functions; Property; Three parameters; Zero-truncated poisson; Maximum likelihood estimation"
"https://www.scopus.com/inward/record.uri?eid=2-s2.0-85094204130&doi=10.1007%2fs40745-018-0179-7&partnerID=40&md5=1340036d3d740e097c58078b79b27eba","Causal inference; Data processing; Inference mechanism; Optimization","Decomposition; Statistical tests; Balance optimization; Bootstrap hypothesis; Causal inferences; Covariates; Inference mechanism; Matching methods; Observational study; Optimisations; Subset selection; Treatment effects; Data handling"
"https://www.scopus.com/inward/record.uri?eid=2-s2.0-85094126455&doi=10.1007%2fs40745-020-00299-5&partnerID=40&md5=36ed4f21e51c55b96a8517e325118a04","Anderson–Darling estimators; Cramér–van Mises estimators; Least and weighted least squares estimators; Percentiles estimators; Simulation","Inverse problems; Least squares approximations; Maximum likelihood estimation; Mean square error; Numerical methods; Weibull distribution; Andersons; Anderson–darling estimator; Crame–van mise estimator; Inverse weibull distribution; Least and weighted least square estimator; Marshalls; Percentile estimators; Reliability modelling; Simulation; Weighted least-squares estimators; Particle swarm optimization (PSO)"
"https://www.scopus.com/inward/record.uri?eid=2-s2.0-85074360162&doi=10.1007%2fs40745-019-00203-w&partnerID=40&md5=9792b95ec0f861f068d5dce8f9dbb9b4","Lifetime data; Maximum likelihood; Weibull distribution; xgamma distribution","Failure rate; Functions; Intelligent systems; Maximum likelihood; Monte Carlo methods; Generating functions; Life-times; Lifetime data; Lifetime models; Ma ximum likelihoods; Mathematical properties; Maximum-likelihood; Time modeling; Two parameter; Xgamma distribution; Weibull distribution"
"https://www.scopus.com/inward/record.uri?eid=2-s2.0-85123885042&doi=10.1007%2fs40745-021-00367-4&partnerID=40&md5=76009ad618f3d0cad8665049ee2bec09","Cloud cover detection; Machine learning; Remote sensing; Satellite images",""
"https://www.scopus.com/inward/record.uri?eid=2-s2.0-85094131510&doi=10.1007%2fs40745-020-00243-7&partnerID=40&md5=16f313522621b5e9873fa549ab7db26e","Asymptotic distributions; Kolmogorov–Smirnov distance; Life distributions; Likelihood ratio statistic","Asymptotic analysis; Probability distributions; Asymptotic distributions; Data set; Kolmogorov-Smirnov; Kolmogorov–smirnov distance; Life distribution; Likelihood ratio statistics; Modelling time; Non negatives; Sample sizes; Time to events; Computational complexity"
"https://www.scopus.com/inward/record.uri?eid=2-s2.0-85094157963&doi=10.1007%2fs40745-020-00250-8&partnerID=40&md5=10d880e293519e77742aafb3ea25a48b","Multi-objective geometric programming; Uncertain variable; Uncertainty theory; Weighted Tchebycheff","Decision making; Functions; Linear programming; Multiobjective optimization; Numerical methods; Geometric programming; Multi objective; Multi-objective geometric programming; Multi-objective optimization models; Multi-objective optimization problem; Objective functions; Optimal solutions; Uncertain variables; Uncertainty theory; Weighted tchebycheff; Optimal systems"
"https://www.scopus.com/inward/record.uri?eid=2-s2.0-85094115443&doi=10.1007%2fs40745-020-00247-3&partnerID=40&md5=3e33d1da3eb9d1fb73d5e764fb39de84","Double neoteric ranked set sampling; Maximum likelihood estimation; Neoteric ranked set sampling; Ranked set sampling; Simple random sampling","Inverse problems; Parameter estimation; Weibull distribution; Double neoteric ranked set sampling; Inverse weibull distribution; Maximum-likelihood estimation; Neoteric ranked set sampling; Ranked set sampling; Sampling design; Sampling method; Simple random sampling; Maximum likelihood estimation"
"https://www.scopus.com/inward/record.uri?eid=2-s2.0-85094191207&doi=10.1007%2fs40745-019-00219-2&partnerID=40&md5=5f0fb2f2cd3e1f8867f78c4c4a0f5e0d","BMI; Intra-class correlation coefficient; Transition model; Trivial solution; Working covariance matrix","Health; Body mass; Body mass index; Correlation coefficient; Covariance matrices; Intra class; Intra-class correlation coefficient; Mass index; Transition model; Trivial solutions; Working covariance matrix; Covariance matrix"
"https://www.scopus.com/inward/record.uri?eid=2-s2.0-85088316439&doi=10.1007%2fs40745-019-00218-3&partnerID=40&md5=bd23b778ac073393fcb6a9c4ada7188c","Latent Dirichlet allocation; Semantic topic unit; Text representation; Topic model","Semantics; Document semantics; Latent Dirichlet allocation; Model method; Model-based OPC; Semantic features; Semantic relationships; Semantic structures; Semantic topic unit; Text representation; Topic Modeling; Statistics"
"https://www.scopus.com/inward/record.uri?eid=2-s2.0-85081175716&doi=10.1007%2fs40745-019-00208-5&partnerID=40&md5=79b6839222860da06d12548c01df8945","ANTON framework; Naïve/Bayes; Semantic focused crawler; SVM; Web crime mining","Ant colony optimization; Crime; Data mining; Ontology; Security of data; Semantic Web; Web crawler; Websites; ANTON framework; Crime informations; Focused crawler; Naive bayes; Ontology's; Semantic focused crawler; SVM; Web crime mining; Web ontology; Web-page; Semantics"
"https://www.scopus.com/inward/record.uri?eid=2-s2.0-85090791511&doi=10.1007%2fs40745-019-00204-9&partnerID=40&md5=b1533cb066ed1235aa319a7b87b32448","","Distribution applications; Distribution property"
"https://www.scopus.com/inward/record.uri?eid=2-s2.0-85094178264&doi=10.1007%2fs40745-019-00225-4&partnerID=40&md5=29270dce533b1caa0af1eeb0c1155324","Gaussian distribution; Hoeffding tree; Massive and streaming data; Misclassification error","Decision trees; Error statistics; Forestry; Analytical method; Hoeffding tree; Massive data; Misclassification error; Misclassifications; Numerical attributes; Splitting value; Statistic errors; Streaming data; Sufficient statistics; Gaussian distribution"
"https://www.scopus.com/inward/record.uri?eid=2-s2.0-85094199122&doi=10.1007%2fs40745-018-0167-y&partnerID=40&md5=cd6a6b871eda2901d40ce104236785e7","Characterizations; Compounding; Maximum likelihood estimation; Reliability","Differential equations; Electron emission; Estimation; Characterization; Compounding; Exponentials; Hazard rates; Life-testing; Maximum-likelihood estimation; Pearson differential equation; Power; Property characterizations; Rate functions; Maximum likelihood estimation"
"https://www.scopus.com/inward/record.uri?eid=2-s2.0-85088473871&doi=10.1007%2fs40745-020-00263-3&partnerID=40&md5=6b36919b6aa9a762cc59b82d1f956096","HPD interval; Lifetime distribution; M–H algorithm; Progressive hybrid censoring","Markov processes; Maximum likelihood estimation; Mean square error; Parameter estimation; Bayesian estimations; Censored data; Exponential distributions; H-algorithm; HPD intervals; Hybrid censoring; Life-time distribution; Maximum likelihood estimator; M–H algorithm; Progressive hybrid censoring; Bayesian networks"
"https://www.scopus.com/inward/record.uri?eid=2-s2.0-85094175028&doi=10.1007%2fs40745-020-00284-y&partnerID=40&md5=86617e2f18cffcd1095ed242a2bd5199","","Acceptance tests; Acceptance sampling; Acceptance sampling inspection plan; Characteristics functions; Consumer’s risk; Inspection plans; Life-tests; Operating characteristic function; Operating characteristics; Producer’s risk; Truncated life test; Normal distribution"
"https://www.scopus.com/inward/record.uri?eid=2-s2.0-85094099508&doi=10.1007%2fs40745-020-00246-4&partnerID=40&md5=33b57797a975b2752db0a3ebce3d0456","Estimation methods; Gompertz distribution; Hazard rate function; Inverse Gompertz distribution","Hazards; Higher order statistics; Intelligent systems; Inverse problems; Least squares approximations; Maximum likelihood estimation; Estimation methods; Gompertz distributions; Hazard rate function; Hazard rates; Inverse gompertz distribution; Power; Rate functions; Statistical properties; Three parameters; Monte Carlo methods"
"https://www.scopus.com/inward/record.uri?eid=2-s2.0-85095573095&doi=10.1007%2fs40745-019-00220-9&partnerID=40&md5=7eb7000995110b9b08f8d0cf6507edaa","Environmental analytics; Shannon entropy; Statistical mechanics","Atmospheric temperature; Wind; Air temperature; Australia; Environmental analytic; Environmental change; Environmental data; Heat capacitance; Shannon's entropy; Temperature-relative humidity; Times series; Wind speed; Statistical mechanics"
"https://www.scopus.com/inward/record.uri?eid=2-s2.0-85094205339&doi=10.1007%2fs40745-019-00234-3&partnerID=40&md5=15884c9ab2c602ccb85274ac6ee451d8","Bayesian inference; HMC; Marshall–Olkin with exponential; Marshall–Olkin with exponentiated exponential; Marshall–Olkin with exponentiated extension; Posterior; R; rstan; Simulation","Bayesian networks; Inference engines; Bayesian inference; Exponentials; HMC; Marshalls; Marshal–olkin with exponential; Marshal–olkin with exponentiated exponential; Marshal–olkin with exponentiated extension; Posterior; R; Rstan; Simulation; Reliability analysis"
"https://www.scopus.com/inward/record.uri?eid=2-s2.0-85086446228&doi=10.1007%2fs40745-018-0169-9&partnerID=40&md5=a4c7d5cc17c3641604425dc306d7bcc7","Estimation; Family of distributions; Moments; Order statistic; Residual life function; Weibull distribution","Estimation; Failure rate; Least squares approximations; Maximum likelihood estimation; Distribution applications; Distribution property; Family of distribution; General expression; Life distribution; Mathematical properties; Moment; Order-statistics; Residual life; Residual life function; Weibull distribution"
"https://www.scopus.com/inward/record.uri?eid=2-s2.0-85095564262&doi=10.1007%2fs40745-020-00288-8&partnerID=40&md5=57c13ad8ae82a19960dda73414607c03","Maxwell generalized family; Maxwell–Weibull; Moments; Order statistics; Quantile function","Ion exchange; Maximum likelihood estimation; Data set; Distribution density function; Hazard function; Maxwell generalized family; Maxwell–weibull; Moment; Order-statistics; Quantile functions; Survival Function; Weibull; Weibull distribution"
"https://www.scopus.com/inward/record.uri?eid=2-s2.0-85094173528&doi=10.1007%2fs40745-019-00205-8&partnerID=40&md5=d322cb770a0329aeb6e7bcbe18f488cc","Beta distribution; Composition map; Exponentiated distribution; Kumaraswamy distribution; Transmutation map; Weibull distribution","Beta distributions; Composition map; Exponentiated distributions; Generalized Weibull distributions; Kumaraswamy distribution; Real-world; Reliability behavior; Reliability modelling; Reverse order; Transmutation map; Weibull distribution"
"https://www.scopus.com/inward/record.uri?eid=2-s2.0-85094158123&doi=10.1007%2fs40745-020-00295-9&partnerID=40&md5=85dd471789a20ca9ba1fd05de73d5352","Asymmetries; Contagion effect; Dynamic conditional correlation; Long memory","Costs; Economics; Investments; Asymmetric effects; Asymmetry; Contagion effects; Dynamic conditional correlations; Exchange rate volatilities; Exchange rates; Long memory; Relationship between stocks; Stock exchange; Stock price; Financial markets"
"https://www.scopus.com/inward/record.uri?eid=2-s2.0-85094183165&doi=10.1007%2fs40745-019-00224-5&partnerID=40&md5=f65c520739199734d8e7fbd7ca910245","Goodness-of-fit; Likelihood ratio test; Maximum likelihood estimates; Mixture chi-square; Model discrimination","Intelligent systems; Mean square error; Monte Carlo methods; Weibull distribution; Gamma distribution; Gamma-Weibull; Generalized gamma distribution; Goodness of fit; Likelihood ratio tests; Log-normal distribution; Maximum-likelihood estimate; Mixture chi-square; Modeling discrimination; Survival data; Maximum likelihood estimation"
"https://www.scopus.com/inward/record.uri?eid=2-s2.0-85094111031&doi=10.1007%2fs40745-019-00236-1&partnerID=40&md5=e415873f4e1d731b8f9cf37a10af7684","Artificial neural network; Artificial roughness; Learning algorithm; Multi-layer perceptron; Porous bed; Solar air heaters","Air preheaters; Energy utilization; Forecasting; Heating equipment; Soft computing; Solar absorbers; Solar energy; Solar equipment; Solar heating; Absorber plates; Artificial roughness; Energy utilization systems; Experimental examination; Multilayers perceptrons; Performance; Performance prediction; Porous bed; Solar air heater; Solar energy utilization; Multilayer neural networks"
"https://www.scopus.com/inward/record.uri?eid=2-s2.0-85088143992&doi=10.1007%2fs40745-019-00211-w&partnerID=40&md5=f1168bd343d4a83ccc58d55d8df9214e","Asymptotic confidence interval; Cramer–Von Mises estimate; Maximum likelihood estimate; Maximum product spacing estimate; Weighted least squares estimate","Estimation; Inverse problems; Least squares approximations; Mean square error; Stochastic systems; Asymptotic confidence interval; Asymptotics; Confidence interval; Crame–von mise estimate; Least squares estimate; Maximum product spacing estimate; Maximum-likelihood estimate; Von Mises; Weighted least square estimate; Weighted least-squares; Maximum likelihood estimation"
"https://www.scopus.com/inward/record.uri?eid=2-s2.0-85094139100&doi=10.1007%2fs40745-019-00233-4&partnerID=40&md5=1a6f2faca82ead9b86ae54d8957c11b6","Estimations; Exponentiated Kumaraswamy-power function; Moments and moment generating function; Monte Carlo simulation; Order statistics","Distribution functions; Intelligent systems; Parameter estimation; Probability density function; Exponentiated kumaraswamy-power function; Generating functions; Hazard rates; Moment and moment generating function; Monte Carlo's simulation; Order-statistics; Parameters estimation; Power function distribution; Power functions; Probability densities; Monte Carlo methods"
"https://www.scopus.com/inward/record.uri?eid=2-s2.0-85094184538&doi=10.1007%2fs40745-019-00216-5&partnerID=40&md5=70d10a5989cffc72e0008c5274034e91","Characterizations; Generalized quadratic hazard rate distribution; Order statistics; Power series distribution","Distribution functions; Estimation; Hazards; Poisson distribution; Characterization; Class of distributions; EM algorithms; Generalized quadratic hazard rate distribution; Hazard rates; Life-time distribution; Order-statistics; Power series; Power series distribution; Rate distributions; Maximum likelihood estimation"
"https://www.scopus.com/inward/record.uri?eid=2-s2.0-85090794876&doi=10.1007%2fs40745-019-00231-6&partnerID=40&md5=406a9d9753a66363b9a3934c78aa7cd7","Bayesian estimation; DUS-exponential distribution; Entropy; HPD interval; Squared error loss function; Upper record value","Bayesian networks; Errors; Maximum likelihood estimation; Mean square error; Bayesian estimations; Bayesian procedures; Classical schemes; DUS-exponential distribution; Exponential distributions; HPD intervals; Maximum likelihood estimator; Record values; Squared error loss functions; Upper record value; Entropy"
"https://www.scopus.com/inward/record.uri?eid=2-s2.0-85094102798&doi=10.1007%2fs40745-019-00222-7&partnerID=40&md5=2ae4dda1a4bca976e997fc4d3e1e61ef","Gumbel distribution; Hydrology data sets; Kappa distribution; Log-normal distribution; Meijer’s-G function; Return period","Computational complexity; Hazards; Hydrology; Normal distribution; Data set; Exponential distributions; G-functions; Gumbel distribution; Hydrology data; Hydrology data set; Kappa distribution; Log-normal distribution; Meije’s-G function; Return periods; Maximum likelihood estimation"
"https://www.scopus.com/inward/record.uri?eid=2-s2.0-85062706287&doi=10.1007%2fs40745-018-0160-5&partnerID=40&md5=7ab45250d424267bb6d21e16aeca6574","Exponentiated family; Maximum likelihood estimation; Order statistics; Transmuted family; Type-I censoring scheme; Weibull distribution","Estimation; Maximum likelihood estimation; Censored samples; Class of distributions; Distribution estimation; Distribution property; Exponentiated family; Maximum-likelihood estimation; Order-statistics; Transmuted family; Type-I censoring; Type-I censoring scheme; Weibull distribution"
"https://www.scopus.com/inward/record.uri?eid=2-s2.0-85096517073&doi=10.1007%2fs40745-019-00226-3&partnerID=40&md5=1782626d00686ed9fea7ce5334e47398","Censored competing risks data; Maximum likelihood estimation; Step stress partially accelerated life tests; Weibull distribution","Maximum likelihood estimation; Risk perception; Testing; Accelerated life tests; Censored competing risk data; Censored data; Competing failure; Competing risks; Constant stress; Maximum-likelihood estimation; Step stress partially accelerated life test; Step-stress; Type II; Weibull distribution"
"https://www.scopus.com/inward/record.uri?eid=2-s2.0-85094191748&doi=10.1007%2fs40745-019-00194-8&partnerID=40&md5=769285f37398dc4e401ac46fa30dc777","Exponential negative binomial; Generalized family; Weibull distribution","Weibull distribution; Exponential negative binomial; Exponentials; Generalized family; Marshalls; Negative binomial; Negative binomial distribution; Real life datasets; Reliability properties; Statistical properties; Geometry"
"https://www.scopus.com/inward/record.uri?eid=2-s2.0-85094183991&doi=10.1007%2fs40745-020-00264-2&partnerID=40&md5=9947afb059eae6d3517227028ce4851f","Duplicated observations; Least square regression; Repeated data; Weight scheme; Weighted least square","Data patterns; Duplicated observation; Least squares regression; Property; Repeated data; Weight schemes; Weighted least-squares"
"https://www.scopus.com/inward/record.uri?eid=2-s2.0-85123064996&doi=10.1007%2fs40745-021-00364-7&partnerID=40&md5=6d0549b4d78a2382bce367a93bf611ac","Audio encryption; Bifurcation diagram; Chaotic maps; Image encryption; Pseudo-random number generation",""
"https://www.scopus.com/inward/record.uri?eid=2-s2.0-85094106951&doi=10.1007%2fs40745-020-00282-0&partnerID=40&md5=6a753801225fd27eb1c9037791aa7ea3","Applications; Beta distribution; Maximum likelihood estimator; Moments; Simulation study","Parameter estimation; Beta distributions; Exponentiations; Generalisation; Lifetime data; Maximum likelihood estimator; Moment; Power functions; Scalings; Simulation studies; Waiting time; Maximum likelihood estimation"
"https://www.scopus.com/inward/record.uri?eid=2-s2.0-85094211398&doi=10.1007%2fs40745-020-00310-z&partnerID=40&md5=23f37d921bd93166bd1cc33de3e14f6d","Bayes estimators; BCIs; Censoring and Chi square test; Informative prior; Loss functions; MCMC; Posterior risks; Transmuted Pareto distribution; Uniform prior","Bayesian networks; Markov processes; Monte Carlo methods; Pareto principle; Risk assessment; Risk perception; Bayes estimator; BCI; Censoring and chi square test; Chi-square tests; Informative Priors; Loss functions; MCMC; Pareto distributions; Posterior risk; Transmuted pareto distribution; Uniform prior; Statistical tests"
"https://www.scopus.com/inward/record.uri?eid=2-s2.0-85094127850&doi=10.1007%2fs40745-020-00314-9&partnerID=40&md5=ba3dc994acae41e1cbd12d7a18555584","COVID-19; COVID-19 outbreak prediction; Machine learning","Forecasting; Learning algorithms; Machine learning; Coronavirus disease-2019; Coronavirus disease-2019 outbreak prediction; Coronaviruses; Global population; Governing bodies; Machine-learning; New case; Prediction modelling; Well being; Coronavirus"
