"Title","Year","Link","Abstract","Author Keywords","Index Keywords"
"TRANSFORMATIONAL LEADERSHIP AND EMPLOYEE’S CAREER SATISFACTION: ROLE OF PSYCHOLOGICAL EMPOWERMENT, ORGANISATIONAL COMMITMENT, AND EMOTIONAL EXHAUSTION","2023","https://www.scopus.com/inward/record.uri?eid=2-s2.0-85178951261&doi=10.21315%2faamj2023.28.2.8&partnerID=40&md5=2ec0be6eee3dd7cd04b1565ef970f6d5","Transformational leadership is essential for employees’ empowerment as it significantly enhances leadership qualities and increases employees’ satisfaction. Accordingly, the lack of comprehensive exploration and understanding has motivated us to examine the relationship between transformational leadership, psychological empowerment, organisational commitment, career satisfaction, and the moderating role of emotional exhaustion. The objectives of this study are (1) to study the relationship between transformational leadership, psychological empowerment, organisational commitment, and career satisfaction of employees, (2) to evaluate the mediating role of psychological empowerment and organisational commitment in relationship between transformational leadership and career satisfaction, and (3) to evaluate moderating role of emotional exhaustion on relationship between transformational leadership, psychological empowerment, and organisational commitment. Data was collected via cross-sectional structured questionnaires by 513 bank employees. Results indicate that transformational leadership significantly relates to empowerment and organisational commitment of employees but is insignificantly associated with career satisfaction. Moreover, transformational leadership significantly influences employees’ career satisfaction through the mediation of empowerment and commitment. Moderation analyses revealed that higher emotional exhaustion weakens employees’ empowerment and transformational leadership, which further weakens the direct relationship between transformational leadership and psychological empowerment and association between transformational leadership and commitment. This research can assist managers in developing retention strategies for employees to enhance psychological empowerment, organisational commitment, and career satisfaction of employees. © Asian Academy of Management and Penerbit Universiti Sains Malaysia, 2023.","career satisfaction; emotional exhaustion; organisational commitment; psychological empowerment; transformational leadership",""
"A bibliometric review of research on venture capital","2021","https://www.scopus.com/inward/record.uri?eid=2-s2.0-85108661200&doi=10.21315%2faamj2021.26.1.3&partnerID=40&md5=c443151bb0f6ddc8d1e281001085bb25","Venture capital is a cross-cutting discipline and research field. This study used bibliometric indicators of publications indexed in Web of Science (WOS) Core Collection over the last two decades to provide an overview of the main characteristics of its publications. A total of 1,840 papers by 2,607 authors in 518 journals were reviewed. The publications were examined in terms of temporal trend, geographical and institutional distribution, references, authors, and citations. The results indicate that the importance of venture capital research is increasing. In terms of impact, a small group of productive countries (e.g., USA and UK) and authors (e.g., Cumming and Wright) contributed to a significant share of these publications. Whereas China is expected to attract more attention to this topic in the future. Harvard University is the most productive institution and the Journal of Business Venturing is the most active journal. By topic, publications that address the contribution of venture capital to entrepreneurship are the most cited. New areas of research have focused especially on the implication of signal theory in venture capital networks, support for decision-makers and crowdfunding as a new investment strategy. Today, the micro-level is the dominant level (compared to the macro-level) in venture capital research. The results of this study aim to contribute to supporting decision making in a venture capital research management context and to serve as a guide for future researchers or evaluators. © Asian Academy of Management and Penerbit Universiti Sains Malaysia, 2021.","Bibliometric analysis; Citation analysis; Research cooperation; Venture capital",""
"INVESTOR BEHAVIOUR AND INVESTMENT DECISIONS: EVIDENCE FROM PAKISTAN STOCK EXCHANGE","2023","https://www.scopus.com/inward/record.uri?eid=2-s2.0-85152393022&doi=10.21315%2faamj2023.28.2.1&partnerID=40&md5=be043926b723b9e9245768702a22b617","This research aims to understand the influence of behavioural factors on investment decisions in the Pakistan Stock Exchange (PSX). This study gathered primary data using a survey-based questionnaire from 318 individual investors. The issue being investigated in this study is how behavioural elements, such as sentiment, overconfidence, over-and under-reaction, and perceived market efficiency, affect investment choices made on the PSX, with a particular emphasis on the limited predictive power of herd behaviour. The sample data were analysed using partial least square-structural equation modelling (PLS-SEM) based approach. Results indicate that financial knowledge, sentiment, overconfidence, over-and under-reaction, and perceived market efficiency significantly affect the investment decision. Interestingly, herd behaviour does not play a significant role in predicting investment decisions. However, we are certain that this study will provide a better understanding of the relationship between behavioural factors and an investor’s investment decision in Pakistan. © Asian Academy of Management and Penerbit Universiti Sains Malaysia, 2023.","financial knowledge; investment decision; Pakistan; perceived market efficiency; sentiment",""
"What makes millennials happy in their workplace?","2020","https://www.scopus.com/inward/record.uri?eid=2-s2.0-85088514822&doi=10.21315%2fAAMJ2020.25.1.6&partnerID=40&md5=56355a31f8d250f588e5beba98e266f3","Happiness in the workplace remains to be an under-researched field which is unfortunate considering that the happiness-productive worker link has been strongly established. More essentially, there has been a lack of research on happiness in the workplace which considers a specific sample of millennials. In preparation for a workforce dominated with millennials, this research will help address the gap with regards to the lack of research on Malaysian millennials’ happiness in the workplace. Through a thorough literature review, six predictors or antecedents of happiness in the workplace among millennials which are meaningful work, work autonomy, transformational leadership, workplace friendship, work life balance, and gratitude have been chosen in this research. This study consists of millennials (“millennials” or Generation Y is defined in the selected literature as individuals born between years 1982 and 2004) who have undergone full time employment of at least one year or more. The results indicated that all the six predictors showed significant moderate to high positive relationships with happiness in the workplace. Multiple regression analysis showed that all six predictors significantly predicts millennials’ happiness in the workplace, besides gratitude. Implications of this study with regards to managing millennial talent in organisations are then discussed. © Asian Academy of Management and Penerbit Universiti Sains Malaysia, 2020.","Millennials; Well-being; Work-life balance; Workforce; Workplace happiness",""
"THE EFFECTS OF ECONOMIC POLICY UNCERTAINTY AND LARGE INVESTMENT PROJECT ON LEVERAGE","2023","https://www.scopus.com/inward/record.uri?eid=2-s2.0-85178889871&doi=10.21315%2faamj2023.28.2.12&partnerID=40&md5=90ba8fa97bf19efc09ff055cbd00b4b7","The dominant view on firms’ financial leverage suggests a stable, long-term leverage ratio, while previous studies recognise that factors like macroeconomic fluctuations and unanticipated financing needs can cause deviations from this target leverage. This study seeks to explore the joint effect of economic policy uncertainty (EPU) and large long-term investments on firms’ leverage decisions, specifically focusing on how these factors influence target leverage dynamics and financial flexibility. This study uses 2,865 listed firms in NYSE, NASDAQ, and AMEX from 1990 to 2019. The data is analysed through fixed effect panel regression model. The results show that EPU negatively affects firms’ leverage, which are reduced through joint effects with large investment for five years. This study also demonstrates firms’ financial flexibility motive to protect the debt capacity of large investments and enhance their capabilities. © Asian Academy of Management and Penerbit Universiti Sains Malaysia, 2023.","economic policy uncertainty; financial flexibility; firm leverage ratio; large investments projects; target leverage",""
"THE EFFECT OF INFORMATION DISCLOSURE ON DONOR COMMITMENT: THE CASE OF WAQF INSTITUTION","2023","https://www.scopus.com/inward/record.uri?eid=2-s2.0-85164451017&doi=10.21315%2faamj2023.28.1.1&partnerID=40&md5=8019a9f92ca89ac474d69ba1a599b3bf","This is an extension of an earlier study that examined the relationship between information disclosure on donor commitment related to waqf institution. Data was obtained from a sample of 558 individuals in Malaysia who are a repeating cash donor to waqf. Partial least squares-structural equation modelling (PLS-SEM) test using SmartPLS was used for data analysis. The findings indicated that future information disclosure and waqif (the person who gives waqf) significantly influenced the latter’s commitment. Additionally, the waqf, or trust in English, plays a role as a mediator between future information disclosure and governance information disclosure to the waqif’s commitment. This theoretical contribution has a practical implication as well in that, it indicates to the waqf or trust to disclose their report to donors to ensure sustainable collection. © Asian Academy of Management and Penerbit Universiti Sains Malaysia, 2023.","cash; commitment; disclosure; donor; waqf",""
"UNVEILING THE LINKAGES BETWEEN EMERGING STOCK MARKET INDICES AND CRYPTOCURRENCIES","2022","https://www.scopus.com/inward/record.uri?eid=2-s2.0-85143514156&doi=10.21315%2faamj2022.27.2.9&partnerID=40&md5=a5110d18ced56d83a08cc213a5c4709f","This paper investigated the relationship between cryptocurrencies and emerging stock market indices using fractional integration and co-integration technique. Particularly, fractional integration is applied to examine stochastic properties of individual assets and fractional cointegration to analyse bivariate connectedness. Our findings unveil the absence of mean reversion in majority cases which indicates high persistence in series. Furthermore, bivariate analysis reveals disconnection between cryptocurrencies prices and stock indices. Surprisingly, a different picture emerges on using conditional volatility instead of prices. Like, conditional volatility-based estimation uncovers evidence of mean reversion in univariate analysis as expected. There is some evidence of cointegration on volatility grounds between cryptocurrencies and emerging stock market indices. Our findings implies that investment decision regarding digital currencies should be taken cautiously. As cryptocurrencies are extremely volatile with high degree of persistence which can make them counterproductive. © Asian Academy of Management and Penerbit Universiti Sains Malaysia, 2022.","autoregressive fractionally integrated moving average; cryptocurrencies; emerging market indices; generalised autoregressive conditional heteroskedasticity; price uncertainty",""
"THE EFFECT OF CORPORATE SOCIAL RESPONSIBILITY AND BOARD GENDER DIVERSITY ON BANKRUPTCY: EVIDENCE FROM KOREA","2021","https://www.scopus.com/inward/record.uri?eid=2-s2.0-85124330838&doi=10.21315%2faamj2021.26.2.3&partnerID=40&md5=7279b3d6c945cab743ccdce0df35c856","This study investigates whether corporate social responsibility (CSR) activities and board gender diversity affect bankruptcy. The core issue focuses on the moderating effect between CSR activities and board gender diversity on bankruptcy. Using 4,654 firm-year observations from a sample of 581 non-financial firms listed on the Korean Stock Exchange over the period 2009–2017, we employ the fixed effect estimation and two-way fixed effect estimation of panel analysis to control endogenous. We find firms engaging more in CSR activities reduce the level of bankruptcy, but board gender diversity does not reduce the level of bankruptcy due to tiny portion of female director in the boardroom. The moderating effect on the relationship between CSR activities and board gender diversity reduce the level of bankruptcy. This result indicates that the influence of female directors on the boards of Korean listed firms is not yet strong but board gender diversity with good CSR activities positively operate to reduce the level of bankruptcy. © Asian Academy of Management and Penerbit Universiti Sains Malaysia, 2021.","Bankruptcy; Board gender diversity; Corporate social responsibility; Female director; Korea",""
"SHAREHOLDERS’ MONITORING AND ONLINE DISCLOSURES OF MINUTES OF SHAREHOLDERS’ MEETING","2024","https://www.scopus.com/inward/record.uri?eid=2-s2.0-85194259528&doi=10.21315%2faamj2024.29.1.9&partnerID=40&md5=6a9e7921dd7e1cfb176d15ea4bb21e7d","Making detailed annual general meeting (AGM) minutes available online allows absentee investors to understand the discussion that took place during the AGM, and other interested parties to gauge the intensity of investor activism and stakeholder engagement from the questions posed. This paper investigated the effects of shareholders’ monitoring through the Minority Shareholders Watch Group (MSWG), the Employees Provident Fund (EPF), and other government-linked institutions on corporate communication via minutes of shareholders’ meeting. This study also incorporated firm size, audit quality, profitability, and grey directors as control variables. Based on a sample of 261 listed firms with financial year ended 31 December 2016 who held their AGMs in 2017, the findings showed that shareholders’ monitoring through the MSWG, EPF, and other government-linked institutions were significant and positively associated with corporate transparency. This implies that minority and institutional shareholders’ activism can be the advocate in pushing for dissemination of online corporate disclosure to enhance the information environment, in align with agency theory. © Asian Academy of Management and Penerbit Universiti Sains Malaysia, 2024.","corporate websites; disclosure choice; gatekeeper; shareholder activism; voluntary disclosure",""
"The influence of brand orientation and knowledge creation on organisational performance of malaysian tourist resorts","2019","https://www.scopus.com/inward/record.uri?eid=2-s2.0-85069891695&doi=10.21315%2faamj2019.24.1.8&partnerID=40&md5=769194e93ba976c660323c7eb1ba82ea","The purpose of this paper is to examine the effects of brand orientation and knowledge creation process on the organisational performance of tourist resorts from the perspective of tourism entrepreneurs. Despite a plethora of branding and knowledge management literature, a limited number of studies have investigated the effects of brand orientation and knowledge creation process together on organisational performance. The studied tourism entrepreneurs exhibit low involvement in branding activities and knowledge creation according to government of Malaysia sources. The significance of brand orientation and knowledge creation process for improving the organisational performance of tourist resorts remains inconclusive. For this study, empirical data was drawn from 322 tourist resorts in Malaysia. The hypothesised relationships are analysed using structural equation modelling (SEM). The results show that brand orientation and knowledge creation process have a positive and significant effect on organisational performance whereas knowledge creation process partially mediates brand orientation and organisational performance. We propose higher involvement of tourism entrepreneurs in knowledge sharing sessions to develop distinctive brands to attract customers, which will in turn improve organisational performance. The top-down management approach in instituting branding activities remains pervasive in tourist resorts in Malaysia’s high-power distance society. © Asian Academy of Management and Penerbit Universiti Sains Malaysia, 2019.","Brand orientation; Entrepreneur; Knowledge creation process; Organisational performance; Tourism",""
"EARNINGS MANAGEMENT AND NEW LISTINGS: EVIDENCE FROM VIETNAM","2021","https://www.scopus.com/inward/record.uri?eid=2-s2.0-85124266299&doi=10.21315%2faamj2021.26.2.2&partnerID=40&md5=a7997d26f9f399f67937b61ec75c5148","Earnings management around corporate events has been widely discussed in literature review which has shown mixed results. Furthermore, prior studies have extensively focused on earnings management around initial public offerings (IPOs) and seasoned equity offerings (SEOs), while less attention has been given to the listing event. Another motivation comes from the context of the undeveloped market. While earnings management has been widely discussed in developed countries, it is still limited in emerging countries in general and in Vietnam in particular, due to the lack of research on this phenomenon and the unique institutional feature and pre-listing profit requirement in Vietnam’s stock market. This research is conducted to investigate the earnings management behaviour around listing event in Vietnam. The sample of this study consists of financial data from 189 newly listed companies on the Ho Chi Minh City Stock Exchange (HOSE) for the period of 2009–2017. Four cross-sectional models were used to estimate earnings management, including two total accruals-based models and two current accruals-based models. This research makes important contributions to the body of literature on Vietnam’s stock market. First, this study provides empirical evidence suggesting a greater positive earnings management practice of newly listed firms in current accrual models than those in total accrual models. Second, the results from both parametric and non-parametric test statistics show that HOSE-listed firms present higher levels of earnings management in the year prior to the listing than those in post-listing year and two subsequent years after listing. Finally, new listing requirements in 2012 require the company’s return on equity (ROE) in the most recent year to be at least 5%. However, the paper finds no evidence to suggest that relative to all newly listed firms after the new profit requirement exhibit greater positive earnings management than that of firms listed before the change in pre-listing year. © Asian Academy of Management and Penerbit Universiti Sains Malaysia, 2021.","Accounting accruals; Earnings management; Ho Chi Minh City Stock Exchange; Listing requirements; New listings",""
"The effects of psychic distance and inter-partner fit on the performance of international joint ventures","2019","https://www.scopus.com/inward/record.uri?eid=2-s2.0-85068672319&doi=10.21315%2faamj2019.24.1.7&partnerID=40&md5=b0d55524780c810fb1fbeef37fe46057","The impact of psychic distance stimuli and inter-partner fit on the performance of international joint ventures (IJVs) has not been adequately explored in the case of emerging economies. Another lacuna in literature is the analysis of the performance of IJVs in regard to the new normal business landscape. This study analyses the impact of psychic distances stimuli and inter-partner fit on the performance of IJVs in the context of new normal business landscape. The secondary data of 122 IJVs headquartered in India with G7 nations is empirically tested. The study indicates that out of all psychic distances, administrative and economic distances significantly affect the performance of IJVs. © Asian Academy of Management and Penerbit Universiti Sains Malaysia, 2019.","Inter-partner fit; International joint ventures; New normal; Performance; Psychic distance stimuli",""
"The influence of social media marketing on apparel brands’ customers’ satisfaction: The mediation of perceived value","2020","https://www.scopus.com/inward/record.uri?eid=2-s2.0-85098092640&doi=10.21315%2faamj2020.25.2.7&partnerID=40&md5=de977132583c9e9e4732237ccddc6d83","The development of social media has changed traditional media by providing a platform to conduct marketing and advertising activities. Nowadays, social media offers the opportunity to build a relationship between customers and brands. The strategic use of social media marketing has significant importance for customers as well as for marketers. In this paper, the influence of social media marketing activities (SMMAs) is assessed on apparel brands’ perceived value and Chinese customers’ satisfaction. The data was collected through a quantitative survey-based approach from Chinese social media and apparel brands’ users (n = 355). The collected data from respondents were analysed through the confirmatory factor analysis (CFA) and Hayes PROCESS macro. Based on our findings, it is noted that SMMAs play an essential role in improving the brand perceived value and customers’ satisfaction in China. Moreover, it is also concluded that the apparel brand’s perceived value significantly mediates the relationship between SMMAs and customers’ satisfaction. This study provides several theoretical and practical guidelines to the marketers in China to effectively implement their advertising activities on social media platforms. © Asian Academy of Management and Penerbit Universiti Sains Malaysia, 2020.","Apparel brands; Customers’ satisfaction; Social media; Social media marketing perceived value; Social media strategic use",""
"THE ROLE OF FUND MANAGERS IN DIVERSIFYING ENDOWMENT INVESTMENT PORTFOLIOS OF MALAYSIAN PUBLIC UNIVERSITIES","2023","https://www.scopus.com/inward/record.uri?eid=2-s2.0-85164411991&doi=10.21315%2faamj2023.28.1.3&partnerID=40&md5=ef20e386dd04100c32765f5bbd7b8b20","Endowment is one of the most important sources of income globally for higher education institutions, and it should be invested for permanent use. Unfortunately, such funds are not optimally managed in Malaysia’s public universities. Therefore, this study was conducted to find ways to manage funds effectively among universities with the highest recorded collection of endowment funds. The participating universities in the study were: Universiti Malaya, Universiti Kebangsaan Malaysia, and Universiti Teknologi Malaysia. Interviews were conducted with representatives from their financial divisions. This study found that endowment funds in Malaysian public universities can be better invested with the appointment of dedicated fund managers. Their role is to assess the assets in which to invest with their expert knowledge to enhance the investmentportfolio of endowment funds. © Asian Academy of Management and Penerbit Universiti Sains Malaysia, 2023.","endowment investment; fund managers; Malaysia; public universities",""
"Evidence for mediating role of affective commitment on green human resource management and organisational citizenship behaviour","2021","https://www.scopus.com/inward/record.uri?eid=2-s2.0-85108652954&doi=10.21315%2faamj2021.26.1.5&partnerID=40&md5=af6a02521fc5a8f6bbb29d6bf2b9d4fe","Exploring management fields in terms of green policies is essential to create a footprint on today’s global corporate world; it is very important for all staff, employers, stakeholders, and other customers. This work attempts to study the relationship between the management of green human resources and the actions of organisational citizenship with the mediating role of affective commitment. The analysis relied on the emerging theory of ability-motivation-opportunity (AMO) to use all the green human resource management (GHRM) attributes. Well renowned secondary school of Kathmandu Valley staff participated in the data collection. Three hundred and fifty fully-filled questionnaires were returned through a self-structured sampling tool. Staff having academic qualifications of at least graduate degrees were preferred for better understanding and effective data quality. A widely used PLS-SEM method was applied to analyse small sample-sized studies and ensures the normal distribution of data. The research highlights the GHRM method and its effect on the engagement of workers to their actions in the organisation. In addition, concerning GHRM and organisational citizenship behaviour (OCB), affective commitment (AC) has formed a mediating role. Only secondary schools are included in the study; the outcome is a fruitful review of the effects of GHRM implementation in the education sector. Numerous studies have reconnoitered various variables to link the GHRM with the organisational studies. The complementary partial mediation effect of AC to OCB is an attempt of showing novelty in the field of education sector in the study. The study suggests a globalised study regarding GHRM for future endeavours. © Asian Academy of Management and Penerbit Universiti Sains Malaysia, 2021.","Affective commitment; Education sector; Green human resource management; Organisational citizenship behaviour; PLS-SEM",""
