"Title","Year","Link","Abstract","Author Keywords","Index Keywords"
"Investigating the nexus between personality traits and Islamic work ethics","2017","https://www.scopus.com/inward/record.uri?eid=2-s2.0-85021346495&doi=10.21315%2faamj2017.22.1.8&partnerID=40&md5=ae0c5bde123242f329d1553ec68b480d","This study examines the nexus between personality traits and Islamic work ethics (IWE) among employees in Malaysia. The data were drawn from 182 participants who completed a 36-item personality traits questionnaire and the short version of the 17-item IWE questionnaire. Data were analysed using Smart PLS version 3.2. Instead of using IWE as one composite factor which was normally done in most previous studies when researching on IWE, the present study has factor analysed the IWE and the result has generated three dimensions of IWE. The three dimensions were used as IWE's factors to test the relationships with the personality traits. The findings of the study revealed that the personality traits of openness-to-experience is a positive significant predictor of effort and competition dimensions of IWE, agreeableness is a significant positive predictor of effort dimension, while emotional instability is a negative predictor of effort dimension of IWE. The practical implication is for managers to use the finding of this study when hiring employees for jobs that require high ethical effort, competitiveness, and socially responsible work practices in their organisations. Another implication of the study is for organisations to consider some adjustments in interpreting the results when measuring the personality traits of the Muslim employees using current personality traits as developed in the West because Muslims interpret personality traits differently from the non-Muslim context. © Asian Academy of Management and Penerbit Universiti Sains Malaysia, 2017.","Agreeableness; Conscientiousness; Emotional instability; Extraversion; Islamic work ethics; Neuroticism; Openness-to-experience; Personality traits",""
"A model for consumer trust in E-commerce","2019","https://www.scopus.com/inward/record.uri?eid=2-s2.0-85074468603&doi=10.21315%2faamj2019.24.s2.7&partnerID=40&md5=c85ce715565144818c3c6af66f11d555","E-commerce has grown rapidly over the past decade and has become a significant trend. One of the major concerns for the successful proliferation of e-commerce is the issue of consumers’ trust in Internet vendors. This study examines the antecedents of trust in e-commerce among Malaysian online consumers. Data was collected from 300 respondents who had recently made online purchases. Structural equation modelling-partial least squares (SEM-PLS) was used to analyse the data, and our findings reveal that brand recognition, service quality, security, and word-of-mouth (WOM) lead to higher levels of consumer trust, whereas customer satisfaction has an insignificant relation to consumer trust. This study enables online vendors or e-commerce business owners to understand consumer demand and satisfy their needs. Strategies need to be set right too to attract more consumers in purchasing online. © Asian Academy of Management and Penerbit Universiti Sains Malaysia, 2019.","E-commerce; Loyalty; Purchase intention; Trust; Word of mouth",""
"Impact of Guanxi on managerial satisfaction and commitment in China","2018","https://www.scopus.com/inward/record.uri?eid=2-s2.0-85051515144&doi=10.21315%2faamj2018.23.1.8&partnerID=40&md5=72cda9bfc23a845494f8921137e186f7","This study assesses the role of guanxi (relationship) in organisational commitment and job satisfaction among mid-level managers in China today. Based on a large survey sample, we quantitatively identify three components of guanxi by adopting the principal component analysis (PCA), and then apply the multivariate regressions to examine the impact of guanxi. Our research unveils how guanxi dimensions, a type of social connection with features of Chinese culture, exert unique and practical impacts on the work environment. Consistent with the literature, organisational guanxi is confirmed to enhance job satisfaction and affective commitment, while personal guanxi is found to undermine job satisfaction and affective commitment. On the other hand, organisational guanxi tends to reduce continuance or normative commitment while personal guanxi improves both. These findings contribute to the literature with evidence highlighting the importance of guanxi in human resources management and also shed new light to the heterogeneity of such influence across geographical locations, demographic variation, and forms of organisation. Overall, this research suggests that the ability to navigate different dimensions of guanxi is a necessary skill for the managers in Chinese business. © Asian Academy of Management and Penerbit Universiti Sains Malaysia, 2018.","Business culture; Guanxi; Job satisfaction; Managerial practice; Organisational commitment",""
"Using analytic hierarchy process to develop hierarchy structural model of consumer decision making in digital market","2016","https://www.scopus.com/inward/record.uri?eid=2-s2.0-84978655767&partnerID=40&md5=167e1fc2829456842b00d87c6b8d3e19","In today's electronic era, e-commerce market is a very fast growing market. With the proliferation of the internet and web applications, customers are increasingly interfacing and interacting with web-based applications. They are shifting themselves offline to online which is creating challenging environment for the service providers to meet them according to their customise needs. It is, therefore, not only to find out the important but also to prioritise the factors which influence customer to online purchasing. The main purpose of this study is to develop a Hierarchy Structural Model (HSM) of consumer decision making in the digital marketplace. To achieve the objective of the study, criteria and their sub-criteria are determined through an extensive literature review and a structured questionnaire is prepared to data from experts through a personal interview on the scale of 1 to 9. Analytic Hierarchy Process (AHP), a multi-criteria decision making mathematical tool has been applied for analysis of the importance of each criteria and to develop a hierarchy of criteria for importance. As per weight estimated through HSM modal, the criteria ""information and e-service quality"" is the most important one followed by the criteria ""online reputation"" and ""incentives and post-purchase"" in online purchasing. Online service providers should focus on these essential criteria to enhance their e-service quality, satisfaction and retention consumer and their online reputation. © Asian Academy of Management and Penerbit Universiti Sains Malaysia 2016.","Analytical hierarchy process (AHP); Customise; e-service quality; Hierarchy structural model (HSM); Incentives and post-purchase; Information; Online reputation",""
"A model for turnover intention: Banking industry in Malaysia","2019","https://www.scopus.com/inward/record.uri?eid=2-s2.0-85074483279&doi=10.21315%2faamj2019.24.s2.6&partnerID=40&md5=2ba349e2cf82364d5f1f50e9c295d8be","The issue of staff’s intention to leave is a huge concern for senior management and human resource managers. It is one of the costliest and most challenging issues within any organisation worldwide. The banking industry records the highest turnover rate in Malaysia. High employee turnover has a profound influence on the banks’ performance and productivity. The primary purpose of this research is to explore the real causes of turnover intention in the banking industry in Malaysia. The result from a total of 395 respondents showed that working environment, job enrichment, and job stress could significantly affect job satisfaction; whereas job stress and job satisfaction will substantially affect turnover intention. The results also found that working environment and job stress have an indirect effect on turnover intention. © Asian Academy of Management and Penerbit Universiti Sains Malaysia, 2019.","Banking industry; Job enrichment; Job satisfaction; Job stress; Turnover intention",""
"Microfinance governance: A multi-theoretical approach for ascertaining the wider stakeholder influencing forces","2019","https://www.scopus.com/inward/record.uri?eid=2-s2.0-85067383121&doi=10.21315%2fAAMJ2019.24.S1.14&partnerID=40&md5=db0518a439e1d208e83f241f85276bd8","Scholars argue that the agency theory has some limitations as the sustaining theory of governance. It is its inability to distinguish the wider stakeholder influencing forces effecting on organisations. This paper delivers a concise picture incorporating other management-based theories to supplement agency theory in distinguishing the wider stakeholder influencing forces as well as the consequential extended governance standard it creates. Yet, for developing the theory building approach it has reviewed and critically examined the existing literatures. Furthermore, a circumstance is built to assimilate four existing theories that supplement each other to distinguish the wider stakeholder influencing forces. Finally, further studies have been recommended to certify the approach with wide-ranging real life institutional settings. © Asian Academy of Management and Penerbit Universiti Sains Malaysia, 2019.","Agency theory; Microfinance governance; Resource dependence theory; Stakeholdetheory; Stewardship theory",""
"The formalisation of social engagement in the medical relief NGO: The evidence of mercy Malaysia","2016","https://www.scopus.com/inward/record.uri?eid=2-s2.0-85008240248&doi=10.21315%2faamj2016.21.supp.1.7&partnerID=40&md5=6faccd10c4aab71d1575bf846b6e36c3","Social engagement involves the participation of a group people in undertaking collective activities in social community. The paper aims to examine the formalisation of NGO social engagement to their stakeholders. The MERCY's social engagement is not only focusing on the traditional forms of reports i.e. social reports to the stakeholders but includes the forms of actions including conversation, behavioural explanations and reasonable conduct through negotiation of performance and impact among stakeholders. The social engagement paradigm emphasises on the rights and contracts between two parties (i.e. Accountor and Accountee). The qualitative research is employed by undertaking empirical case study research for MERCY, an international disaster relief NGO that highlight an understanding of social engagement through the power of negotiation. The data are gathered through indepth series of interviews and documentary reviews, which was analysed through thematic analysis. The findings revelas the social ""closeness"" within the community can be seen from the moral values imperatives that had driven by the trustworthiness and willingness of the people in the community to engage in the volunteering work. © Asian Academy of Management and Penerbit Universiti Sains Malaysia, 2016.","Medical relief; Social contract; Social disclosure; Social engagement",""
"Adaptive selling behaviour: A study among salesperson in pharmaceutical industry","2018","https://www.scopus.com/inward/record.uri?eid=2-s2.0-85051516509&doi=10.21315%2faamj2018.23.1.1&partnerID=40&md5=c1438fdba91899fb3fde475827e9e9f5","Sales management of today is facing challenging issues of sales force management in order to achieve the desired firm’s business performance. A firm’s business performance is closely associated to how effective the sales force is in performing their selling tasks. As salespersons need to face different customers and engage in different sales situations, salespersons must be flexible and be able to adapt their selling styles in all different situations. Salespersons’ behaviour in adapting their selling approaches is known as adaptive selling behaviour. The ability of salespersons in performing their selling tasks hinges on their capability in practicing adaptive selling behaviour during and across the sales interactions with customers. This study focuses on the managerial practices of control and empowerment, and examines their simultaneous influence on salesperson’s adaptive selling behaviour. This study was conducted on a sample of pharmaceutical salespersons in Malaysia, whose customers are healthcare professionals. Nine pharmaceutical firms participated in the survey with a total of 154 responses received. Results revealed that control practice of activity control and empowerment practices of promoting participation in decision-making, expressing confidence, and providing autonomy had significant relationships with salesperson’s practice of adaptive selling behaviour. Implications, limitations of the research, and improvements for future studies were discussed. © Asian Academy of Management and Penerbit Universiti Sains Malaysia, 2018.","Adaptive selling behaviour; Control; Empowerment; Salesperson; Social exchange theory",""
"Investigating the relationship between corporate citizenship culture and organisational performance in the Malaysian context","2014","https://www.scopus.com/inward/record.uri?eid=2-s2.0-84907210801&partnerID=40&md5=b70babb75687c8fd7618529a2c4ebbf5","Contemporary organisations are required to be responsible to their shareholders, customers, employees, communities and ecology in all aspects of their operations in order to gain a competitive advantage. An organisation's obligations toward society, known as corporate citizenship, are economic, legal, ethical, and discretionary. Corporate citizenship reflects one view of social responsibility that relates to the social responsibilities of organisations toward their stakeholders. Thus, this study examines the relationship between corporate citizenship culture and organisational performance. Overall, 261 respondents from a total population of 1379 were used in analysing the data. The units of analysis of this study are publicly listed companies in Malaysia. The findings suggest that all elements of corporate citizenship culture are significantly related to organisational performance, especially ethical citizenship. The results support theoretical predictions and reveal interesting findings that can help organisations to better understand how their performance affects society's perceptions of them and help change organisational behaviour to meet public expectations. © Asian Academy of Management and Penerbit Universiti Sains Malaysia, 2014. All rights reserved.","Corporate citizenship culture; Corporate social responsibility; Organisational performance; Stakeholder theory",""
"Strategic motivations of australian and New Zealand manufacturing foreign direct investments in international markets","2011","https://www.scopus.com/inward/record.uri?eid=2-s2.0-84858434461&partnerID=40&md5=15ecafbcc8c811e62588c089cd8d90c0","We empirically investigate how different location-specific variables and strategic motives influenced Australian and New Zealand (ANZ) firms' ownership strategy choices in foreign markets between 1998 and 2008. This study is the first to analyse how strategic motives and ownership-specific, location-specific, and internalisation variables have influenced the ownership structure choices of ANZ firms in foreign markets. The results indicate that large market potential and low levels of cultural distance increase the probability that ANZ manufacturing firms will undertake wholly owned subsidiary (WOS) ownership structures and market-seeking (MS) and/or efficiency-seeking (ES) foreign direct investment (FDI). Low exchange rate fluctuation increases the probability that ANZ manufacturing firms will undertake WOS-type risk reduction-seeking (RRS) FDI. © Asian Academy of Management and Penerbit Universiti Sains Malaysia, 2011.","Australia; Foreign direct investment (FDI); Joint ventures (JV); New Zealand; Ownership strategies; Wholly-owned subsidiary (WOS)",""
"Family business succession planning: Unleashing the key factors of business performance","2015","https://www.scopus.com/inward/record.uri?eid=2-s2.0-84948756212&partnerID=40&md5=3f20b343bc55e91a175e258a4eb50e3a","Family business studies are becoming more pervasive in Malaysia, and several studies have focused on factors that shape family-owned business performance levels. Succession planning issues, and specifically the succession issues and experiences of second or third generation family business owners (2GO/3GO), have not yet been explored at length. This study aims to revisit various factors that shape family firm performance by examining succession issues and transition experiences encountered by successors. Data were drawn from self-administered surveys completed by 55 2GOs and 3GOs. Descriptive, correlation and regression analyses were conducted to interpret our findings. The findings show that management styles, relationships between family members, values and beliefs and successor training significantly influence family business performance levels. The relationship between antecedents and business performance is found to be partly mediated by succession issues and fully mediated by sucession experience. Both theoretical and practical implications and avenues for future research are discussed © Asian Academy of Management and Penerbit Universiti Sains Malaysia, 2015.","Business performance; Family-owned firms; Succession",""
"Risk management in research and development (R&D) projects: The case of South Australia","2014","https://www.scopus.com/inward/record.uri?eid=2-s2.0-84921743850&partnerID=40&md5=1a6246df2ecc031cd6de1b0d8f1ae60c","A definition of the effective methods of risk management in R&D projects has remained elusive. Similarly, there have been calls to devise effective risk management methods in R&D projects. To develop this area further, the purpose of this study is twofold. First, it validates the veracity of claims about the urgency of introducing effective methods of risk management to R&D projects in South Australia based on nine unstructured interviews with experts. Second, the study presents the outcomes of two case studies that deployed the extended version of the failure mode and effect analysis, namely, the RFMEA method in a South Australian organisation, to investigate how the method can facilitate the identification of effective contingency plans to mitigate high-priority risks. The findings showed that the RFMEA method would be effective for project managers in dealing with risk management issues in R&D projects. The discussions presented will provide guidelines for practitioners in the industry. © Asian Academy of Management and Penerbit Universiti Sains Malaysia, 2014.","FMEA; Project; Research and development; RFMEA; Risk management; South Australia",""
"Investigating the dimensionality of organisational citizenship behaviour from Islamic perspective (OCBIP): Empirical analysis of business organisations in southeast Asia","2014","https://www.scopus.com/inward/record.uri?eid=2-s2.0-84907200086&partnerID=40&md5=a068064fb262ed72d87e5844c4e63bdc","Although Organisational Citizenship Behaviour (OCB) emanating from the Western value system has received enormous attention by researchers, OCB from the Islamic perspective (OCBIP) has not been much explored. This empirical study attempts to enrich the understanding of the OCB phenomenon from Islamic management perspective. A survey of 405 Muslim employees in business organisations in Malaysia was drawn for the study. The construct validity of OCBIP via Chartered Financial Analyst (CFA) led to the major finding; the OCBIP measurement model in the business organisational context is explained by four components; Altruism, Civic virtue, Advocating high moral standards and Removal of harm.  © Asian Academy of Management and Penerbit Universiti Sains Malaysia, 2014. All rights reserved.","Advocating high moral standards; Altruism; Civic virtue; Organisational citizenship behaviour from Islamic perspective (OCBIP); Removal of harm",""
"Do generational membership and psychographic characteristics influence positive word of mouth in a university context?","2012","https://www.scopus.com/inward/record.uri?eid=2-s2.0-84862186178&partnerID=40&md5=48125ff88bba65e98b4abc249ff7e568","The specific question that this paper seeks to answer is: do psychographic culturally-anchored values act as antecedents to positive word of mouth intention independently of an individual's generational (Generation Y rather than Generation X) membership? This question has important implications for service-based industries like universities. Results suggest that positive word of mouth intention is influenced by psychographic characteristics. Generation Y's positive word of mouth antecedents were: high collectivism, high uncertainty avoidance, and high power distance. Generation X's had only one antecedent, high collectivism. This paper concludes by outlining the areas for future research of Generation Y and the implication of this research for university leaders tasked with enhancing positive word of mouth in current students and alumni. © Asian Academy of Management and Penerbit Universiti Sains Malaysia, 2012.","Culturally-anchored values; Generation X; Generation Y; Higher education service provision; Positive word of mouth",""
"Job satisfaction and organisational citizenship behaviour: An empirical study at higher learning institutions","2011","https://www.scopus.com/inward/record.uri?eid=2-s2.0-84858377021&partnerID=40&md5=7a24c5c990f87067014420427eb425c7","This study is designed to measure the two dimensions of organisational citizenship behaviour (i.e., OCBI and OCBO) and to examine how these organisational citizenship behaviours are related to the two facets of job satisfaction (intrinsic and extrinsic). To achieve the research objectives, the survey method is employed. Findings of this study reveal that both extrinsic and intrinsic job satisfaction are very important in predicting citizenship behaviour. Implications and limitations of the study are discussed along with suggestions for future research. © Asian Academy of Management and Penerbit Universiti Sains Malaysia, 2011.","Higher education institutions; Job satisfaction; Malaysia; Organisational citizenship behaviour",""
"A study on the determinants of business stability in credit card firms: Evidence from Korea","2014","https://www.scopus.com/inward/record.uri?eid=2-s2.0-84921822567&partnerID=40&md5=fc0d636518b64fc1fada12c2d8e2a994","This study empirically analyses several factors that affect financial stability such as the profitability of Korean credit card firms, capital adequacy, loan soundness, and liquidity. In particular, internal and external factors found in previous studies were applied to the analysis in order to investigate whether or not those factors had a significant effect on the business stability of Korean credit card firms. The major research findings are as follows. First, the determinant factors for profitability were found to be the degree of enlargement, foreign credibility, and the level of risk management. Second, the determinant factors for capital adequacy were found to be the degree of enlargement, diversification, foreign credibility, the level of management, and the interest rate. Third, the determinant factors for loan soundness were found to be the degree of enlargement and foreign credibility. Lastly, the determinant factors for liquidity were found to be the degree of diversification, foreign credibility, the level of risk management, the degree of competition, economic conditions, and the interest rate. In conclusion, with the recent reduction in the card affiliates' fees, the leverage regulation, and the credit card debt suppression policy, financial authorities will likely refer to this study as they carefully examine the various influences on the business stability of domestic credit card firms and come up with relevant countermeasures for the continuous growth of those firms. © Asian Academy of Management and Penerbit Universiti Sains Malaysia, 2014.","Business stability; Capital adequacy; Credit card firms; Liquidity; Loan soundness; Profitability",""
"Factors influencing students' decisions in choosing private institutions of higher education in Malaysia: A Structural Equation Modelling approach","2013","https://www.scopus.com/inward/record.uri?eid=2-s2.0-84885442973&partnerID=40&md5=51440eb5df133ffc0a5a5e0a59efe5f1","There are almost 500 institutions of private higher education currently in operation in Malaysia, these include colleges, university colleges and universities. These institutions are helpful because they fill the gap caused by limited seating for potential students in government institutions of higher learning. A total sample of 373 students comprising students from secondary schools was used in this study. These students were in the British equivalent O and A levels of education. A questionnaire containing 46 statements was distributed randomly to the respondents during a motivation seminar at their respective schools. The data analysis was conducted using SPSS and AMOS software programme packages for Windows. Factor analysis was performed to extract and decide on the number of factors underlying the measured variables of interest. Structural Equation Modelling (SEM) was then used to examine the variables and the fitness of the proposed model. The results indicate a substantial positive effect of perception and promotion on the students' choice of private institutions for higher education. The results also reveal a significant positive effect of perception on influence and promotion on influence. Therefore, the findings of this study have a substantial effect on private institutions of higher education. © Asian Academy of Management and Penerbit Universiti Sains Malaysia, 2013.","Higher learning; Malaysia; Private institutions; Structural Equation Modelling (SEM)",""
