"Title","Year","Link","Abstract","Author Keywords","Index Keywords"
"Audit exemption for small and medium enterprises: Perceptions of Malaysian auditors","2016","https://www.scopus.com/inward/record.uri?eid=2-s2.0-85010377962&doi=10.21315%2faamj2016.21.2.7&partnerID=40&md5=2157d1f2c7cc4084fea264d1590931ed","The objective of the study is to examine audit firm size, the provision of non-audit services (NAS) and audit tenure as factors that influence the likelihood that an auditor agrees with allowing audit exemption. This study employs a 2 × 2 × 2 within-subject experimental design. Respondent auditors were required to evaluate 8 case scenarios. A total of 79 questionnaires were returned and used for data analysis. General Linear Measurement (Repeat Measure) was used to analyse the data. The study found that an audit firm size has a significant impact on the likelihood that an auditor agrees with offering audit exemption. The larger the size of the firm, the greater is the likelihood of agreeing with allowing audit exemption. Therefore, it is suggested that small audit firms (with 5 or fewer employees) merge and focus on activities that contribute more added value such as consultancy. In so doing, auditors from these firms would be required to improve their knowledge and capacity by offering these services and not merely focusing on traditional audit work for SMEs. This is because SMEs are known to have limited resources and capacity and thus would be expected to have poor internal control. The requirement of a mandatory audit for such firms might lead auditors to compromise their independence. Thus, the government and the Malaysian Institute of Accountant (MIA) should help small audit firms to develop the necessary knowledge, skills and competencies to perform non-audit services. © Asian Academy of Management and Penerbit Universiti Sains Malaysia, 2016.","Audit; Audit exemption; Audit firms; Firm size; NAS; Non-audit services; SMEs",""
"Service innovation management practices and pricing practices for performance in Malaysian telecom","2017","https://www.scopus.com/inward/record.uri?eid=2-s2.0-85039924819&doi=10.21315%2faamj2017.22.2.5&partnerID=40&md5=6b27ad8c0303a833d812ef1d16e49730","This study aims to test the role of pricing practices as an intervening variable in the relationship between service innovation management practices (innovation strategy, innovation process, cross-functional organisation, tools/technology, and system integration) and firms’ performance in an emerging economy. Data were collected from 249 managers representing the Malaysian telecommunications sector using a structured questionnaire. Structural equation modelling (SEM) with SmartPLS software, version 3, was used to achieve the research objectives and to analyse the measurements and structural model. The results showed that, whereas innovation strategy, innovation process, cross-functional organisation, and system integration positively influence pricing practice, tools and technology has an insignificant effect on pricing practice. Interestingly, pricing practice mediates the relationship between innovation strategy and system integration regarding firm performance. The findings of this study suggest that, in the formulation of such a strategy, service firms should consider the pricing factor. Telecommunications service providers could use this model to implement pricing practices particularly driven by innovation practices to achieve the desired performance. The study could also assist managers in understanding suitable pricing practices in the context of the telecommunications industry. The originality of this study lies in the effort to adjoin service innovation management practices with pricing practices that lead to improving the performance of the telecommunications industry. © Asian Academy of Management and Penerbit Universiti Sains Malaysia, 2017.","Malaysia; Performance; Pricing practice; Service innovation management; Telecommunications industry",""
"The impact of internal factors on small business success: A case of small enterprises under the felda scheme","2017","https://www.scopus.com/inward/record.uri?eid=2-s2.0-85021371156&doi=10.21315%2faamj2017.22.1.2&partnerID=40&md5=fb8357a03854e2b58ec40e7baffdbd22","This study attempts to identify the antecedents of business success in the Malaysian perspective, with particular reference to small businesses under the Federal Land Development Authority (FELDA) scheme. Cross sectional data were collected from 199 small businesses operating under the (FELDA) scheme via questionnaire. The data collected were analysed using partial least square method. The empirical results indicated that only entrepreneurial competency and technology usage are related to successes of small businesses. However, this study found insufficient empirical evidence to support the relationship between marketing capability, financial resources, knowledge sharing, and business success. As this study was confined to the small businesses under the FELDA scheme, this provides valuable findings by uncovering the differences among the critical success factors due to the different reasons for formation of the small businesses. The insights gained from this study could facilitate industry practitioners to develop comprehensive business strategies and effective institutional policies to maintain the global competitiveness of small businesses under the FELDA scheme. © Asian Academy of Management and Penerbit Universiti Sains Malaysia, 2017.","Business success; Developing economy; FELDA; Small business; Strategy",""
"Regulation, incentives and government policy: How does it stimulate R&D engineers’ innovative behaviours in malaysian biotechnology SMEs?","2016","https://www.scopus.com/inward/record.uri?eid=2-s2.0-85008219563&doi=10.21315%2fAAMJ2016.SUPP.1.3&partnerID=40&md5=472ebc0fa58c2f489cfdc9fc60340f61","This study seeks to examine the relationship between regulation, incentives and government policy to R&D (research and development) engineers’ innovative behaviour in Malaysia biotechnology SMEs. This research is empirical study where survey data was drawn from 218 R&D engineers in biotechnology SMEs in Malaysia. The data were analysed using SmartPLS which is Structural Equation Modelling (SEM) tool. The result unfolds that government policy is positively and significantly associated with innovative behaviour. Nevertheless, regulation was found significant to innovative behaviour but demonstrates negative magnitude. On the other hand, incentives was insignificant to innovative behaviour. This in turn suggests that government policy is critical to foster innovative behaviour whereby the regulation enforcement that indicates disequilibrium possess by higher compliance cost be a disincentive for the R&D engineers to act innovatively. Contradict to previous studies, the insignificant relationship between incentives and individual innovative behaviour, possibly influence by lack of coordination, monitoring and vetting system with regards to the incentives distribution. © Asian Academy of Management and Penerbit Universiti Sains Malaysia, 2016.","Biotechnology SMEs; Government policy; Incentives; Innovative behaviour; R&d engineers; Regulation",""
"The significant contribution of islamic relationship marketing practice in malaysian takaful industry towards determining customer gratitude, trust, and commitment","2016","https://www.scopus.com/inward/record.uri?eid=2-s2.0-85008162621&doi=10.21315%2faamj2016.supp.1.8&partnerID=40&md5=8d61520f3f064dbc99fc4cc9ba098279","Parallel to the achievement of the Takaful industry, agency system becomes the main medium utilised by the industry to educate the public and assist them about future financial preparation. As a mirror to an Islamic type of insurance, Takaful agents play significant role not only to sell the Takaful products, but also to behave according to the Islamic norms in front of their customers. Thus, this research is conducted to introduce new concept of Islamic relationship marketing (IRM) and investigates its significance towards customer gratitude, trust, and commitment in the industry. A total of 741 of Family Takaful customers in Klang Valley area have participated in the survey conducted in this study. Few statistical analyses were performed to confirm the proposed measures of IRM including descriptive, exploratory factor analysis (EFA), measurement model, and structural equation modelling (SEM) analysis. Through EFA and measurement model, four variables were confirmed to measure the IRM which are Islamic ethical behaviour, social, structural, and financial bonds. Furthermore, these measures of IRM have significantly affected customer gratitude, trust, and commitment via SEM analysis. This study serves as a starting point to promote new approach of marketing in the Takaful industry based on the Islamic norms. It basically aims to tackle the needs of Takaful participants which should be taken care by the Takaful agents as to ensure both of these parties receive benefits in the Takaful contract. © Asian Academy of Management and Penerbit Universiti Sains Malaysia, 2016.","Customer commitment; Customer gratitude; Customer trust; Family takaful customer; Islamic relationship marketing",""
"Mediating role of consumer involvement between celebrity endorsement and consumer evaluation: Comparative study of high and low involvement product","2019","https://www.scopus.com/inward/record.uri?eid=2-s2.0-85078277337&doi=10.21315%2faamj2019.24.2.6&partnerID=40&md5=512e7f1d1281b1ff063ebc5f89c9ada3","Celebrity endorsement has been an important area of study from the perspectives of marketers as well as consumers. This research aims at developing and testing a model of celebrity endorsement with celebrity-product congruence and attractiveness as predictor variables, with consumer involvement affecting a consumer assessment of the brand and purchase intention. The research has been guided by current attention being given to the significance of celebrities for endorsing products. However, the same has not been duly explored in the context of celebrity endorsement, with consumer involvement as a mediating variable, and further its impact on consumers’ evaluation. The present research discusses the relationship effect of celebrity endorsement on consumers’ evaluation of the communication done through the celebrity endorsing the brand. The study highlights mediating role of consumer involvement for both high and low involvement products in formation of attitude towards advertisement and buying intention. Using mall intercept method, the data was collected from 246 respondents. Structural equation modelling was used for analysing the data using AMOS 22.0. The results indicate that consumer responses. © Asian Academy of Management and Penerbit Universiti Sains Malaysia, 2019.","Attitude towards advertisement; Celebrity attractiveness; Celebrity endorsement; Celebrity-product congruence; Consumer involvement",""
"The impact of government support on firm performance in Vietnam: New evidence from a dynamic approach","2018","https://www.scopus.com/inward/record.uri?eid=2-s2.0-85061341979&doi=10.21315%2faamj2018.23.2.5&partnerID=40&md5=aa2bdf8b190f436f1f87017be73295cc","Using a sample of private manufacturing small-and medium-sized enterprises (SMEs) in the period 2007–2015, this paper examines the effect of government support on firms’ financial performance in Vietnam. Contrary to many previous studies, the study finds that government assistance affects firms’ financial performance after controlling for heterogeneity, unobservable factors, and dynamic endogeneity. The finding supports the viewpoint of institutional theory. The study also reveals that assistance measures, such as tax exemptions, soft loans, and investment incentives to promote financial performance, are vital for the development of Vietnamese private SMEs. © Asian Academy of Management and Penerbit Universiti Sains Malaysia, 2018.","Firm financial performance; Government support; Innovation; SMEs; Vietna",""
"Measuring the effects of work motivation on stress and performance linkages in SME","2019","https://www.scopus.com/inward/record.uri?eid=2-s2.0-85074526642&doi=10.21315%2faamj2019.24.s2.1&partnerID=40&md5=f51634928eeb2540100b1ee492aceeed","Entrepreneurship is important for the economic growth and wealth of the nation. Entrepreneurs are responsible for not only generating income to themselves but also to others in terms of job creation. However, the issue of the entrepreneurs’ well-being is hardly being touched upon particularly in the context of stress, work motivation, and performance in enterprises of small and medium sizes in Malaysia. Work motivation as the mediator is the main contributions from the study. Therefore, the study aims to examine these relationships within this context. Stress, motivation, and performance were measured using A Shortened Stress Screening Tool (ASSET), Multidimensional Work Motivation Scale (MWMS), and Individual Work Performance (IWPQ), respectively. Questionnaires were distributed among the Majlis Amanah Rakyat (MARA) entrepreneurs located in Klang Valley and approximately 150 respondents responded. Data were analysed using the hierarchical multiple regression method. The results showed that certain stressors such as work relationship, work overload, job security, and resources and communication significantly affect motivation. Meanwhile, work motivation significantly predicts performance. Finally, stressors such as work relationships, work-life balance, job security, and pay and benefits significantly influence performance. Overall, work motivation partially mediated stress and performance relationship. Entrepreneurs should be aware of these significant stressors and conduct interventions so as to reduce their stresses and thus, improve their work motivation and performance. © Asian Academy of Management and Penerbit Universiti Sains Malaysia, 2019.","ASSET; Entrepreneurs; MWMS; Performance; Stress; Work motivation",""
"The role of leader’s spiritual leadership on organisation outcomes","2018","https://www.scopus.com/inward/record.uri?eid=2-s2.0-85061304347&doi=10.21315%2faamj2018.23.2.3&partnerID=40&md5=ba3efc8fce26828e96ea38102d95c324","This paper aims to investigate a causal model of spiritual leadership theory in organisational context and evaluates the effectiveness of spiritual survival and empowerment on organisational outcomes in terms of commitment and citizenship behaviour. It used structural equation model (SEM) approach to test a conceptual framework with data collection of 329 full-time employees working in service industries in Ho Chi Minh City, Vietnam. The findings illustrated the critical effects of spiritual leadership on organisational outcomes throughout membership, empowerment, and personal characteristics regarding meaning and calling. Specifically, a qualitative approach was conducted to highlight the testing results and get a better understanding of unanticipated consequences from the quantitative analysis. Based on the findings, the study proposed some specific interests of managerial implications and identify some limitations for future study. © Asian Academy of Management and Penerbit Universiti Sains Malaysia, 2018.","Empowerment; Membership; Organisational citizenship behaviour; Organisational commitment; Spiritual leadership",""
"The future sustainability of malaysian higher education institutions: What matters most?","2019","https://www.scopus.com/inward/record.uri?eid=2-s2.0-85067407794&doi=10.21315%2fAAMJ2019.24.S1.12&partnerID=40&md5=ea8fe4bd7d4ca54fdd158cd7c04b5964","The purpose of the study was to examine the relationship between the organisational quality management initiatives (OQMI) and organisational culture (OC) on the sustainability of Malaysian higher education institutions (SMHEI). The study utilised 263 top administrators’ completed questionnaire survey from universities in Peninsular Malaysia. The statistical techniques employed in this study were descriptive statistics, confirmatory factor analysis (CFA), and a full-fledged structural equation modelling to address the research questions and hypotheses testing. The findings revealed that long-term strategic planning initiatives (LSPI) required a thorough revision; communication and decision-making, and organisational climate of Malaysian higher education institutions (MHEI) persisted as challenges in improving the SMHEI. It was also revealed that the implementation of balanced scorecard could enhance the effectiveness and efficiency of MHEI. This study provides a basis for future studies, particularly in the Peninsular Malaysia context. Theoretically, the study also found that not only leadership perspectives required further investigation but also the financial, customer, internal process, and learning and growth perspectives in the administration for SMHEI. © Asian Academy of Management and Penerbit Universiti Sains Malaysia, 2019.","Balanced scorecard; Long-term strategic planning initiatives; Organisational climate; Quality assurance; Sustainability",""
"The formalisation of social engagement in the medical relief ngo: The evidence of mercy Malaysia","2016","https://www.scopus.com/inward/record.uri?eid=2-s2.0-85114190512&doi=10.21315%2fAAMJ2016.SUPP.1.7&partnerID=40&md5=e63d5bebc7d55f6425c298a9752a6776","Social engagement involves the participation of a group people in undertaking collective activities in social community. The paper aims to examine the formalisation of NGO social engagement to their stakeholders. The MERCY's social engagement is not only focusing on the traditional forms of reports i.e. social reports to the stakeholders but includes the forms of actions including conversation, behavioural explanations and reasonable conduct through negotiation of performance and impact among stakeholders. The social engagement paradigm emphasises on the rights and contracts between two parties (i.e. Accountor and Accountee). The qualitative research is employed by undertaking empirical case study research for MERCY, an international disaster relief NGO that highlight an understanding of social engagement through the power of negotiation. The data are gathered through in-depth series of interviews and documentary reviews, which was analysed through thematic analysis. The findings revelas the social ""closeness"" within the community can be seen from the moral values imperatives that had driven by the trustworthiness and willingness of the people in the community to engage in the volunteering work. © Asian Academy of Management and Penerbit Universiti Sains Malaysia, 2016.","Medical relief; Social contract; Social disclosure; Social engagement",""
"Market structure of Malaysian palm oil refining industry","2018","https://www.scopus.com/inward/record.uri?eid=2-s2.0-85061303531&doi=10.21315%2faamj2018.23.2.6&partnerID=40&md5=0179377e6bb4d20580fcf67d2e12cbf1","Palm oil refining industry has become one of the most important industries in Malaysia since 1960s. In the second quarter of 2018, total production and total exports of Malaysian palm oil products recorded low-single digit drop, despite an encouraging recovery in production in 2017. It is worrying to note the declining trend of utilisation rate of these refineries over the years signifying the loss of market share of these refineries in the global market. This study aims to focus on determining the structure of the industry using six concentration indicators namely Herfindahl-Hirschman index (HHI), concentration ratio (CR), entropy index (EI), relative entropy (RE), Hannah and Kay index (HKI), and the Gini coefficient (GINI). The results obtained indicate that the industry is an oligopoly with apparent shift from a highly indexed oligopoly to a lower indexed oligopoly during the studied period. The results further affirmed the concern raised in this study that the domestic palm oil refining industry has lost its market share and position in the international market. © Asian Academy of Management and Penerbit Universiti Sains Malaysia, 2018.","Concentration indicators; Malaysian palm oil refininindustry; Market share; Market structure; Oligopoly",""
"Regulation, incentives and government policy: How does it stimulate R&D engineers’ innovative behaviours in malaysian biotechnology SMEs?","2016","https://www.scopus.com/inward/record.uri?eid=2-s2.0-85088061562&doi=10.21315%2faamj2016.21.supp.1.3&partnerID=40&md5=0abad44b90af66501f6b2ef0d296628d","This study seeks to examine the relationship between regulation, incentives and government policy to R&D (research and development) engineers’ innovative behaviour in Malaysia biotechnology SMEs. This research is empirical study where survey data was drawn from 218 R&D engineers in biotechnology SMEs in Malaysia. The data were analysed using SmartPLS which is Structural Equation Modelling (SEM) tool. The result unfolds that government policy is positively and significantly associated with innovative behaviour. Nevertheless, regulation was found significant to innovative behaviour but demonstrates negative magnitude. On the other hand, incentives was insignificant to innovative behaviour. This in turn suggests that government policy is critical to foster innovative behaviour whereby the regulation enforcement that indicates disequilibrium possess by higher compliance cost be a disincentive for the R&D engineers to act innovatively. Contradict to previous studies, the insignificant relationship between incentives and individual innovative behaviour, possibly influence by lack of coordination, monitoring and vetting system with regards to the incentives distribution. © Asian Academy of Management and Penerbit Universiti Sains Malaysia, 2016.","Biotechnology SMEs; Government policy; Incentives; Innovative behaviour; R&D engineers; Regulation",""
"How efficient are Malaysian public universities? A comparative analysis using data envelopment analysis","2016","https://www.scopus.com/inward/record.uri?eid=2-s2.0-85010417575&doi=10.21315%2faamj2016.21.2.4&partnerID=40&md5=0f0f2cef1b3c817c2e93319a48d632b9","This paper aims to examine the efficiency of Malaysian public universities in comparison with the private and foreign universities using Data Envelopment Analysis (DEA). The study involves 22 universities (17 public, 1 private and 4 foreign) and based on data between year 2008 and 2011. Results reveal that the most efficient Malaysian public universities are: University Malaya (among research universities); Universiti Teknologi Mara (among comprehensive universities) and Universiti Utara Malaysia (among focused universities). When these three most efficient Malaysian public universities are compared with the private university in Malaysia and another 4 foreign universities, they are found to be inefficient in income generation and in managing inputs which include the government operating grant. The plausible explanation could be associated with a long history of over-dependence on government grants that may have resulted in the public universities becoming too complacent. The study calls for mechanisms to re-strategise and to get these public universities to be more financially independent. © Asian Academy of Management and Penerbit Universiti Sains Malaysia, 2016.","Data Envelopment Analysis (DEA); Efficiency analysis; Malaysian public universities",""
"Self-identity and social identity as drivers of consumers’ purchase intention towards luxury fashion goods and willingness to pay premium price","2018","https://www.scopus.com/inward/record.uri?eid=2-s2.0-85061335296&doi=10.21315%2faamj2018.23.2.8&partnerID=40&md5=9d6f3ec09cfac45264a0fc7fcfda97f3","The main purpose of this study is to examine consumer behaviour towards purchasing luxury fashion goods based on an extended model that integrates the constructs of theory of planned behaviour (TPB), social identity, self-identity, and price premium. The proposed model is examined using a self-structured questionnaire with a dataset of 395 valid responses. Statistical analysis is based on the PLS-SEM approach with the use of Smart-PLS software 3.2.0. The results indicate that all the hypotheses associated with the relationships between social identity and TBP determinants and between self-identity and TBP determinants are supported; however, the hypothesis on the relationship between self-identity and subjective norm is not supported. Moreover, the hypotheses associated with the relationships between TPB determinants, subjective norm, perceived behavioural control (PBC), attitude, and intention to purchase luxury fashion are also supported. Finally, the proposed relationships between intention to purchase luxury fashion and model outcome, purchase of luxury fashion and intention for price premium are supported as well. This study is the first that integrates social identity, self-identity, and price premium with TPB to explain consumers’ purchase behaviour towards luxury fashion products. The findings can help marketers develop effective marketing strategies in order to stay competitive. © Asian Academy of Management and Penerbit Universiti Sains Malaysia, 2018.","Luxury fashion; Price premium; Self-identity; Social identity; Theory of planned behaviour",""
