"Link","Author Keywords","Index Keywords"
"https://www.scopus.com/inward/record.uri?eid=2-s2.0-85163015009&doi=10.18331%2fBRJ2023.10.2.2&partnerID=40&md5=ff9581dcc8bbec88895df5a72e52a930","Acetate; Acetoclastic; Caldicellulosiruptor bescii; Methanogenesis; Syntrophic; Volatile fatty acids","Biogas; Concentration; Digesters; Digestion; Energy; Fertilizers; Production; Anaerobic digestion; Biogas; Fertilizers; Gibbs free energy; Hydrogen production; Methanogens; Suspensions (fluids); Acetate; Acetate concentrations; Acetoclastic; Acetoclastic methanogens; Biogas production; Caldicellulosiruptor bescii; Gibbs energy change; Methanogenesis; Syntrophic; Thermodynamic methods; Volatile fatty acids"
"https://www.scopus.com/inward/record.uri?eid=2-s2.0-85085869806&doi=10.18331%2fBRJ2020.7.2.3&partnerID=40&md5=6118c8f4dcc86250aad8d48723dccaec","Butanol; Butyrate; Ethanol; Genomic analysis; Second-generation biofuels","Acetone; Biofuels; Genes; Metabolism; Organic solvents; Substrates; Volatile fatty acids; Animal dungs; Argentina; Buenos Aires; Butyrate; Genomics; Genomics analysis; Second generation; Second-generation biofuel; Solvent production; Thermoanaerobacterium; Ethanol"
"https://www.scopus.com/inward/record.uri?eid=2-s2.0-85131430249&doi=10.18331%2fBRJ2022.9.2.2&partnerID=40&md5=740362396174ed785849560eb3930f64","Biofuels; Carbon footprint; Climate change mitigation; Indirect land-use change (iluc); Life cycle assessment; Uncertainty","Biofuels; Carbon footprint; Crops; Fossil fuels; Gasoline; Global warming; Greenhouse gases; Land use; Sensitivity analysis; Uncertainty analysis; Climate change mitigation; Electricity-generation; Greenhouses gas; Indirect land-use change; Indirect land-use changes; Landuse change; Life cycle assessment model; Modeling approach; Sources of uncertainty; Uncertainty; Life cycle"
"https://www.scopus.com/inward/record.uri?eid=2-s2.0-85028935198&doi=10.18331%2fBRJ2017.4.3.7&partnerID=40&md5=2b94d96e0dcc7282163c62521dac9c04","Biochemical; Biofuel; Biopolymer; Biorefinery; Sugarcane; Techno-economic assessment","Bagasse; Biofuels; Biomolecules; Biopolymers; Chemical industry; Climate change; Decision making; Fighter aircraft; Fossil fuels; Fuel economy; Lactic acid; Bio-based; Biochemical; Biofuel production; Biopolymer; Biorefineries; Recent trends; Resource depletion; Sugar-cane bagasse; Sugarcane; Techno-economic assessment; Refining"
"https://www.scopus.com/inward/record.uri?eid=2-s2.0-85153326680&doi=10.18331%2fBRJ2023.10.1.3&partnerID=40&md5=3709d35ff0c94c01573ec55326793f7a","Amines; Biogas upgrading; CO<sub>2</sub> removal; Hybrid solvent; Ionic liquid; Sustainability assessment","Amines; Biogas; Carbon dioxide; Computer software; Costs; Economics; Energy conservation; Ethanolamines; Exergy; Fossil fuels; Investments; Ionic liquids; Sustainable development; Biogas upgrading; CO2 removal; Diethanolamine; Energy; Environmental concerns; Hybrid solvent; Imidazolium-based ionic liquid; Sustainability analysis; Sustainability assessment; Tetrafluoroborates; Solvents"
"https://www.scopus.com/inward/record.uri?eid=2-s2.0-85125742056&doi=10.18331%2fBRJ2022.9.1.3&partnerID=40&md5=ca1d3662977a3d7f358741fad015be70","Bio-oil; Biochar; Bioenergy; Cork (quercus suber l.); Pyrolysis; Sustainability","Biofuels; C (programming language); Cerium oxide; Chemical analysis; Granulation; Hydrocarbons; Nitrogen; Pyrolysis; Sustainable development; Bio-energy; Bio-oils; Biochar; Cork (quercu suber l.); Nitrogen atmospheres; Product characterizations; Pyrolysis temperature; Quercus suber L; Slow pyrolysis; Valorisation; Feedstocks"
"https://www.scopus.com/inward/record.uri?eid=2-s2.0-85150395907&doi=10.18331%2fBRJ2022.9.4.2&partnerID=40&md5=b5395fe86cc05c03d08e2d6c58cfdbc9","Agricultural waste; Biomass; Fuel pellet; Sugarcane bagasse; Torrefaction","Agricultural wastes; Agriculture; Bagasse; Economic analysis; Fossil fuels; Gas emissions; Global warming; Greenhouse gases; Pelletizing; Ash contents; Biomass fuels; Economic feasibilities; Feasibility studies; Fuel pellet; Fuel substitution; Greenhouse gas emissions; Potential feedstock; Sugar-cane bagasse; Torrefaction; Biomass"
"https://www.scopus.com/inward/record.uri?eid=2-s2.0-85121820592&doi=10.18331%2fBRJ2021.8.4.4&partnerID=40&md5=c9dbc7faa16116f52ca7102d48a921b3","Cheese whey; Ethanol; Metabolic engineering; Renewable carbon sources; Yeast fermentation","Carbon; Fermentation; Metabolic engineering; Metabolism; Refining; Yeast; Biotechnological applications; Cheese whey; Circular economy; Dairy industry; Environmental concerns; Nutritional value; Renewable carbon sources; Valorisation; Yeast cell; Yeast fermentation; Ethanol"
"https://www.scopus.com/inward/record.uri?eid=2-s2.0-85137703423&doi=10.18331%2fBRJ2022.9.3.4&partnerID=40&md5=0f27dd1c4a286d0a3657fa6c37829b19","Biochar; Circular economy; Inert torrefaction; Oxidative torrefaction; Sustainability; Thermochemical biorefineries","Agricultural wastes; Agriculture; Bioconversion; Biomass; Calorific value; Microalgae; Microorganisms; Refining; Temperature scales; Biochar; Biorefineries; Biorefining; Circular economy; Inert torrefaction; Micro-algae; Oxidative torrefaction; Thermochemical biorefinery; Thermochemicals; Woody biomass; Sustainable development"
"https://www.scopus.com/inward/record.uri?eid=2-s2.0-85130822289&doi=10.18331%2fBRJ2022.9.2.3&partnerID=40&md5=09d8610be81ad840e34d498ef0199f21","Biodiesel; Cetane number; Cloud point; Emissions; Fractionation; Oxidation stability","Biodiesel; Carbon monoxide; Esters; Fractionation; Metabolism; Nitrogen oxides; Palm oil; Processing; Saturated fatty acids; Temperature; Cloud points; Emission; Fatty acids methyl esters; ITS applications; Low temperature performance; Oil fatty acids; Onset temperature; Oxidation stability; Petroleum diesel; Thermal crystallization; Urea"
"https://www.scopus.com/inward/record.uri?eid=2-s2.0-85076284241&doi=10.18331%2fBRJ2019.6.4.2&partnerID=40&md5=c95a1a1f57f635fea1cbfa7b4aa237bf","Bio-oil; Box-Behnken; Fast pyrolysis; Forest biomass; Fractional condensation","ASTM standards; Auger electron spectroscopy; Augers; Surface analysis; Bio-oil yield; Bio-oils; Box-Behnken; Fast pyrolysis; Forest biomass; Fractional condensation; Oil quality; Oil-production; Optimisations; Yield enhancement; Condensation"
"https://www.scopus.com/inward/record.uri?eid=2-s2.0-85085889669&doi=10.18331%2fBRJ2020.7.1.4&partnerID=40&md5=50f1363a79de6d18786df6249fd4320b","Biofuels; Biomass; Economic viability; Lignocellulose; Pretreatment; Sustainability","Bioethanol; Biomass; Energy conservation; Feedstocks; Lignin; Wastewater reclamation; Water conservation; 'current; Biofuel production; Capitals costs; Economic viability; Future prospects; High costs; Large scale productions; Ligno-cellulosics; Pre-treatments; Pretreatment methods; Lignocellulose"
"https://www.scopus.com/inward/record.uri?eid=2-s2.0-85103130135&doi=10.18331%2fBRJ2021.8.1.2&partnerID=40&md5=f8fb093f5cde7c569dbcd042a3d57321","Bioenergy; Biomass; Lignocellulose; Pyrolysis; Reaction kinetics; Sensor","Association reactions; Biomass; Gas chromatography; Heat transfer; Mass spectrometry; Particle size; Pyrolysis; Reaction kinetics; 'current; Advanced modeling; Bio-energy; Biomass pyrolysis; Modeling and validation; Product composition; Product yields; Pyrolysis gas chromatography; Pyrolysis gas mass; Sensor; Lignocellulose"
"https://www.scopus.com/inward/record.uri?eid=2-s2.0-85098528467&doi=10.18331%2fBRJ2020.7.4.4&partnerID=40&md5=1f7b4952769130b12332b229664fa0b2","ABE fermentation; Biobutanol; Clostridia; Lignocellulose; Pretreatment; Waste","Acetone; Drops; Fermentation; Purification; Substrates; Acetone; Biofuels; Drops; Fermentation; Investments; Lignin; Purification; Substrates; Acceptable performance; Acetone butanol ethanols; Acetone-butanol-ethanol fermentation; Biobutanol; Blended fuels; Carbohydrate resources; Liquid biofuels; Microbial products; Pre-treatments; Production process; Lignocellulose"
"https://www.scopus.com/inward/record.uri?eid=2-s2.0-85047884411&doi=10.18331%2fBRJ2018.5.2.2&partnerID=40&md5=bec4024023a323180d5b06ee4a82b634","","Climate change; Cost effectiveness; Nanotechnology; Biofuel production; Cost effective; Industrial scale; Property; Renewable energies; Biofuels"
"https://www.scopus.com/inward/record.uri?eid=2-s2.0-85072585027&partnerID=40&md5=a1033508b8d18c8d98eae600bb2226dd","Bio-jet fuel; Biobutanol; Bioethanol; Biofuel; Fuel additive; Microbial metabolite; Sustainable energy","Ammonia; Bioethanol; Climate change; Deterioration; Ethanol; Ethanol fuels; Fossil fuels; Fuel additives; Greenhouse gases; Liquids; Metabolites; Sustainable development; Bio-jet fuel; Biobutanol; Biofuel production; Eco-friendly; Energy carriers; Environmental deterioration; Global climate changes; Greenhouse gas emissions; Microbial metabolites; Transportation sector; Gas emissions"
"https://www.scopus.com/inward/record.uri?eid=2-s2.0-85065497382&doi=10.18331%2fBRJ2019.6.1.5&partnerID=40&md5=85530da4db2ffa6c70ee4a5f97133572","5-L Scale; Lignin de-polymerization; Lignin-to-Liquid; Stabilization; Stirring","Formic acid; Lignin; Loading; Organic solvents; Polymerization; Principal component analysis; Wood; 5-L scale; Bio-oil yield; Bio-oils; Condition; De-polymerization; Level of loading; Lignin de-polymerization; Lignin-to-liquid; Solvent system; Stirring; Stabilization"
"https://www.scopus.com/inward/record.uri?eid=2-s2.0-85068930055&doi=10.18331%2fBRJ2019.6.2.4&partnerID=40&md5=e41e913df2e7c06239ec52ddef3704db","Bioconversion; Biorefinery; Olive mill wastewater; Sustainable management; Valorization and recycling; Value-added compounds","Agriculture; Aquatic organisms; Bioremediation; Biotechnology; Ecosystems; Effluents; Olive oil; Refining; Sustainable development; Wastewater treatment; Water pollution; Agro-industrial effluents; Air-water; Biorefineries; Olive-mill waste-waters; Pollution loads; Sustainable management; Valorisation; Valorization and recycling; Value-added compound; Water ecosystems; Bioconversion"
"https://www.scopus.com/inward/record.uri?eid=2-s2.0-85076319554&doi=10.18331%2fBRJ2019.6.4.3&partnerID=40&md5=2432bccc3ea7ae2e733c014344dc4a99","Biofuels; Biomass; Oil palm biomass; Pyrolysis; Pyrolysis products","Biofuels; Calorific value; Gas chromatography; Gases; Ionization of gases; Liquid chromatography; Liquids; Palm oil; Pyrolysis; Scanning electron microscopy; Agitated bed; Biochar; Higher heating value; Liquid products; Oil palm biomass; Oil palm frond; Pyrolysis gas; Pyrolysis products; Pyrolysis reactor; Pyrolysis temperature; Biomass"
"https://www.scopus.com/inward/record.uri?eid=2-s2.0-85042760312&doi=10.18331%2fBRJ2018.5.1.4&partnerID=40&md5=3ec07b2e20c38a85ad4a0de92789d440","Biochemical conversion; Biofuel applications; Biofuel feedstock; Canada; Liquid biofuel; Thermochemical conversion","Competition; Feedstocks; Gas emissions; Greenhouse gases; Liquids; 'current; Biochemical conversion; Biofuel application; Biofuel feedstocks; Canada; Critical component; Future prospects; Liquid biofuels; Low carbon fuels; Thermochemical Conversion; Biofuels"
"https://www.scopus.com/inward/record.uri?eid=2-s2.0-85153289950&doi=10.18331%2fBRJ2023.10.1.5&partnerID=40&md5=4f730c5c9353506d2724a6cefe2765f3","Biofuel; Biomaterial; Biorefinery; Greenhouse gas; Life cycle assessment; Sustainable development","Biofuels; Environmental impact; Gas emissions; Life cycle; Refining; Sustainable development; Bio-based materials; Bioproducts; Biorefineries; Energy; Energy economics; Fossil resources; Greenhouses gas; Life cycle assessment; Resource gas; Sustainability assessment; Greenhouse gases"
"https://www.scopus.com/inward/record.uri?eid=2-s2.0-85059291580&doi=10.18331%2fBRJ2018.5.4.4&partnerID=40&md5=1d3c3e1fdb1d2eacd7e295c9950a5351","Algae; Bioenergy; Biofuel; Biomass feedstocks; Input-output analysis; LCA","Algae; Biofuels; Biomass; Carbon; Cost benefit analysis; Cost estimating; Crops; Ethanol; Feedstocks; Global warming; Investments; Physiological models; Bio-energy; Biomass feedstock; Cost components; Energy inputs; Energy return on investments; First order; Input-output; Input/Output analysis; Order estimates; Output energy; Life cycle"
"https://www.scopus.com/inward/record.uri?eid=2-s2.0-85116493687&doi=10.18331%2fBRJ2021.8.3.5&partnerID=40&md5=5e569a8b9c17391f4b53a7c631de076d","Biomass conversion; Chlorophyllin; Co-substrates utilization; Light; Lytic polysaccharide monooxygenases","Activation analysis; Activation energy; Bioconversion; Biomass; Catalytic oxidation; Molecular oxygen; Substrates; Biomass conversion; Chlorophyllin; Co-substrate utilization; Cosubstrates; Light activation; Lytic polysaccharide monooxygenase; Monooxygenases; Plant biomass; Reductants; Substrate utilization; Enzymes"
"https://www.scopus.com/inward/record.uri?eid=2-s2.0-85120986040&doi=10.18331%2fBRJ2017.4.4.2&partnerID=40&md5=c09ba44457ce54d6152db85c56442860","","Biofuels; Charcoal; Green chemistry; Sources of energy; Fossil fuels"
"https://www.scopus.com/inward/record.uri?eid=2-s2.0-85162941385&doi=10.18331%2fBRJ2023.10.2.3&partnerID=40&md5=117f0ee396bcf20fe9301eeb23280e45","Acid-base extraction; Aspergillus niger lipase; Biodiesel; Enzymatic esterification/transesterification; Rice bran acid oil; γ-oryzanol","Aspergillus; Enzymes; Esters; Ethanol; Extraction; Fatty acids; Furfural; Molar ratio; Recovery; Sodium hydroxide; Sustainable development; Acid base; Acid oil; Acid-base extraction; Aspergillus niger; Aspergillus niger lipase; Enzymatic esterification; Enzymatic esterification/transesterification; Oryzanol; Rice bran acid oil; Rice brans; Transesterifications; Γ-oryzanol; Biodiesel"
"https://www.scopus.com/inward/record.uri?eid=2-s2.0-85059255918&doi=10.18331%2fBRJ2018.5.4.3&partnerID=40&md5=ad54768253981176b1d041460cf5d5c6","Biofuel; Carbonaceous solid acid; CS-Fe<sub>3</sub>O<sub>4</sub>@SO<sub>3</sub>H; Furfural; Furylmethane","Acetylene; Aldehydes; Ammonia; Biofuels; Carbonization; Catalyst selectivity; Dimethyl sulfoxide; Furfural; Magnetite; Methane; Organic solvents; Bronsted acid sites; Carbonaceous solid acid; Chitosan-fe3O4@SO3H; Furylmethane; ITS applications; Lewis acid site; One-pot synthesis; Solid acid; Sulphonation; ]+ catalyst; Temperature"
"https://www.scopus.com/inward/record.uri?eid=2-s2.0-85062346970&doi=10.18331%2fBRJ2019.6.1.2&partnerID=40&md5=9900b3e5efa55ce0b8babe918d2bfafc","Deposit formation; Emissions; Endurance test; Injector; Preheated Jatropha oil; Spray characteristics; Thermal efficiency","Combustion; Deposits; Diesel fuels; Direct injection; Efficiency; Scanning electron microscopy; Smoke; Combustion parameters; Deposit formation; Emission; Endurance test; Injector; Jatropha oil; Preheated jatropha oil; Pure vegetable oil; Spray characteristics; Thermal-efficiency; Diesel engines"
"https://www.scopus.com/inward/record.uri?eid=2-s2.0-85103132318&doi=10.18331%2fBRJ2021.8.1.5&partnerID=40&md5=b0fee16ecabeb888886d1f4de7affcb4","Biofuel; Fuel cell; Steam reforming; Surface chemistry; Syngas","Biofuels; Carbon; Catalyst supports; Deposition; Fossil fuels; Metal nanoparticles; Morphology; Particle size; Perovskite; Steam reforming; Surface chemistry; Alkalines; Carbon deposition; Catalyst surfaces; Catalysts support; Catalytic behavior; Exsolution; Perovskite catalysts; Support interaction; Syn gas; ]+ catalyst; Fuel cells"
"https://www.scopus.com/inward/record.uri?eid=2-s2.0-85091823573&doi=10.18331%2fBRJ2020.7.3.3&partnerID=40&md5=dcb41d848564f87eb7a421a3944b73e2","Bicarbonate; Biogas upgrading; Fermentation; Light attenuation; Spirulina platensis","Algae; Biogas; Biomass; Ecology; Electromagnetic wave attenuation; Sodium bicarbonate; Alkaliphilic; Bicarbonate; Biogas upgrading; Carbonate solutions; CO2 capture; Cyanobacterium; Light attenuation; Light intensity; Platensis; Spirulina platensis; Carbon dioxide"
"https://www.scopus.com/inward/record.uri?eid=2-s2.0-85072578048&doi=10.18331%2fBRJ2019.6.3.4&partnerID=40&md5=aeba1a09c702c1795ab144d2ed337ded","Biogas; Financial and economic analysis; GHG mitigation; Pulp and paper mill; UASB reactor; Wastewater treatment","Bioconversion; Biogas; Cellulose; Economic analysis; Energy security; Gas emissions; Greenhouse gases; Hydrolysis; Investments; Paper and pulp industry; Paper and pulp mills; Papermaking machinery; Pulp; Pulp manufacture; Recycling; Refining; Case-studies; Economics analysis; Energy matrix; Financial analysis; GHG mitigation; Integrated approach; Pulp and paper industry; Pulp and paper mill; Up-flow anaerobic sludge blanket reactors; Upflow anaerobic sludge blanket reactors; Wastewater treatment"
"https://www.scopus.com/inward/record.uri?eid=2-s2.0-85028950648&doi=10.18331%2fBRJ2017.4.3.3&partnerID=40&md5=241ef4b44eabcbecb88e54985f78f08e","Attributional LCA; Biodiesel; Bus; Consequential LCA; Idle operation; Urban public transportation sector","Biodiesel; Climate change; Ecosystems; Health; Health risks; Life cycle; Oils and fats; Urban transportation; Waste incineration; Attributional life cycle assessment; Consequential life-cycle assessment; Fuel blends; Idle operation; Poultry fats; Transportation sector; Urban bus; Urban public transportation sector; Urban public transportations; Waste cooking oil; Buses"
"https://www.scopus.com/inward/record.uri?eid=2-s2.0-85163029073&doi=10.18331%2fBRJ2023.10.2.5&partnerID=40&md5=d496a8d8fbd2faac510f7cd8ffaf6802","2nd generation feedstock; Bioethanol; Biofuel production; Cellulosic ethanol; Lignocellulosic ethanol; Machine learning","Bioethanol; Cellulosic ethanol; Ethanol; Fermentation; Forestry; Hydrolysis; Neural networks; 2nd generation feedstock; Bio-ethanol production; Bio-ethanols; Biofuel production; Critical review; Ethanol production; Ligno-cellulosics; Lignocellulosic ethanols; Machine learning applications; Machine-learning; Machine learning"
"https://www.scopus.com/inward/record.uri?eid=2-s2.0-85071390262&doi=10.18331%2fBRJ2019.6.2.2&partnerID=40&md5=80a5a90a2107c52b8a58a7d609e79f7c","Biosorption; Cross-linking; Heavy metals; Microalgae; Pretreatment","Alkalinity; Binding sites; Biomass; Carbon dioxide; Crosslinking; Heavy metals; Metal ions; Particle size; Sodium bicarbonate; Sodium Carbonate; Sodium hydroxide; Supercritical fluid extraction; Sustainable development; Biosorbents; Conventional methods; Cross linking; Human health; Low concentrations; Mechanical; Metal biosorption; Metal uptake; Pre-treatments; Sorption capacities; Microalgae"
"https://www.scopus.com/inward/record.uri?eid=2-s2.0-85116466513&doi=10.18331%2fBRJ2021.8.3.4&partnerID=40&md5=15bb4f35753f454026b092633437c44b","Energy balance; Hydrothermal carbonization Anaerobic digestion; Sludge biodegradability Steam gasification Liquid fertilizer","Biodegradability; Carbonization; Chemical oxygen demand; Fertilizers; Gasification; Methane; Nutrients; Sludge digestion; Thermochemistry; Energy recovery; Hydrothermal carbonization; Hydrothermal carbonization anerobic digestion; Liquid fertilizers; Post treatment; Pre-treatments; Sludge biodegradabilities; Sludge biodegradability steam gasification liquid fertilizer; Steam gasification; Treatment techniques; Anaerobic digestion"
"https://www.scopus.com/inward/record.uri?eid=2-s2.0-85028927701&doi=10.18331%2fBRJ2017.4.3.6&partnerID=40&md5=9a3477f224a9afccdb8f369d84e4cd22","Biodiesel; Biorefinery; Conceptual design; Economic viability; Environmental sustainability","Bioconversion; Biodiesel; Economic analysis; Feedstocks; Food supply; Palm oil; Refining; Sustainable development; Biodiesel production; Biorefineries; Biorefinery concept; Economic viability; Environmental sustainability; Large-scales; Long-term sustainability; Petroleum diesel; Production plant; Scale of production; Conceptual design"
"https://www.scopus.com/inward/record.uri?eid=2-s2.0-85126975542&doi=10.18331%2fBRJ2021.8.4.5&partnerID=40&md5=add1843e96381e0cc2afa9e769526192","",""
"https://www.scopus.com/inward/record.uri?eid=2-s2.0-85131416514&doi=10.18331%2fBRJ2022.9.2.5&partnerID=40&md5=16ab684fe08c8bae89511264d01c946e","Biofuel; Circular economy; Climate change; Food crisis; Food insecurity; Ukraine-russia war","Biofuels; Economic and social effects; International trade; Oils and fats; Supply chains; Systems thinking; Circular economy; Energy systems; Food crisis; Food insecurity; Food markets; Food system; International markets; System thinkings; Ukraine; Ukraine-russia war; Climate change"
"https://www.scopus.com/inward/record.uri?eid=2-s2.0-85042784778&doi=10.18331%2fBRJ2018.5.1.3&partnerID=40&md5=fc6ba5ffbf74decbf744618608d45e50","Acetylation; Biodiesel; Fuel additive; Monoacetin; Solketalacetin","Acetone; Acetylation; Catalyst activity; Fuel additives; Molar ratio; Reusability; Silica gel; Synthetic fuels; Amberlyst; Benzyl alcohol; Functionalized; Green fuel; Ketalization; Molar ratio; Monoacetin; Solketalacetin; Sulphonic acids; ]+ catalyst; Biodiesel"
"https://www.scopus.com/inward/record.uri?eid=2-s2.0-85091870534&doi=10.18331%2fBRJ2020.7.3.5&partnerID=40&md5=65985e83916f5017708793367cfd1bcf","Aromatic hydrocarbons; Catalytic fast pyrolysis; Desilication treatment; Hierarchical mesoporous zeolites; Metal addition; Olefins","Aromatic hydrocarbons; Aromatization; Catalyst activity; Fuels; Metal nanoparticles; Metals; Olefins; Pore structure; Pyrolysis; Zeolites; Catalytic fast pyrolyse; Desilication; Desilication treatment; Fast pyrolysis; Hierarchical mesoporous zeolite; Hierarchical zeolites; Mesoporous zeolite; Metal addition; Transportation fuels; ]+ catalyst; Biomass"
"https://www.scopus.com/inward/record.uri?eid=2-s2.0-85091838314&doi=10.18331%2fBRJ2020.7.3.2&partnerID=40&md5=8118bc2ae68a48e96711f652f35bcead","Bioenergy; Climate change mitigation; Flores island; Grass pellet; Greenhouse gas; Marginal land","Biomass; Coal; Coal combustion; Electric power generation; Global warming; Greenhouse gases; Life cycle; Sensitivity analysis; Bio-energy; Biomass yield; Climate change mitigation; Electricity-generation; Flore island; Grass pellets; Greenhouse gases savings; Greenhouses gas; Indonesia; Marginal lands; Pelletizing"
"https://www.scopus.com/inward/record.uri?eid=2-s2.0-85085894504&doi=10.18331%2fBRJ2020.7.2.2&partnerID=40&md5=349177031a2a7aac2af4adfeb90179cf","Climate change mitigation; Consequential-LCA; Life-cycle GHG; Perennial crops; Plant diversity","Biomass; Climate change; Crops; Fossil fuels; Fuel storage; Gas emissions; Greenhouse gases; Land use; Life cycle; Soils; Aboveground biomass; Bio-energy; Biomass yield; Carbon storage; Climate change mitigation; Consequential LCA; Greenhouse gas emissions; Life-cycle GHG; Perennial crops; Plant diversity; Biofuels"
"https://www.scopus.com/inward/record.uri?eid=2-s2.0-85042765339&doi=10.18331%2fBRJ2018.5.1.5&partnerID=40&md5=016d6ed0e02bed3fdb3b6f76c5c5a750","Bioethanol; Biomass; Biorefinery; Carbohydrates; Microalgae; Pretreatment","Bioethanol; Biomass; Chemical modification; Ethanol; Fossil fuels; Microorganisms; Saccharification; Sugars; Alternative to fossil fuels; Bio-ethanol production; Biomass pre treatments; Biorefineries; Fermentable sugars; High capacity; High potential; High-capacity; Microalgal biomass; Pre-treatments; Microalgae"
"https://www.scopus.com/inward/record.uri?eid=2-s2.0-85137723615&doi=10.18331%2fBRJ2022.9.3.3&partnerID=40&md5=37df5f0991c1ac52dcbcb35de42691f7","Biomass combustion; Boiler; Cytotoxicity; Graphene; Histochemistry; Ultrafine particle emission","Biochemistry; Biological organs; Boilers; Cell death; Energy dispersive X ray analysis; Fossil fuels; Health risks; Heavy metals; High resolution transmission electron microscopy; Monolayers; Wood; X ray diffraction analysis; Advanced technology; Biomass combustion; Combustion emissions; Epithelial monolayers; Histochemistry; Human lung; In-vitro; Synthesised; Ultrafine particles emissions; Wood burning; Nanoparticles"
"https://www.scopus.com/inward/record.uri?eid=2-s2.0-85121927379&doi=10.18331%2fBRJ2021.8.4.2&partnerID=40&md5=62ca8c4fc993d4e30ec8f2f60adb6907","Combustion; Nitrogen oxides Ethanol/gasoline blends SI engines; Renewable energy","Alternative fuels; Engines; Ethanol; Ethanol fuels; Fossil fuels; Ignition; Physicochemical properties; Combustion products; Ethanol gasoline blend; Exhausts emissions; Fuel blends; Gasoline fuels; Incomplete combustion; Nitrogen oxide ethanol/gasoline blend spark-ignition engine; Oxygen content; Renewable energies; Spark-ignition engine; Nitrogen oxides"
"https://www.scopus.com/inward/record.uri?eid=2-s2.0-85098121186&doi=10.18331%2fBRJ2020.7.4.2&partnerID=40&md5=4497bfd9aff3f5338ce2de27b25a76cb","Chlamydomonas; Isoprenoid; Microalgae; Squalene; Triacylglycerol","Biodiesel; Biosynthesis; Costs; Glycerol; Lipids; Microorganisms; Pigments; Biosynthetic pathway; Chlamydomonas; Co-production; Isoprenoid lipids; Isoprenoids; Natural products; Squalene; Terbinafine; Triacylglycerols; Wild types; Microalgae"
"https://www.scopus.com/inward/record.uri?eid=2-s2.0-85085891868&doi=10.18331%2fBRJ2020.7.2.5&partnerID=40&md5=38cb153e37cfe8304937acfb8e885bca","Acid esterification; Biodiesel; Chemical process intensifier; High FFA content; Oscillating electromagnetic field; Transesterification","Catalysts; Electromagnetic fields; Esters; Fatty acids; Feedstocks; Magnetostrictive devices; Oils and fats; Sodium hydroxide; Transesterification; Acid esterification; Biodiesel production; Chemical process; Chemical process intensifier; Fatty acid contents; Free fatty acid; High free fatty acid content; High free fatty acids; Oscillating electromagnetic fields; Transesterifications; Biodiesel"
