"Link","Author Keywords","Index Keywords"
"https://www.scopus.com/inward/record.uri?eid=2-s2.0-84962074472&doi=10.1109%2fTEVC.2015.2424410&partnerID=40&md5=0257a29f87865693fd18f0a3c6946b0a","Even Parity Problem; Evolutionary Computation; Gene Expression Programming; Genetic Programming; Symbolic Regression Problem","Chromosomes; Efficiency; Evolutionary algorithms; Genes; Genetic algorithms; Genetic programming; Optimization; Control parameters; Differential Evolution; Even-Parity problems; Evolutionary search; Gene expression programming; Search efficiency; State-of-the-art algorithms; Symbolic regression problems; Gene expression"
"https://www.scopus.com/inward/record.uri?eid=2-s2.0-84973330906&doi=10.1109%2fTEVC.2015.2477284&partnerID=40&md5=a63370499fa9ffadc981ca993a9caec8","Genetic algorithm (GA); mutation operators; permutation distance metrics; permutation representation; search landscape analysis; simulated annealing (SA)","Calculations; Genetic algorithms; Simulated annealing; Crossover operator; Mutation operators; Optimization problems; Permutation distances; Permutation problems; Permutation representation; Relative positioning; Search landscapes; Optimization"
"https://www.scopus.com/inward/record.uri?eid=2-s2.0-84962048125&doi=10.1109%2fTEVC.2015.2428292&partnerID=40&md5=40eae8fb77dbf1d34cc502a7431d6f7a","Constrained Optimization; Covariance Matrix Adaptation; Differential Evolution; Memetic Computing; Viability Evolution","Benchmarking; Covariance matrix; Evolutionary algorithms; Local search (optimization); Problem solving; Algorithmic informations; Covariance matrix adaptation; Covariance matrix adaptation evolution strategies; Differential Evolution; Exploitation and explorations; Memetic computing; Unconstrained optimization problems; Viability Evolution; Constrained optimization"
"https://www.scopus.com/inward/record.uri?eid=2-s2.0-84973334701&doi=10.1109%2fTEVC.2015.2484840&partnerID=40&md5=7d5eeb9c9767212c3c161d0c7e6d1386","Evolutionary game theory; N-person trust game; trust; trust game","Behavioral research; Game theory; Evolutionary dynamics; Evolutionary game theory; Evolutionary games; Fundamental concepts; Initial population; Replicator dynamics; trust; Trust games; Dynamics"
"https://www.scopus.com/inward/record.uri?eid=2-s2.0-84982833718&doi=10.1109%2fTEVC.2015.2505317&partnerID=40&md5=04adbadbca26351ed4024a78c350d377","Combinatorial optimization; face-centered-cubic (FCC) lattice; genetic algorithms (GAs); HP model; macro-mutation; protein structure prediction (PSP); random-walk","Algorithms; Amino acids; Bioinformatics; Combinatorial optimization; Evolutionary algorithms; Forecasting; Genetic algorithms; Heuristic methods; Hydrophobicity; Macros; Proteins; Random processes; Face centered cubic lattice; Genetic algorithm (GAs); Hp model; Macro mutations; Protein structure prediction; Random Walk; Optimization"
"https://www.scopus.com/inward/record.uri?eid=2-s2.0-84973375450&doi=10.1109%2fTEVC.2015.2474158&partnerID=40&md5=82cad8d2f6b716f19bfe280643d38be8","Automatic algorithm configuration; evolutionary algorithms; multiobjective optimization; permutation flow shop problem (PFSP)","Algorithms; Combinatorial optimization; Design; Multiobjective optimization; Optimization; Parameter estimation; Algorithmic design; Automatic algorithms; Combinatorial optimization problems; Conceptual views; Multi objective evolutionary algorithms; Numerical parameters; Permutation flow shops; Software frameworks; Evolutionary algorithms"
"https://www.scopus.com/inward/record.uri?eid=2-s2.0-84973307746&doi=10.1109%2fTEVC.2015.2459718&partnerID=40&md5=702d116f42c8cea003342a9a5a5398b3","Many-objective optimization; mono-objective optimization; multiobjective optimization; non-dominated sorting genetic algorithm (NSGA)-III; unified algorithms","Algorithms; Constrained optimization; Equivalence classes; Genetic algorithms; Multiobjective optimization; Optimization; Problem solving; Engineering optimization design; Evolutionary algorithms (EAs); Evolutionary optimization algorithm; Many-objective optimizations; Non-dominated sorting genetic algorithms; Objective optimization; Population-based algorithm; Unified algorithm; Evolutionary algorithms"
"https://www.scopus.com/inward/record.uri?eid=2-s2.0-85002753738&doi=10.1109%2fTEVC.2016.2555315&partnerID=40&md5=08ca9fde2ed57b8ba55dcb32c74cb614","Data-driven optimization; evolutionary algorithm (EA); multiobjective optimization; surrogate; trauma system design","Evolutionary algorithms; Function evaluation; Hospital data processing; Multiobjective optimization; Problem solving; Regression analysis; Analytic functions; Data-driven optimization; Evolutionary optimizations; Management strategies; Multi-objective evolutionary optimizations; Multi-objective optimization problem; Optimization problems; surrogate; Optimization"
"https://www.scopus.com/inward/record.uri?eid=2-s2.0-84982830440&doi=10.1109%2fTEVC.2015.2504420&partnerID=40&md5=3c43a953fb6b88cb0e9fabebcd90ba2e","Classification; data mining; evolutionary computation; feature selection; machine learning","Artificial intelligence; Calculations; Classification (of information); Data mining; Evolutionary algorithms; Learning systems; Surveys; Classification algorithm; Feature selection problem; Improving performance; Issues and challenges; Lost opportunities; Search spaces; State of the art; Feature extraction"
"https://www.scopus.com/inward/record.uri?eid=2-s2.0-84890355666&doi=10.1109%2fTEVC.2013.2281527&partnerID=40&md5=14c1d238e894047cc880701b79596104","Grammatical evolution; Hyper-heuristics; Timetabling; Vehicle routing","Combinatorial optimization; Computational grammars; Heuristic methods; Scheduling; Vehicle routing; Acceptance criteria; Capacitated vehicle routing problem; Combinatorial optimization problems; Grammatical evolution; Hyper-heuristics; Neighborhood structure; Problem solving process; Timetabling; Problem solving"
"https://www.scopus.com/inward/record.uri?eid=2-s2.0-84901820581&doi=10.1109%2fTEVC.2013.2281502&partnerID=40&md5=c3d5ce3c9f4913991de4ecf8f64cd277","Combinatorial Optimisation Problems; fitness landscape; Graph- Colouring problem; long-range correlation; Maximum Satisfiability problem; Quadratic Assignment problem; scaling analysis; Travelling Salesman problem","Principal component analysis; Traveling salesman problem; Fitness landscape; Graph- Colouring problem; Long range correlations; Maximum satisfiability problems; Quadratic assignment problems; Scaling analysis; Travelling salesman problem; Combinatorial optimization"
"https://www.scopus.com/inward/record.uri?eid=2-s2.0-84926317673&doi=10.1109%2fTEVC.2014.2313659&partnerID=40&md5=0d3de36f1fff8536dc1aa2069e52aa4b","Differential perturbation; diversity; local information sharing; multimodal optimization; niching algorithm","Algorithms; Genetic algorithms; Information analysis; Information dissemination; Optimization; Particle swarm optimization (PSO); Stochastic systems; Differential perturbation; diversity; Local information sharing; Multi-modal optimization; Niching algorithms; Evolutionary algorithms"
"https://www.scopus.com/inward/record.uri?eid=2-s2.0-84921954403&doi=10.1109%2fTEVC.2014.2360890&partnerID=40&md5=714b9a7611a4651658f5b8ce75a89532","Differential evolution; global numerical optimization; individual-dependent; mutation strategy; Parameter setting","Benchmarking; Evolutionary algorithms; Optimization; Differential Evolution; Global numerical optimizations; individual-dependent; Mutation strategy; Parameter setting; Algorithms"
"https://www.scopus.com/inward/record.uri?eid=2-s2.0-84930944076&doi=10.1109%2fTEVC.2014.2326863&partnerID=40&md5=2cbd16f129ec704e1f8b2bf412b64c94","Biochemical oscillators; evolutionary algorithm (EA); molecular programming","Biochemistry; Evolutionary algorithms; Biochemical oscillators; Biochemical process; Biochemical systems; Chemical reaction networks; Molecular programming; Neuroevolution of augmenting topologies; Oscillation shapes; Oscillatory networks; Topology"
"https://www.scopus.com/inward/record.uri?eid=2-s2.0-84890397212&doi=10.1109%2fTEVC.2013.2247404&partnerID=40&md5=c7f09858ddc398cbc4f8800966e05e2f","Estimation of distribution algorithm; Large-scale optimization; Model complexity control","Evolutionary algorithms; Global optimization; Heuristic algorithms; Optimization; Population statistics; Black-box optimization; Continuous optimization; Curse of dimensionality; Estimation of distribution algorithms; High-dimensional problems; Higher-dimensional problems; Large-scale optimization; Model complexity; Problem solving"
"https://www.scopus.com/inward/record.uri?eid=2-s2.0-84930939687&doi=10.1109%2fTEVC.2014.2339823&partnerID=40&md5=61449e6b875bf0dd121d8dc163005ce9","Adaptive epsilon constraint handling; decomposition; evolutionary algorithm; many-objective optimization","Algorithms; Benchmarking; Decomposition; Optimization; Problem solving; Water management; Water resources; Bench-mark problems; Constraint handling; Distance measure; General aviation; Many-objective optimizations; Optimization problems; Systematic sampling; Waterresource management; Evolutionary algorithms"
"https://www.scopus.com/inward/record.uri?eid=2-s2.0-84930942738&doi=10.1109%2fTEVC.2014.2321259&partnerID=40&md5=aa5fe0244391d79fd692fa22c2c1c211","Geometric crossover; mutation; problem decomposition; program synthesis; reversible computing; semantics","Algorithms; Backpropagation; Backpropagation algorithms; Evolutionary algorithms; Genetic algorithms; Semantics; Geometric crossover; mutation; Problem decomposition; Program synthesis; Reversible Computing; Genetic programming"
"https://www.scopus.com/inward/record.uri?eid=2-s2.0-84926357040&doi=10.1109%2fTEVC.2014.2315442&partnerID=40&md5=28cce9bf849bc8a3fc6e03101c673dd9","Evolutionary many-objective optimization; evolutionary multiobjective optimization (EMO); many-objective problems","Algorithms; Combinatorial optimization; Evolutionary algorithms; Diversity improvement; Evolutionary multiobjective optimization; Highly-correlated; Many-objective optimizations; many-objective problems; Multi objective evolutionary algorithms; Performance deterioration; Scalarizing function; Multiobjective optimization"
"https://www.scopus.com/inward/record.uri?eid=2-s2.0-84901851233&doi=10.1109%2fTEVC.2013.2281503&partnerID=40&md5=e8111010399cc12e17bf62826570cf1d","Capacitated are routing problem; cooperative co-evolution; memetic algorithm; route distance grouping; scalability","Calculations; Scalability; Software engineering; Capacitated arc routing problem; Capacity constraints; Cooperative co-evolution; Decomposition scheme; Divide-and-conquer approach; Memetic algorithms; route distance grouping; Routing problems; Network routing"
"https://www.scopus.com/inward/record.uri?eid=2-s2.0-84897524208&doi=10.1109%2fTEVC.2013.2256427&partnerID=40&md5=bfa1e622075d48ef3870ccbf952e1589","Annual crop planning (ACP); computational intelligence; cuckoo search (CS); firefly algorithm; genetic algorithm (GA); glowworm optimization method; irrigation water requirements","Artificial intelligence; Bioluminescence; Crops; Irrigation; Crop planning; Cuckoo searches; Firefly algorithms; Glowworm optimizations; Irrigation water requirements; Genetic algorithms"
"https://www.scopus.com/inward/record.uri?eid=2-s2.0-84907854757&doi=10.1109%2fTEVC.2014.2336882&partnerID=40&md5=846e90665178e91644e052fc0f5f3729","Ant colony optimization (ACO); crossentropy (CE) optimization; discrete optimization; evolutionary computation; heuristic optimization; model-based optimization","Ant Colony Optimization (ACO); Cross entropy; Discrete optimization; Heuristic optimization; Model based optimization; Evolutionary algorithms"
"https://www.scopus.com/inward/record.uri?eid=2-s2.0-84905567326&doi=10.1109%2fTEVC.2013.2281532&partnerID=40&md5=e68efd6210417f1c8ea9cb6097c08f54","Artificial biochemical networks; Automated disease diagnosis; Classification; Genetic programming; Time series analysis","Classification (of information); Dynamical systems; Genetic algorithms; Genetic programming; Neurodegenerative diseases; Time series analysis; Age-matched controls; Biochemical network; Classifier ensembles; Combining classifiers; Differential diagnosis; Disease diagnosis; Movement characteristics; Parkinson's disease; Diagnosis"
"https://www.scopus.com/inward/record.uri?eid=2-s2.0-84930935926&doi=10.1109%2fTEVC.2014.2336865&partnerID=40&md5=8371faca3f1a1584711381ae4232163a","","Algorithms; Evolutionary algorithms; Genetic algorithms; Mathematical transformations; Multiobjective optimization; Optimal systems; Optimization; Ordinary differential equations; Pareto principle; Bi-objective optimization; Multi objective evolutionary algorithms; Multiple optimal solutions; Non-dominated sorting genetic algorithm - ii; Nonlinear equation system; Single objective optimization; Solving nonlinear equations; Transformation techniques; Nonlinear equations"
"https://www.scopus.com/inward/record.uri?eid=2-s2.0-84905591330&doi=10.1109%2fTEVC.2013.2281537&partnerID=40&md5=65148f6df0cca45de54ab762991aabe7","Building Blocks; Code Fragments; Genetic Programming; Layered Learning; Learning classifier Systems; Scalability","Genetic algorithms; Genetic programming; Multiplexing; Multiplexing equipment; Scalability; Building blockes; Code fragments; Even-Parity problems; Evolutionary computation techniques; Large-scale problem; Layered learning; Learning classifier system; Reusing buildings; Learning systems"
"https://www.scopus.com/inward/record.uri?eid=2-s2.0-84926306136&doi=10.1109%2fTEVC.2014.2306994&partnerID=40&md5=cb35c5a31bf2c0fe38321c0411bd43bd","Complexity measure; genetic programming; Pareto dominance; Tikhonov regularization","Genetic algorithms; Semantics; Complexity measures; Decision mechanism; Multiobjective genetic programming; Pareto dominance; Regression problem; Semantic information; Test errors; Tikhonov regularization; Genetic programming"
"https://www.scopus.com/inward/record.uri?eid=2-s2.0-84907808174&doi=10.1109%2fTEVC.2013.2283968&partnerID=40&md5=a245f9e9d1d4093ed1877736253268a7","ellipsoid model; Evolution strategy; progress rate; self-adaptation","Evolution strategies; Self adaptation"
"https://www.scopus.com/inward/record.uri?eid=2-s2.0-84907807481&doi=10.1109%2fTEVC.2013.2281508&partnerID=40&md5=432a51f85575947a11ba2438dca0174e","Automated content generation; evolutionary computation; games","Automated content generation; games; Map generation; Evolutionary algorithms"
"https://www.scopus.com/inward/record.uri?eid=2-s2.0-84901842931&doi=10.1109%2fTEVC.2013.2281529&partnerID=40&md5=c680f430a6278cf957cb8f27c8537418","Active Learning; Competitive Coevolution; Optimal Experiment Design; Shannon Information Criterion","Artificial intelligence; Genetic algorithms; Active Learning; Base-line performance; Competitive co evolutions; High-dimensional systems; Optimal experiment design; Shannon information; Shannon information theory; Symbolic expression; Design"
"https://www.scopus.com/inward/record.uri?eid=2-s2.0-84897502435&doi=10.1109%2fTEVC.2013.2251885&partnerID=40&md5=8b65628e7701ebfd90e1d7f380a65960","Combinatorial optimization; diversity; fitness assignment; frequency; genetic programming (GP); numerical optimization","Combinatorial optimization; Genetic algorithms; Genetic programming; Optimization; diversity; Evolution strategies; Fitness assignment; frequency; Meta-heuristic optimizations; Numerical optimizations; Objective functions; Optimization algorithms; Flood control"
"https://www.scopus.com/inward/record.uri?eid=2-s2.0-84922311259&doi=10.1109%2fTEVC.2013.2281540&partnerID=40&md5=2a78ea9337cab5497c06b24f7866adf8","Adaptive distance maps; fluoroscopy; joint kinematics; memetic algorithms (MAs)","Bone; Evolutionary algorithms; Fluorescent screens; Geometry; Gesture recognition; Kinematics; Learning algorithms; Learning systems; Medicine; Motion analysis; Motion estimation; Optimization; Reliability analysis; Accuracy and repeatabilities; Adaptive distance maps; fluoroscopy; Joint kinematics; Joint motion analysis; Local optimization algorithm; Memetic algorithms; Reliability and robustness; Algorithms"
"https://www.scopus.com/inward/record.uri?eid=2-s2.0-84897539411&doi=10.1109%2fTEVC.2013.2260548&partnerID=40&md5=78d63d873eb5cab52c892e9de938065a","Estimation of distribution algorithms; Generalized Mallows model; Permutation flowshop scheduling problem; Permutations-based optimization problems","Benchmarking; Heuristic algorithms; Optimization; Scheduling; Estimation of distribution algorithms; Flow shop scheduling problem; Mallows models; Optimization problems; Permutation flowshop scheduling problems; Probabilistic modeling; State-of-the-art approach; Variable neighborhood search; Evolutionary algorithms"
"https://www.scopus.com/inward/record.uri?eid=2-s2.0-84922354547&doi=10.1109%2fTEVC.2014.2304415&partnerID=40&md5=56b5a14c7a14a722c4952c3bb6ccb0c8","Estimation; Pareto optimization; uncertainty","Additive noise; Algorithms; Curricula; Estimation; Evolutionary algorithms; Optimization; Pareto principle; Competitive performance; Continuous spaces; Evolutionary multiobjective optimization; Noisy optimization; Pareto optimization; Real-world problem; Uncertain evaluation; uncertainty; Multiobjective optimization"
"https://www.scopus.com/inward/record.uri?eid=2-s2.0-84907857345&doi=10.1109%2fTEVC.2014.2349160&partnerID=40&md5=b613069229b71c361242f0a0b1086200","Algorithm design and analysis; computational complexity; computational intelligence; heuristic algorithms","Artificial intelligence; Heuristic algorithms; Algorithm design and analysis; Fixed budget; Computational complexity"
"https://www.scopus.com/inward/record.uri?eid=2-s2.0-84922260649&doi=10.1109%2fTEVC.2014.2306677&partnerID=40&md5=b378cd40fab81ec6fef57c975e4a96e7","Multimodal optimization; niching; search history; speciation; topology","Algorithms; Budget control; Evolutionary algorithms; Optimization; Computational overheads; Design and application; Distance-based methods; Multi-modal optimization; niching; Optimization problems; Search history; speciation; Topology"
"https://www.scopus.com/inward/record.uri?eid=2-s2.0-84914097965&doi=10.1109%2fTEVC.2013.2288779&partnerID=40&md5=306658f045a48414edd7673a81a685cd","crossbar-based nanoelectronics; defect-tolerant logic mapping (DTLM); fitness approximation; local search; maximum-bipartite-matching (MBM); Memetic algorithms","Approximation algorithms; Benchmarking; Combinatorial optimization; Computation theory; Computer circuits; Efficiency; Evolutionary algorithms; Health; Local search (optimization); Mapping; Problem solving; Bipartite matchings; fitness approximation; Local search; Logic mapping; Memetic algorithms; Optimization"
"https://www.scopus.com/inward/record.uri?eid=2-s2.0-84930943078&doi=10.1109%2fTEVC.2014.2322883&partnerID=40&md5=02af8c5e292df2a1b958f86ee54645e3","Control parameter tuning; multiobjective optimization; objective function evaluation (OFE) budget","Algorithms; Budget control; Control system analysis; Function evaluation; Optimization; Parameter estimation; Particle swarm optimization (PSO); Sensitivity analysis; Control parameters; Multi objective particle swarm optimization; Multi-objective optimization problem; Multiple objective functions; Numerical experiments; objective function evaluation (OFE) budget; Optimization algorithms; Stochastic optimization algorithm; Multiobjective optimization"
"https://www.scopus.com/inward/record.uri?eid=2-s2.0-84938576668&doi=10.1109%2fTEVC.2014.2343791&partnerID=40&md5=2a3d79e11de081d1f69e1371066fb601","Evolutionary algorithm; many-objective; robust optimization","Algorithms; Design; Optimization; Process engineering; Six sigma; Uncertainty analysis; Environmental conditions; Feasibility robustness; many-objective; Many-objective optimizations; Performance robustness; Robust design optimization; Robust optimization; Six sigma robust designs; Evolutionary algorithms"
"https://www.scopus.com/inward/record.uri?eid=2-s2.0-84907807131&doi=10.1109%2fTEVC.2014.2358376&partnerID=40&md5=e0951d2f062faad9c6568ee221a15634","",""
"https://www.scopus.com/inward/record.uri?eid=2-s2.0-84907327357&doi=10.1109%2fTEVC.2013.2286404&partnerID=40&md5=feda74ed7b70639213d11d548c1ac385","cyanobacterial blooms; Evolutionary algorithm; genetic programming; population-based algorithms",""
"https://www.scopus.com/inward/record.uri?eid=2-s2.0-84914115432&doi=10.1109%2fTEVC.2013.2286492&partnerID=40&md5=5e2003f2f076dc087a88b047d0c78e58","Evolutionary stability; game theory; iterated prisoner's dilemma; strategies","Stability; Evolution of cooperation; Evolutionary stability; Iterated prisoner's dilemma; Memory strategies; Novel strategies; Short memory; strategies; Theoretical study; Game theory"
"https://www.scopus.com/inward/record.uri?eid=2-s2.0-84922332964&doi=10.1109%2fTEVC.2013.2285122&partnerID=40&md5=4c945dece4d86465a1ce3bc5e133ddff","Bandwidth Allocation; Evolutionary Algorithm; MPEG-4; Scheduling; Traffic Estimation","Evolutionary algorithms; Frequency allocation; Genetic algorithms; Genetic programming; Motion Picture Experts Group standards; Multimedia systems; Regression analysis; Scheduling; Allocation efficiencies; Cartesian genetic programming; Contemporary techniques; Linear regression methods; MPEG-4; Multimedia streaming applications; Traffic estimation; Variable bit rate traffics; Bandwidth"
"https://www.scopus.com/inward/record.uri?eid=2-s2.0-84901833759&doi=10.1109%2fTEVC.2013.2281521&partnerID=40&md5=6e3c3c744035a4b749168b450cd9e769","continuous problem analysis; Dispersion; Euclidean distance; random sampling","Algorithms; Dispersion (waves); Algorithm performance; Computational effort; Continuous problems; Euclidean distance; Landscape analysis; Meta-heuristic optimizations; Random sampling; Sampling technique; Dispersions"
"https://www.scopus.com/inward/record.uri?eid=2-s2.0-84926365884&doi=10.1109%2fTEVC.2014.2316199&partnerID=40&md5=bb594d6e8008c6bbdbaab545cb816830","3-D printers; coevolution; surrogate-assisted evolution; wind turbines","Computational fluid dynamics; Design; Evolutionary algorithms; Neural networks; Wind tunnels; Aerodynamic efficiency; Artificial evolution; Co-evolution; Co-evolutionary algorithm; Computational fluid dynamics simulations; Mathematical formulation; surrogate-assisted evolution; Vertical axis wind turbines; Wind turbines"
"https://www.scopus.com/inward/record.uri?eid=2-s2.0-84893857606&doi=10.1109%2fTEVC.2013.2281396&partnerID=40&md5=44797bd3ec20725b494b9b561af888c9","Classification rules; data mining; fire evacuation; multiobjective evolutionary algorithms; particle swarm optimization","Data mining; Multiobjective optimization; Particle swarm optimization (PSO); Population statistics; Classification rules; Comparative experiments; Comprehensive learning; Emergency evacuation; Fire evacuation; Multi objective evolutionary algorithms; Multi objective particle swarm optimization; State-of-the-art methods; Classification (of information)"
"https://www.scopus.com/inward/record.uri?eid=2-s2.0-84930935903&doi=10.1109%2fTEVC.2014.2322121&partnerID=40&md5=06b2a7a0630c434ab933f07e67bcc2f1","Agent-based modeling; artificial stock market; genetic programming; social network","Algorithms; Autonomous agents; Commerce; Computational methods; Costs; Dynamics; Electric network topology; Financial data processing; Functional programming; Genetic algorithms; Social networking (online); Agent-based model; Artificial stock markets; Fully connected networks; Genetic programming algorithms; Information transmission; Preferential attachments; Social network structures; Word-of-mouth communication; Genetic programming"
"https://www.scopus.com/inward/record.uri?eid=2-s2.0-84907820583&doi=10.1109%2fTEVC.2013.2285111&partnerID=40&md5=653a3a8971be19ece2fc1e94d39c3f29","Computer chess; Fitness evaluation; Games; Genetic algorithms; Parameter tuning","Computer chess; Fitness evaluations; Games; Parameter-tuning; Genetic algorithms"
"https://www.scopus.com/inward/record.uri?eid=2-s2.0-84905591110&doi=10.1109%2fTEVC.2013.2281512&partnerID=40&md5=037478ec04223bb737ab3b02f6bd1860","Genetic programming; graph theory; optimization; search methods; sparse matrices","Fluid mechanics; Genetic algorithms; Genetic programming; Graph theory; Heuristic methods; Linear systems; Matrix algebra; Optimization; Engineering disciplines; Local search algorithm; Matrix elements; Number of methods; Search method; Sparse matrices; State-of-the-art algorithms; Symmetric matrices; Algorithms"
"https://www.scopus.com/inward/record.uri?eid=2-s2.0-84897524983&doi=10.1109%2fTEVC.2013.2255611&partnerID=40&md5=5d9c139dfbf6f0c0fd0162c38f31114f","Genetic algorithms (GAs); image processing; image representations; license plate detection; machine vision; road vehicle identification; sorting crossover","Color image processing; Computer vision; Image processing; Adaptive threshold method; Connected component analysis; Dynamic image processing; Genetic algorithm (GAs); Illumination conditions; Image representations; License plate detection; Road vehicle identification; Genetic algorithms"
"https://www.scopus.com/inward/record.uri?eid=2-s2.0-84907821155&doi=10.1109%2fTEVC.2013.2283513&partnerID=40&md5=b4dfffa20042f274119a83ef7f5d00a8","Cluster validity; Clustering; Genetic algorithm; Local search; Memetic algorithm; Niching method; Parameter Adaptation","Cluster validity; Clustering; Local search; Memetic algorithms; Niching methods; Parameter adaptation; Genetic algorithms"
