"Link","Author Keywords","Index Keywords"
"https://www.scopus.com/inward/record.uri?eid=2-s2.0-85103185284&doi=10.1109%2fTEVC.2021.3066285&partnerID=40&md5=962d09b9edbcd85c8b84cd23141ad392","Adversarial networks; attention model; evolutionary; multimodal; representation learning","Image enhancement; Image recognition; Learning systems; Adversarial networks; Attention mechanisms; Evolutionary training; Learning-based approach; Posterior distributions; Question Answering; Real-world datasets; Tag recommendations; Deep learning"
"https://www.scopus.com/inward/record.uri?eid=2-s2.0-85098754234&doi=10.1109%2fTEVC.2020.3046569&partnerID=40&md5=8429723fc66e7e097f504d03f6422197","Genetic programming (GP); population diversity; symbolic regression","Genetic algorithms; Metadata; Semantics; Diversity measure; Evolutionary process; Evolutionary techniques; Fitness functions; Population diversity; Pre-mature convergences; Selection operators; Symbolic regression; Genetic programming"
"https://www.scopus.com/inward/record.uri?eid=2-s2.0-85135754368&doi=10.1109%2fTEVC.2022.3194349&partnerID=40&md5=16ec6daed121ba24b5e2e6bdf335172c","attack strategy; attack-defense confrontation; Collaboration; Collision avoidance; denied environment; evolutionary algorithm; Fuzzy logic; Robot kinematics; Robot sensing systems; robot swarm; Robots; Swarm robotics","Collision avoidance; Deep learning; Evolutionary algorithms; Network security; Reinforcement learning; Robots; Swarm intelligence; Attack strategies; Attack-defense confrontation; Collaboration; Collisions avoidance; Denied environment; Fuzzy-Logic; Robot kinematics; Robot sensing system; Robot swarms; Swarm robotics; Fuzzy logic"
"https://www.scopus.com/inward/record.uri?eid=2-s2.0-85107351514&doi=10.1109%2fTEVC.2021.3085906&partnerID=40&md5=f4fbe36ea0f6ca5853d0ac94f0555238","Channel state information (CSI); fingerprint localization; genetic algorithm; neural network; tensor decomposition","Backpropagation; Data handling; Genetic algorithms; Indoor positioning systems; Iterative methods; Location; Neural networks; Tensors; Wavelet decomposition; Wi-Fi; Wireless local area networks (WLAN); Adaptive genetic algorithms; Back-propagation neural networks; Decomposition algorithm; Fingerprint database; Localization accuracy; Non-linear relationships; Processing complexity; Tensor decomposition; Channel state information"
"https://www.scopus.com/inward/record.uri?eid=2-s2.0-85140800682&doi=10.1109%2fTEVC.2022.3214503&partnerID=40&md5=39cce557574ba0dd5a80c847014d0db8","Artificial neural networks; Computational modeling; Computer architecture; Deep learning; Deep Learning; Evolutionary Computation; Evolutionary Deep Learning; Genetic Programming; Image classification; Image Classification; Small Data; Task analysis; Training","Classification (of information); Computer architecture; Deep learning; Genetic algorithms; Image analysis; Image classification; Job analysis; Network architecture; Neural networks; Computational modelling; Deep learning; Evolutionary deep learning; Images classification; Learning methods; New approaches; Small data; Task analysis; Genetic programming"
"https://www.scopus.com/inward/record.uri?eid=2-s2.0-85101751260&doi=10.1109%2fTEVC.2021.3060012&partnerID=40&md5=4dd9ba6613ef57d1ae9e78cea27787b0","Continuous dynamic real-world problems; dynamic benchmark problems; evolutionary algorithms; future directions; performance indicators; unconstrained continuous dynamic optimization","Evolutionary algorithms; Optimization; Surveys; Bench-mark problems; Continuous dynamic optimization; Continuous problems; Dynamic optimization; Evolutionary dynamics; Performance analysis; Performance indicators; Static optimization; Benchmarking"
"https://www.scopus.com/inward/record.uri?eid=2-s2.0-85103778486&doi=10.1109%2fTEVC.2020.3016049&partnerID=40&md5=18a5cdbd2d61e719491aea5a312e5e1e","Classification; duplication analysis; evolutionary algorithm (EA); feature selection; multiobjective optimization","Cell proliferation; Classification (of information); Feature extraction; Quality control; Classification datasets; Complex optimization problems; Evolutionary algorithms (EAs); Feature selection problem; Multiple-objectives; Performance metrics; Real-world problem; Single objective optimization; Evolutionary algorithms"
"https://www.scopus.com/inward/record.uri?eid=2-s2.0-85135203750&doi=10.1109%2fTEVC.2022.3193287&partnerID=40&md5=80f371d9e35272e61d2f46e7d133881a","Correction model; Correlation; Correlation; Evolutionary dynamic multiobjective optimization; Manifolds; Optimization; Prediction; Prediction algorithms; Predictive models; Self-adaptively selection; Sociology; Task analysis","Benchmarking; Evolutionary algorithms; Job analysis; Multiobjective optimization; Pareto principle; Correction models; Correlation; Dynamic multiobjective optimization; Evolutionary dynamic multiobjective optimization; Evolutionary dynamics; Manifold; Optimisations; Prediction algorithms; Predictive models; Self-adaptively selection; Task analysis; Forecasting"
"https://www.scopus.com/inward/record.uri?eid=2-s2.0-85100479441&doi=10.1109%2fTEVC.2021.3055538&partnerID=40&md5=da150aaa2bcd8e5c52c479dfa9cb2e5a","Constraint handling; evolutionary algorithms (EAs); multiobjective testing resource allocation; reliability constraint","Constrained optimization; Economic and social effects; Evolutionary algorithms; Managers; Resource allocation; Software reliability; Computational resources; Constraint handling; Constraint Solving; Constraint violation; Constraint-handling techniques; Multi objective evolutionary algorithms; System reliability; Tradeoff solution; Software testing"
"https://www.scopus.com/inward/record.uri?eid=2-s2.0-85099253961&doi=10.1109%2fTEVC.2021.3049131&partnerID=40&md5=cc37ccfae9f7e868405dd36f6a7e1218","Deep Q-learning (DQL); evolutionary computation; many-objective optimization; multiagent systems (MAS); task allocation.","Deep learning; Evolutionary algorithms; Learning systems; Multitasking; Reinforcement learning; Allocation methods; Allocation problems; Density estimation; Efficient strategy; Many-objective optimizations; Optimal solutions; Resource utilizations; Strength pareto evolutionary algorithm; Multi agent systems"
"https://www.scopus.com/inward/record.uri?eid=2-s2.0-85107232855&doi=10.1109%2fTEVC.2021.3081167&partnerID=40&md5=0eb4866664e9b882f4dcee30ed9a6dcc","Bayesian data analysis (BDA); benchmark comparison; black-box optimization; statistical models","Data handling; Information analysis; Bayesian data analysis; Benchmark comparison; Benchmark functions; Data transformation; Evolutionary computing; Hypothesis testing; Optimization algorithms; Standard practices; Statistics"
"https://www.scopus.com/inward/record.uri?eid=2-s2.0-85140772107&doi=10.1109%2fTEVC.2022.3215743&partnerID=40&md5=cb6ac36d07ec47690af6b02db8d8b6ff","knowledge transfer; multiform optimization; multitasking; Point cloud registration","Knowledge management; Surface measurement; Convergence characteristics; Global search capability; Knowledge transfer; Local optima; Multiform optimization; Optimisations; Point cloud registration; Point-clouds; Registration methods; Transfer strategies; Multitasking"
"https://www.scopus.com/inward/record.uri?eid=2-s2.0-85136875413&doi=10.1109%2fTEVC.2022.3199045&partnerID=40&md5=d8b6e12382a2c60624d616766318bcf4","Computational modeling; decomposition; deep reinforcement learning; evolutionary algorithms; Multi-objective optimization; Optimization; orienteering problems; pointer networks; Reinforcement learning; Sociology; Statistics; Training; Urban areas","Combinatorial optimization; Deep learning; Evolutionary algorithms; Learning algorithms; Multiobjective optimization; Personnel training; Reinforcement learning; Traveling salesman problem; Urban planning; Computational modelling; Deep reinforcement learning; Multi objective; Multi-objectives optimization; Optimisations; Orienteering problem; Pointer network; Reinforcement learnings; Urban areas; Iterative methods"
"https://www.scopus.com/inward/record.uri?eid=2-s2.0-85103771619&doi=10.1109%2fTEVC.2020.3023480&partnerID=40&md5=e9877e66813ebcf9bdd15711859865bb","Evolutionary multitasking (EMT); knowledge transfer; multifactorial optimization (MFO); multitask optimization (MTO); subspace aligning","Alignment; Evolutionary algorithms; Knowledge management; Base vectors; Bench-mark problems; Computationally efficient; Decision space; Information transfers; Knowledge transfer; Optimization algorithms; Optimization task; Vectors"
"https://www.scopus.com/inward/record.uri?eid=2-s2.0-85135754375&doi=10.1109%2fTEVC.2022.3194729&partnerID=40&md5=5ed79cc39123a28641a7000a25ba8981","Evolutionary constrained multiobjective optimization; multiobjective-based constraint-handling technique; reversed nondominated sorting; two-archive mechanism","Constrained optimization; Constraint handling; Multiobjective optimization; Constrained multiobjective optimization; Constraint-handling techniques; Evolutionary constrained multiobjective optimization; Multi objective; Multiobjective optimization problems; Multiobjective-based constraint-handling technique; Non-dominated Sorting; Objective functions; Reversed nondominated sorting; Two-archive mechanism; Evolutionary algorithms"
"https://www.scopus.com/inward/record.uri?eid=2-s2.0-85105887949&doi=10.1109%2fTEVC.2021.3079320&partnerID=40&md5=f8f95e15c49e231239cb05e92d4d34ca","Autoencoder; evolutionary algorithm (EA); learning classifier system (LCS); neural network; self-Adaptation; stochastic gradient descent; XCSF","Cost reduction; Classifier systems; Compression algorithms; Computational costs; Convergence time; Evaluating models; Global modeling; Learning classifier system; Local approximation; Learning systems"
"https://www.scopus.com/inward/record.uri?eid=2-s2.0-85103284100&doi=10.1109%2fTEVC.2021.3068842&partnerID=40&md5=6a1b92bbc3152402d754e785ad0c055d","Cooperative co-evolutionary algorithm; cooperative dual evolution; evolutionary computation (EC); generative adversarial networks (GANs); multiobjective optimization","Benchmarking; Economic and social effects; Multiobjective optimization; Adversarial networks; Co-evolutionary algorithm; Complementary property; Dual evolution; Generative model; Image datasets; Optimization problems; Soft mechanism; Evolutionary algorithms"
"https://www.scopus.com/inward/record.uri?eid=2-s2.0-85142795427&doi=10.1109%2fTEVC.2022.3222791&partnerID=40&md5=ec815d066dfa550d0a6e18586a34b646","Energy efficient; Flexible job shop; Optimization; Scheduling","Benchmarking; Energy efficiency; Evolutionary algorithms; Job shop scheduling; Productivity; Tabu search; Efficient scheduling; Energy efficient; Energy-consumption; Energy-Efficient Scheduling; Flexible job shops; High productivity; Individual-based; Manufacturing industries; Optimisations; Scheduling; Energy utilization"
"https://www.scopus.com/inward/record.uri?eid=2-s2.0-85100481330&doi=10.1109%2fTEVC.2021.3055076&partnerID=40&md5=f0c200c1a59bc067556142955bff4b39","CNN architecture encoding; CNN performance prediction; CNNs; Convolutional neural network (CNN) architecture description; data mining","Deep neural networks; Evolutionary algorithms; Logistic regression; Mean square error; Benchmark datasets; Computational resources; Differential methods; Mean square error criterions; Neural architectures; Performance prediction; Performance predictor; Search Algorithms; Network architecture"
"https://www.scopus.com/inward/record.uri?eid=2-s2.0-85099549591&doi=10.1109%2fTEVC.2021.3051172&partnerID=40&md5=25631b3e0d712abfc3d2fa4d16ec2efa","Change pattern; changing environment; dynamic test problem; evolutionary algorithm; niching","Errors; Global optimization; Numerical methods; Random processes; Adaptive mechanism; Change frequencies; Controlled experiment; Multi-modal optimization; Numerical results; Prediction errors; Prediction methods; Problem dimensionality; Forecasting"
"https://www.scopus.com/inward/record.uri?eid=2-s2.0-85099098409&doi=10.1109%2fTEVC.2020.3048174&partnerID=40&md5=43be0070f548eafff69fd4ccf042d353","Complex networks; graph embedding (GE); multiobjective optimization; robustness; surrogates","Complex networks; Computational efficiency; Multiobjective optimization; Computational costs; Computationally efficient; Multi objective evolutionary algorithms; Multi-objective robustness; Real-world networks; Robustness optimizations; Single objective optimization; State-of-the-art methods; Evolutionary algorithms"
"https://www.scopus.com/inward/record.uri?eid=2-s2.0-85140795338&doi=10.1109%2fTEVC.2022.3216349&partnerID=40&md5=d5b2fc8bf9f0211939a80e4958b6fe6e","Behavioral sciences; Benchmark testing; evolutionary computation; majority; Needles; neutrality; Optimization; plateau; run time analysis; Search problems; Trajectory; Upper bound","Behavioral research; Computation theory; Local search (optimization); Behavioral science; Benchmark testing; Local search; Majority; Neutrality; Optimisations; Plateau; Run-time analysis; Search problem; Upper Bound; Evolutionary algorithms"
"https://www.scopus.com/inward/record.uri?eid=2-s2.0-85137608730&doi=10.1109%2fTEVC.2022.3201890&partnerID=40&md5=c9bda886ecc433efd386581c52499704","Adaptive mechanism; Convergence; Decomposition-based multi-objective optimization algorithm; Linear programming; Neighborhood adjustment; Optimization; Runtime; Search problems; Sociology; Statistics; Weight vector","Evolutionary algorithms; Multiobjective optimization; Optimal systems; Population statistics; Vectors; Adaptive mechanism; Convergence; Decomposition-based multi-objective optimization algorithm; Linear-programming; Multi-objectives optimization; Neighborhood adjustment; Neighbourhood; Optimisations; Optimization algorithms; Runtimes; Search problem; Weight vector; Linear programming"
"https://www.scopus.com/inward/record.uri?eid=2-s2.0-85102617958&doi=10.1109%2fTEVC.2021.3064508&partnerID=40&md5=493d9b2d9ce0ad4483629bc7209b52d0","Evolution strategy; multimodal multiobjective evolutionary algorithm (MMOEA); multimodal multiobjective optimization problem (MMOP)","Evolutionary algorithms; Optimal systems; Pareto principle; Evolution strategies; Multi objective evolutionary algorithms; Multi-objective optimization problem; Niching strategies; Pareto optimal solutions; Performance indicators; Self-adaptive strategy; State of the art; Multiobjective optimization"
"https://www.scopus.com/inward/record.uri?eid=2-s2.0-85137931049&doi=10.1109%2fTEVC.2022.3205286&partnerID=40&md5=12cd7a53f42b87a5453da3b96be8fc4e","Constraints; Genetic programming; Genetic Programming; Physics; Predictive models; Satisfiability Modulo Theories; Springs; Standards; Symbolic regression; Task analysis; Training","Benchmarking; Formal logic; Genetic algorithms; Job analysis; Learning systems; Regression analysis; Constraint; Formal constraints; Monotonicity; Predictive models; Property; Regression problem; Satisfiability modulo Theories; Symbolic regression; Target model; Task analysis; Genetic programming"
"https://www.scopus.com/inward/record.uri?eid=2-s2.0-85107235570&doi=10.1109%2fTEVC.2021.3080683&partnerID=40&md5=89593652accee68af5936ce3b88208c7","Combinatorial optimization; evolutionary algorithm (EA); knapsack problem (KP); set theory (ST); transforming process","Combinatorial optimization; Set theory; Combinatorial optimization problems; Feasible solution; Feasible solution set; Knapsack problems; Local optimal solution; New solutions; Solution set; Evolutionary algorithms"
"https://www.scopus.com/inward/record.uri?eid=2-s2.0-85092034572&doi=10.1109%2fTEVC.2020.2967501&partnerID=40&md5=5002cc1ef932a2215a901c82525a26f3","Benchmark test suite; inequality constraint; large-scale multiobjective optimization; time-varying ratio error estimation (TREE); voltage transformer (VT)","Benchmarking; Constraint theory; Electric power transmission; Forestry; Power transformers; Evolutionary multiobjective optimization; Inequality constraint; Multi-objective optimization problem; Multiple-objectives; Optimization problems; Power delivery systems; Real-world problem; Voltage transformer; Multiobjective optimization"
"https://www.scopus.com/inward/record.uri?eid=2-s2.0-85083432037&doi=10.1109%2fTEVC.2020.2987361&partnerID=40&md5=8a4f80c2f4bba901019c2eae40f181e1","Estimation of distribution algorithms (EDAs); genetic drift; running time analysis; theory","Ant colony optimization; Genetic algorithms; Population distribution; Probability distributions; Compact genetic algorithm; Estimation of distribution algorithms; Evolutionary algorithms (EAs); MAX MIN Ant systems; Population based incremental learning; Probabilistic modeling; Sampling frequencies; Univariate marginal distribution algorithms; Iterative methods"
"https://www.scopus.com/inward/record.uri?eid=2-s2.0-85077910240&doi=10.1109%2fTEVC.2020.2966014&partnerID=40&md5=a5275b8a6e6ae7ff2ed847304e5c6a74","Evolutionary multiobjective optimization (EMO); optimal distributions of objective vectors; quality indicators","Benchmarking; Multiobjective optimization; Evolutionary multiobjective optimization; Objective space; Optimal distributions; Pareto front; Problem formulation; Quality indicators; Quality control"
"https://www.scopus.com/inward/record.uri?eid=2-s2.0-85065121134&doi=10.1109%2fTEVC.2019.2911736&partnerID=40&md5=254b55854cf72a37953be3b805e953e7","Assignment graph; evolutionary algorithm (EA); fuzzy subset; two-echelon vehicle routing problem (2E-VRP)","Evolutionary algorithms; Fuzzy systems; Iterative methods; Learning systems; Optimization; Routing algorithms; Sales; Satellites; Statistics; Vehicle routing; an assignment graph; Fuzzy subset; Routing; Sociology; Vehicle Routing Problems; Graphic methods"
"https://www.scopus.com/inward/record.uri?eid=2-s2.0-85070416991&doi=10.1109%2fTEVC.2019.2930316&partnerID=40&md5=bba03b4be569c9099dc9c07eb851950a","Conically constrained problem; evolution strategies (ESs); intermediate recombination; repair by projection","Approximation algorithms; Constrained optimization; Differential equations; Heuristic algorithms; Maintainability; Mathematical models; Next generation networks; Optimization; Repair; Constrained problem; Evolution strategies; intermediate recombination; Next generation networking; Steady state; Evolutionary algorithms"
"https://www.scopus.com/inward/record.uri?eid=2-s2.0-85082992962&doi=10.1109%2fTEVC.2019.2919762&partnerID=40&md5=4e85ce9e53cd0d984d317fee36bc7526","High-dimensional expensive problems; multiple surrogates; prescreening strategy; simplified Kriging; surrogate-assisted evolutionary algorithm; surrogate-guided crossover operation; trust region method","Interpolation; Crossover operations; High-dimensional; Kriging; multiple surrogates; Prescreening; Trust-region methods; Genetic algorithms"
"https://www.scopus.com/inward/record.uri?eid=2-s2.0-85097405665&doi=10.1109%2fTEVC.2019.2917709&partnerID=40&md5=7ea89a7e77ea43afb77f9bd1326a5090","Convex quadratic function; finite-sample analysis; information geometric optimization (IGO); learning rates; single step expected improvement","Eigenvalues and eigenfunctions; Gaussian distribution; Optimization; Sampling; Stochastic systems; Black-box optimization; Deterministic algorithms; Expected improvements; Finite sample sizes; Geometric optimization; Objective functions; Quadratic function; Stochastic search algorithms; Geometry"
"https://www.scopus.com/inward/record.uri?eid=2-s2.0-85081565861&doi=10.1109%2fTEVC.2020.2980111&partnerID=40&md5=41e42cdfe521fac70ac8c50a26dbad3b","Combinatorial optimization; Markov chain; metropolis algorithm; minimum-weight codeword; mixing time analysis; randomized local search heuristics","Approximation algorithms; Combinatorial optimization; Gas generators; Heuristic algorithms; Markov chains; Markov processes; Matrix algebra; Optimization; Space time codes; Codeword; Linear codes; Metropolis algorithms; Mixing time; Randomized local search; Search problem; C (programming language)"
"https://www.scopus.com/inward/record.uri?eid=2-s2.0-85086003080&doi=10.1109%2fTEVC.2019.2928991&partnerID=40&md5=c1a0cb5666f24b223d68c265efe9ff93","Dynamic tree data structures; evolutionary algorithms (EAs); tree representations","Data Sharing; Evolutionary algorithms; Graph structures; Efficient data structures; Evolutionary algorithms (EAs); Mutation operators; Optimization method; Spanning tree problems; Time complexity; Tree data structures; Tree representation; Trees (mathematics)"
"https://www.scopus.com/inward/record.uri?eid=2-s2.0-85071754589&doi=10.1109%2fTEVC.2019.2938531&partnerID=40&md5=52e98b45c4370ef15cca905de3df4e67","Cooperation; differential evolution (DE); evolutionary algorithm (EA); protein structure prediction (PSP); underestimation","Evolutionary algorithms; Forecasting; Genetic algorithms; Proteins; Benchmark functions; cooperation; Differential Evolution; Effectiveness and efficiencies; Evolutionary process; Protein 3-D structure; Protein structure prediction; underestimation; Bioinformatics"
"https://www.scopus.com/inward/record.uri?eid=2-s2.0-85072963306&doi=10.1109%2fTEVC.2019.2941824&partnerID=40&md5=8ea397984418215b918ec65cc70f42f7","Graph matching; large-scale optimization; metaheuristics; virtual network embedding (VNE)","Bandwidth; Decision making; Embeddings; Graphic methods; Heuristic algorithms; Optimization; Pattern matching; Polynomial approximation; Set theory; Substrates; Classification algorithm; Graph matchings; Large-scale optimization; Meta heuristics; Search problem; Virtual network embedding; Evolutionary algorithms"
"https://www.scopus.com/inward/record.uri?eid=2-s2.0-85065981548&doi=10.1109%2fTEVC.2019.2917275&partnerID=40&md5=b548b1fbd2ffcdeeef89d4ff4fac7573","Evolutionary algorithm (EA); noise fitness model; population diversity","Biodiversity; Correlation methods; Dispersion (waves); Evolutionary algorithms; Genetic algorithms; Health; Random variables; Sociology; Arithmetic crossover; Covariance matrices; Experimental validations; Fitness modeling; Genetics; Multi-dimensional case; Population diversity; Prediction accuracy; Covariance matrix"
"https://www.scopus.com/inward/record.uri?eid=2-s2.0-85100293380&doi=10.1109%2fTEVC.2020.3009390&partnerID=40&md5=1005df03223298e243e38037f4339511","Cooperative co-evolution (CC); decomposition; large-scale global optimization","Calculations; Software engineering; Computational costs; Computational resources; Continuous problems; Cooperative co-evolution; Evolutionary framework; Historical information; Large-scale optimization; Optimization problems; Optimization"
"https://www.scopus.com/inward/record.uri?eid=2-s2.0-85089873389&doi=10.1109%2fTEVC.2019.2950935&partnerID=40&md5=b5a18344f2b7f2a4b3afbfb564c63c69","Complex networks; evolutionary algorithm (EA); graph embedding (GE); robustness; surrogate-assisted optimization","Complex networks; Embeddings; Evolutionary algorithms; Optimization; Computation time; Computational costs; Computationally efficient; Large-scale network; Robust optimization; Robust optimization method; Robustness measures; State-of-the-art methods; Cost estimating"
"https://www.scopus.com/inward/record.uri?eid=2-s2.0-85083040099&doi=10.1109%2fTEVC.2019.2916183&partnerID=40&md5=b66ffcaf25dca36544548d75f3922507","Convolutional neural network (CNN); deep learning; genetic algorithms (GAs); image classification","Convolution; Deep neural networks; Gene encoding; Genetic algorithms; Heuristic algorithms; Heuristic methods; Image classification; Network architecture; Scales (weighing instruments); Classification error rate; Computational resources; Fitness evaluations; Gradient-based optimization; Neural network designs; Representation schemes; State-of-the-art methods; Variable length gene encoding; Convolutional neural networks"
"https://www.scopus.com/inward/record.uri?eid=2-s2.0-85097394683&doi=10.1109%2fTEVC.2020.3035225&partnerID=40&md5=0e2370bcb5d8f853cdfe0a542585cca7","",""
"https://www.scopus.com/inward/record.uri?eid=2-s2.0-85090041091&doi=10.1109%2fTEVC.2020.2987804&partnerID=40&md5=4b2c0051789251927476607306773000","Bilevel optimization; evolutionary algorithms (EAs); interaction; lower-level variables; mobile edge computing (MEC); resource pricing; upper-level variables","Quadratic programming; Bi-level optimization; Bilevel optimization problems; Constraint violation; Evolutionary algorithms (EAs); Fitness evaluations; Objective functions; Optimal solutions; Sequential quadratic programming; Evolutionary algorithms"
"https://www.scopus.com/inward/record.uri?eid=2-s2.0-85100398615&doi=10.1109%2fTEVC.2020.3008822&partnerID=40&md5=efb873864ffa9675123ddccc25227c48","Clustering; evolutionary algorithm; multimodal optimization; multiobjective optimization","Clustering algorithms; Multiobjective optimization; Population statistics; Bench-mark problems; Decision space; Dual clustering; Multi objective evolutionary algorithms; Multi-objective evolutionary optimizations; Nondominated solutions; Objective space; Population sizes; Evolutionary algorithms"
"https://www.scopus.com/inward/record.uri?eid=2-s2.0-85089729785&doi=10.1109%2fTEVC.2019.2956633&partnerID=40&md5=176bee61f3336a52942c0c2c8462eb21","Estimation-of-distribution algorithm (EDA); run time analysis; theory","Heuristic algorithms; Iterative methods; Polynomial approximation; Population statistics; Probability distributions; Benchmark functions; Compact genetic algorithm; Compact genetic algorithm (cga); Distributed modeling; Estimation of distribution algorithms; Probabilistic modeling; Quasi-linear time; Randomized search heuristics; Genetic algorithms"
