"Link","Author Keywords","Index Keywords"
"https://www.scopus.com/inward/record.uri?eid=2-s2.0-67349115362&doi=10.1109%2fTEVC.2008.923394&partnerID=40&md5=f5d18d85f84282d5cd16983790baef1e","Artificial immune system (AIS); Associative classification (AC); Evolutionary computations","Association rules; Immunology; Mining; Artificial immune system (AIS); Associative classification (AC); Classification accuracies; Classification process; Classification techniques; Evolutionary computations; Large data sets; Mining association rules; New approaches; Rule discoveries; Rule searches; Search spaces; Associative processing"
"https://www.scopus.com/inward/record.uri?eid=2-s2.0-69249171350&doi=10.1109%2fTEVC.2008.2011478&partnerID=40&md5=1f490a6fe9b6136ad2356c9d73564dc1","Ant algorithms; Grid; Information dissemination; Information system; Peer-to-peer (P2P); Resource discovery","Ad hoc networks; Algorithms; Cellular automata; Information dissemination; Metadata; Ant algorithms; Ant systems; ANTARES; Bio-inspired algorithms; Computational grids; Descriptors; Dynamic grid; Global levels; Grid; Grid resource; Metadata information; Peer-to-peer (P2P); Performance analysis; Range query; Resource discovery; Self organizing; Self-organized; Self-structured organization; Simple operation; Spatial ordering; Structured P2P; Structured systems; Swarm algorithms; Swarm Intelligence; Information systems"
"https://www.scopus.com/inward/record.uri?eid=2-s2.0-57149123339&doi=10.1109%2fTEVC.2007.904345&partnerID=40&md5=34b5c79a9cf9179c3199efabaa4ebf92","Code-division multiple-access (CDMA) networks; Dominance; Multiple objectives; Simulated annealing","Annealing; Binary sequences; Code division multiple access; Convergence of numerical methods; Multiobjective optimization; Perturbation techniques; Wireless networks; Air interfaces; Code-division multiple-access (CDMA) networks; Composite functions; Composite objective functions; Dominance; Industrial problems; Mobile telecommunications; Multi objectives; Multiple access; Multiple objectives; Non-dominated solutions; Nsga-ii; Optimizer; Optimizers; Other algorithms; Pareto fronts; Rapid convergences; Scalings; Single-objective genetic algorithms; Standard tests; System energies; Simulated annealing"
"https://www.scopus.com/inward/record.uri?eid=2-s2.0-56549108841&doi=10.1109%2fTEVC.2007.903551&partnerID=40&md5=5d22b9fab68f02ab1a5807f8e085e7ab","Closest classifier matching (CCM); Compaction; Condensation; Function approximation; Genetic algorithm (GA); Hyperellipsoids; Learning classifier system (LCS); Neural network (NN); Recursive least squares (RLS); Self organization; XCS","Approximation algorithms; Classifiers; Compaction; Condensation; Curve fitting; Fuzzy control; Genetic algorithms; Heuristic algorithms; Learning algorithms; Learning systems; Mathematical operators; Neural networks; Optimization; Piecewise linear techniques; Population statistics; Recursive functions; Closest classifier matching (CCM); Function approximation; Hyperellipsoids; Learning classifier system (LCS); Neural network (NN); Recursive least squares (RLS); Self organization; XCS; Least squares approximations"
"https://www.scopus.com/inward/record.uri?eid=2-s2.0-70349866649&doi=10.1109%2fTEVC.2009.2021465&partnerID=40&md5=b9194d5fa0571020a263212ca3dfbced","Continuous optimization; Experimental analysis; Integration of algorithmic components; Particle swarm optimization (PSO); Run-time distributions; Swarm intelligence","Algorithms; Cellular automata; Integration; Composite algorithm; Composite particles; Continuous optimization; Difference points; Empirical studies; Experimental analysis; Experimental studies; Optimizers; Original particle swarm optimization; Performance evaluation; PSO algorithms; Run-time distributions; Swarm intelligence; Particle swarm optimization (PSO)"
"https://www.scopus.com/inward/record.uri?eid=2-s2.0-76149086477&doi=10.1109%2fTEVC.2009.2023793&partnerID=40&md5=ff0debb66c24dd0129774f1fbe151138","Blockmodel; Grouping genetic algorithm (GGA); Social network analysis","Electric network analysis; Blockmodel; Computational time; Grouping genetic algorithms; Large groups; Large sizes; Research areas; Social Network Analysis; Genetic algorithms"
"https://www.scopus.com/inward/record.uri?eid=2-s2.0-70349860273&doi=10.1109%2fTEVC.2009.2014613&partnerID=40&md5=7b61ae583e2c12ed7f8730d0be4505dd","Adaptive parameter control; Differential evolution; Evolutionary optimization; External archive","Adaptive algorithms; Control system analysis; Convergence of numerical methods; Particle swarm optimization (PSO); Silicate minerals; Adaptive parameter control; Bench-mark problems; Control parameters; Convergence performance; DE algorithms; Differential evolution; Differential evolution algorithms; Evolutionary optimization; External archive; High-dimensional problems; Historical data; Mutation strategy; Optimization problems; Parameter adaptation; Parameter setting; Prior knowledge; Simulation result; Parameter estimation"
"https://www.scopus.com/inward/record.uri?eid=2-s2.0-70349860274&doi=10.1109%2fTEVC.2009.2012163&partnerID=40&md5=f671ab41014861822811fbf483b81c87","Categorical attributes; Fuzzy clustering; Multiobjective genetic algorithm; Pareto optimality","Cluster analysis; Fuzzy clustering; Fuzzy systems; Genetic algorithms; Multiobjective optimization; Pareto principle; Categorical attributes; Categorical data; Categorical data clustering; Categorical datasets; Clustering solutions; Clustering techniques; Continuous data; Data sets; Fuzzy compactness; Growing demand; Majority voting; Multi objective; Multiobjective approach; Multiobjective genetic algorithm; Novel methods; Pareto front; Pareto optimal solutions; Pareto optimality; Statistical significance test; Clustering algorithms"
"https://www.scopus.com/inward/record.uri?eid=2-s2.0-70349847838&doi=10.1109%2fTEVC.2009.2015575&partnerID=40&md5=eed2e53c717b84403b8d00b3bf2280cb","Complexity analysis; Computational geometry; Multiobjective optimization; Performance assessment","Approximation algorithms; Computational complexity; Computational geometry; Computer science; Control theory; Evolutionary algorithms; Set theory; Complex nature; Complexity analysis; Compromise solutions; D dimensions; Hypervolume; Klee's measure problem; Lower bounds; Multiobjective optimizers; Optimal sets; Optimizers; Pareto front; Performance assessment; Point set; Quality measures; Real-life problems; S-metric; Upper Bound; Multiobjective optimization"
"https://www.scopus.com/inward/record.uri?eid=2-s2.0-65449172945&doi=10.1109%2fTEVC.2008.2003009&partnerID=40&md5=1195d6926041139c5546a3ce6ae6b11b","Evolution; Genetic algorithm (GA); Incremental learning (IL); Prisoner's dilemma","Education; Genetic algorithms; Learning systems; Neural networks; Probabilistic logics; Adaptation frameworks; Complementary features; Double loops; Dynamic environments; Evolution; Evolutionary process; Feedback learning; Incremental learning (IL); Iterated prisoner's dilemmas; Learning strategies; Memetic; Prisoner's dilemma; Simulation results; Learning algorithms"
"https://www.scopus.com/inward/record.uri?eid=2-s2.0-59749106662&doi=10.1109%2fTEVC.2008.915992&partnerID=40&md5=6f0a9c4845ee838f98cb44fb311b4dfd","Evolutionary computation; Fuzzy systems; Portfolio management; Stock market; Trading systems","Artificial intelligence; Commerce; Financial data processing; Fuzzy sets; Fuzzy systems; Intelligent control; Investments; Comprehensive analysis; Computational intelligences; Dynamic markets; Evolutionary computation; Evolutionary process; Financial industries; Fuzzy logic rules; Portfolio evaluations; Portfolio management; Stock market; Trading rules; Trading systems; Fuzzy logic"
"https://www.scopus.com/inward/record.uri?eid=2-s2.0-71549150874&doi=10.1109%2fTEVC.2009.2028646&partnerID=40&md5=dadec6d39ad4b2f237e0748fe9a656c9","",""
"https://www.scopus.com/inward/record.uri?eid=2-s2.0-67349159859&doi=10.1109%2fTEVC.2008.923391&partnerID=40&md5=bba254bbe90b3704e9146989ead0ee12","Benchmark application; Economic externalities; Groundwater management; Multiobjective evolutionary algorithm; Pareto set approximation; PISA","Applications; Approximation algorithms; Benchmarking; Decision support systems; Groundwater; Groundwater resources; Hand tools; Hydrogeology; Multiobjective optimization; Pareto principle; Planning; Sustainable development; Water management; Benchmark application; Groundwater management; Multiobjective evolutionary algorithm; Pareto set approximation; PISA; Evolutionary algorithms"
"https://www.scopus.com/inward/record.uri?eid=2-s2.0-67650188577&doi=10.1109%2fTEVC.2008.2008797&partnerID=40&md5=ff7d6a0e9b8443854c038e2b520d9e11","Automatic programming; Computer science education; Educational technology; Genetic algorithms","Computer aided software engineering; Computer software; Education computing; Inspection equipment; Students; Unmanned aerial vehicles (UAV); Computer science education; Detecting plagiarism; Educational technology; Empirical evidence; Grammar evolution; Plagiarism detection; Programming assignments; Programming language; Software tool; Time-consuming tasks; Computer programming"
"https://www.scopus.com/inward/record.uri?eid=2-s2.0-69249232044&doi=10.1109%2fTEVC.2009.2017516&partnerID=40&md5=09a0171c0c0f74e6c549eabc3c7b9f97","Fault detection; Self-organization; Swarm intelligence; Swarm robotics; Synchronization","Algorithms; Bioluminescence; Cellular automata; Fault detection; Fault tolerance; Fault tolerant computer systems; Light emitting diodes; Quality assurance; Robotics; Synchronization; Catastrophic failures; Decentralized algorithms; Failure rate; Fault-tolerant; Lightemitting diode; Real-world; Self-organization; Self-repair; Swarm intelligence; Swarm robotic systems; Swarm robotics; Robots"
"https://www.scopus.com/inward/record.uri?eid=2-s2.0-59749092617&doi=10.1109%2fTEVC.2008.920677&partnerID=40&md5=a1b15c1bcff8f9c174dd8018c54f12ba","Evolution strategies; Multicriteria design; Multiobjective optimization; Multiply-specified tracking filters","Air filters; Air traffic control; Airport buildings; Control towers; Design; Evolutionary algorithms; Function evaluation; Global optimization; Optimization; Specifications; Aggregation schemes; Air traffics; Computational loads; Engineering designs; Evolution strategies; Evolutionary computation techniques; Fitness functions; Global optimization techniques; Multi-objective problems; Multicriteria design; Multiobjective evolutionary algorithms; Multiply-specified tracking filters; Nonlinear tracking; Performance specifications; Problem sizes; Real-world; Worst case; Multiobjective optimization"
"https://www.scopus.com/inward/record.uri?eid=2-s2.0-76149104896&doi=10.1109%2fTEVC.2009.2016569&partnerID=40&md5=79076694fbf4d457a20155e24470f7b6","Convergence; Evolutionary algorithms; Multiobjective optimization; Pareto set approximation; Preference articulation","Approximation algorithms; Convergence of numerical methods; Evolutionary algorithms; Pareto principle; Set theory; Algorithm design; Convergence; Convergence properties; Evolutionary multiobjective optimization; Multiobjective search; Optimizers; Pareto set; Performance assessment; Preference relation; Set problems; Statistical performance; Multiobjective optimization"
"https://www.scopus.com/inward/record.uri?eid=2-s2.0-76149094484&doi=10.1109%2fTEVC.2009.2025032&partnerID=40&md5=ec58bc26bcd5691bff08e94ea6539761","Evolvable hardware; Field programmable gate arrays; Genetic algorithm; IP core","Field programmable gate arrays (FPGA); Function evaluation; Hardware; Health; Logic gates; Number theory; Optimization; Population statistics; Random number generation; Search engines; Application-Specific; Block memories; Clock speed; Crossover and mutation; Customizable; Evolvable hardware; Experimental test; Fitness evaluations; Fitness functions; Hardware experiment; Hardware implementations; IP core; Netlist; Optimal solutions; Optimization engine; Optimum solution; Population sizes; Programmability; Random number generators; Real-time application; Software implementation; Standard optimization; System architectures; Test functions; Genetic algorithms"
"https://www.scopus.com/inward/record.uri?eid=2-s2.0-57149125006&doi=10.1109%2fTEVC.2008.926734&partnerID=40&md5=0ac2b022154c16ab38e447442e37d99e","Binary coding; Global numerical optimization; Real number coding; Stochastic children; Stochastic genetic algorithm (StGA); Variance adaptation",""
"https://www.scopus.com/inward/record.uri?eid=2-s2.0-65749094710&doi=10.1109%2fTEVC.2008.2009457&partnerID=40&md5=e5229e878dfc59ed6368aea39ce93418","Differential evolution; Evolutionary algorithms; Meta-heuristics; Numerical optimization; Particle swarm optimization","Frequency estimation; Function evaluation; Global optimization; Heuristic algorithms; Heuristic methods; Parameter estimation; Spectroscopy; Benchmark functions; Continuous spaces; Differential evolution; Evolutionary computing; Exploration and exploitation; Frequency modulated; Meta-heuristics; Mutation operators; Numerical optimization; Parameter vectors; Phase codes; Premature convergence; PSO algorithms; Real-life problems; Real-world problem; Search heuristics; Sound waves; Spread spectrum radars; Particle swarm optimization (PSO)"
"https://www.scopus.com/inward/record.uri?eid=2-s2.0-57149134232&doi=10.1109%2fTEVC.2008.920673&partnerID=40&md5=300d26f5a64589529e1e2d7841630c7e","Artificial immune systems; Clonal selection principle; Data mining; Gene expression programming","Antigens; Bioactivity; Chemical shift; Computational linguistics; Computer programming; Data mining; Decision support systems; Gene expression; Genetic algorithms; Immunology; Information management; Knowledge management; Magnetic anisotropy; Artificial immune systems; Benchmark problems; Classification rules; Clonal selection algorithms; Clonal selection principle; Clonal Selection Principles; Clonal selections; CLONALG; Data classes; Data mining tasks; Evolutionary techniques; Foreign antigens; Gene expression programming; Gene Expression programmings; Hybrid techniques; Immune responses; Immune systems; Prediction accuracies; Receptor editing; Computer software selection and evaluation"
"https://www.scopus.com/inward/record.uri?eid=2-s2.0-67349183953&doi=10.1109%2fTEVC.2008.2004422&partnerID=40&md5=8f3a4d50137ce0c21237778c2e1891cc","Coevolution; Evolutionary algorithms; Minimax optimization; Robust design","Design; Evolutionary algorithms; Optimization; Classical techniques; Co-evolutionary; Coevolution; Discrete forms; Existing methods; Minimax optimization; Minimax problems; Optimization techniques; Robust design; Robust pole placements; Ship engineerings; Test problems; Problem solving"
"https://www.scopus.com/inward/record.uri?eid=2-s2.0-67650164999&doi=10.1109%2fTEVC.2008.2008799&partnerID=40&md5=17012adc0c336e46de34eef39bfce0d7","Bias; Edge-sets; One-max tree problem; Optimal communication spanning tree (OCST) problem; Tree representation","Communication; Encoding (symbols); Evolutionary algorithms; Heuristic algorithms; Heuristic methods; Optimal systems; Optimization; Bias; Edge-sets; One-max tree problem; Optimal communication spanning tree (OCST) problem; Tree representation; Graph theory"
"https://www.scopus.com/inward/record.uri?eid=2-s2.0-71549154408&doi=10.1109%2fTEVC.2008.2003010&partnerID=40&md5=582e59020955120a815a94ed0854f2e0","Coarse grained algorithm; Optimization; Probabilistic models; Quantum computing","Computer science; Optimization; Quantum computers; Quantum theory; Coarse grained algorithms; Convergence behaviors; Estimation of distribution algorithms; Learning speed; Multi-model; Multimodel approach; Optimization problems; Original algorithms; Probabilistic models; Quantum Computing; Quantum inspired evolutionary algorithm; Search spaces; Single model approach; Solution quality; Evolutionary algorithms"
"https://www.scopus.com/inward/record.uri?eid=2-s2.0-70349866664&doi=10.1109%2fTEVC.2009.2014362&partnerID=40&md5=ce2d5dded2fda44b93ab1df889eeccba","Combinatorial optimization; Computational complexity; Evolutionary algorithms; Vertex cover; Worst-case approximation","Approximation algorithms; Combinatorial optimization; Computational complexity; Computational efficiency; Control theory; Learning algorithms; Polynomial approximation; Problem solving; Approximate solution; Approximation ratios; Combinatorial optimization problems; Empirical results; Local search algorithm; Lower bounds; NP-hard; Optimization task; Polynomial-time; Restart strategy; State-of-the-art algorithms; Vertex cover; Vertex Cover problems; Vertex degree; Worst case; Worst-case approximation; Evolutionary algorithms"
"https://www.scopus.com/inward/record.uri?eid=2-s2.0-59749105367&doi=10.1109%2fTEVC.2008.920671&partnerID=40&md5=c98d883d535591be70e2464d1bb046e5","Coevolution; Dynamic multiobjective optimization; Evolutionary algorithms","Algorithms; Benchmarking; Evolutionary algorithms; Optimization; Bench-mark problems; Co-evolutionary; Co-evolutionary algorithms; Coevolution; Competition and cooperations; Cooperative co evolutions; Cooperative mechanisms; Decomposition process; Dynamic environments; Dynamic multiobjective optimization; Evolutionary optimizations; Iterative process; Local optimality; Multi-objective evolutionary algorithms; Multi-objective optimization problems; Multi-objective problems; Non convexities; Optimization algorithms; Optimization problems; Pareto fronts; Real-world applications; Static and dynamics; Static environments; Multiobjective optimization"
"https://www.scopus.com/inward/record.uri?eid=2-s2.0-76149096264&doi=10.1109%2fTEVC.2009.2017517&partnerID=40&md5=436097a99b6f070544edd838681e7062","Bi-objective multipopulation GA; Genetic algorithms; Multimodal optimization; Recursive middling","Optimization; Bi-objective multipopulation GA; Clustering scheme; Empirical comparison; Local optima; Multi modal function; Multi population; Multi-modal; Multi-modal optimization; Multi-population genetic algorithm; Multimodal function optimization; Objects detection; Overall effectiveness; Recursive middlings; Search spaces; Sub-populations; Target functions; Genetic algorithms"
"https://www.scopus.com/inward/record.uri?eid=2-s2.0-69249181588&doi=10.1109%2fTEVC.2008.2011743&partnerID=40&md5=71f1a84aeeab028e8b9a40a00f221bae","Evolutionary multiobjective optimization; Neural networks","Convergence of numerical methods; Genetic algorithms; Mathematical operators; Neural networks; Convergence acceleration; Decision variables; Evolutionary multiobjective optimization; Hybridized algorithms; Mapping techniques; Multi objective evolutionary algorithms; Multi-objective optimizations; Non-dominated sorting genetic algorithms; Objective space; Original algorithms; Search capabilities; Speed of convergence; Strength Pareto evolutionary algorithm; Multiobjective optimization"
"https://www.scopus.com/inward/record.uri?eid=2-s2.0-59749089834&doi=10.1109%2fTEVC.2008.2011407&partnerID=40&md5=6b7eb4c200b30ba476652bce1b1c822d","Implied volatility smile; Option pricing; Prospect theory; Skewness premium","Costs; Programming theory; Agent-based; Agent-based approaches; Implied volatility smile; Key factors; Loss aversions; Option pricing; Option pricing theories; Prospect theory; Skewness premium; Stylized facts; Theoretical models; Financial data processing"
"https://www.scopus.com/inward/record.uri?eid=2-s2.0-59749084372&doi=10.1109%2fTEVC.2008.907594&partnerID=40&md5=c99715df7af96d1cbbc9e8e30bda8b4a","Adaptive trader-agents; Algorithmic trading; Automated market mechanism design; Genetic algorithms (GAs); ZIP traders","Algorithms; Automation; Commerce; Electronic commerce; Genetic algorithms; Machine design; Marketing; Principal component analysis; Adaptive trader-agents; Algorithmic trading; Automated market mechanism design; Genetic algorithms (GAs); ZIP traders; Adaptive algorithms"
"https://www.scopus.com/inward/record.uri?eid=2-s2.0-67349108023&doi=10.1109%2fTEVC.2008.925798&partnerID=40&md5=13559bf89e121c518aa6b21723f19a3a","Aggregation; Decomposition; Differential evolution; Evolutionary algorithms; Multiobjective optimization; Pareto optimality; Test problems","Evolutionary algorithms; Pareto principle; Shape optimization; Testing; Aggregation; Differential evolution; General class; Multi-objective evolutionary algorithms; Multi-objective optimization problems; Nsga-ii; Pareto optimality; Pareto sets; Reproduction operators; Test instances; Test problems; Multiobjective optimization"
"https://www.scopus.com/inward/record.uri?eid=2-s2.0-70349858275&doi=10.1109%2fTEVC.2009.2023448&partnerID=40&md5=70d125b2012cde89d13f7e40661017aa","Antennae; Benchmarking; Evolutionary algorithms; Metaheuristics; Optimization; Radio network design (RND)","Benchmarking; Computational complexity; Design; Evolutionary algorithms; Optimization; Radio; Antennae; Direct impact; Industrial area; Meta-heuristic techniques; Metaheuristics; NP-hard; Optimization problems; Problem formulation; Radio network design; Radio network design (RND); Wide spectrum; Problem solving"
"https://www.scopus.com/inward/record.uri?eid=2-s2.0-67349217061&doi=10.1109%2fTEVC.2008.927707&partnerID=40&md5=816388560f560545a3855b111426e171","Genetic algorithms; Optimization methods; Search methods","Heuristic methods; Optimization; Population statistics; Exploration and exploitations; Fitness landscapes; Model problems; Mutation rates; Optimization methods; Population sizes; Search methods; Simple genetic algorithms; Genetic algorithms"
"https://www.scopus.com/inward/record.uri?eid=2-s2.0-59749093654&doi=10.1109%2fTEVC.2008.928176&partnerID=40&md5=b2848e602f218bb8e693ec21deee6ce0","Artificial neural networks (ANNs); Evolutionary algorithms (EAs); Feature selection; Genetic algorithm (GA); Least squares support vector machine (LSSVM); Mixed kernel; Parameter optimization; Statistical models; Stock market trend mining","Algorithms; Backpropagation; Curve fitting; Education; Forecasting; Gears; Genetic algorithms; Image retrieval; Learning algorithms; Least squares approximations; Marketing; Multilayer neural networks; Neural networks; Optimization; Parameter estimation; Structural optimization; Support vector machines; Vectors; Artificial neural networks (ANNs); Evolutionary algorithms (EAs); Feature selection; Genetic algorithm (GA); Least squares support vector machine (LSSVM); Mixed kernel; Parameter optimization; Statistical models; Stock market trend mining; Evolutionary algorithms"
"https://www.scopus.com/inward/record.uri?eid=2-s2.0-69249166079&doi=10.1109%2fTEVC.2009.2017515&partnerID=40&md5=c541902e37621be8728146e7f99b5f68","Genetic algorithms; Multiobjective evolutionary algorithm (MOEA); Multiobjective optimization; Preference","Communication channels (information theory); Genetic algorithms; Optimal systems; Pareto principle; Set theory; Computational costs; Decision makers; Multi objective evolutionary algorithms; Multi-objective optimization problem; Multiobjective evolutionary algorithm (MOEA); Non-dominated sets; Optimal solutions; Pareto front; Pareto optimal solutions; Pareto-optimal front; Per unit; Performance metrices; Preference; Preference-based; Selection scheme; Test problem; Weight set; Weighted Sum; Multiobjective optimization"
"https://www.scopus.com/inward/record.uri?eid=2-s2.0-67349180578&doi=10.1109%2fTEVC.2008.2004262&partnerID=40&md5=247bebca6d341b818bebba2bca426049","Evolutionary algorithms; Optimization methods; Scheduling; Squeaky wheel heuristic","Evolutionary algorithms; Heuristic algorithms; Optimization; Personnel; Repair; Wheels; Construction steps; Different domains; Driver scheduling; Execution speed; Fitness values; Hospital nurse; Iterative improvements; Optimization methods; Personnel scheduling problems; Prioritization; Remaining components; Solution components; Squeaky wheel heuristic; Squeaky wheel optimizations; Heuristic methods"
"https://www.scopus.com/inward/record.uri?eid=2-s2.0-65349171735&doi=10.1109%2fTEVC.2007.904343&partnerID=40&md5=6b42d233db0dcdcd9f18b7d7c1e0e338","Design optimization; Ergonomics; Interactive evolutionary computation; Multiobjective optimization","Design; Ergonomics; Design criterion; Design diversities; Design frameworks; Design optimization; Design problems; Design solutions; Ergonomic chairs; Ergonomic designs; Interactive evolutionary computation; Interactive genetic algorithms; Multiobjective approaches; Quantitative criterion; User evaluations; User satisfactions; Multiobjective optimization"
"https://www.scopus.com/inward/record.uri?eid=2-s2.0-67349179627&doi=10.1109%2fTEVC.2008.925144&partnerID=40&md5=a2ee4353310cfcf3a5a51f6ac6850804","Genetic fuzzy systems; Michigan-style learning classifier systems; Pattern classification; Supervised learning","Classifiers; Competition; Education; Fuzzy control; Fuzzy logic; Fuzzy systems; Linguistics; Supervised learning; Classifier systems; Complex decisions; Fuzzy models; Fuzzy representations; Generalization capabilities; Genetic fuzzy systems; Interpretability; Linguistic representations; Michigan-style learning classifier systems; Pattern classification; Rule sets; Test performance; Fuzzy inference"
"https://www.scopus.com/inward/record.uri?eid=2-s2.0-78649837181&doi=10.1109%2fTEVC.2010.2041061&partnerID=40&md5=0341d3e0e6ec1fc53c20d3aae2265c1e","2-D stock cutting; genetic programming; hyper-heuristics","Genetic algorithms; Genetic programming; Building blockes; Creative process; Genetic programming system; Heuristic designs; Hyper-heuristics; Solution methods; Stock cutting; Strip packing problem; Heuristic methods"
