"Link","Author Keywords","Index Keywords"
"https://www.scopus.com/inward/record.uri?eid=2-s2.0-85154053294&doi=10.1038%2fs42256-023-00655-z&partnerID=40&md5=561a61d1ccb96aabcae5c2de4f19d8dc","",""
"https://www.scopus.com/inward/record.uri?eid=2-s2.0-85152017619&doi=10.1038%2fs42256-023-00641-5&partnerID=40&md5=58d8c3d94ea248063c7c9b66cce40bdd","",""
"https://www.scopus.com/inward/record.uri?eid=2-s2.0-85149449397&doi=10.1038%2fs42256-023-00630-8&partnerID=40&md5=e80ecf5159ce8888ac3e9c2f69fe746e","","Network architecture; Binding problem; Common languages; Distributed representation; End to end; High-dimensional; Higher-dimensional; matrix; Neural-networks; Rule search; State of the art; Deep neural networks"
"https://www.scopus.com/inward/record.uri?eid=2-s2.0-85161404351&doi=10.1038%2fs42256-023-00664-y&partnerID=40&md5=afdfbcfb0b150392924b0f3324d32375","",""
"https://www.scopus.com/inward/record.uri?eid=2-s2.0-85150945285&doi=10.1038%2fs42256-023-00617-5&partnerID=40&md5=9748a147c48ef582a84936f2e1120721","","Artificial intelligence; Earth (planet); Information management; NASA; Biomonitoring; Deep space; Health systems; Human exploration; Key solution; Machine learning applications; Machine modelling; Model application; Paradigm shifts; Substantial distances; Health hazards"
"https://www.scopus.com/inward/record.uri?eid=2-s2.0-85167362223&doi=10.1038%2fs42256-023-00713-6&partnerID=40&md5=460983759a78198aa7da63f5d888d1c4","",""
"https://www.scopus.com/inward/record.uri?eid=2-s2.0-85164160156&doi=10.1038%2fs42256-023-00683-9&partnerID=40&md5=197bdebe1fc52ebea9ee57df48d18c5a","","Drug interactions; Pareto principle; Signal encoding; Accurate modeling; Computational overheads; Computer aided drug design; FAST model; Molecular properties; Property; Property predictions; Side by sides; Specific properties; Unified Modeling; Forecasting"
"https://www.scopus.com/inward/record.uri?eid=2-s2.0-85165094418&doi=10.1038%2fs42256-023-00652-2&partnerID=40&md5=ae32e1c2aed80dc02ba1a4ac7b9bec86","","Benchmarking; Patient treatment; Population statistics; 'current; Evidence-based practices; Health care providers; Intelligence models; Large-scales; Open platforms; Patient experiences; Performance; Quantitative evaluation; Reducing costs; Artificial intelligence"
"https://www.scopus.com/inward/record.uri?eid=2-s2.0-85158141327&doi=10.1038%2fs42256-023-00650-4&partnerID=40&md5=fe1a1f055efb761130ea8d722a2707b4","","Backpropagation; Complex networks; E-learning; Learning systems; Network architecture; Neurons; Object recognition; Forward propagation; Neural-networks; Online learning; Online training; Performance; Recurrent networks; Simple++; Small networks; Spiking Neurones; Temporal sequences; Recurrent neural networks"
"https://www.scopus.com/inward/record.uri?eid=2-s2.0-85149863240&doi=10.1038%2fs42256-023-00620-w&partnerID=40&md5=d7115f6159d60c651e571bef051b17fd","","Data distribution; Discriminative features; Human judgments; Interpretability; Neural-networks; Performance; Quantitative evaluation; Quantitative metric; Synthetic datasets; Time series classifications; Time series"
"https://www.scopus.com/inward/record.uri?eid=2-s2.0-85149283298&doi=10.1038%2fs42256-023-00619-3&partnerID=40&md5=2690cdfd673326da0222a3942db66c37","","Cell membranes; Cytology; Diagnosis; Epitopes; T-cells; Turing machines; Accurate prediction; Antigen binding; Binding pattern; Binding specificities; Computational challenges; Exogenous peptides; Learn+; Metalearning; Receptor binding; T cells receptors; Peptides"
"https://www.scopus.com/inward/record.uri?eid=2-s2.0-85164333592&doi=10.1038%2fs42256-023-00688-4&partnerID=40&md5=c05a47ef79de4c0cfd6d5c8184804522","","Cell culture; Diseases; Forecasting; Machine learning; Artificial intelligence methods; Cancer cell lines; Cancer patients; Cell lines; Clinical settings; Drug response; Machine-learning; Personalized medicines; Reproducibilities; Response prediction; Reusability"
"https://www.scopus.com/inward/record.uri?eid=2-s2.0-85168567339&doi=10.1038%2fs42256-023-00710-9&partnerID=40&md5=c3cc57ed138201778c8691be05f593ce","",""
"https://www.scopus.com/inward/record.uri?eid=2-s2.0-85151436351&doi=10.1038%2fs42256-023-00624-6&partnerID=40&md5=d640e3307265fc589eff7ac03271f78c","","Artificial intelligence; Learning systems; Artificial intelligence methods; Cross-modal; Dynamic network; Heterogeneous graph; Inductive bias; Interacting particle system; Model complexes; Multi-modal; Multi-modal dataset; Multi-modal learning; Blueprints"
"https://www.scopus.com/inward/record.uri?eid=2-s2.0-85165397133&doi=10.1038%2fs42256-023-00703-8&partnerID=40&md5=d6834044988386f57050394cddfe9cf3","",""
"https://www.scopus.com/inward/record.uri?eid=2-s2.0-85160562664&doi=10.1038%2fs42256-023-00637-1&partnerID=40&md5=6ccd8960639e4b55278d6b92f0ee9513","","Computational linguistics; Deep neural networks; Domain Knowledge; Embeddings; Natural language processing systems; 'current; Black box modelling; Embeddings; Language model; Large scale proteins; Natural languages; Network-based; Protein functions; Protein sequence data; Roadmap; Proteins"
"https://www.scopus.com/inward/record.uri?eid=2-s2.0-85151423540&doi=10.1038%2fs42256-023-00635-3&partnerID=40&md5=a7912aa41b8e14b3bab3706225b8a3f1","","Cell death; Deep learning; Diagnosis; Diseases; Spatial distribution; Tumors; Cancer diagnosis; Clinical practices; Clinical prognosis; Clinical value; Human-centric; Interpretability; Learning models; Liver cancers; Treatment planning; Whole slide images; Biomarkers"
"https://www.scopus.com/inward/record.uri?eid=2-s2.0-85150972658&doi=10.1038%2fs42256-023-00618-4&partnerID=40&md5=512bd6809c8cdd03aa7c9ae102441ca3","","Artificial intelligence; Orbits; Predictive analytics; Space flight; Biological research; Deep space; Deep-space exploration; Experiment data; Experiment modeling; Experiment platforms; Model organisms; Self drivings; Space biology; Space-borne; NASA"
"https://www.scopus.com/inward/record.uri?eid=2-s2.0-85148615630&doi=10.1038%2fs42256-023-00622-8&partnerID=40&md5=be9fa1596c9982d6e4c01a6841b7ec62","","Capacitance; Degrees of freedom (mechanics); Intelligent robots; Manipulators; Geometric details; High resolution; Local deformations; Local surfaces; Morphological reconstruction; Robot geometry; Robotic tasks; Soft robot; Soft robotics; Soft-bodies; Geometry"
"https://www.scopus.com/inward/record.uri?eid=2-s2.0-85152679076&doi=10.1038%2fs42256-023-00642-4&partnerID=40&md5=908ddcde1e8e3c40b7bc75f5ac84578a","","Electric load dispatching; Global optimization; Machine learning; Particle swarm optimization (PSO); Complex problems; General reliabilities; Globaloptimum; Local optima; Machine-learning; Optimum reliability; Particle swarm; Problem structure; Swarm optimization; Theoretical guarantees; Inverse problems"
"https://www.scopus.com/inward/record.uri?eid=2-s2.0-85161347769&doi=10.1038%2fs42256-023-00669-7&partnerID=40&md5=5cc74cb8fe97fd5a8072973825fb9cd4","",""
"https://www.scopus.com/inward/record.uri?eid=2-s2.0-85162585622&doi=10.1038%2fs42256-023-00676-8&partnerID=40&md5=f1096db6cecb8c1addb7ae278d39fe90","","Geometry; Morphology; Rigid structures; Robots; Swarm intelligence; Biological organisms; Control methods; Mechanical control; Mechanical materials; Mechanical structures; Polygon meshing; Robotic systems; Soft robot; Structure control; Structure materials; Economic and social effects"
"https://www.scopus.com/inward/record.uri?eid=2-s2.0-85149140450&doi=10.1038%2fs42256-023-00625-5&partnerID=40&md5=241c2e72874ebecde7e7afaf40200ca6","","Bioinformatics; Image analysis; Medical imaging; Professional aspects; Quality control; Algorithm validation; Amazon's mechanical turks; Biomedical image analysis; Comprehensive examination; High quality; Image analysis algorithms; Labelings; Optimisations; Professional practise; Systematic study; Competition"
"https://www.scopus.com/inward/record.uri?eid=2-s2.0-85160849190&doi=10.1038%2fs42256-023-00666-w&partnerID=40&md5=3b6e73dae0c89a493bad4c62a35acbff","",""
"https://www.scopus.com/inward/record.uri?eid=2-s2.0-85167514270&doi=10.1038%2fs42256-023-00702-9&partnerID=40&md5=c89ca5c0ee80040b2c96e30abe6b1a48","","Cytology; Deep neural networks; Disease control; Fluorescence; Forecasting; Learning systems; Neurodegenerative diseases; Stem cells; Cellular mechanisms; Chemical induction; Fluorescent labeling; Human neurons; Learning Based Models; Machine-learning; Mechanistics; Neurodegenerative disorders; Stem cell model; Stem cell technology; Neurons"
"https://www.scopus.com/inward/record.uri?eid=2-s2.0-85147712163&doi=10.1038%2fs42256-023-00639-z&partnerID=40&md5=76ab8b95bc92c7ac56c7dc116599e750","","Computational linguistics; Modeling languages; Molecules; Regression analysis; Generative model; Inductive bias; Language model; Model problems; Nominal scale; Performance; Property; Regression modelling; Sequence generation; Sequence models; Proteins"
"https://www.scopus.com/inward/record.uri?eid=2-s2.0-85150876177&doi=10.1038%2fs42256-023-00634-4&partnerID=40&md5=51828834adef62f84c7ed435cc07da52","","Cell membranes; Deep learning; Forecasting; T-cells; 'current; Binding mechanisms; Computational modelling; Interaction modeling; Interaction prediction; Limited capacity; Prediction tools; Residue level; T cells receptors; T-cell epitopes; Epitopes"
"https://www.scopus.com/inward/record.uri?eid=2-s2.0-85160410267&doi=10.1038%2fs42256-023-00663-z&partnerID=40&md5=3d3de0a1585c99d60dcdd7060beb9474","","Cytology; Electrophysiology; Gene expression; Machine learning; Auto encoders; Cellular mechanisms; Cross-modal; Embeddings; Individual cells; Learn+; Multi-modal; Multi-modal data; Multi-modal dataset; Single cells; Embeddings"
"https://www.scopus.com/inward/record.uri?eid=2-s2.0-85168617148&doi=10.1038%2fs42256-023-00706-5&partnerID=40&md5=8e8f0c2e193b593bdfb155246c71b07a","",""
"https://www.scopus.com/inward/record.uri?eid=2-s2.0-85165176793&doi=10.1038%2fs42256-023-00694-6&partnerID=40&md5=77fd1f7c2f52886f2ca6d67665fc7c57","","Classification (of information); Complex networks; Deep neural networks; Forecasting; Ligands; Mass spectrometry; Adaptive immune response; Cancer vaccine; Class I; Experimental validations; Immune response; Immunogenicity; Learn+; Major histocompatibility complex; Neo epitopes; State of the art; Epitopes"
"https://www.scopus.com/inward/record.uri?eid=2-s2.0-85164811175&doi=10.1038%2fs42256-023-00682-w&partnerID=40&md5=72d24efef293257b25df791395d9a157","","Deep learning; Large dataset; Learning systems; Magnetic resonance imaging; Medical imaging; Supervised learning; Topography; Human bias; Large amounts; Large-scale datasets; Learn+; Learning models; Medical image segmentation; Prediction tasks; Semi-supervised; Uncertainty; Volumetrics; Image segmentation"
"https://www.scopus.com/inward/record.uri?eid=2-s2.0-85147305688&doi=10.1038%2fs42256-022-00605-1&partnerID=40&md5=75c7bb31725b169ec3d7d5a9e0d0dbbc","","Benchmarking; Deep learning; Drug interactions; Domain adaptation; Drug discovery; Drug targets; Drug-target interactions; Generalization performance; Learn+; Learning-based methods; Local interactions; Performance; Target prediction; Forecasting"
"https://www.scopus.com/inward/record.uri?eid=2-s2.0-85162886701&doi=10.1038%2fs42256-023-00686-6&partnerID=40&md5=3fa65730223024e95b2b4c53c384b8db","",""
"https://www.scopus.com/inward/record.uri?eid=2-s2.0-85148945117&doi=10.1038%2fs42256-023-00631-7&partnerID=40&md5=5009d22e15103e0260d4155b71431d57","",""
"https://www.scopus.com/inward/record.uri?eid=2-s2.0-85151980997&doi=10.1038%2fs42256-023-00633-5&partnerID=40&md5=3d92d194c5836b0684e87ab0f69a8f76","","Data fusion; Diseases; Bio-marker discovery; Biomedical data; Cancer biomarkers; Clinical records; Complementary data; High-dimensional; High-throughput; Higher-dimensional; Multimodal data fusion; Technological advances; Deep learning"
"https://www.scopus.com/inward/record.uri?eid=2-s2.0-85147270055&doi=10.1038%2fs42256-022-00607-z&partnerID=40&md5=8edc31b67e387db39ba0a4908f49aad5","","Ethical technology; Open source software; Open systems; Trajectories; Autonomous driving; Autonomous Vehicles; Behavior planning; Ethical implications; Ethical principles; Fair distribution; Minimisation; Road users; Trajectory Planning; Trajectory planning algorithm; Autonomous vehicles"
"https://www.scopus.com/inward/record.uri?eid=2-s2.0-85166949422&doi=10.1038%2fs42256-023-00704-7&partnerID=40&md5=10c0de7e947804a6430a5e72ea66ddf2","","Computational Imaging; Deep learning; Image reconstruction; Inverse problems; Learning systems; Lithography; Supervised learning; Computational imaging; Computational microscopies; Generalisation; Hologram reconstruction; Image datasets; Images reconstruction; Labeled training data; Large-scales; Learning models; Training image; Holograms"
"https://www.scopus.com/inward/record.uri?eid=2-s2.0-85160913311&doi=10.1038%2fs42256-023-00665-x&partnerID=40&md5=169a0067efbaf522385e380557a74b27","","Codes (symbols); Data Science; Philosophical aspects; Complex data; Data systems; Engineering skills; Fundamental tools; Large complex systems; Machine-learning; Reproducibilities; Science learning; Science systems; Software engineering methods; Software engineering"
"https://www.scopus.com/inward/record.uri?eid=2-s2.0-85151455576&doi=10.1038%2fs42256-023-00636-2&partnerID=40&md5=459d8b3190f086b5593c51105e2a8aaf","","Curricula; Iterative methods; Learning systems; Recurrent neural networks; Reinforcement learning; Scaffolds; De novo design; Entry system; Iterative Optimization; Network-based; Optimization procedures; Property; Reinforcement learning method; Reinforcement learnings; Training data; Molecules"
"https://www.scopus.com/inward/record.uri?eid=2-s2.0-85160832351&doi=10.1038%2fs42256-023-00662-0&partnerID=40&md5=a3f64351ff9f7f5a55ea4f9222b631b2","","Computer vision; Deep learning; Learning systems; Classical techniques; Computer vision techniques; Data driven; Performance; Performance benefits; Physical modelling; Physical world; Physics based vision; Property; Recent researches; Pipelines"
"https://www.scopus.com/inward/record.uri?eid=2-s2.0-85160039594&doi=10.1038%2fs42256-023-00657-x&partnerID=40&md5=0277dabef27fe70ae2775a5b46bfe5e8","","Estimation approaches; Estimation strategies; Feature information; Future research directions; Machine learning models; Shapley value; Game theory"
"https://www.scopus.com/inward/record.uri?eid=2-s2.0-85158119386&doi=10.1038%2fs42256-023-00646-0&partnerID=40&md5=77e5f389f550b8b7650dac28a2c0416f","","Commerce; Costs; Algorithmics; Competitive behavior; Competitive mechanisms; Digital marketplace; Learn+; Network-based framework; Pricing algorithm; Real- time; Regulatory agencies; Turn offs; Profitability"
"https://www.scopus.com/inward/record.uri?eid=2-s2.0-85160112931&doi=10.1038%2fs42256-023-00659-9&partnerID=40&md5=0ab6b9d254722a18651e6c722cb15397","",""
"https://www.scopus.com/inward/record.uri?eid=2-s2.0-85146878003&doi=10.1038%2fs42256-022-00606-0&partnerID=40&md5=03de7667d01979a7ff98a19d77a77da4","",""
"https://www.scopus.com/inward/record.uri?eid=2-s2.0-85162974139&doi=10.1038%2fs42256-023-00679-5&partnerID=40&md5=ba2ce260aba5f3819e932894a744b2f9","","Drug dosage; Extrapolation; Gene expression; Mammals; Tumors; Biological process; Developmental biology; Gene expression profiles; Genes expression; Late stage; Learn+; Temporal dynamics; Time-series gene expression data; Times series; Tumor biology; Time series"
"https://www.scopus.com/inward/record.uri?eid=2-s2.0-85158030467&doi=10.1038%2fs42256-023-00653-1&partnerID=40&md5=15ffdaa857c29ba1c8ea82544713cb74","",""
"https://www.scopus.com/inward/record.uri?eid=2-s2.0-85158091081&doi=10.1038%2fs42256-023-00654-0&partnerID=40&md5=c53ebeb634e93e901c05cb4b55daf8b6","","Deep learning; Domain Knowledge; Knowledge graph; Semantics; Construction rules; Data driven; Drug candidates; Fine tuning; Knowledge graphs; Learning models; Molecular properties; Potential drug; Pre-training; Prior information; Forecasting"
"https://www.scopus.com/inward/record.uri?eid=2-s2.0-85162980659&doi=10.1038%2fs42256-023-00680-y&partnerID=40&md5=9f9d5c17bf6e1080f40df8a0ab862c59","","Computational efficiency; Computer hardware; Data transfer; Deep neural networks; Energy efficiency; Learning systems; Memristors; Multilayer neural networks; Network layers; Random number generation; Reinforcement learning; Stochastic systems; Uncertainty analysis; Bayesian; Computing system; Decisions makings; High Speed; Memristor; Policy optimization; Random-number generation; Reinforcement learnings; Stochastic computations; Uncertainty quantifications; Decision making"
"https://www.scopus.com/inward/record.uri?eid=2-s2.0-85159396401&doi=10.1038%2fs42256-023-00658-w&partnerID=40&md5=fe36a336a944c7286bf9adf54c42cfaf","",""
"https://www.scopus.com/inward/record.uri?eid=2-s2.0-85150983926&doi=10.1038%2fs42256-023-00643-3&partnerID=40&md5=dfe948bcbc54d8b54809064765b68fa8","",""
"https://www.scopus.com/inward/record.uri?eid=2-s2.0-85163441561&doi=10.1038%2fs42256-023-00693-7&partnerID=40&md5=e3e43cfa0660c3043f6cf7c9b400ff28","",""
"https://www.scopus.com/inward/record.uri?eid=2-s2.0-85152015236&doi=10.1038%2fs42256-023-00638-0&partnerID=40&md5=9ae7fa018307abb366bb5046d28b1d9a","","Confounder; Critical problems; Different treatments; Encodings; Hospital mortality; Life threatening conditions; Mortality rate; Novel methods; Observational data; Treatment effects; Antibiotics"
"https://www.scopus.com/inward/record.uri?eid=2-s2.0-85160088714&doi=10.1038%2fs42256-023-00678-6&partnerID=40&md5=217be68791fa82982a7d43dc9e4a8050","",""
"https://www.scopus.com/inward/record.uri?eid=2-s2.0-85158104977&doi=10.1038%2fs42256-023-00656-y&partnerID=40&md5=56ea50680c2acdf8932b1d429f2cd333","","Cell culture; Cell proliferation; Drug therapy; Feature Selection; Genes; Oncology; Supervised learning; T-cells; Cell data; Cell populations; Cell subpopulations; Embeddings; Features selection; Gene selection; High confidence; Learning frameworks; Regression mode; Single cells; Trajectories"
"https://www.scopus.com/inward/record.uri?eid=2-s2.0-85160947789&doi=10.1038%2fs42256-023-00681-x&partnerID=40&md5=2eb5ec3f95714b2b79126963c3b24031","",""
"https://www.scopus.com/inward/record.uri?eid=2-s2.0-85162895485&doi=10.1038%2fs42256-023-00673-x&partnerID=40&md5=d59be870dcbff643f0c067b8310f4950","",""
"https://www.scopus.com/inward/record.uri?eid=2-s2.0-85160447199&doi=10.1038%2fs42256-023-00671-z&partnerID=40&md5=9e8edc5516f16be32497819b60a8948b","","Stiffness; Virtual reality; Active perceptions; First person; Fundamental properties; Haptic devices; Haptics; High-fidelity; Immersive virtual reality; Mechanical; Physical environments; Stiffness perception; Hardness"
"https://www.scopus.com/inward/record.uri?eid=2-s2.0-85167344551&doi=10.1038%2fs42256-023-00699-1&partnerID=40&md5=8de14b7d8e9346f7b74be397c87e39a5","",""
"https://www.scopus.com/inward/record.uri?eid=2-s2.0-85166003731&doi=10.1038%2fs42256-023-00689-3&partnerID=40&md5=6fda8f59fe8636316c67c419571e7874","","Commerce; Economic and social effects; Fluorescence microscopy; Image acquisition; Image enhancement; Nanostructures; Optical resolving power; Stimulated emission; Biological tissues; Image-analysis; Imaging parameters; Light exposure; Multiple imaging; Optical-; Resolution enhancement; Spatial and temporal resolutions; Superresolution; Trade off; Generative adversarial networks"
"https://www.scopus.com/inward/record.uri?eid=2-s2.0-85147959058&doi=10.1038%2fs42256-022-00604-2&partnerID=40&md5=158bb2d1ceaa9460d32704cf6b4431d0","","Forecasting; Genes; Network architecture; Neurodegenerative diseases; Amyotrophic lateral sclerosis; Disease phenotypes; Genetic architecture; Genetic disease; Genetic variants; Hierarchical structures; Holistic manner; Network-based approach; Non-linear relationships; Test data in; Complex networks"
"https://www.scopus.com/inward/record.uri?eid=2-s2.0-85163125020&doi=10.1038%2fs42256-023-00670-0&partnerID=40&md5=6af7e2e06e82cab034470b5e261f8921","","Digital storage; Health care; Medical imaging; Sustainable development; Artificial intelligence learning; Health care application; Health management; Health monitoring; Machine learning models; Medical image analysis; Medical image computing; Resource awareness; Resource sustainability; Sustainability issues; Artificial intelligence"
"https://www.scopus.com/inward/record.uri?eid=2-s2.0-85150042943&doi=10.1038%2fs42256-023-00632-6&partnerID=40&md5=4fafd60b50a73f1643bed83579b5894c","","Learning algorithms; Ordinary differential equations; Probability distributions; Reaction rates; Reinforcement learning; Stochastic models; Stochastic systems; Auto-regressive; Chemical master equation; Chemical species; Joint probability distributions; Network solutions; Neural-networks; Reaction network; State-space; Stochastics; Systems of ordinary differential equations; Random processes"
"https://www.scopus.com/inward/record.uri?eid=2-s2.0-85167825823&doi=10.1038%2fs42256-023-00700-x&partnerID=40&md5=20459a522b35dc24e3e4279a6cf2fe07","","Deep neural networks; Multilayer neural networks; Neural network models; Algorithm schemes; Duality relations; Feed forward neural net works; Generalisation; Generalization performance; Key factors; Machine-learning; Neural network model; Regularization schemes; Training data; Learning algorithms"
"https://www.scopus.com/inward/record.uri?eid=2-s2.0-85165951792&doi=10.1038%2fs42256-023-00692-8&partnerID=40&md5=4eb9b1a66d7d58e830e92b61c3d7aa31","","Speech processing; Complex model; Conversational interface; Existing systems; Healthcare workers; Interactive dialog system; Machine learning models; Model prediction; Natural languages; Real-world evaluation; Three-component; Machine learning"
"https://www.scopus.com/inward/record.uri?eid=2-s2.0-85165210189&doi=10.1038%2fs42256-023-00691-9&partnerID=40&md5=46ecfc4429c4d2e2dbd3c98c53a53691","","Biochemical engineering; Genetic engineering; Proteins; Directed evolution; Drug discovery; Efficient sampling; Machine-learning; Optimisations; Property; Protein engineering; Protein sequences; Reinforcement learnings; Self-play; Reinforcement learning"
"https://www.scopus.com/inward/record.uri?eid=2-s2.0-85168542639&doi=10.1038%2fs42256-023-00701-w&partnerID=40&md5=b186a8cb21870d2979417bee117c7b59","","Deep learning; Reinforcement learning; Sensory feedback; Feedback state; Gravity vectors; Motor learning; Motor skills; Neural-networks; Quadruped Robots; Qualitative approach; Reflect state; Reinforcement learnings; Saliency analysis; Robots"
"https://www.scopus.com/inward/record.uri?eid=2-s2.0-85164955660&doi=10.1038%2fs42256-023-00684-8&partnerID=40&md5=4943eb0003500abecdf6d0230ef6053a","","Digital storage; Gene expression; Histology; Tissue; Biological mechanisms; Cell types; Genes expression; Graph representation; Homoeostasis; Hyper graph; Integration method; Privacy concerns; Tissue integration; Tissue types; Factorization"
"https://www.scopus.com/inward/record.uri?eid=2-s2.0-85147953508&doi=10.1038%2fs42256-023-00609-5&partnerID=40&md5=e29bbf0a8bed0233d8b2c30cd7e286b5","","Classification (of information); Complex networks; Computer graphics; Energy efficiency; Graph neural networks; Graphic methods; Learning systems; Memory architecture; Program processors; Digital hardware; Drug discovery; Graph neural networks; Graph structured data; Machine learning models; Memory array; Representation of graphs; Resistive memory; State graphs; Transistor scaling; Graphics processing unit"
"https://www.scopus.com/inward/record.uri?eid=2-s2.0-85166025093&doi=10.1038%2fs42256-023-00695-5&partnerID=40&md5=dd46edf8b964de8cebbc4ed1601c5d23","",""
"https://www.scopus.com/inward/record.uri?eid=2-s2.0-85164452108&doi=10.1038%2fs42256-023-00690-w&partnerID=40&md5=132dfa2016a278f370fd518531f957b4","",""
"https://www.scopus.com/inward/record.uri?eid=2-s2.0-85161649647&doi=10.1038%2fs42256-023-00674-w&partnerID=40&md5=c4b0942b68da2b6e9943384ace257623","",""
"https://www.scopus.com/inward/record.uri?eid=2-s2.0-85150471190&doi=10.1038%2fs42256-023-00629-1&partnerID=40&md5=6cf6607083e7c1ce13d43076c7baf353","","Data acquisition; Intelligent systems; Medical imaging; Philosophical aspects; Analysis of data; Automated interpretation; Data collection; Data integrity; Ethical considerations; Image-analysis; Interventional; Learning-based algorithms; Synthetic data; X-ray image; Image analysis"
"https://www.scopus.com/inward/record.uri?eid=2-s2.0-85148529153&doi=10.1038%2fs42256-023-00611-x&partnerID=40&md5=b1a0e18452b0fa3e46f960ae9efb4eb0","","Action prediction; Binary variables; Categorical variables; Causal modeling; Counterfactuals; Functional constraints; Learn+; Prediction methods; Property; TWIN networks; Deep neural networks"
"https://www.scopus.com/inward/record.uri?eid=2-s2.0-85149874450&doi=10.1038%2fs42256-023-00627-3&partnerID=40&md5=ebefafd86e6d010c573872b77d887339","","Computational methods; Cost effectiveness; Deep neural networks; Forecasting; Metabolites; Microorganisms; Ordinary differential equations; Biological functions; Community IS; Cost effective; Metabolic profiles; Metabolomics; Microbial communities; Microbial composition; Microbiome; Sequencing method; Species composition; Nutrition"
"https://www.scopus.com/inward/record.uri?eid=2-s2.0-85147564603&doi=10.1038%2fs42256-023-00614-8&partnerID=40&md5=ce247809aa99511cfd94b4e83e2623a5","",""
"https://www.scopus.com/inward/record.uri?eid=2-s2.0-85161468950&doi=10.1038%2fs42256-023-00672-y&partnerID=40&md5=dd66f9207c70343411a21666673c69c9","",""
