"Link","Author Keywords","Index Keywords"
"https://www.scopus.com/inward/record.uri?eid=2-s2.0-85103436391&partnerID=40&md5=9663da32ee71f63b4ab126525d7ae2b2","Big data; Business analytics; Business intelligence; Business process; Business Value of IT; Decision making; Information value chain; Inhibitors of value realization; IS value; Knowledge creation; Process level; Qualitative literature review; Research agenda","Blending; Information systems; Information use; Mobile telecommunication systems; Operations research; Business analytics; Business Process; Empirical findings; General management; Information value; Literature reviews; Potential outcomes; Process Modeling; Advanced Analytics"
"https://www.scopus.com/inward/record.uri?eid=2-s2.0-85103158031&doi=10.1007%2f978-981-33-6815-6_15&partnerID=40&md5=70f5dfba6a3f7c3914826750841c231e","Business analytics; Data analytics; Machine learning; Recommendation systems",""
"https://www.scopus.com/inward/record.uri?eid=2-s2.0-85068994472&doi=10.1016%2fj.ejor.2019.06.051&partnerID=40&md5=1e2cc8d2bbefe86f6570bbec60d2da94","Agility; Analytics; Dynamic capabilities; Operations research","Advanced Analytics; Operations research; Agility; Analytics; Business analytics; Business aspects; Dynamic capabilities; Micro-foundation; Research agenda; Uncertain environments; Enterprise resource management"
"https://www.scopus.com/inward/record.uri?eid=2-s2.0-85136611973&doi=10.4018%2f978-1-7998-2566-1.ch013&partnerID=40&md5=83af6e68417574a5a00b12a7838edb09","",""
"https://www.scopus.com/inward/record.uri?eid=2-s2.0-85065389516&doi=10.1016%2fj.ejor.2019.04.036&partnerID=40&md5=e6797a74b3a84c67c3368c549f8e325d","Business analytics; Business ethics canvas; Data science; GDPR; Markkula","Advanced Analytics; Data Science; Decision making; Business analytics; Business ethics; Development process; Ethical decision making; Ethical implications; GDPR; General data protection regulations; Markkula; Philosophical aspects"
"https://www.scopus.com/inward/record.uri?eid=2-s2.0-85100164050&doi=10.1109%2fGOL49479.2020.9314725&partnerID=40&md5=03afaf905e87539e719dc12b27acd09d","Business Analytics; Business Intelligence; Decision Support Systems; Simulation what-if; Simulation-based analytics","Advanced Analytics; Benchmarking; Business analytics; Data availability; Data intensive; Decision making tool; Future perspectives; Key performance indicators; Simulation technique; What-if Analysis; Decision making"
"https://www.scopus.com/inward/record.uri?eid=2-s2.0-85085283486&doi=10.3926%2fjiem.3030&partnerID=40&md5=8d60b6e3d70b82edd5c7d3121a2f1c1e","Analytics; Business analytics; Business intelligence; Decision support; Systematic review",""
"https://www.scopus.com/inward/record.uri?eid=2-s2.0-85108148083&partnerID=40&md5=ca121bb518595b6db1ce9a3168cb2db8","",""
"https://www.scopus.com/inward/record.uri?eid=2-s2.0-85116709211&partnerID=40&md5=94a15bc97669c74004f014fdd7c9bd3c","",""
"https://www.scopus.com/inward/record.uri?eid=2-s2.0-85101084503&doi=10.17705%2f1CAIS.04805&partnerID=40&md5=dac607d445a295c9401a4f94569bbbee","Analytics; Learning; Pedagogy","Advanced Analytics; Business analytics; Business majors; Coronaviruses; Engaging students; General education; Remote teaching; Teaching"
"https://www.scopus.com/inward/record.uri?eid=2-s2.0-85092066719&doi=10.1109%2fICIRCA48905.2020.9183336&partnerID=40&md5=51032ba6d406fb8458fac999e853a6f5","Affiliate marketing; Commission junction; KPI; Power BI; Talend","Advanced Analytics; Behavioral research; Decision making; Business metrics; Business owners; Data-sources; Decision making process; Level management; Price comparisons; Self-service business intelligences; Single source; Data integration"
"https://www.scopus.com/inward/record.uri?eid=2-s2.0-85082659745&doi=10.19139%2fsoic-2310-5070-551&partnerID=40&md5=b0c58bd4ae7791d6ec0ed80bc2e9ffc4","Business intelligence and analytics; Customer entry-exit rates; Dynamic pricing",""
"https://www.scopus.com/inward/record.uri?eid=2-s2.0-85073512719&doi=10.1016%2fj.ejor.2019.09.018&partnerID=40&md5=d5218f68073c35bb2974a9e4e2530472","Analytics; Deep learning; Deep neural networks; Managerial implications; Research agenda","Advanced Analytics; Deep learning; Machine learning; Managers; Network architecture; Operations research; Analytics; Business analytics; Computational experiment; Embedded network; Managerial implications; Operational performance; Prediction performance; Research agenda; Deep neural networks"
"https://www.scopus.com/inward/record.uri?eid=2-s2.0-85098630721&partnerID=40&md5=22e39b8c6841ad2e38b0082145dec4e1","",""
"https://www.scopus.com/inward/record.uri?eid=2-s2.0-85056473136&doi=10.1016%2fj.ijinfomgt.2018.10.019&partnerID=40&md5=a7677dbdaa2fa0882e212ab5e1202a26","",""
"https://www.scopus.com/inward/record.uri?eid=2-s2.0-85067235056&partnerID=40&md5=c2bb0b7dbde40c1dc2365cb621c9b5d6","Business analytics; Business intelligence; Maturity models",""
"https://www.scopus.com/inward/record.uri?eid=2-s2.0-85062502096&partnerID=40&md5=2a1ca6ebaafe413fd2e4369e95c2e755","Analytical insights; Analytics process; Business analytics; Contingency theory; Information-processing theory; Model development; Resource-based view","Advanced Analytics; Decision making; Information systems; Information use; Multivariant analysis; Analytical insights; Business analytics; Contingency theory; Information processing theories; Model development; Resource-based view; Factor analysis"
"https://www.scopus.com/inward/record.uri?eid=2-s2.0-85125310713&partnerID=40&md5=c8300b2a601c85dfed8e7a34e451320b","",""
"https://www.scopus.com/inward/record.uri?eid=2-s2.0-85085330025&doi=10.22364%2fbjmc.2019.7.3.06&partnerID=40&md5=ed1ee719f6d2f5e142ffc8476c44f6f0","Business intelligence tools; Learning analytics; Video lectures",""
"https://www.scopus.com/inward/record.uri?eid=2-s2.0-85065012534&partnerID=40&md5=633c8e910c42bb51230926cb85752bc9","Big data; Business analytics; Business intelligence; Curriculum design & development; Data management; Northwind database","Advanced Analytics; Big data; Competitive intelligence; Database systems; E-learning; Information management; Teaching; Body of knowledge; Business analytics; Business schools; Curriculum designs; Database course; On-line analytical process; Pedagogical designs; Teaching methods; Curricula"
"https://www.scopus.com/inward/record.uri?eid=2-s2.0-85061206348&doi=10.3390%2fsu11030853&partnerID=40&md5=9de4a7010f7c0a218c1a52b790ac0c2f","Business analytic skills; Business analytics; Job requirements; Maturity framework","Romania; economic conditions; educational development; green job; job search; knowledge; labor market; market conditions; university sector"
"https://www.scopus.com/inward/record.uri?eid=2-s2.0-85108298858&partnerID=40&md5=ec09261f0e522ced1fcf5b65b9941fc3","",""
"https://www.scopus.com/inward/record.uri?eid=2-s2.0-85020756143&doi=10.1057%2fs41266-016-0009-8&partnerID=40&md5=4a06e64b71c6b5c6cd81fa340cb7bb66","business analytics; business intelligence; CLV; credit card",""
"https://www.scopus.com/inward/record.uri?eid=2-s2.0-85054210164&partnerID=40&md5=1d3b118c60f3fd72c17b60416e2083b4","Business analytics; Business value; It alignment; It department; Resource-based view","Decision making; Information use; Business analytics; Business value; IT alignment; It department; Resource-based view; Information systems"
"https://www.scopus.com/inward/record.uri?eid=2-s2.0-85077464863&doi=10.3233%2fJIFS-190641&partnerID=40&md5=fe820f709bed8d08dc8998ec4aacffe1","airline industry; date envelopment analysis (DEA); Performance evaluation; slack based DEA model (SBM)","Advanced Analytics; Air transportation; Data Analytics; Data envelopment analysis; Economic and social effects; Efficiency; Airline industry; Date envelopment analysis; DEA models; Efficient frontier; Performance evaluation; Resource utilizations; Technical efficiency; US airline industry; Civil aviation"
"https://www.scopus.com/inward/record.uri?eid=2-s2.0-85064100230&doi=10.1007%2f978-981-13-1334-9&partnerID=40&md5=d842805896d882e76daf52385ef4bdab","Business analytics; Business applications; Data mining; HR analytics; Predictive modelling; Structural equation modeling",""
"https://www.scopus.com/inward/record.uri?eid=2-s2.0-85150735599&partnerID=40&md5=a5af1cc6d2495fede45f038ff46a4516","Business Analytics; Case-driven Approach; Data Analytics; Data-driven Decision Making; Industrial Applications of Analytics; Machine Learning; Natural Language Processing",""
"https://www.scopus.com/inward/record.uri?eid=2-s2.0-85114902519&partnerID=40&md5=baae3fe131785898dda625bba82843c1","Data acquisition; Hierarchical Bayesian model; Kullback-Leibler divergence; Markov chain Monte Carlo (MCMC); Tobit model","Advanced Analytics; Bayesian networks; Data acquisition; Information systems; Information use; Markov chains; Monte Carlo methods; Business analytics; Estimation and predictions; Hierarchical Bayesian modeling; Hierarchical Bayesian models; Individual customers; Kullback Leibler divergence; Markov chain Monte Carlo; Markov chain monte carlo simulation; Sales"
"https://www.scopus.com/inward/record.uri?eid=2-s2.0-85047256940&doi=10.1080%2f07421222.2018.1451950&partnerID=40&md5=69a60fbbc61387679bc741983f290888","",""
"https://www.scopus.com/inward/record.uri?eid=2-s2.0-85057111519&doi=10.1080%2f10528008.2018.1436974&partnerID=40&md5=0d15ff06ef1c270512aba085b7cb4ad7","",""
"https://www.scopus.com/inward/record.uri?eid=2-s2.0-85091339441&partnerID=40&md5=586ce59b7e3ace8f0ea8dac43504466e","Business analytics; Curricular development; Quantitative analysis","Advanced Analytics; Information systems; Information use; Management information systems; Motivation; Business analytics; Course contents; Course delivery; Course development; Curricular design; Curriculum designs; Program elements; US universities; Curricula"
"https://www.scopus.com/inward/record.uri?eid=2-s2.0-85052510449&doi=10.1145%2f3234698.3234758&partnerID=40&md5=c839265ed2ff1c8cfc53622531f2e9bf","Adaptive management; Big data; Disaster recovery plan; Fuzzy cognitive map; Networked enterprises","Cognitive systems; Complex networks; Computer system recovery; Disaster prevention; Disasters; Fuzzy rules; Information management; Large scale systems; Recovery; Risk assessment; Risk management; Adaptive Management; Business networks; Disaster planning; Disaster recovery; Disaster recovery plan; Fuzzy cognitive map; Networked enterprise; Risk assessment methodologies; Big data"
"https://www.scopus.com/inward/record.uri?eid=2-s2.0-85021714828&doi=10.1016%2fj.ejor.2017.06.031&partnerID=40&md5=dc4016735a147f4669671391d67631a9","Analytics; Data mining; OR for community development; Problem structuring methods; Soft systems methodology","Data mining; Mathematical models; Operations research; Analytics; Business analytics; Community development; Development project; Dynamic visualization; Operational research; Problem structuring methods; Soft systems methodology; Population statistics"
"https://www.scopus.com/inward/record.uri?eid=2-s2.0-85067063740&partnerID=40&md5=c14d3dcf7cd47e622ace49f752841991","Engineering education; Intelligent mobility; Intelligent transportation system; Transportation and traffic",""
"https://www.scopus.com/inward/record.uri?eid=2-s2.0-85056853380&doi=10.1016%2fj.jbusres.2018.11.028&partnerID=40&md5=fcc867b4d62806437787e47fe84e330a","Business analytics; Business process performance; Firm performance; Resource-based view; Turkey",""
"https://www.scopus.com/inward/record.uri?eid=2-s2.0-85114902493&partnerID=40&md5=cdf4fc2e17e13dab72c9d38a408233a3","Big data; Business analytics; Data science; Historical paradigms; Information systems theory","Bifurcation (mathematics); Big data; Data Science; Information systems; Information use; Business analytics; Conceptual foundations; Historical paradigms; Teaching analytics; Advanced Analytics"
"https://www.scopus.com/inward/record.uri?eid=2-s2.0-85065465643&doi=10.1287%2fited.2018.0196&partnerID=40&md5=93c1393437b62296146612cdda7ee73b","Customer analytics; Database; Descriptive analytics; Microsoft excel; MIS; Operations; Zip codes",""
"https://www.scopus.com/inward/record.uri?eid=2-s2.0-85057110651&doi=10.1080%2f10528008.2017.1421050&partnerID=40&md5=0540e36c85ad814c737b5c3ba3194929","",""
"https://www.scopus.com/inward/record.uri?eid=2-s2.0-85060930462&doi=10.1016%2fj.chb.2018.08.024&partnerID=40&md5=5d3312a15d1bc9a54e765f4721a618b9","Achievement emotion; Business analytics; India; Moderated mediating effect; Perceived success; Value","Advanced Analytics; Students; Achievement emotion; Business analytics; India; Mediating effect; Perceived success; Value; academic achievement; adult; article; fear; female; gender; human; human experiment; India; learning; major clinical study; male; student; Behavioral research"
"https://www.scopus.com/inward/record.uri?eid=2-s2.0-85088407662&doi=10.5130%2facis2018.ah&partnerID=40&md5=6f531b9e6f2c3c79293df76350b9e540","Business analytics; Fit; Information processing capabilities; Information processing needs; Information processing theory; Performance","Competition; Decision making; Information systems; Information use; Supply chain management; Business analytics; Information processing capability; Information processing needs; Information processing theories; Performance; Advanced Analytics"
"https://www.scopus.com/inward/record.uri?eid=2-s2.0-85108251251&partnerID=40&md5=93e70e4ac3221b6242e80ac05632a057","",""
"https://www.scopus.com/inward/record.uri?eid=2-s2.0-85052751792&doi=10.1002%2fbbb.1922&partnerID=40&md5=d36331f852de9900664849c14a7a5208","",""
"https://www.scopus.com/inward/record.uri?eid=2-s2.0-85079088979&doi=10.1016%2fj.procs.2019.11.026&partnerID=40&md5=c556c69471276467b2f14f83a5c34449","Analytics; Benchmarking; Big data; Data mining","Advanced Analytics; Benchmarking; Big data; Data mining; Health care; Analytics; Benchmarking process; Business analytics; Data environment; Data-mining tools; Evaluation criteria; Technological development; Traditional techniques; Data communication systems"
"https://www.scopus.com/inward/record.uri?eid=2-s2.0-85061319761&partnerID=40&md5=6f1412f41321b74a9a7b29d7347d951a","Business Analytics; Challenges; Metrics; Organization; Social Media Management","Advanced Analytics; Decision making; Information systems; Information use; Managers; Societies and institutions; Business analytics; Challenges; Contextuality; International organizations; Metrics; Online business; Social media; Social media analytics; Social networking (online)"
"https://www.scopus.com/inward/record.uri?eid=2-s2.0-85077198247&partnerID=40&md5=789dfd521bb62d3b9e6c3623f2ad7bdc","Business analytics; Business intelligence; Business planning; Competitive advantage","Competition; Competitive intelligence; Decision making; Digital storage; Strategic planning; Boston consulting groups; Business analytics; Business planning; Competitive advantage; Data driven decision; Digital technologies; Exchange of information; Information exchanges; Advanced Analytics"
"https://www.scopus.com/inward/record.uri?eid=2-s2.0-85020741786&doi=10.1007%2fs11135-017-0522-7&partnerID=40&md5=ad09d92106a197e929efa3c628d1c570","Business analytics; Co-authorship; Co-occurrence network; Collaboration; Scientometrics; Social network analysis; VOS viewer",""
"https://www.scopus.com/inward/record.uri?eid=2-s2.0-85062176036&doi=10.2195%2flj_NotRev_brueggenolte_de_201811_01&partnerID=40&md5=f1fa380f9e89882795b6698ad74cee0a","Bestandsmanagement; Big data; Business analytics; Reifegradmodell; Vorgehensmodell",""
"https://www.scopus.com/inward/record.uri?eid=2-s2.0-85061820823&doi=10.1109%2fICONIC.2018.8601236&partnerID=40&md5=67acd39dcf7d5f509d181825ffd6da9b","Business Analytics; Decision Making; Institutions of Higher Learning; Management","Advanced Analytics; Information management; Intelligent computing; Management; Academic managements; Business analytics; Data infrastructure; Higher learning; Quality performance; Real time solution; Semi structured interviews; Strategic objectives; Decision making"
"https://www.scopus.com/inward/record.uri?eid=2-s2.0-85041895106&doi=10.1016%2fj.im.2018.01.005&partnerID=40&md5=c6598a359f1c299163db39b7ae97adc1","Analytics resources; Analytics technology assets; Business analytics; Business analytics capability; Business value; Resource-based view","Information systems; Analytics resources; Analytics technology assets; Business analytics; Business value; Resource-based view; Information science"
"https://www.scopus.com/inward/record.uri?eid=2-s2.0-85054417186&doi=10.1016%2fj.hitech.2018.09.004&partnerID=40&md5=ee0514f182f60cdab42c9dc189549f65","Big data; Business analytics; ERP; Maturity model; Portfolio perspective; Sustainable competitive advantages","Cognitive systems; Competition; Data integration; Deep learning; Distributed computer systems; Enterprise resource planning; Integration; Media streaming; Sustainable development; Artificial intelligence techniques; Business analytics; Internet of thing (IoTs); Maturity model; Portfolio perspective; Social media platforms; Sustainable competitive advantages; Technology Integration; Big data"
"https://www.scopus.com/inward/record.uri?eid=2-s2.0-85041206721&doi=10.1080%2f10580530.2017.1416948&partnerID=40&md5=5c206dfa75cab053750212ab572d08e3","Business analytics; executive IT perception; maturity model","Information management; Business analytics; Data analytics; Management support; Maturity model; Process levels; Managers"
"https://www.scopus.com/inward/record.uri?eid=2-s2.0-85146170437&doi=10.1007%2f978-981-10-6427-2_47&partnerID=40&md5=d65e8c5a9afc0d0b9adc2ac298ab2d3b","",""
"https://www.scopus.com/inward/record.uri?eid=2-s2.0-85136447237&doi=10.4324%2f9780429492433&partnerID=40&md5=d4a5575cd415d4dfc09e5fca6f7071b0","",""
"https://www.scopus.com/inward/record.uri?eid=2-s2.0-85060824186&partnerID=40&md5=cbddedbe25d00e2b53d6888317764296","Business Analytics; Business Intelligence; City of Houston; Planning; Smart Utility; Strategic Asset Management; Utility Management","Advanced Analytics; Asset management; Competitive intelligence; Decision making; Life cycle; Planning; Business analytics; Houston; Smart Utility; Strategic asset managements; Utility management; Wastewater treatment"
"https://www.scopus.com/inward/record.uri?eid=2-s2.0-85069483186&doi=10.24874%2fti.2019.41.02.14&partnerID=40&md5=696df241465a1ad304234654c040a525","Business analytics; Coating design; Design of experiments; Manufacturing analytics; Tribotest",""
"https://www.scopus.com/inward/record.uri?eid=2-s2.0-85054356416&doi=10.1080%2f08832323.2018.1507987&partnerID=40&md5=fa7e00d5debeb3c8069811bb46e68804","Business analytics; curriculum development; education; Microsoft Excel; statistics",""
"https://www.scopus.com/inward/record.uri?eid=2-s2.0-85073443278&partnerID=40&md5=03e13cc941a1246c2df58bd8d55d447b","Business analytics; Employability; Fresher’s perspective",""
"https://www.scopus.com/inward/record.uri?eid=2-s2.0-85040632535&doi=10.1016%2fj.ijinfomgt.2018.01.005&partnerID=40&md5=fe969b0a80f7df75c439dea2eb23a5b6","Business analytics; Customer relationship management; Customer response capability; Data management capability; Dynamic capability","Enterprise resource management; Information management; Sales; Business analytics; Customer relationship management; Customer response; Dynamic capabilities; Management capabilities; Public relations"
"https://www.scopus.com/inward/record.uri?eid=2-s2.0-85074080423&partnerID=40&md5=f8604fdbdbad4fce0b7df97e298ea25f","Innovation; Resources; Security; System; Trade",""
"https://www.scopus.com/inward/record.uri?eid=2-s2.0-85073744882&doi=10.17705%2f1CAIS.04441&partnerID=40&md5=58218a2c8caa645998c337aae9abe91b","Business analytics; Business analytics breadth level; Job placement; MBA; Salary; University ranking","Commerce; Employment; Investments; Wages; Business analytics; Business schools; Job market; Job placement; Level playing fields; Re-turn-on; Signaling theory; University ranking; Advanced Analytics"
"https://www.scopus.com/inward/record.uri?eid=2-s2.0-85059154081&doi=10.3390%2fsu11010064&partnerID=40&md5=8436032487436d5bb1a079009054f57a","Feature selection; Financial distress prediction; Genetic algorithm; Instance selection; Support vector machines","accuracy assessment; artificial intelligence; genetic algorithm; heuristics; numerical model; risk assessment; support vector machine; sustainability"
"https://www.scopus.com/inward/record.uri?eid=2-s2.0-85053547880&doi=10.1007%2f978-3-030-00063-9_32&partnerID=40&md5=a40f02b3dcffda73b12b1806599b46f6","Analytical tools; Big data applications; Business analytics; Business intelligence; Conceptual modelling; Data mining; Data pre-processing; Decision support; Information visualisation","Big data; Competitive intelligence; Data handling; Decision making; Decision support systems; Information systems; Information use; Learning algorithms; Learning systems; Visualization; Analytical tool; Big data applications; Business analytics; Conceptual modelling; Data preprocessing; Decision supports; Information visualisation; Data mining"
"https://www.scopus.com/inward/record.uri?eid=2-s2.0-85083449421&partnerID=40&md5=73ca53c53af251471916b0b8e9b610ff","","Advanced Analytics; Decision trees; Pipelines; Sales; Software engineering; Support vector machines; Turing machines; Individual prediction; Opportunity management; Pipeline management; Professional expertise; Random forest algorithm; Real business data; Sales representatives; Supervised classifiers; Learning systems"
"https://www.scopus.com/inward/record.uri?eid=2-s2.0-85061328591&partnerID=40&md5=f55ee921471b009fce17114ad6ed85e8","Algebra of Random Variables; Business Analytics; Design Science; Unreliability","Algebra; Decision making; Information systems; Information use; Random variables; Business analytics; Decision makers; Design science; Managerial decision; Mathematical foundations; Reliability information; Theoretical foundations; Unreliability; Advanced Analytics"
"https://www.scopus.com/inward/record.uri?eid=2-s2.0-85073293778&doi=10.1590%2f1807-7692bar2019180136&partnerID=40&md5=1cd9d65c25105306b8a6a2b652483251","Business analytics; Hotel reviews; Text mining",""
"https://www.scopus.com/inward/record.uri?eid=2-s2.0-85041435692&doi=10.1016%2fj.eswa.2018.01.029&partnerID=40&md5=de04a6de5d54fad60d5f8a448f9579f2","Clustering; Customer visit segmentation; Data mining; Retail business analytics; Shopper behavior","Cereal products; Commerce; Costs; Marketing; Sales; Taxonomies; Trees (mathematics); Business analytics; Clustering; Fast moving consumer goods; Marketing campaign; Product categories; Product recommendation; Retail business; Shopper behavior; Data mining"
"https://www.scopus.com/inward/record.uri?eid=2-s2.0-85032702646&doi=10.1080%2f00207543.2017.1395488&partnerID=40&md5=144587db68aae868013ae027cb8a540b","agile manufacturing; big data and business analytics; competitive advantage; enablers; performance","Competition; Manufacture; Supply chains; Agile manufacturing; Business analytics; Competitive advantage; enablers; performance; Big data"
"https://www.scopus.com/inward/record.uri?eid=2-s2.0-85077856579&doi=10.1080%2f2573234X.2018.1507605&partnerID=40&md5=416c6cbaeaec5a2b523381d666606363","analytics; Business analytics (BA); definition; Google Trends; search; text analysis","Search engines; Academic literature; Business analytics; Database searches; Empirical approach; Keyword search; Qualitative research; Text analytics; Tools and techniques; Advanced Analytics"
"https://www.scopus.com/inward/record.uri?eid=2-s2.0-85061361425&partnerID=40&md5=b7d955a0198c34af8c1274b350aa8380","",""
"https://www.scopus.com/inward/record.uri?eid=2-s2.0-85125615706&partnerID=40&md5=aeed071e96acc0ae88174f63a182406b","",""
"https://www.scopus.com/inward/record.uri?eid=2-s2.0-85064100823&doi=10.1007%2f978-981-13-1334-9_11&partnerID=40&md5=2994f4febff3869a7469be663eb5cd5b","",""
"https://www.scopus.com/inward/record.uri?eid=2-s2.0-85068686840&partnerID=40&md5=34403728060b78268fc55f6ea75cef85","",""
"https://www.scopus.com/inward/record.uri?eid=2-s2.0-85064155384&doi=10.1080%2f2573234X.2018.1557020&partnerID=40&md5=f6b038b68db8f3af304f351917ec9ee4","Big data; business analytics; financial performance; holistic thinking; operational performance","Cost effectiveness; Business analytics; Contract manufacturers; Financial performance; Financial statements; Holistic thinking; Impact performance; Integrated business; Theoretical framework; Advanced Analytics"
"https://www.scopus.com/inward/record.uri?eid=2-s2.0-85108292275&partnerID=40&md5=6039cd5eaafec1e57e38ab1d5b51f905","",""
"https://www.scopus.com/inward/record.uri?eid=2-s2.0-85057406708&doi=10.1016%2fj.compag.2018.11.028&partnerID=40&md5=586c8cd73096012ef7cd9f86a5b85253","Business analytics functionality; ERP systems; Farms; FMIS; Industry 4.0","Brazil; Agriculture; Chemical analysis; Disease control; Farms; Industry 4.0; Information analysis; Information dissemination; Information management; Interoperability; Solar energy; Business analytics; Diffusion of innovation theory; Enterprise resource planning (ERP) systems; ERP system; FMIS; Managerial implications; Soil chemical compositions; Technology-organization-environment frameworks; agriculture; agroindustry; business; empirical analysis; entrepreneur; environmental planning; farm; information system; software; technology adoption; Enterprise resource planning"
"https://www.scopus.com/inward/record.uri?eid=2-s2.0-85067027614&partnerID=40&md5=c445698a8dddaa92d90d20f916caacd4","",""
