"Link","Author Keywords","Index Keywords"
"https://www.scopus.com/inward/record.uri?eid=2-s2.0-85146436051&doi=10.1016%2fj.segan.2022.100989&partnerID=40&md5=8f84809e080a6aa9b4118a8aa95333ad","Charging station; Improved flow-capturing location model; Plug-in electric vehicle; Pricing design; Renewable energy resource","Charging (batteries); Costs; Electric loads; Electric power distribution; Integer programming; Investments; Location; Plug-in electric vehicles; Profitability; Sales; Charging station; Critical challenges; Distribution companies; Electricity sales; Fast charging stations; Improved flow-capturing location model; Location modeling; Optimal locations; Pricing design; Sale price; Renewable energy resources"
"https://www.scopus.com/inward/record.uri?eid=2-s2.0-85146833592&doi=10.1016%2fj.segan.2023.100996&partnerID=40&md5=b4a3552d9fa7420600c0a4b25335d51f","Artificial neural networks; Electricity price forecasting; Market integration; Transfer learning","Deregulation; Forecasting; Learning systems; Power markets; Accurate prediction; Day-ahead; Deregulated markets; Electricity prices; Electricity prices forecasting; Market integration; Neural network model; Performance; Research fields; Transfer learning; Neural networks"
"https://www.scopus.com/inward/record.uri?eid=2-s2.0-85140047399&doi=10.1016%2fj.segan.2022.100938&partnerID=40&md5=ae344f6cea5fd27d6b2106d624fc06f7","Attention layer; Convolution Neural Network (CNN); Load disaggregation; Machine learning (ML); Multi-head CNN (mhNet); Non-intrusive load monitoring (NILM)","Convolution; Convolutional neural networks; Electric power transmission networks; Electric power utilization; Energy management systems; Multilayer neural networks; Attention layer; Convolution neural network; Disaggregation; Load disaggregation; Machine learning; Machine-learning; Multi-head convolution neural network (mhnet); Non-intrusive load monitoring; Nonintrusive load monitoring; Machine learning"
"https://www.scopus.com/inward/record.uri?eid=2-s2.0-85142693175&doi=10.1016%2fj.segan.2022.100952&partnerID=40&md5=7e4efd1d05c0533e6baca3aec74c2c4e","Distributed energy resources; Feasibility; Flexibility; Frequency control ancillary services; Optimal power flow; TSO–DSO coordination","Commerce; Electric load management; Electric power system interconnection; Electric power transmission networks; Energy resources; Frequency estimation; Real time systems; Structural optimization; Ancillary service; Distributed Energy Resources; Feasibility; Feasibility region; Flexibility; Flexibility region; Frequency control ancillary service; Grid structures; Optimal power flows; TSO–DSO coordination; Electric load flow"
"https://www.scopus.com/inward/record.uri?eid=2-s2.0-85144057724&doi=10.1016%2fj.segan.2022.100963&partnerID=40&md5=8230563c5dcec2e68895c6c9e30534db","Collective self-consumption; Electric mobility; MILP model; Optimal design; Renewable energy","Electric vehicles; Energy efficiency; Integer programming; Optimal systems; Stochastic models; Collective self-consumption; Electric mobility; Energy; Energy fields; European Countries; MILP model; Optimal design; Renewable energies; Renewable energy source; Smart solutions; Renewable energy resources"
"https://www.scopus.com/inward/record.uri?eid=2-s2.0-85143706412&doi=10.1016%2fj.segan.2022.100971&partnerID=40&md5=6aa22f3150f9b859fded0701c909afed","Islanded microgrid; Parameter design; Passivity enhancement; Voltage source inverter","Damping; Design; Power quality; Renewable energy resources; Control loop; Control strategies; Damping injection; Enhancement control; Islanded microgrid; Microgrid; Parameter designs; Passivity enhancement; Voltage source inverter; Voltage-source inverter; Electric inverters"
"https://www.scopus.com/inward/record.uri?eid=2-s2.0-85150257303&doi=10.1016%2fj.segan.2023.101025&partnerID=40&md5=011671f4119ed3e8325813e1682ccefd","Bayesian optimization; CNN–BiLSTM–attention mechanism; Deep learning; Feature extraction; Missing record identification; PV power prediction","Bismuth compounds; Forecasting; Learning systems; Power quality; Attention mechanisms; Bayesian optimization; CNN–BiLSTM–attention mechanism; Deep learning; Features extraction; High resolution; Missing record identification; Photovoltaic power; Photovoltaic power prediction; Power predictions; Deep learning"
"https://www.scopus.com/inward/record.uri?eid=2-s2.0-85139296967&doi=10.1016%2fj.segan.2022.100923&partnerID=40&md5=df1233e0740eb2f2b40914ce7712c791","Amplify and forward; Energy efficiency; OFDM","Budget control; Cognitive radio; Energy efficiency; Energy utilization; Iterative methods; Amplify-and-forward; Cooperative amplify and forwards; Cooperative relay networks; Data-rate; Energy-consumption; Green carbons; Low carbon; Network data; Network throughput; Throughput rate; Orthogonal frequency division multiplexing"
"https://www.scopus.com/inward/record.uri?eid=2-s2.0-85147940176&doi=10.1016%2fj.segan.2023.101017&partnerID=40&md5=24d993e1cb0c0d9033d5d7a511ba490b","Adaptive protection; Convolutional neural networks; Distribution systems; Fault detection; Support vector machines; Topology estimation","Convolution; Convolutional neural networks; Electric power distribution; Fault detection; Timing circuits; Topology; Vectors; Adaptive protection; Convolutional neural network; Distribution systems; Ensemble models; Fault detection and classification; Fault detector; Faults detection; Sub-systems; Support vectors machine; Topology estimation; Support vector machines"
"https://www.scopus.com/inward/record.uri?eid=2-s2.0-85149801540&doi=10.1016%2fj.segan.2023.101023&partnerID=40&md5=d271681f4dc300b235f7c8b8f347334c","Algorithmic trading; Day-ahead market; Deep reinforcement learning; Electricity price forecasting; Energy trading; Intraday market; Machine learning","Costs; Dams; Deep learning; Forecasting; Intelligent agents; Learning systems; Reinforcement learning; Algorithmic trading; Day ahead market; Deep reinforcement learning; Electricity prices forecasting; Energy trading; Intraday market; Machine-learning; Reinforcement learnings; Statistical arbitrage; Trading strategies; Power markets"
"https://www.scopus.com/inward/record.uri?eid=2-s2.0-85144612407&doi=10.1016%2fj.segan.2022.100984&partnerID=40&md5=833c2ec09db659b366679abcf21bc0fa","Optimization; Power distribution systems; Resilience; Trajectory design; Unmanned aerial vehicles","Antennas; Damage detection; Disasters; Electric power distribution; Repair; Scheduling algorithms; Aerial vehicle; Communication coverage; Control centre; Damage assessments; Distribution systems; Optimisations; Power-distribution system; Resilience; Trajectory designs; Unmanned aerial vehicle; Unmanned aerial vehicles (UAV)"
"https://www.scopus.com/inward/record.uri?eid=2-s2.0-85150406347&doi=10.1016%2fj.segan.2023.101018&partnerID=40&md5=6d4488c2d90f72817b053c1e64ef677a","Battery storage; Load forecast; Optimum; Peak shaving; Rule-based control","Battery storage; Deep learning; Digital storage; Electric batteries; Electric power plant loads; Battery storage; Case-studies; Grid operators; Load forecast; Optimum; Peak-shaving; Rule-based control; Stationary energy storages; Storage systems; Total energy; Electric power distribution"
"https://www.scopus.com/inward/record.uri?eid=2-s2.0-85139066443&doi=10.1016%2fj.segan.2022.100924&partnerID=40&md5=d87d8d16c412c2032f5491fed8527b35","Demand response; Electric vehicles; Energy storage systems; Microgrid; Vehicle-to-grid","Charging (batteries); Cost benefit analysis; Cost estimating; Electric power transmission networks; Electric vehicles; Fleet operations; Renewable energy resources; Secondary batteries; Vehicle-to-grid; Demand response; End-users; Energy; Energy cost; Energy storage system; Microgrid; Neighbourhood; Storage systems; Vehicle fleets; Vehicle to grids; Energy storage"
"https://www.scopus.com/inward/record.uri?eid=2-s2.0-85143153271&doi=10.1016%2fj.segan.2022.100950&partnerID=40&md5=ed4398d61c2681e8cd2e9748fb0ec75b","Fuzzy droop control; Membership functions; Optimization; Powers coefficients; Renewable distributed generator","Computer circuits; Distributed power generation; Electric machine control; Electric power system control; Electric power transmission networks; Fuzzy logic; MATLAB; Power management; Quadratic programming; Adaptive fuzzy logic; Distributed generators; Droop control; Fuzzy droop control; Memberships function; Microgrid; Optimisations; Power allocations; Power coefficients; Renewable distributed generator; Membership functions"
"https://www.scopus.com/inward/record.uri?eid=2-s2.0-85140782717&doi=10.1016%2fj.segan.2022.100942&partnerID=40&md5=35e56c62826c7d2d587232ccd86c7933","Electricity markets; Flexibility; Information gap decision theory; Techno-economic assessment; TSO-DSO coordination; Uncertainty","Costs; Decision theory; Economic analysis; Electric power transmission; Energy resources; Sales; Distributed Energy Resources; Flexibility; Information gap decision theory; Information-gap; Multi-Criterion; Retail electricity markets; Techno-economic assessment; TSO-DSO coordination; Uncertainty; Wholesale electricity markets; Power markets"
"https://www.scopus.com/inward/record.uri?eid=2-s2.0-85141535280&doi=10.1016%2fj.segan.2022.100947&partnerID=40&md5=a4dd1e9d3df4300f9cd267e91689b330","Ancillary grid services; BESS; Electricity markets; Energy storage; Frequency control; Nordic power system","Digital storage; Electric batteries; Electric energy storage; Electric power system control; Electric power transmission; Electric power transmission networks; Power markets; Ancillary grid; Ancillary grid service; Balancing market; BESS; Energy; Frequency control; Grid services; Nordic power system; Power; Regulating power; Profitability"
"https://www.scopus.com/inward/record.uri?eid=2-s2.0-85139596815&doi=10.1016%2fj.segan.2022.100937&partnerID=40&md5=006b8c629f0d93aaf4ee4ce7f9c54bfa","Closed-loop operation; Distribution network reconfiguration; Renewable energy sources; Short-circuit; Stochastic programming","Integer programming; Natural resources; Renewable energy resources; Stochastic models; Stochastic systems; Timing circuits; Closed-loop operation; Distribution network reconfiguration; Mixed integer; Optimal reconfigurations; Programming models; Renewable energy source; Scenario-based; Second-order cone programming; Stochastics; Technical loss; Stochastic programming"
"https://www.scopus.com/inward/record.uri?eid=2-s2.0-85142204206&doi=10.1016%2fj.segan.2022.100951&partnerID=40&md5=da8c812c2b6c04b4bf0c9bb69a19b2be","Ancillary services; Local energy markets; Peer-to-peer energy trading; Reactive power; Smart grids; Two-stage stochastic programming","Electric batteries; Electric load flow; Electric power transmission networks; Energy resources; Power markets; Reactive power; Stochastic models; Stochastic programming; Stochastic systems; Ancillary service; Energy; Energy markets; Energy trading; Local energy; Local energy market; Peer to peer; Peer-to-peer energy trading; Smart grid; Two-stage stochastic programming; Smart power grids"
"https://www.scopus.com/inward/record.uri?eid=2-s2.0-85147192849&doi=10.1016%2fj.segan.2023.101008&partnerID=40&md5=ef1e2ffdc74501359ea167818a555002","Collaborative loads; Demand response; Energy management; Feature extraction; Mutual interaction","Electric loads; Electric power distribution; Electric power utilization; Empirical mode decomposition; Extraction; Housing; Water distribution systems; Collaborative load; Demand response; Electricity demands; Features extraction; Mutual interaction; Peak demand; Peak time; Size and shape; Water demand; Water distributions; Feature extraction"
"https://www.scopus.com/inward/record.uri?eid=2-s2.0-85144529001&doi=10.1016%2fj.segan.2022.100982&partnerID=40&md5=eed780e2febc2b3c7b2564219c71a9f1","AC/DC hybrid microgrids; Flexible sources; Monte-Carlo simulation; Optimal power flow; Resilience; Self-healing; Stochastic analysis","Charging (batteries); Distributed power generation; Electric load flow; Electric load shedding; Integer programming; Intelligent systems; Monte Carlo methods; Renewable energy resources; Self-healing materials; Stochastic models; Vehicle-to-grid; AC/DC hybrid microgrid; Electrical vehicles; Flexible device; Flexible source; Microgrid; Monte Carlo's simulation; Optimal power flows; Resilience; Self-healing; Stochastic analysis; Stochastic systems"
"https://www.scopus.com/inward/record.uri?eid=2-s2.0-85142746916&doi=10.1016%2fj.segan.2022.100958&partnerID=40&md5=39da71828523753b6b6a7d6c256cc09f","Batteries; Battery policy; Energy economics; Energy storage; Industrial","Battery storage; Economic analysis; Economic and social effects; Electric batteries; Electric load dispatching; Industrial economics; Battery; Battery policies; Battery size; Case-studies; Commercial sector; Energy economics; Industrial; Industrial facilities; Industrial sector; Residential sectors; Housing"
"https://www.scopus.com/inward/record.uri?eid=2-s2.0-85145970791&doi=10.1016%2fj.segan.2022.100991&partnerID=40&md5=45b18f03567b10cfd55331403086048d","Electric vehicle; Fleet management; Mobile energy storage; Peak shaving; Vehicle for grid","Economic and social effects; Economics; Electric load dispatching; Electric power distribution; Electric vehicles; Energy resources; Fleet operations; Integer programming; Energy supplies; Fleet management; Future planning; Grid technologies; Load demand; Mobile energy storage; Peak-shaving; Vehicle fleets; Vehicle for grid; Vehicle to grids; Energy storage"
"https://www.scopus.com/inward/record.uri?eid=2-s2.0-85143529315&doi=10.1016%2fj.segan.2022.100967&partnerID=40&md5=c1e0753bd6e48d5a550e4a22bebb6f5f","Active distribution networks; Active distribution system management; Soft open points; State estimation","Electric power distribution; Equivalent circuits; Functional analysis; Nonlinear equations; Active distribution network; Active distribution system management; Active distribution systems; Active distributions; Distribution network modelling; Estimation process; Functional equation; Soft open point; Systems management; Weighted least-squares; State estimation"
"https://www.scopus.com/inward/record.uri?eid=2-s2.0-85147095350&doi=10.1016%2fj.segan.2023.100999&partnerID=40&md5=c9c015651e4a6fedd306de48963e3aa5","Active distribution network (ADN); Battery energy storage (BES); Flexibilities; Photovoltaic (PV); Stochastic optimization","Battery storage; Electric batteries; Electric fault currents; Electric load dispatching; Electric power transmission; Electric power transmission networks; Flexible structures; Reactive power; Second-order cone programming; Stochastic models; Stochastic systems; Active and Reactive Power; Active distribution network; Active distributions; Battery energy storage; Flexibility; Photovoltaic; Photovoltaics; Scenarios generation; Stochastic optimizations; Electric power distribution"
"https://www.scopus.com/inward/record.uri?eid=2-s2.0-85142715198&doi=10.1016%2fj.segan.2022.100953&partnerID=40&md5=318f1e30cda1e027e33312baec019da1","Day-ahead; Energy markets; Flexible Ramping Product; Microgrid; Real-time; Renewable energy sources; Risk; Two-stage stochastic","Decision theory; Power markets; Renewable energy resources; Stochastic systems; Uncertainty analysis; Day-ahead; Energy markets; Flexible ramping product; Microgrid; Product markets; Real- time; Renewable energy source; Stochastics; Time energy; Two-stage stochastic; Decision making"
"https://www.scopus.com/inward/record.uri?eid=2-s2.0-85148076603&doi=10.1016%2fj.segan.2023.101005&partnerID=40&md5=e9720e004d301b2e7ccbcced2107e667","Adequacy assessments; Capacity credits; Capacity remuneration mechanisms; Electricity storage; Resource adequacy; Security of supply","Economic analysis; Electric energy storage; Electric load dispatching; Adequacy assessment; Capacity credit; Capacity remuneration mechanism; Electricity storages; Loss of load expectation; Power; Resource adequacy; Security of supply; Short term storage; Storage operations; Renewable energy resources"
"https://www.scopus.com/inward/record.uri?eid=2-s2.0-85143850517&doi=10.1016%2fj.segan.2022.100966&partnerID=40&md5=d8c52a0118330010cf53e361b04ea4b3","Classification; Deep learning; Energy consumption; Knowledge discovery; Smart meter","Deep learning; Distributed power generation; Housing; Learning systems; Sales; Smart meters; Smart power grids; Deep learning; Distribution network operators; Electricity industry; Energy consumer; Energy-consumption; Learning approach; Legal frameworks; Penetration level; Policy framework; Residential customers; Energy utilization"
"https://www.scopus.com/inward/record.uri?eid=2-s2.0-85145658307&doi=10.1016%2fj.segan.2022.100970&partnerID=40&md5=b262675315f6da2f0ef8bce21b1812d2","Dynamic thermal rating (DTR); Linear programming (LP); System integrity protection scheme (SIPS); Transmission line congestion; Transmission line thermal limits; Wind curtailment","Electric power system protection; Electric power transmission; Electric power transmission networks; Linear programming; Meteorology; Wind; Wind power; Dynamic thermal rating; Dynamic thermal ratings; Line congestions; Linear programming; Linear-programming; System integrity protection scheme; System Integrity Protection Schemes; Thermal limits; Transmission line congestion; Transmission line thermal limit; Transmission-line; Wind curtailment; Electric lines"
"https://www.scopus.com/inward/record.uri?eid=2-s2.0-85149727955&doi=10.1016%2fj.segan.2023.100997&partnerID=40&md5=39e3f6cc0b22df9ec58513dde616ec96","Peer-to-peer energy trading; Product differentiation; Renewable integration; Transactive energy","Blockchain; Costs; Distributed ledger; Electric load flow; Electric power distribution; Integration; Open systems; Peer to peer networks; Power markets; Smart power grids; Bilateral negotiations; Block-chain; Energy; Energy markets; Energy trading; Peer to peer; Peer-to-peer energy trading; Product differentiation; Renewable integration; Transactive energy; Smart contract"
"https://www.scopus.com/inward/record.uri?eid=2-s2.0-85141465776&doi=10.1016%2fj.segan.2022.100946&partnerID=40&md5=d2a9bdafa758af4d2d2080546c7dea78","CNN; Electroluminescence; Fault detection; Photovoltaic; Vector machine","Classification (of information); Convolution; Convolutional neural networks; Electroluminescence; Image classification; Learning algorithms; Solar panels; Support vector machines; Convolutional neural network; Electroluminescence images; Faults detection; Model vectors; Network support; Neural network model; Photovoltaic panels; Photovoltaics; Support vector machine techniques; Vector machines; Fault detection"
"https://www.scopus.com/inward/record.uri?eid=2-s2.0-85149885563&doi=10.1016%2fj.segan.2023.101024&partnerID=40&md5=1e6dc25186dd541cbbd8a624f5fe98f7","AC-microgrid; Adaptive protection; Distributed generation; Fault detection and classification; Fault superimposed components; Synchrophasor measurements","Complex networks; Electric fault currents; Electric power system protection; Fault detection; Phase measurement; Phasor measurement units; AC-microgrid; Adaptive protection; Differential phase; Fault detection and classification; Fault superimposed components; Microgrid; Penetration rates; Phase angles; Protection schemes; Synchrophasor measurements; Distributed power generation"
"https://www.scopus.com/inward/record.uri?eid=2-s2.0-85140079177&doi=10.1016%2fj.segan.2022.100939&partnerID=40&md5=06666cd98579bfc1ca72d000f7d1b784","Battery energy storage systems; Deep regression learning; Frequency regulation; Multivariate forecasting; State of charge","Battery management systems; Battery storage; Charging (batteries); Digital storage; Learning systems; Long short-term memory; Mean square error; Regression analysis; Secondary batteries; Battery energy storage systems; Deep regression learning; Fast response time; Forecasting methods; Frequency regulation services; Frequency regulations; Multisteps; Multivariate forecasting; States of charges; System state; Forecasting"
"https://www.scopus.com/inward/record.uri?eid=2-s2.0-85147039347&doi=10.1016%2fj.segan.2022.100917&partnerID=40&md5=214cbc942fbf1c7209dbc79a86b57081","Clustering; Data compression; Missing data; PMUs; Smart meters; Tensor decomposition; Tucker decomposition","Clustering algorithms; Compressed sensing; Iterative methods; Phasor measurement units; Singular value decomposition; Smart meters; Tensors; Advanced monitoring; Clusterings; Missing data; Multidimensional arrays; PMU; Power; Reconstruction error; Tensor decomposition; Times series; Tucker decompositions; Data compression"
"https://www.scopus.com/inward/record.uri?eid=2-s2.0-85150154046&doi=10.1016%2fj.segan.2023.101026&partnerID=40&md5=9c09f9d82cdba92fff31b94fd62a3718","Day-ahead robust optimization; Optimal operating interval; Shared energy storage","Economics; Game theory; Optimization; Coupling constraints; Day-ahead; Day-ahead robust optimization; Optimal operating interval; Renewable energy power; Robust optimization; Scheduling methods; Shared energy storage; Storage scheduling; Storage systems; Energy storage"
"https://www.scopus.com/inward/record.uri?eid=2-s2.0-85137160823&doi=10.1016%2fj.segan.2022.100911&partnerID=40&md5=274c1f6e8cc751841b6f28989f39e538","Ancillary services; Energy storage systems; Renewable energy source; Renewable generation; Ultracapacitors; Voltage source converters","DC-DC converters; Electric power system control; Energy management; Energy management systems; Energy storage; Land vehicle propulsion; Natural resources; Renewable energy resources; Ancillary service; DC-bus voltages; Energy storage system; Renewable energy source; Renewable generation; Stability and robustness; Storage systems; Ultracapacitors; Voltage source; Voltage source converter; Supercapacitor"
"https://www.scopus.com/inward/record.uri?eid=2-s2.0-85131353915&doi=10.1016%2fj.segan.2022.100789&partnerID=40&md5=b5747e0cabe2c1bffbe955e281a686ba","High-throughput scheduling; Massively parallel computing; Numerical optimization; Optimal power flow; Power grid; Unit commitment","Data Analytics; Electric load flow; Electric power transmission networks; Quadratic programming; Renewable energy resources; Smart power grids; High-throughput; High-throughput scheduling; Massively parallel computing; Massively parallels; Numerical experiments; Numerical optimizations; Optimal power flows; Parallel data; Power grids; Unit Commitment; Uncertainty analysis"
"https://www.scopus.com/inward/record.uri?eid=2-s2.0-85138482969&doi=10.1016%2fj.segan.2022.100933&partnerID=40&md5=060ce25c303888b621368f4fb1c5fcfd","Conditional value at risk (CVaR); Dispatchable DG; Distributed generation (DG); Distribution system resiliency; Microgrid; Renewable DG; Tie line","Disasters; Electric load dispatching; Gas emissions; Global warming; Greenhouse gases; Integer programming; Photoelectrochemical cells; Sensitivity analysis; Conditional value at risk; Conditional Value-at-Risk; Dispatchable distributed generation; Distributed generation; Distribution system resiliency; Distribution systems; Microgrid; Natural disasters; Renewable distributed generations; Tie-line; Distributed power generation"
"https://www.scopus.com/inward/record.uri?eid=2-s2.0-85135715518&doi=10.1016%2fj.segan.2022.100860&partnerID=40&md5=20050d27e64c0d0c00531a36547277c3","Business ecosystem; Cooperative energy; Distributed energy resources (DERs); Ethereum blockchain; Smart contract","Blockchain; Distributed ledger; Energy resources; Ethereum; Block-chain; Business ecosystem; Business models; Cooperative energies; Distributed energy resource; Distributed Energy Resources; Energy; Energy sharings; Ethereum blockchain; Prosumer; Smart contract"
"https://www.scopus.com/inward/record.uri?eid=2-s2.0-85131267112&doi=10.1016%2fj.segan.2022.100759&partnerID=40&md5=e1eaed7d798ad4f0f966fca5b51eb2f0","Capacitated diversion flow-refueling location model; Driving range; Electric vehicle; Locating; Renewable energy sources; Uncertainty","Charging (batteries); Electric vehicles; Integer programming; Investments; Renewable energy resources; Uncertainty analysis; Capacitated diversion flow-refueling location model; Charging station; Driving range; Fast charging stations; Location modeling; Renewable energy source; Siting and sizings; States of charges; Transportation network; Uncertainty; Location"
"https://www.scopus.com/inward/record.uri?eid=2-s2.0-85138484867&doi=10.1016%2fj.segan.2022.100883&partnerID=40&md5=a150d4ceeee52c7ac980b56329e7607a","Controller-hardware-in-the-loop (CHIL); Electric vehicle; Grid impact analysis","Charging (batteries); Electric power system control; Electric power transmission networks; Hardware-in-the-loop simulation; Synthetic apertures; Vehicle-to-grid; Voltage regulators; Charging loads; Charging station; Controller hardware; Controller-hardware-in-the-loop; Grid impact analysis; Grid impacts; Hardware in the loops; High power; Power vehicles; Vehicle charging; Controllers"
"https://www.scopus.com/inward/record.uri?eid=2-s2.0-85136637353&doi=10.1016%2fj.segan.2022.100909&partnerID=40&md5=91f7af232fe0e80716e94d6a18e308f6","Energy management system; Fuzzy logic controller; Hybrid energy storage system; Multi-objective approach; Multi-stack fuel cell; Renewable microgrid","Computer circuits; Energy management; Fuel cells; Fuzzy logic; Housing; Model predictive control; Operating costs; Predictive control systems; Renewable energy resources; Storage management; Fuzzy logic controllers; Fuzzy-Logic; Hybrid energy storage systems; Microgrid; Multi objective; Multi-objective approach; Multi-stack fuel cell; Objective approaches; Performance; Renewable microgrid; Energy management systems"
