"Link","Author Keywords","Index Keywords"
"https://www.scopus.com/inward/record.uri?eid=2-s2.0-85101928553&doi=10.1016%2fj.segan.2021.100432&partnerID=40&md5=0090d950f649aaf1da723d6eb45f0e7d","Battery capacity estimation; Demand response; Energy management; MILP; Rainflow Cycle Counting algorithm; Smart grid","Air conditioning; Costs; Electric batteries; Energy management; Energy resources; Energy storage; Housing; Humidity control; Integer programming; Battery energy storage systems; Capacity degradation; Distributed Energy Resources; Energy expenditure; Indoor temperature; Mixed-integer linear programming; Rainflow cycle counting; Smart grid architectures; Scheduling"
"https://www.scopus.com/inward/record.uri?eid=2-s2.0-85100425714&doi=10.1016%2fj.segan.2021.100436&partnerID=40&md5=e8857b45c85105e171268d8c78f52fab","Aerial Bunched Cables (ABC); Aggregated Technical and Commercial (AT&C) loss; Environment and Social Impact (ESI); Grid modernization; High Voltage Distribution System (HVDS); Low Voltage Distribution System (LVDS)","Aluminum coated steel; Antennas; Modernization; Smart power grids; Sustainable development; Voltage distribution measurement; Aluminum conductor steel reinforced; High voltage distributions; Impact assessments; Low Voltage distribution system; Modernization programs; Operational data; Prediction errors; Simulation tests; Electric power transmission networks"
"https://www.scopus.com/inward/record.uri?eid=2-s2.0-85111907182&doi=10.1016%2fj.segan.2021.100517&partnerID=40&md5=fd6a51b7d4069db02c1b54d6c5172d5a","AC/DC systems; HVDC links; Linear programming; Power rescheduling; Security constrained OPF; VSC units","Linear programming; Piecewise linear techniques; Power plants; Quadratic programming; Contingency analysis; Linear programming models; Modelling framework; Optimisation method; Piece-wise linear functions; Security constrained opf; Security-constrained optimal power flow; Sequential quadratic programming; Electric power system security"
"https://www.scopus.com/inward/record.uri?eid=2-s2.0-85103081233&doi=10.1016%2fj.segan.2021.100452&partnerID=40&md5=4d730cc922afa0c5a6ec7eaa7ae55d39","Charging power; Demand flexibility; Electric vehicles; Grid impact","Electric transformers; Electric vehicles; Energy security; Gas emissions; Greenhouse gases; Distribution grid; Distribution transformer; Electric Vehicles (EVs); Empirical studies; Local air pollutions; Real transaction data; Residential charging; Transportation sector; Charging (batteries)"
"https://www.scopus.com/inward/record.uri?eid=2-s2.0-85109038716&doi=10.1016%2fj.segan.2021.100506&partnerID=40&md5=e79add5be1929cebb001b8508d69edde","Bi-level optimization; Demand response; False data injection attack; Reconfiguration; Time of use","Budget control; Communication channels (information theory); Smart meters; Bi-level optimization; Defense strategy; Distribution network reconfiguration; False data injection attacks; Network operations; Network re-configuration; Optimal locations; Real time pricing; Network security"
"https://www.scopus.com/inward/record.uri?eid=2-s2.0-85118897484&doi=10.1016%2fj.segan.2021.100556&partnerID=40&md5=edc488a5056827b8b02d3f9c08413734","Ancillary services; Biomass power plants; Energy systems; Spatial analysis; Spatial regression","Biomass; Economic analysis; Power markets; Reactive power; Spatial variables measurement; Ancillary service; Ancillary services markets; Biomass plants; Biomass power plants; Economic framework; Energy systems; Reactive power market; Spatial analysis; Spatial regression; Transmission systems; Electric power transmission"
"https://www.scopus.com/inward/record.uri?eid=2-s2.0-85103076156&doi=10.1016%2fj.segan.2021.100460&partnerID=40&md5=bfac3fab6dab9ca60a6ebb5dcb4e229f","DC microgrid; DER outage; Ensemble classifier; Local information; Protection scheme; Weather intermittency","Energy resources; Energy transfer; Microgrids; Stochastic systems; Topology; Wind; Distributed energy resource; Ensemble classifiers; Network re-configuration; On-line identification; Power transfer capability; Protection schemes; System reconfiguration; Topology identification; Fault detection"
"https://www.scopus.com/inward/record.uri?eid=2-s2.0-85101510038&doi=10.1016%2fj.segan.2021.100450&partnerID=40&md5=b0ae275d8f84efe5fc6146252195803b","Artificial intelligence; Identification; Power system faults; Signal processing; Support Vector Machine; time–frequency​ technique","Wavelet transforms; Bus systems; Frequency resolutions; Intelligent Algorithms; Power system disturbances; Power system fault; Super resolution; Support vector machines"
"https://www.scopus.com/inward/record.uri?eid=2-s2.0-85104581238&doi=10.1016%2fj.segan.2021.100482&partnerID=40&md5=0f0a95e8a7569e6e821e6caceb592b4c","Fuzzy multi-objective; Hybrid uncertainty modelling approach; Islanded microgrid; Particle swarm optimization; Sequential optimization strategy","Distributed power generation; Microgrids; Multiobjective optimization; Particle swarm optimization (PSO); Reactive power; Active and Reactive Power; Distributed generators; Environmental objectives; Multi objective particle swarm optimization; Optimization problems; Particle swarm optimization algorithm; Reactive power sharing; Sequential optimization; Electric load dispatching"
"https://www.scopus.com/inward/record.uri?eid=2-s2.0-85111264213&doi=10.1016%2fj.segan.2021.100520&partnerID=40&md5=01166252d37905b93ac726d224271f8b","Adaptive protection; Distributed energy resources; Microgrid; Oscillatory signals; Protective zones","Electric equipment protection; Energy resources; Accuracy estimation; Adaptive protection; Adaptive protection schemes; Critical boundaries; Distributed Energy Resources; Online environments; Protection schemes; Three-step approach; Microgrids"
"https://www.scopus.com/inward/record.uri?eid=2-s2.0-85112612673&doi=10.1016%2fj.segan.2021.100515&partnerID=40&md5=b665158ce2b59403aa511a7c2da545e9","Current sharing; DC microgrid; Distributed control; Droop control; LADRC","Disturbance rejection; Frequency domain analysis; Microgrids; Active disturbance rejection controls; Control strategies; Current controller; Droop control method; Dynamic performance; Linear active disturbance rejection controls; Voltage controllers; Voltage deviations; Controllers"
"https://www.scopus.com/inward/record.uri?eid=2-s2.0-85111562438&doi=10.1016%2fj.segan.2021.100524&partnerID=40&md5=3f8be582eb385264c2947ee574acef0e","Blockchain; Equilibrium; Iterative double auction; Microgrid; Peer-to-Peer energy trading","Blockchain; Combinatorial optimization; Energy resources; Microgrids; Power markets; Buyers and sellers; Distributed Energy Resources; Double auction mechanism; Hidden information; Market participants; Optimal allocation; Utility companies; Zero intelligences; Iterative methods"
"https://www.scopus.com/inward/record.uri?eid=2-s2.0-85103429904&doi=10.1016%2fj.segan.2021.100465&partnerID=40&md5=d72581d0f2b59a777dcf0b97d776aaa7","Distance relay; ETAP; MATLAB; Operational experience; Performance evaluation; Power swing; System Integrity and Protection Schemes (SIPS)","Electric power plants; MATLAB; Renewable energy resources; User interfaces; Design and analysis; Electrical transients; Operational experience; Renewable energy source; Simulation studies; System contingencies; System Integrity Protection Schemes; User friendly interface; HVDC power transmission"
"https://www.scopus.com/inward/record.uri?eid=2-s2.0-85100739110&doi=10.1016%2fj.segan.2021.100444&partnerID=40&md5=3d9ffe9b2cf45c1097e41401c2ca5a80","Decentralized droop control; Microgrid; Power sharing strategy; Small-signal stability; Synchronous generator (SG)","Eigenvalues and eigenfunctions; Microgrids; Signal analysis; Stability; Synchronous generators; Time domain analysis; Eigenvalue analysis; Loading condition; Power system stabilizer (PSS); Small signal model; Small signal stability; Small signal stability analysis; Stability study; Time-domain simulations; Loading"
"https://www.scopus.com/inward/record.uri?eid=2-s2.0-85111057186&doi=10.1016%2fj.segan.2021.100514&partnerID=40&md5=25fa801dac08178b25b5a306538dfade","Energy pricing; Game theory; Loss reduction; Microgrid; Reliability improvement","Economics; Electric utilities; Microgrids; Reliability theory; Active distribution networks; Distributed generations (DGs); Economic incentive; Locational marginal prices; Reliability improvement; Sharing strategies; Taiwan power companies; Theoretical methods; Game theory"
"https://www.scopus.com/inward/record.uri?eid=2-s2.0-85105302459&doi=10.1016%2fj.segan.2021.100472&partnerID=40&md5=25dbcfaac8b1f83a8ed5bda958f69839","B2X operational flexibility; Battery state-of-health; Battery swap station; Distributed generation; Energy management","Battery management systems; Distributed power generation; Electric vehicles; Energy management systems; Integer programming; Photovoltaic cells; Photovoltaic effects; Quality of service; Distributed generation units; Electric vehicle batteries; Flexible operation; Mixed integer linear programming; On-site distributed generation; Operational concepts; Operational sustainability; Photovoltaic systems; Automotive batteries"
"https://www.scopus.com/inward/record.uri?eid=2-s2.0-85119188664&doi=10.1016%2fj.segan.2021.100561&partnerID=40&md5=6738b46078988e72db06210a5cf795d9","Electricity network costs; Power sector decarbonisation; Renewable energy sources","Cost benefit analysis; Cost reduction; Economic analysis; Electric power transmission networks; Expansion; Integration; Investments; Natural resources; Operating costs; Decarbonisation; Electricity network cost; Electricity networks; Generation capacity; Investment costs; Network costs; Network investment; Power sector; Power sector decarbonization; Renewable energy source; Renewable energy resources"
"https://www.scopus.com/inward/record.uri?eid=2-s2.0-85121421338&doi=10.1016%2fj.segan.2021.100537&partnerID=40&md5=f5a463116e762442b192f01d276ce6d8","Interaction; Microgrid; Modal interaction index; Resonance; Small signal stability; Uncertainties","Damping; Eigenvalues and eigenfunctions; Microgrids; Monte Carlo methods; Renewable energy resources; Uncertainty analysis; Critical modes; Interaction; Interaction index; Microgrid; Modal interaction index; Modal interactions; Power; Renewable energies; Small signal stability; Uncertainty; Resonance"
"https://www.scopus.com/inward/record.uri?eid=2-s2.0-85107980576&doi=10.1016%2fj.segan.2021.100500&partnerID=40&md5=61acc84aac7f6ccc67e43346339a2c46","CFD simulation; Climate responsive design; Natural ventilation; Residential complex; Thermal comfort","Climate change; Fossil fuels; Housing; Thermal comfort; Ventilation; Wind; Computational fluid dynamics simulations; Indoor environment; Indoor thermal comfort; Interior environments; Natural ventilation; Renewable energies; Residential block; Residential complexes; Computational fluid dynamics"
"https://www.scopus.com/inward/record.uri?eid=2-s2.0-85105697183&doi=10.1016%2fj.segan.2021.100481&partnerID=40&md5=87a08d57a79bbdaab13db91235527337","Concentrated photovoltaic cell; Efficiency; Performance analysis; Power output; Thomson effect; Two-stage thermoelectric generator","Electronic equipment; Energy efficiency; Hybrid materials; Hybrid systems; Photoelectrochemical cells; Photovoltaic cells; Photovoltaic effects; Solar concentrators; Solar energy; Solar power generation; Thermocouples; Thermoelectric energy conversion; Thermoelectric equipment; Thermoelectricity; Cogeneration systems; Electricity production; Mathematical formulas; Mathematical relation; Maximum power density; Operating temperature; Thermo-Electric materials; Thermoelectric generators; Solar cells"
"https://www.scopus.com/inward/record.uri?eid=2-s2.0-85104135138&doi=10.1016%2fj.segan.2021.100471&partnerID=40&md5=80f0458a9752c55b8fd2089c954f92e1","ADMM; ALADIN; Distributed optimization; MATLAB; Open source; Power flow","Constrained optimization; Least squares approximations; MATLAB; Newton-Raphson method; Open source software; Open systems; Alternating direction method of multipliers; Alternating directions; Augmented Lagrangians; Distributed optimization; Inexact Newton method; Least-squares formulation; Open source implementation; Open source MATLAB codes; Electric load flow"
"https://www.scopus.com/inward/record.uri?eid=2-s2.0-85112667531&doi=10.1016%2fj.segan.2021.100518&partnerID=40&md5=f181824ed3906c41b72521669c89a5f0","Demand-response; Local energy communities (LECs); Low voltage distribution network; Operational flexibility; Peak demand management; Smart-community","Computer networks; Energy management; Energy resources; Information systems; Connection capacity; Day-ahead scheduling; Energy generations; Grid connections; Optimization strategy; Photovoltaic generation; Tariff structures; University campus; Renewable energy resources"
"https://www.scopus.com/inward/record.uri?eid=2-s2.0-85111259912&doi=10.1016%2fj.segan.2021.100516&partnerID=40&md5=058e6d4779319f661ccb3f1780408419","Microgrids; Multi-source capacitated facility location coverage problem; Optimization; Photovoltaic (PV); Renewable distributed power generation; Stochastic programming","Budget control; Disaster prevention; Disasters; Distributed power generation; Electric power transmission networks; Location; Microgrids; Stochastic programming; Back-up generators; Capacitated facilities; Distributed generator (DGs); Distributed generators; Location and sizings; Operation and maintenance; Stochastic optimizations; Two-stage stochastic programming; Outages"
"https://www.scopus.com/inward/record.uri?eid=2-s2.0-85103105387&doi=10.1016%2fj.segan.2021.100466&partnerID=40&md5=02a594a4b4bdc7ee28f876a33a7cf234","Availability; Eigenvalues; IEC-61850; Linear dynamical systems; Markov partitions; Repair efficiency; Symbolic dynamics","Efficiency; Eigenvalues and eigenfunctions; Linear control systems; Markov processes; Reliability analysis; Telecommunication networks; Combinatorial analysis; Dynamical behaviours; Linear dynamical systems; Power distributions; Reliability and availability; Reliability performance; Repair efficiencies; Substation communications; Dynamical systems"
"https://www.scopus.com/inward/record.uri?eid=2-s2.0-85104390717&doi=10.1016%2fj.segan.2021.100480&partnerID=40&md5=54d44db9895824c7527b2518e876ec88","Carbon emission; Carbon tax; Market equilibrium; Non-cooperative game theory; Oligopoly; Wholesale electricity market","Carbon dioxide; Competition; Electric industry; Emission control; Global warming; Power markets; Taxation; Transmissions; Carbon dioxide emissions; Equilibrium constraint; Generation technologies; Independent system operators; Non-cooperative game theory; Oligopolistic competition; Transmission congestion; Wholesale electricity markets; Game theory"
"https://www.scopus.com/inward/record.uri?eid=2-s2.0-85109079556&doi=10.1016%2fj.segan.2021.100504&partnerID=40&md5=d3f9edf5a58b33c8d042b9184bbfbdf6","Inertia control; Maximum power point tracking; Power system dynamics and control; Virtual synchronous generator; Wind turbine generators","Circuit oscillations; Frequency response; Synchronous generators; Turbogenerators; Wind turbines; Adaptive inertia; Antagonistic interactions; Control approach; Control strategies; Electromechanical oscilla-tions; Fully rated converters; Maximum power point; Penetration level; Electric machine control"
"https://www.scopus.com/inward/record.uri?eid=2-s2.0-85107976608&doi=10.1016%2fj.segan.2021.100502&partnerID=40&md5=6eeb42e2eab9f6fe6cf51f36d328fab0","Artificial neural networks; Multi-step prediction; Real-time; Voltage and frequency forecasting","Deep neural networks; Digital storage; Distributed power generation; Electric power system stability; Electric power transmission networks; Energy storage; Forecasting; Predictive analytics; Recurrent neural networks; Battery storage system; Different time scale; Distributed generation system; Experimental validations; Real time controllers; Real-time prediction; Short term prediction; University of Manchester; Electric power system control"
"https://www.scopus.com/inward/record.uri?eid=2-s2.0-85105738004&doi=10.1016%2fj.segan.2021.100490&partnerID=40&md5=e7ed481d1f3bfbd8a7cfd13aefbbbd78","Deep learning; Load transient identification; LSTM neural network; Non-intrusive load monitoring; Time series data augmentation","Deep learning; Deep neural networks; Electric load management; Energy efficiency; Energy utilization; Template matching; Time series; Comparison result; Dynamic time warping; Identification accuracy; Nonintrusive load monitoring; Specific energy consumption; State of the art; Template matching method; Time-series data; Long short-term memory"
"https://www.scopus.com/inward/record.uri?eid=2-s2.0-85103377804&doi=10.1016%2fj.segan.2021.100467&partnerID=40&md5=a4d105ee41730961f7f37341fac73a14","Ancillary Services; Distributed Energy Storage; Distribution management system; Electric Vehicles; TSO–DSO coordination","Digital instruments; Electric power transmission; Energy storage; Renewable energy resources; Storage as a service (STaaS); Voltage regulators; Congestion management; Distributed energy storages; Distribution systems; Regulatory frameworks; Renewable energy source; Sliding time windows; Transmission and distribution; Transmission system operators; Storage management"
"https://www.scopus.com/inward/record.uri?eid=2-s2.0-85111291525&doi=10.1016%2fj.segan.2021.100521&partnerID=40&md5=b13b39f3be89e251b804700acc11bd54","Cellular automata; Energy Local Area Network; Power information fusion; Risk transmission across space","Cellular automata; Electric power systems; Network security; Robots; Self-healing materials; Space power generation; Cell architectures; Cellular automaton models; Distributed autonomy; Effective management; Real time interactions; Self-healing abilities; Simulation parameters; Transmission simulations; Local area networks"
"https://www.scopus.com/inward/record.uri?eid=2-s2.0-85119043320&doi=10.1016%2fj.segan.2021.100559&partnerID=40&md5=6392d59855173fad1d185a956bca83c2","Constant temperature and variable flow operation strategy; Electric boiler with thermal storage; Hydraulic time delay correction; Improved second-order cone programming; Regional integrated heat and electricity system","Boilers; District heating; Electric load dispatching; Integer programming; Mass transfer; Scheduling; Timing circuits; Constant temperature; Constant temperature and variable flow operation strategy; Electric boiler with thermal storage; Electricity system; Heat and electricity; Heat systems; Hydraulic time delay correction; Improved second-order cone programming; Integrated heat; Operation strategy; Regional integrated heat and electricity system; Second-order cone programming; Thermal storage; Heat storage"
"https://www.scopus.com/inward/record.uri?eid=2-s2.0-85109066195&doi=10.1016%2fj.segan.2021.100499&partnerID=40&md5=d533216c202870bb6fa7d3578a984e66","Hydro-Wind-PV complementation; Hydropower Scheduling; Lancang cascade; Optimization","Drought; Electric power system planning; Hydroelectric power; Large scale systems; Multiple zones; Reservoirs (water); Scheduling; Solar power generation; Solar power plants; Water levels; Cascaded reservoirs; Generating capacity; Generating efficiencies; Hydropower scheduling; Industrial challenges; Large-scale hydropower systems; Multiple-objectives; Turbine maintenance; Hydroelectric power plants"
"https://www.scopus.com/inward/record.uri?eid=2-s2.0-85101138456&doi=10.1016%2fj.segan.2021.100442&partnerID=40&md5=9546bcb471712a4fcc46b1ad8f479a2f","Feature selection; Machine learning; Multi-step prediction; Power quality; Regression","Domestic appliances; Electric power transmission networks; Forecasting; Machine learning; Microgrids; Predictive analytics; Stochastic systems; Electrical devices; Fault tolerant operations; Load characteristics; Multi-step prediction; Prediction algorithms; Renewable energies; Selection procedures; Short-circuit power; Power quality"
"https://www.scopus.com/inward/record.uri?eid=2-s2.0-85120924119&doi=10.1016%2fj.segan.2021.100507&partnerID=40&md5=34dfe37e39554ae76d7deb981f3a4c90","Flexibility; Market mechanism; Reactive power; Voltage support","Cost effectiveness; Reactive power; Risk assessment; Voltage control; American electric power; Control capabilities; Cost-effective solutions; Low-carbon policies; Multi-infeed interaction factors; Reactive power capacity; Transmission and distribution; Voltage sensitivity; Costs"
"https://www.scopus.com/inward/record.uri?eid=2-s2.0-85110609599&doi=10.1016%2fj.segan.2021.100511&partnerID=40&md5=e9271a2d8d710a16e6c855db0ce1ff2a","Dynamic pricing; Energy management system; Multi interval programming; Optimal scheduling","Artificial intelligence; Electric industry; Electric utilities; Housing; Particle swarm optimization (PSO); Scheduling; Artificial intelligence techniques; Comparative analysis; Electricity prices; Interval programming; Meta-heuristic optimization techniques; Residential consumers; Residential electricity; Residential sectors; Costs"
"https://www.scopus.com/inward/record.uri?eid=2-s2.0-85100786749&doi=10.1016%2fj.segan.2021.100435&partnerID=40&md5=3e1298e5fc0c16db9766abbb9b85a314","Active damping; Constant power load (CPL); DC microgrid; Stability analysis; Virtual resistance","Stability criteria; Voltage regulators; Active stabilization; Behavioral characteristics; Constant power load; Negative incremental resistances; Nonlinear state space; Small signal stability; Sufficient criterion; Theoretical foundations; Microgrids"
"https://www.scopus.com/inward/record.uri?eid=2-s2.0-85105748446&doi=10.1016%2fj.segan.2021.100493&partnerID=40&md5=44117e2f7d589f3821cdb163fae62c8d","Differential protection; Fault detection; Hermite transform; Inrush current; Internal fault; Multiresolution analysis; Power transformer","Electric fault currents; Electric grounding; Electric instrument transformers; Frequency domain analysis; Power transformers; Signal processing; Current transformer saturation; Differential protection; Differential scheme; Gaussian derivatives; Multiple resolutions; Signal processing technique; Single phase to ground faults; Transient conditions; Transformer protection"
"https://www.scopus.com/inward/record.uri?eid=2-s2.0-85105692678&doi=10.1016%2fj.segan.2021.100484&partnerID=40&md5=319d26a1444b8fa0a867165396325f78","Actuator saturation; Linear matrix inequality; Time varying delay; Wide area damping control","Actuators; Circuit oscillations; Controllers; Damping; Electric power system control; Electric power system interconnection; Electric power system measurement; Linear matrix inequalities; Robustness (control systems); State feedback; Time delay; Communication delays; Inter-area oscillations; Krasovskii functional; Stabilization criteria; State feedback control law; Supplementary damping controllers; Thyristor controlled series capacitor; Wide- area measurement systems (WAMS); Time varying control systems"
"https://www.scopus.com/inward/record.uri?eid=2-s2.0-85119911901&doi=10.1016%2fj.segan.2021.100549&partnerID=40&md5=7d453d2f0a5fa161549cd1db05d32dcb","C37.118 Protocol; Communication Protocols; GOOSE (IEC 61850) Protocol; GPS; Power System Laboratory","Electric power system protection; Electric power transmission networks; Electric substations; Internet protocols; Laboratories; Network layers; Quality of service; Real time systems; Wide area networks; C37.118 protocol; Communications networking; Communications protocols; Cyber physicals; GOOSE (IEC 61850) protocol; Iec-61850; Physical power; Power; Power system laboratory; Systems Laboratories; Timing circuits"
"https://www.scopus.com/inward/record.uri?eid=2-s2.0-85105358823&doi=10.1016%2fj.segan.2021.100488&partnerID=40&md5=a0a359942dcee391ae5d7cbdae7d4fb8","Elman; Feature selection; Load identification; Radial Basis Function; ReliefF","Feature extraction; Radial basis function networks; Elman neural network; Feature selection methods; Harmonic currents; Identification accuracy; Load identification; Radial basis function neural networks; Residential loads; Selection procedures; Classification (of information)"
"https://www.scopus.com/inward/record.uri?eid=2-s2.0-85119099273&doi=10.1016%2fj.segan.2021.100553&partnerID=40&md5=14e51b900c557bb3fc7de5d23799c0af","Blockchain; Cybersecurity; Distributed energy resource (DER); Distributed Ledger Technology (DLT); Power systems; Smart grid","Distributed ledger; Electric power transmission networks; Energy resources; Network architecture; Open systems; Smart power grids; Standardization; Transmission control protocol; Block-chain; Cyber security; Distributed energy resource; Distributed Energy Resources; Distributed ledg technology; Energy applications; Global trends; Power; Power applications; Power system; Blockchain"
"https://www.scopus.com/inward/record.uri?eid=2-s2.0-85118538294&doi=10.1016%2fj.segan.2021.100554&partnerID=40&md5=fcde96d7331a6e2fd334702e795d4e4e","Distributed Generation (DG); Hybrid system; Optimal placement; Reliability assessment","Analytical models; Distributed power generation; Energy storage; Integration; Markov processes; Outages; Reliability analysis; Solar energy; 'current; Distributed generation; Distribution systems; Energy storage system systems; Multi-state model; Optimal placements; Photovoltaic systems; Photovoltaics; Reliability assessments; Storage systems; Hybrid systems"
