"Link","Author Keywords","Index Keywords"
"https://www.scopus.com/inward/record.uri?eid=2-s2.0-85152226062&doi=10.1016%2fj.segan.2023.101042&partnerID=40&md5=806c02e2df9b77ded6cc8c42e73c0a01","Average voltage restoration; DC microgrids; Distributed secondary control; Economic dispatch; Fixed-time convergence","Electric load dispatching; Microgrids; Renewable energy resources; Restoration; Average voltage restoration; DC microgrid; Distributed secondary control; Economic Dispatch; Fixed time; Fixed-time convergence; Microgrid; Secondary control; Time-scales; Voltage restoration; Voltage regulators"
"https://www.scopus.com/inward/record.uri?eid=2-s2.0-85168421214&doi=10.1016%2fj.segan.2023.101125&partnerID=40&md5=2e924e156d838064f371f88fa0290bba","Electricity markets; Local flexibility markets; Optimization; Power system economics; TSO–DSO coordination","Electric power distribution; Electric power transmission; Electric substations; Sensitivity analysis; Voltage distribution measurement; Case-studies; Coordination scheme; Local flexibility; Local flexibility market; Market design; Optimisations; Power systems economics; Swedishs; Transmission grids; TSO–DSO coordination; Power markets"
"https://www.scopus.com/inward/record.uri?eid=2-s2.0-85159609710&doi=10.1016%2fj.segan.2023.101061&partnerID=40&md5=6297cf212834aec8fb07356d99e72312","Decomposition; Electric vehicle charging station; Line flow; Transmission cost allocation; Transmission fixed cost; Wind farms","Charging (batteries); Costs; Electric load shedding; Electric power transmission; Electric power transmission networks; Electric utilities; Electric vehicles; Vehicle transmissions; Wind farm; Charging station; Electric vehicle charging; Electric vehicle charging station; Fair allocation; Fixed cost; Line flows; Optimal allocation; Transmission cost allocation; Transmission fixed cost; Wind farm; Electric lines"
"https://www.scopus.com/inward/record.uri?eid=2-s2.0-85168012311&doi=10.1016%2fj.segan.2023.101123&partnerID=40&md5=249e959a860a8ac9f706342fb7051414","Carbon emissions; CCHP-CCS-P2G (CCP); Energy station (ES); Regionally Integrated Energy System (RIES); Reliability; Two-stage distributionally robust optimization (DDTS-DRO)","Carbon capture; Climate change; Climate models; Cooling systems; Digital storage; Integer programming; Uncertainty analysis; Capture system; Carbon emissions; Combined cooling heating and power; Combined cooling, heating, and power system-carbon capture system-P2G; Data driven; Energy station; Energy stations; Integrated energy systems; Regionally integrated energy system; Robust optimization; Two-stage distributionally robust optimization (data-driven two-stage distributionally robust optimization); Reliability"
"https://www.scopus.com/inward/record.uri?eid=2-s2.0-85167588505&doi=10.1016%2fj.segan.2023.101127&partnerID=40&md5=fa21010e651946a13bfee1b2c33d42d8","Automatic sectionalizer; Distribution network reliability; Mixed integer linear programming; Relocation; Switch placement; Tie switch","Integer programming; Reliability; Remote control; Software testing; Automatic sectionalizer; Disconnect switch; Distribution network reliability; Integer Linear Programming; Mixed integer linear; Mixed integer linear programming; Network reliability; Re closers; Switch placement; Tie switch; Sensitivity analysis"
"https://www.scopus.com/inward/record.uri?eid=2-s2.0-85156175156&doi=10.1016%2fj.segan.2023.101051&partnerID=40&md5=5da10a03c52220152aa29d37ff9470a6","Community energy storage; Energy hub; Energy sharing; PV prosumers; Stochastic optimization","Digital storage; Electric power distribution; Iterative methods; Optimization; Probability distributions; Stochastic models; Stochastic systems; Uncertainty analysis; Community energy; Community energy storage; Data driven; Energy hubs; Energy sharings; Photovoltaic prosumer; Photovoltaics; Stochastic optimizations; Stochastics; Uncertainty; Energy storage"
"https://www.scopus.com/inward/record.uri?eid=2-s2.0-85167971531&doi=10.1016%2fj.segan.2023.101126&partnerID=40&md5=43b25eada90bfa1054ed7be9a8245c11","Data-driven; Fault detection; Semi-supervised detection; Sensor faults; Wind turbines","Condition monitoring; Data acquisition; Gaussian noise (electronic); Independent component analysis; Multivariant analysis; Wind turbines; Data driven; Detection threshold; Faults detection; Independent components analysis; Non-Gaussian data; Semi-supervised; Semi-supervised detection; Sensor fault detection; Sensors faults; Supervisory control and data acquisition; Fault detection"
"https://www.scopus.com/inward/record.uri?eid=2-s2.0-85151014090&doi=10.1016%2fj.segan.2023.101032&partnerID=40&md5=7f657876c8f24a25b6103a9db3b8e416","Distributed generation; Graph signal processing; Graph theory; Power flow; Power system","Computer software; Electric load flow; Flow graphs; Graphic methods; Power quality; Signal processing; 'current; Current variability; Graph signal processing; Load currents; Power; Power flows; Power system; Signal processing on graphs; Signal-processing; Simulink; Distributed power generation"
"https://www.scopus.com/inward/record.uri?eid=2-s2.0-85163216234&doi=10.1016%2fj.segan.2023.101088&partnerID=40&md5=6090f2e9d81f9bf7f954441d0d8a0417","Distributed generation; Energy community; Interval optimization; Stackelberg game","Distributed computer systems; Integer programming; Profitability; Active distributions; Day-ahead scheduling; Decarbonisation; Energy; Energy community; Interval optimization; Scheduling strategies; Stackelberg; Stackelberg Games; Submodules; Distributed power generation"
"https://www.scopus.com/inward/record.uri?eid=2-s2.0-85153397477&doi=10.1016%2fj.segan.2023.101036&partnerID=40&md5=5ec9bfd1ba5bf1084fe27b515e50e1bf","Deep learning; Energy losses; Image processing; Photovoltaics panels; Snow cover","Deep learning; Deposition rates; Hydrogen; Image enhancement; Learning systems; Snow; Solar panels; Solar power generation; Uncertainty analysis; Deep learning; Energy productions; Images processing; Loss model; Perspective transformation; Photovoltaic panels; Photovoltaics; Snow coverage; Snow covers; Solar module; Energy dissipation"
"https://www.scopus.com/inward/record.uri?eid=2-s2.0-85162952959&doi=10.1016%2fj.segan.2023.101091&partnerID=40&md5=63c0b72eb4e066a1b223513c07c7ca81","Forecast reconciling; Hierarchical forecasting; Identifiability; Large-p small-n problem; Mean absolute scaled error; Shrinkage estimator; Spatial correlation; Spatial smoothing","Electric utilities; Shrinkage; Weather forecasting; Wind farm; Forecast reconciling; Hierarchical forecasting; Identifiability; Large-p small-n; Large-p small-n problem; Mean absolute scaled error; Shrinkage estimator; Spatial correlations; Spatial smoothing; Wind farm; Covariance matrix"
"https://www.scopus.com/inward/record.uri?eid=2-s2.0-85151273354&doi=10.1016%2fj.segan.2023.101033&partnerID=40&md5=5f535142ea3a3c153abb43eca7d1207a","Energy management system; Flexibility; Forecasting; Machine learning; Prosumer; Security","Computational complexity; Decision trees; Economic and social effects; Energy management; Housing; Information management; Machine learning; Profitability; Weather forecasting; Computational resources; Data-source; Flexibility; Machine learning models; Machine-learning; Optimisations; Prosumer; Residential energy management system; Security; Trade off; Energy management systems"
"https://www.scopus.com/inward/record.uri?eid=2-s2.0-85166671949&doi=10.1016%2fj.segan.2023.101120&partnerID=40&md5=e2bb885a28c5308539065090b57317ff","Electric vehicles (EV); Photovoltaic Generator; Smart EV charging; Vehicle-to-grid","Charging (batteries); Economics; Electric loads; Electric vehicles; Energy resources; Forecasting; Quadratic programming; Secondary batteries; Battery lifetime; Centralised; Electric vehicle; Electric vehicle batteries; Electric vehicle charging; Forecasting models; Photovoltaic generator; Photovoltaics; Smart electric vehicle charging; Vehicle to grids; Vehicle-to-grid"
"https://www.scopus.com/inward/record.uri?eid=2-s2.0-85165081574&doi=10.1016%2fj.segan.2023.101108&partnerID=40&md5=19f6ea52ff3cf17803241540171bb245","Energy supply network (ESN); Graph theory; Integrated energy system (IES); Layering and pruning method (L&PM); Planning","Complex networks; Economic analysis; Energy resources; Pipelines; Energy internet; Energy supply network; Energy supply networks; Integrated energy system; Integrated energy systems; Layering and pruning method; Minimums panning tree; Multi energy; Optimal planning method; Pruning methods; Graph theory"
"https://www.scopus.com/inward/record.uri?eid=2-s2.0-85151517845&doi=10.1016%2fj.segan.2023.101037&partnerID=40&md5=26c290d1f12c2d4bb33e86234ca762b5","Emergency operation; Mobile battery storage; Multi-stage optimization.; Network resiliency; Renewable energy curtailment mitigation","Battery storage; Electric power factor; Fleet operations; Large scale systems; Secondary batteries; Trucks; Battery storage; Battery storage system; Emergency operations; Mobile battery storage; Multi-stage optimization; Multi-stage optimization.; Network resiliency; Renewable energies; Renewable energy curtailment mitigation; Small island; Electric power distribution"
"https://www.scopus.com/inward/record.uri?eid=2-s2.0-85150841004&doi=10.1016%2fj.segan.2023.101027&partnerID=40&md5=ac101604eeec85bb4ab55f86dc0cf3d2","Cyber–physical security; Fast charging stations; Machine learning; Microgrids; Vehicle-to-grid","Charging (batteries); Crime; Cyber attacks; Denial-of-service attack; Machine learning; Microgrids; Network security; Outages; Renewable energy resources; Vehicle-to-grid; Ancillary service; Cyber physicals; Cyber-attacks; Cyber-Physical securities; Fast charging stations; Machine-learning; Microgrid; Physical attacks; Time-resolution; Vehicle to grids; Losses"
"https://www.scopus.com/inward/record.uri?eid=2-s2.0-85164219563&doi=10.1016%2fj.segan.2023.101078&partnerID=40&md5=4ddce311f7966adf0b5aedf551ecbf01","Energy model; Industry; Load profile; Load profile generation; Simulation","Electric loads; Energy efficiency; Energy management; Industrial plants; Markov processes; Plants (botany); Bottom-up and top-down; Energy demands; Energy model; Load profile generation; Load profiles; Measured loads; Non-energy; Simulation; Top down approaches; Energy utilization"
"https://www.scopus.com/inward/record.uri?eid=2-s2.0-85162908671&doi=10.1016%2fj.segan.2023.101089&partnerID=40&md5=7ede892498da2268b9cf5791bad93bc5","Hammerstein; Least square (LS); State of charge (SOC); The key-term separation principle","Battery management systems; Charging (batteries); Extended Kalman filters; Lithium-ion batteries; Long short-term memory; Parameter estimation; Stochastic models; Stochastic systems; Estimation models; Hammerstein; Least Square; LeastSquare algorithm; Separation principle; State of charge; State-of-charge estimation; States of charges; The key-term separation principle; Least squares approximations"
"https://www.scopus.com/inward/record.uri?eid=2-s2.0-85163033106&doi=10.1016%2fj.segan.2023.101085&partnerID=40&md5=56cca2fafcb9daa71465650b8cf0f28b","Cost-based smart charging; Electric vehicle; Grid impact; Low voltage; Monte-Carlo simulation; Power distribution network","Cables; Charging (batteries); Costs; Electric network analysis; Electric vehicles; Intelligent systems; Monte Carlo methods; Probability distributions; Smart meters; Smart power grids; Voltage distribution measurement; Cost-based smart charging; Electric vehicle charging; Grid impacts; Low voltage distribution network; Low voltage power distribution networks; Low voltages; Monte Carlo's simulation; Power distribution network; Probabilistic models; Smart charging; Electric power distribution"
"https://www.scopus.com/inward/record.uri?eid=2-s2.0-85163950244&doi=10.1016%2fj.segan.2023.101079&partnerID=40&md5=b2d7ed04f2b55a64c8060ef025dde77f","Convex optimization; Coordinated operation; Flexible ramping product; Natural gas","Flow of gases; Gases; Natural gas; Convex optimisation; Coordinated operation; Day-ahead; Electricity networks; Flexible ramping product; Gas systems; Natural gas networks; Penetration level; Potential fluctuations; Renewable resource; Convex optimization"
"https://www.scopus.com/inward/record.uri?eid=2-s2.0-85162956753&doi=10.1016%2fj.segan.2023.101080&partnerID=40&md5=29b481d39ca127e98aae140c1dff66da","Q-V analysis; Reactive power margin; RoCoF; Static voltage stability limit; Underfrequency load shedding","Electric load dispatching; Electric load shedding; Electric power plant loads; Frequency response; Network security; Reactive power; Zoning; Load shedding scheme; Load-shedding; Power; Q-V analyse; Rate of change of frequencies; Reactive power margin; Static voltage stability; Static voltage stability limit; Underfrequency load-shedding; Voltage stability limits; IEEE Standards"
"https://www.scopus.com/inward/record.uri?eid=2-s2.0-85163806101&doi=10.1016%2fj.segan.2023.101103&partnerID=40&md5=42112f13158ca315460bad5b42501a83","Demand response; Flexible demand; Greenhouse gas emissions; Marginal emissions; Net zero","Gas emissions; Greenhouse gases; Building energy analysis; Demand response; Emission factors; Emissions intensity; Flexible demand; Greenhouse gas emissions; In-buildings; Marginal emission; Net zero; Time varying; Investments"
"https://www.scopus.com/inward/record.uri?eid=2-s2.0-85153283573&doi=10.1016%2fj.segan.2023.101045&partnerID=40&md5=ffcae0874d272374ea7909a359b366ac","Bi-level mixed-integer programming; Multi-fuel units; Prohibited operating zone; Reformulation-and-decomposition technique; Scenario-based optimization; Transmission expansion planning","Electric load dispatching; Electric power transmission networks; Iterative methods; Bi-level mixed-integer programming; Decomposition technique; Mixed-Integer Programming; Multi-fuel unit; Optimisations; Prohibited operating zone; Reformulation-and-decomposition technique; Scenario-based; Scenario-based optimization; Transmission expansion-planning; Integer programming"
"https://www.scopus.com/inward/record.uri?eid=2-s2.0-85163289850&doi=10.1016%2fj.segan.2023.101092&partnerID=40&md5=9b6cebc59e91be528c71013e143125f1","Combination weighting; Electricity market; Game theory; Power supply reliability; Renewable energy","Analytic hierarchy process; Electric energy storage; Electric industry; Electric power transmission; Game theory; Power markets; Reliability theory; Transmissions; Combination weighting; Energy-based; Ideal solutions; Impact index; Power; Power energy; Power supply reliability; Reliability Evaluation; Renewable energies; Solution methods; Renewable energy resources"
"https://www.scopus.com/inward/record.uri?eid=2-s2.0-85162235972&doi=10.1016%2fj.segan.2023.101087&partnerID=40&md5=fc82e32ffa3af6b525550a537bf4aab9","Demand-side flexibility; Generation flexibility; Multi-microgrid systems; Renewable generation; Stochastic approach","Decision making; Game theory; Stochastic systems; Demand-side; Demand-side flexibility; Generation flexibilities; Microgrid; Microgrid systems; Multi micro-grids; Multi-microgrid system; Peak period; Renewable generation; Stochastic approach; Operating costs"
"https://www.scopus.com/inward/record.uri?eid=2-s2.0-85166938290&doi=10.1016%2fj.segan.2023.101114&partnerID=40&md5=09b51a21025bff5ce8186b1ce0c9bbc5","Optimization; Scheduling; Self-committed; V2G","Heuristic algorithms; Housing; Power markets; Vehicle-to-grid; Composite optimization; Economic benefits; Energy markets; Operational constraints; Optimisations; Policy makers; Residential complexes; Scheduling; Self-committed; Vehicle to Grid (V2G); Optimization"
"https://www.scopus.com/inward/record.uri?eid=2-s2.0-85164113300&doi=10.1016%2fj.segan.2023.101082&partnerID=40&md5=37fc403cdb1512bcf1a59a658c3acf7e","Conditional value-at-risk (CVaR); Electric buses (EBs); Island formation; Photovoltaic charging station; Stochastic optimization; Storm","Charging (batteries); Electric loads; Electric power distribution; Integer programming; Solar energy; Solar power generation; Stochastic systems; Storms; Uncertainty analysis; Wind; Charging station; Conditional value-at-risk; Electric bus; Island formation; Photovoltaic charging station; Photovoltaics; Stochastic framework; Stochastic optimizations; Electric buses"
"https://www.scopus.com/inward/record.uri?eid=2-s2.0-85159595601&doi=10.1016%2fj.segan.2023.101059&partnerID=40&md5=b3b81240735ba4ae3df7211201f54289","Distribution grid; Flexibility; Local community market; Peer-to-peer trading; Risk modeling","Electric power distribution; Peer to peer networks; Power markets; Risk analysis; Risk assessment; Value engineering; Community markets; Distribution grid; Energy trading; Flexibility; Local community; Local community market; Local energy; Peer to peer; Peer-to-peer trading; Risk modeling; Profitability"
"https://www.scopus.com/inward/record.uri?eid=2-s2.0-85168806062&doi=10.1016%2fj.segan.2023.101137&partnerID=40&md5=6ea666f620c7b22b3d48532d30038ba4","DC Microgrid; Energy management; PHEV; Point estimate method; Uncertainty","Electric load dispatching; Energy management; Inverse problems; Microgrids; Random variables; Uncertainty analysis; Correlated uncertainty; DC microgrid; Energy management schemes; Load demand; Microgrid; Multi objective; PHEV; Point-estimate methods; Technical constraints; Uncertainty; Energy dissipation"
"https://www.scopus.com/inward/record.uri?eid=2-s2.0-85158003375&doi=10.1016%2fj.segan.2023.101050&partnerID=40&md5=bdd88f5a0ef15bd478eac0378ba747ea","Deep reinforcement learning (DRL); Dynamic line rating (DLR); Economic dispatch; Random fuzzy variable; Renewable generations (RGs)","Deep learning; Electric load dispatching; Electric load flow; Electric power transmission; Learning systems; Markov processes; Renewable energy resources; Deep reinforcement learning; Dynamic line rating; Economic Dispatch; Industrial parks; Line ratings; Random fuzzy variable; Reinforcement learning approach; Reinforcement learnings; Renewable generation; Reinforcement learning"
"https://www.scopus.com/inward/record.uri?eid=2-s2.0-85165359494&doi=10.1016%2fj.segan.2023.101110&partnerID=40&md5=10e7b0b21f0e76324fdd27758945d278","aFRR service; Ancillary services; Deep learning; Electricity prices; Energy markets; Forecasting; Neural networks","Convolutional neural networks; Costs; Electric industry; Electric load dispatching; Feedforward neural networks; Long short-term memory; Power markets; Renewable energy resources; AFRR service; Ancillary service; Automatic frequency; Deep learning; Electricity prices; Energy markets; Generation technologies; Iberian electricity market; Neural-networks; Renewable energy source; Restoration"
"https://www.scopus.com/inward/record.uri?eid=2-s2.0-85152238354&doi=10.1016%2fj.segan.2023.101039&partnerID=40&md5=bfd961435b33c89cf555a34ce6d6322b","Incentive mechanism; Load management; Privacy enhancement; Renewable energy; Smart home","Automation; Costs; Electric load management; Energy management; Energy management systems; Housing; Secondary batteries; Battery schemes; Electricity costs; Incentive mechanism; Load management; Privacy enhancement; Privacy protection; Renewable energies; Residential users; Smart homes; Users' satisfactions; Domestic appliances"
"https://www.scopus.com/inward/record.uri?eid=2-s2.0-85167598763&doi=10.1016%2fj.segan.2023.101119&partnerID=40&md5=1610c60784f936d1ce41c314b55df181","Constant power load; DC microgrid; EV charger; Renewable energy sources; Sliding mode control","Adaptive control systems; Charging (batteries); Controllers; DC-DC converters; Electric loads; Lyapunov methods; Microgrids; Natural resources; Renewable energy resources; Secondary batteries; Solar power generation; Adaptive sliding mode control; Constant power load; Dc - dc boost converters; Dc micro-grid; DC microgrid; Electric vehicles chargers; Microgrid; Renewable energy source; Sliding-mode control; Stability margins; Sliding mode control"
"https://www.scopus.com/inward/record.uri?eid=2-s2.0-85166961930&doi=10.1016%2fj.segan.2023.101116&partnerID=40&md5=856d8ba5448d11595cf0fa323e84a0b0","Cyber security; False data injection attack; Machine learning; State estimation; Sudden load change","Cyber attacks; Cyber Physical System; Embedded systems; Machine learning; Network security; State estimation; Anomaly detection; Bad data; Combining model; Cyber security; False data injection attacks; Load change; Machine-learning; Power system state estimation; Sudden change; Sudden load change; Anomaly detection"
"https://www.scopus.com/inward/record.uri?eid=2-s2.0-85167617864&doi=10.1016%2fj.segan.2023.101124&partnerID=40&md5=8229c89fbeed17bcb848b549dcaa7bd7","Demand response; Electric vehicle; Self-consumption; Smart charging; Smart grid; Solar power","Charging (batteries); Deep learning; Fleet operations; Housing; Reinforcement learning; Smart meters; Solar power generation; Vehicle-to-grid; Decarbonisation; Demand response; Electric vehicle charging; Passengers vehicles; Reinforcement learnings; Self-consumption; Smart charging; Smart grid; Transport sectors; Vehicle fleets; Solar energy"
"https://www.scopus.com/inward/record.uri?eid=2-s2.0-85162233641&doi=10.1016%2fj.segan.2023.101049&partnerID=40&md5=826cd72ef7bd7a2f39d327acc6938626","Backward–forward sweep; Decoupled network model; Load flow; UML","Electric load flow; Backward–forward sweep; Decoupled network model; Distribution management systems; Forward sweeps; Large-scales; Load flow; Multiphases; Network models; Power applications; UML; Electric power distribution"
"https://www.scopus.com/inward/record.uri?eid=2-s2.0-85163018109&doi=10.1016%2fj.segan.2023.101097&partnerID=40&md5=543e12366d0e117b364f36ce23bef340","Balancing Market; Battery; Control strategy; Flexibility; Prosumer; RES integration; Revenue stacking","Battery management systems; Battery storage; Charging (batteries); Commerce; Secondary batteries; Balancing market; Battery; Control strategies; Flexibility; Prosumer; Renewable energy source; Renewable energy source integration; Revenue stacking; Sources integrations; Stackings; Renewable energy resources"
"https://www.scopus.com/inward/record.uri?eid=2-s2.0-85158090834&doi=10.1016%2fj.segan.2023.101054&partnerID=40&md5=9f1d0a489d13ef48bef8ddbcad9d195e","Deep reinforcement learning; Multi-objective solution; OPF; Renewable energy","Acoustic generators; Deep learning; Electric load dispatching; Electric load flow; Electric power system control; Learning algorithms; Learning systems; Operating costs; Power control; Deep reinforcement learning; Generator sets; Learning strategy; Multi objective; Multi-objective solution; Optimal power flow problem; Optimal power flows; Power- generations; Reinforcement learnings; Renewable energies; Reinforcement learning"
"https://www.scopus.com/inward/record.uri?eid=2-s2.0-85156250826&doi=10.1016%2fj.segan.2023.101058&partnerID=40&md5=987589d67751dafdbeb3ee57cbdf4b3b","Game theory; Local Electricity Market; Net billing; Net metering; Prosumers","Benchmarking; Electric industry; Electric load dispatching; Electric power distribution; Energy policy; Energy resources; Game theory; Smart power grids; Virtual storage; Billing schemes; Distributed Energy Resources; Local electricity market; Metering schemes; Net billing; Net energy; Net metering; Pilot programs; Prosumer; Smart grid; Power markets"
"https://www.scopus.com/inward/record.uri?eid=2-s2.0-85152919442&doi=10.1016%2fj.segan.2023.101043&partnerID=40&md5=d9b41a544e5c1851117d1a54291d9b6b","Battery management; Energy system simulation; Load forecasting; Photovoltaic systems; Renewable Energy Communities","Battery management systems; Battery storage; Economic analysis; Electric batteries; Integer programming; Investments; Losses; Battery Management; Community energy; Energy independence; Energy system simulations; European directive; Load forecasting; National Grid; Photovoltaic systems; Renewable energy community; Technical rules; Electric loads"
"https://www.scopus.com/inward/record.uri?eid=2-s2.0-85153198462&doi=10.1016%2fj.segan.2023.101044&partnerID=40&md5=f64cf7b6240bf5097d8e6d507acb4c9c","Customer satisfaction; Incentive-based demand response programs; Kano model; Machine learning forecasting; Multi-objective optimization modeling","Commerce; Economic and social effects; Electric loads; Energy policy; Energy security; Environmental protection; Machine learning; Multiobjective optimization; Sales; Social aspects; Customers' satisfaction; Day-ahead; Demand response programs; Incentive-based demand response; Incentive-based demand response program; Kano model; Machine learning forecasting; Machine-learning; Multi-objective optimization models; Response model; Customer satisfaction"
"https://www.scopus.com/inward/record.uri?eid=2-s2.0-85165940238&doi=10.1016%2fj.segan.2023.101109&partnerID=40&md5=f76f019f860ad1cf8701bec1f12c15c6","Deep reinforcement learning; Energy market; Hydro-thermal economic dispatch; Optimization problem","Decision making; Deep learning; Electric load dispatching; Energy management; Energy resources; Optimization; Power markets; Uncertainty analysis; Deep reinforcement learning; Economic Dispatch; Energy demands; Energy markets; Hydro-thermal economic dispatch; Optimization problems; Reinforcement learning approach; Reinforcement learnings; Thermal; Uncertainty; Reinforcement learning"
