"Link","Author Keywords","Index Keywords"
"https://www.scopus.com/inward/record.uri?eid=2-s2.0-85125151298&doi=10.1016%2fj.segan.2022.100646&partnerID=40&md5=896a65258be455f66cf15322672edac7","Charge navigation; Dijkstra's algorithm; Electric vehicles; Time utility difference","Charging (batteries); Electric power transmission networks; Electric vehicles; Vehicle-to-grid; Charge navigation; Charging strategies; Charging time; Dijkstra's algorithms; Fast charging; Navigation modes; Navigation strategies; Penetration rates; Power grid networks; Time utility difference; Navigation"
"https://www.scopus.com/inward/record.uri?eid=2-s2.0-85127825499&doi=10.1016%2fj.segan.2022.100702&partnerID=40&md5=f6e4963d28b46e759b5050c66f75053b","Deep learning; False data injection attack; Smart grid; State estimation","Cost effectiveness; Deep learning; Electric power transmission networks; Smart power grids; Deep learning; Effective approaches; False data injection attacks; Learning models; Measurement sets; Monitoring and control; Novel strategies; Real- time; Smart grid; State estimation algorithms; State estimation"
"https://www.scopus.com/inward/record.uri?eid=2-s2.0-85122204438&doi=10.1016%2fj.segan.2021.100582&partnerID=40&md5=2bd3f0a927cb6f13ee06fecd39bc9020","CatBoost; Fault diagnosis and classification; Light gradient boosting machine; Machine learning; PV arrays; XGBoost","Adaptive boosting; Computer aided diagnosis; Decision trees; Fault detection; Machine learning; Photovoltaic cells; Solar power generation; Boosting method; Categorical boosting; Fault classification; Faults diagnosis; Gradient boosting; Light gradient boosting machine; Light gradients; Photovoltaic arrays; Photovoltaic systems; Xgboost; Failure analysis"
"https://www.scopus.com/inward/record.uri?eid=2-s2.0-85122630111&doi=10.1016%2fj.segan.2021.100546&partnerID=40&md5=86052018fa8712e2b8fc53ba904c826d","Cooperative strategy; Emission reduction; Fair cost allocation; Integrated energy resources; Multi-microgrids","Cost reduction; Energy resources; Gas emissions; Greenhouse gases; Multiobjective optimization; Operating costs; Cooperative strategy; Cost-allocation; Emission reduction; Energy; Fair cost allocation; Greenhouse gas emissions; Integrated energy resource; Microgrid; Microgrid systems; Multi micro-grids; Emission control"
"https://www.scopus.com/inward/record.uri?eid=2-s2.0-85124071763&doi=10.1016%2fj.segan.2022.100616&partnerID=40&md5=117d5bd76b3a2e8055525a9aba0a24cc","Demand; Design; Energy; Heating season; Insulation; Soil","Developing countries; Demand; District heating system; Energy; Heat production; Heating season; In-pipe; Loss rates; Operational data; Outdoor temperature; Regression function; Heat losses"
"https://www.scopus.com/inward/record.uri?eid=2-s2.0-85122979396&doi=10.1016%2fj.segan.2021.100596&partnerID=40&md5=e0e9688b64e04b5ef57987016363dd28","Energy management; Energy storage systems; Energy trading; Lyapunov optimization","Costs; Electric energy storage; Energy management; Energy management systems; Model predictive control; Power markets; Real time systems; Renewable energy resources; Stochastic systems; Water tanks; End-users; Energy productions; Energy storage system; Energy trading; Lyapunov optimization; Optimisations; Real time optimal control; Renewable energies; Stochastic optimization problems; Storage systems; Optimization"
"https://www.scopus.com/inward/record.uri?eid=2-s2.0-85122834507&doi=10.1016%2fj.segan.2021.100539&partnerID=40&md5=0866c6e1601d4b34da874c3902f69aa7","Bi-level optimization; Electric vehicle parking lot; Electricity market; Optimal bidding; Renewable energy portfolio manager","Decision making; Electric vehicles; Managers; Power markets; Risk management; Stochastic systems; Value engineering; Bi-level optimization; Day ahead market; Electric vehicle parking lot; Energy portfolio; Optimal bidding; Parking lots; Portfolio managers; Renewable energies; Renewable energy portfolio manager; Vehicle parking; Electric industry"
"https://www.scopus.com/inward/record.uri?eid=2-s2.0-85125730133&doi=10.1016%2fj.segan.2022.100656&partnerID=40&md5=9fa26debc23c5ce6c2adbdfee9e02c8a","Dynamic Security Assessment; Low Inertia system; Machine Learning; Power systems operation; Probabilistic security","Machine learning; Case-studies; Dynamic security assessment; Low inertia system; Machine-learning; Power system operations; Probabilistic securities; Probabilistics approach; Real-time dynamics; Safety costs; Safety margin; Dynamical systems"
"https://www.scopus.com/inward/record.uri?eid=2-s2.0-85122644475&doi=10.1016%2fj.segan.2021.100532&partnerID=40&md5=25cbbdb09a8cd37fd9e1f00f9a1da2ab","District heating networks; Electric power networks; Multi-energy systems; Network operation; Uniform marginal pricing","Commerce; Costs; District heating; Electric network analysis; Electric network parameters; Electric power transmission networks; Resource allocation; District heating networks; Efficient resource allocation; Electric power; Electric power networks; Marginal pricing; Multi-energy systems; Network operations; Operational constraints; Redispatch; Uniform marginal pricing; Renewable energy resources"
"https://www.scopus.com/inward/record.uri?eid=2-s2.0-85122628043&doi=10.1016%2fj.segan.2021.100547&partnerID=40&md5=76c1dc7ff8233d9e9881da42713a1e67","Electric vehicle; Extreme weather condition; Multi-objective optimization; Reconfiguration; Resilience","Dynamic models; Electric power transmission networks; Electric vehicles; Energy resources; Genetic algorithms; Meteorology; Smart power grids; Distribution companies; Economic benefits; Energy; Extreme weather conditions; Management IS; Multi-objectives optimization; Optimal operation; Reconfiguration; Resilience; Vehicles managements; Multiobjective optimization"
"https://www.scopus.com/inward/record.uri?eid=2-s2.0-85120179666&doi=10.1016%2fj.segan.2021.100562&partnerID=40&md5=a12ffd8abc723779d3c852ef242ff8a0","Active distribution network (ADN); Distributed generator (DG); Multi-stage supply restoration; Sequential switching operation; Soft open points (SOP)","Computer system recovery; Electric load flow; Outages; Restoration; Sequential switching; Time switches; Active distribution network; Active distributions; Distributed generator; Distributed generators; Multi-stage supply restoration; Multi-stages; Sequential switching operation; Soft open point; Supply restoration; Switching operations; Distributed power generation"
"https://www.scopus.com/inward/record.uri?eid=2-s2.0-85129559725&doi=10.1016%2fj.segan.2022.100712&partnerID=40&md5=2b1c299373ee971506aa0b6b8d5d56d5","Brown's double exponential smoothing; Dynamic state estimation; Power systems; Square-root cubature Kalman filter","Estimation; Functions; Interactive computer systems; Real time systems; State estimation; Brown double exponential smoothing; Double exponential; Dynamic state estimation; Exponential smoothing; Kalman filter technique; Operating condition; Power; Power system; Power system dynamics; Square-root cubature kalman filters; Extended Kalman filters"
"https://www.scopus.com/inward/record.uri?eid=2-s2.0-85124009892&doi=10.1016%2fj.segan.2022.100618&partnerID=40&md5=5dd17cff45bf8f1a7baae963f7400131","Extreme weather condition; Hub energy system; Reconfiguration; Resilient operation; Smart grid","Electric power transmission networks; Embedded systems; Optimization; Outages; Renewable energy resources; Smart power grids; Uncertainty analysis; Electrical grids; Energy systems; Extreme weather conditions; High potential; Hub energy system; Information-gap; Reconfiguration; Resilient operation; Time interval; Uncertain parameters; Decision theory"
"https://www.scopus.com/inward/record.uri?eid=2-s2.0-85126114239&doi=10.1016%2fj.segan.2022.100658&partnerID=40&md5=f71360bca4d9d28945584c5aed5f7758","Affinity propagation; Clustering; Coherency; Frequency; Phasor measurement units; Slow coherency","Clustering algorithms; Matrix algebra; Affinity propagation; Clusterings; Coherency; Distance metrics; Frequency; Power; Power system coherency; Propagation algorithm; Propagation method; Slow coherency; Phasor measurement units"
"https://www.scopus.com/inward/record.uri?eid=2-s2.0-85125008256&doi=10.1016%2fj.segan.2022.100630&partnerID=40&md5=9d5faa36ca0cc329fff1e7cac9f2598c","Demand response; DR programs; Home energy management; Load scheduling; Smart appliances; Smart grid","Convolution; Cost reduction; Electric load management; Electric power transmission networks; Electric power utilization; Energy conservation; Energy management; Energy management systems; Housing; Optimization; Scheduling algorithms; Smart power grids; Convolutional model; Demand response; DR program; Electricity bill; Home energy managements; Load scheduling; Optimization algorithms; Residential loads; Smart appliances; User comforts; Scheduling"
"https://www.scopus.com/inward/record.uri?eid=2-s2.0-85122833032&doi=10.1016%2fj.segan.2021.100544&partnerID=40&md5=67f4c55d4d393bcb30279457e2c372ed","Available transfer capability; Electricity transmission; Ford–Fulkerson​ algorithm; Maximum flow problem","Electric power transmission; Sustainable development; Transmissions; Available transfer capability; Electricity transmission; Energy; Energy flow; Ford–fulkerson​ algorithm; Globalisation; Maximum flow problems; Optimal solutions; Optimisations; Transmission-line; Electric lines"
"https://www.scopus.com/inward/record.uri?eid=2-s2.0-85125244363&doi=10.1016%2fj.segan.2022.100650&partnerID=40&md5=7903fb0e1b7a06dc19112a4da504ed1d","Coastal hotel building; Energy matching; Hybrid wind–wave​ energy; Renewable energy; Wave energy converter; Zero energy building","Computer software; Economics; Gas emissions; Greenhouse gases; Investments; Renewable energy resources; Wave energy conversion; Zero energy buildings; Coastal hotel building; Electrical energy; Energy matching; Hotel building; Hybrid wind; Hybrid wind–wave​ energy; Renewable energies; Wave energy; Wave energy converters; Wind wave; Energy utilization"
"https://www.scopus.com/inward/record.uri?eid=2-s2.0-85122813826&doi=10.1016%2fj.segan.2021.100531&partnerID=40&md5=f675ffc4ae5b7e309f43a195a196b1fd","Photovoltaics; Solar panel cleaning; Solar panel modelling","Dust; Photovoltaic cells; Solar cell arrays; Solar concentrators; Solar power generation; Dust deposition; Dust deposits; Energy; Performance; Photovoltaics; PV arrays; Sand dusts; Solar panel cleaning; Solar panels; Solar-panel modeling; Cleaning"
"https://www.scopus.com/inward/record.uri?eid=2-s2.0-85122805524&doi=10.1016%2fj.segan.2021.100551&partnerID=40&md5=b647e84a46be3a17fa9237334ea1e3c9","Bidding problem; Combined cooling; Distribution network; Heating and Power Systems; Power outage; Service restoration","Cooling; Cooling systems; Restoration; Bidding problem; Combined cooling; Combined cooling heating and power; Heat and power; Heating and power; Heating and power system; Inherent flexibility; Power outage; Restoration project; Service restoration; Outages"
"https://www.scopus.com/inward/record.uri?eid=2-s2.0-85126633347&doi=10.1016%2fj.segan.2022.100680&partnerID=40&md5=4db8f931794f5a67ffdb71213fc186b5","Communication delay; Converter faults; Ensemble classifier; Hybrid microgrid; Observability; Strategic sensor location; Wavelet packet decomposition","Costs; Location; Microgrids; Observability; Wavelet analysis; Wavelet decomposition; Communication delays; Converter faults; Ensemble-classifier; Hybrid microgrid; Microgrid; Optimal sensor locations; Protection schemes; Sensor location; Strategic sensor location; Wavelet Packet Decomposition; Energy resources"
"https://www.scopus.com/inward/record.uri?eid=2-s2.0-85124704969&doi=10.1016%2fj.segan.2022.100638&partnerID=40&md5=637218a0fb79141f068deaa4dd5c1a88","Charging stations; Electric bus; Electric power transmission networks; Electric vehicle aggregators; Long-term planning; Public transportation network","Bus transportation; Buses; Charging (batteries); Electric power transmission; Electric vehicles; Vehicle transmissions; Charging station; Charging station planning; Electric bus; Electric vehicle aggregator; Government IS; High elevation; Long term planning; Planning models; Public transportation; Public transportation networks; Scheduling"
"https://www.scopus.com/inward/record.uri?eid=2-s2.0-85123925905&doi=10.1016%2fj.segan.2022.100612&partnerID=40&md5=25c24ab30b85ff557681df7869e601f6","Co-simulation; IEC61850; MMS; Power system protection; Proxy gateway architecture; Routable-generic object-oriented substation event (R-GOOSE); Simulations; Smart grids","Electric power system protection; Electric power transmission networks; Electric substations; Gateways (computer networks); Planning; Simulation platform; Smart power grids; Transmission control protocol; Cosimulation; Gateway architecture; Generic object oriented sub-station events; Iec-61850; MMS; Power system protection; Proxy gateway architecture; Routable-generic object-oriented substation event; Simulation; Smart grid; Wide area networks"
"https://www.scopus.com/inward/record.uri?eid=2-s2.0-85122676788&doi=10.1016%2fj.segan.2021.100560&partnerID=40&md5=cc7057d99af2d8f40dea006481557312","Controlled islanding; Density-based clustering algorithm; Electrical distance; Frequency stability; MILP; WAMS","Distributed power generation; Electric network parameters; Electric power system stability; Electric power transmission networks; Frequency stability; Integer programming; Nonlinear programming; Stability criteria; Controlled islanding; Density-based clustering algorithms; Electrical distance; Integer Linear Programming; Islanding; Islanding schemes; Mixed integer linear; Mixed-integer linear programming; Objective functions; Wide area measuring system; Clustering algorithms"
"https://www.scopus.com/inward/record.uri?eid=2-s2.0-85121931848&doi=10.1016%2fj.segan.2021.100592&partnerID=40&md5=2b067a09cab6924ada6dde0801789ed8","Data analysis; Maximum power; Monitoring; Photovoltaic (PV); SVM classifier","Classification (of information); Data handling; Support vector machines; Analysis approach; Classification approach; Maximum power; Performance; Photovoltaic; Photovoltaic modules; Photovoltaic performance; Photovoltaic systems; Photovoltaics; Support vector machine classifiers; Photovoltaic cells"
"https://www.scopus.com/inward/record.uri?eid=2-s2.0-85129633107&doi=10.1016%2fj.segan.2022.100726&partnerID=40&md5=1da70bac13e777180418b464d9693ad0","Adequacy; Fully renewable power system; Renewable energy sources; Zonal DC power flow","Electric load flow; Electric power transmission; Adequacy; Case-studies; DC power flow; Economic feasibilities; Feasibility studies; Fully renewable power system; Renewable energy source; Renewable power systems; Sardinia; Zonal DC power flow; Renewable energy resources"
"https://www.scopus.com/inward/record.uri?eid=2-s2.0-85126348936&doi=10.1016%2fj.segan.2022.100678&partnerID=40&md5=974c2e9d51eec2205bf0db1f42d4a252","Clustering algorithm; Probabilistic aggregation; Stability analysis; Wind generation","Electric power system interconnection; Electric power system stability; K-means clustering; Wind; Wind power; Clustering approach; Large-scale power systems; Probabilistic aggregation; Probabilistic clustering; Probabilistics; Stability analyze; Stability assessment; Wind farm; Wind farm models; Wind generation; Electric utilities"
"https://www.scopus.com/inward/record.uri?eid=2-s2.0-85129969682&doi=10.1016%2fj.segan.2022.100734&partnerID=40&md5=c65967540cd8d1cf319cdd47da455b70","Best worst method; Fuzzy set; MARCOS; Multiple attribute group decision-making (MAGDM); Regional distribution network outage loss; Relative entropy","Decision making; Decision support systems; Entropy; Outages; Sensitivity analysis; BAD methods; Best bad method; Measurement of alternative and ranking according to compromize solution; Measurements of; Multiple attribute group decision-making; Multiple-attribute group decision makings; Network outages; Regional distribution; Regional distribution network outage loss; Relative entropy; Geographical distribution"
"https://www.scopus.com/inward/record.uri?eid=2-s2.0-85126751611&doi=10.1016%2fj.segan.2022.100674&partnerID=40&md5=f792bdd14ca0e875b80eedac8b5f7847","Convolutional neural network; Data noise; Imbalanced dataset; Transfer learning; Transient stability prediction","Convolutional neural networks; E-learning; Efficiency; Electric power transmission networks; Forecasting; Learning systems; Stability; Time domain analysis; Transients; Convolutional neural network; Data noise; Data-driven methods; Imbalanced dataset; Learning frameworks; Operation point; Power; Training sets; Transfer learning; Transient stability prediction; Convolution"
"https://www.scopus.com/inward/record.uri?eid=2-s2.0-85120986195&doi=10.1016%2fj.segan.2021.100572&partnerID=40&md5=49c087e4f5520422372af027e42f7bfc","Deep Q Network; Demand-side management; Home area network; Reinforcement learning; Smart grid; User behavior","Automation; Behavioral research; Cost reduction; Deep learning; Demand side management; Digital storage; Electric power transmission networks; Electric utilities; Energy management; Energy utilization; Home networks; Multi agent systems; Smart power grids; Deep Q network; Electricity costs; Energy-consumption; Global energy; Peak to average ratios; Q-learning; Real- time; Research topics; User behaviors; User's preferences; Reinforcement learning"
"https://www.scopus.com/inward/record.uri?eid=2-s2.0-85125932911&doi=10.1016%2fj.segan.2022.100603&partnerID=40&md5=ae0cc555732a99b84226942ca1aebcb3","Electric Vehicle; Li-ion battery; Linear regression; Ridge regression; Savitzky–Golay filter; State of Health","Battery management systems; Forecasting; Fossil fuels; Health; Hybrid vehicles; Ions; Learning systems; Regression analysis; Sustainable development; Accurate prediction; Hybrid framework; Machine learning techniques; Noisy data; Noisy datasets; Prediction and forecasting; Ridge regression; Savitzky-Golay filter; State of health; Statistical learning techniques; Lithium-ion batteries"
"https://www.scopus.com/inward/record.uri?eid=2-s2.0-85123262718&doi=10.1016%2fj.segan.2021.100594&partnerID=40&md5=35a827059cd2e568bea0e6255b33ab9b","Distributed energy resources; Distribution system planning; Flexibility services; Risk assessment","Energy resources; Stochastic systems; Distributed Energy Resources; Distribution networks planning; Distribution system planning; Distribution systems; Flexibility service; Low voltage systems; Planning procedure; Risk-based; Risks assessments; System development; Risk assessment"
"https://www.scopus.com/inward/record.uri?eid=2-s2.0-85125875915&doi=10.1016%2fj.segan.2022.100677&partnerID=40&md5=0e0c13f5f00be004d8df368b705eb9f3","Dynamic security assessment; Load growth direction uncertainty; Load margin; PMU placement; Small-signal stability; Voltage stability","Electric power system stability; Monitoring; Neural networks; Real time systems; Dynamic security assessment; Growth directions; Growth-variation; Load growth; Load growth direction uncertainty; Load margin; Phasor measurement unit placement; Small signal stability; Stability requirements; Uncertainty; Phasor measurement units"
"https://www.scopus.com/inward/record.uri?eid=2-s2.0-85121579850&doi=10.1016%2fj.segan.2021.100584&partnerID=40&md5=5de6979f2ccbcff6ea3a26abea1ea4b8","Mixed-integer linear programming; Optimization; Peer-to-peer energy trading; Responsive demand; Visual interface","Automation; Digital storage; Distributed computer systems; Economic analysis; Energy management systems; Energy transfer; Intelligent buildings; Peer to peer networks; Power markets; Energy trading; Integer Linear Programming; Market structures; Mixed integer linear; Mixed-integer linear programming; Optimisations; Peer to peer; Peer-to-peer energy trading; Responsive demand; Visual Interface; Integer programming"
"https://www.scopus.com/inward/record.uri?eid=2-s2.0-85121006779&doi=10.1016%2fj.segan.2021.100564&partnerID=40&md5=56b6cec96fc01518b2c23a9177297568","Customer engagement; Demand response program; Dynamic distribution network tariffs; Flexibility products; Local flexibility market; Network reinforcement","Commerce; Electric utilities; Reinforcement; Customer engagement; Demand response programs; Distribution levels; Dynamic distribution; Dynamic distribution network tariff; Electricity distribution; Flexibility product; Local flexibility; Local flexibility market; Network reinforcements; Sales"
"https://www.scopus.com/inward/record.uri?eid=2-s2.0-85124511112&doi=10.1016%2fj.segan.2021.100545&partnerID=40&md5=819ce35a85cba3c512b9b0c160694336","Air conditioning system; Dead-band temperature; Heuristic algorithm; Load scheduling; Mixed integer linear programming; Optimization; Power consumption; Smart grid","Compressors; Electric power transmission networks; Electric power utilization; Heuristic algorithms; Integer programming; Scheduling; Scheduling algorithms; Smart power grids; Air conditioning system; Conditioning systems; Dead-band temperature; Deadbands; Heuristics algorithm; Integer Linear Programming; Load scheduling; Mixed integer linear; Mixed integer linear programming; Optimisations; Air conditioning"
"https://www.scopus.com/inward/record.uri?eid=2-s2.0-85124889525&doi=10.1016%2fj.segan.2022.100628&partnerID=40&md5=ee0f29f471f9203b4bed1e3b598edd92","DC optimal power flow; Transmission switching","Cost functions; Electric load flow; Electric power transmission; Heuristic algorithms; Integer programming; Iterative methods; Light transmission; Switching; Binary variables; DC optimal power flow; Feasible regions; Larger networks; Optimal power flows; Optimal transmission; Region-based; Small networks; Time-scales; Transmission switching; Acoustic generators"
"https://www.scopus.com/inward/record.uri?eid=2-s2.0-85123898329&doi=10.1016%2fj.segan.2022.100624&partnerID=40&md5=100f2db7a0bb566bf28ed67bd3e05ccc","Demand response; Electric vehicles; Power system planning; Renewable energy sources","Electric load flow; Electric power distribution; Electric power transmission networks; Genetic algorithms; Investments; Plug-in electric vehicles; Stochastic models; Stochastic programming; Stochastic systems; Vehicle-to-grid; Demand response; Distributed Energy Resources; LV distribution networks; Power systems planning; Programming framework; Renewable energy source; Resources allocation; Stochastic programming model; Two-stage stochastic programming; Vehicle response; Renewable energy resources"
"https://www.scopus.com/inward/record.uri?eid=2-s2.0-85123009829&doi=10.1016%2fj.segan.2022.100608&partnerID=40&md5=bab3ea292229bfb641d314d548e810f0","Adaptive droop method; Cumulant method; Probabilistic power distribution; Truncated versatile distribution; Uncertainty of DGs; Uncertainty of load","Cost reduction; Electric load flow; Probability distributions; Adaptive droop method; Cumulant methods; Distributed generators; Droop method; Power distributions; Probabilistic power distribution; Probabilistics; Truncated versatile distribution; Uncertainty; Uncertainty of distributed generator; Uncertainty of load; Distributed power generation"
"https://www.scopus.com/inward/record.uri?eid=2-s2.0-85122796268&doi=10.1016%2fj.segan.2021.100538&partnerID=40&md5=d208d853fa87886d2b5d1e2f3d407851","Frequency containment reserve; Hydroelectric power generation; Optimal control","Convex optimization; Flow of water; Hydraulic motors; Hydroelectric power plants; Machine components; Rivers; Turbomachine blades; Assets management; Control strategies; Frequency containment reserve; Grid frequency; Hydroelectric power generation; Hydropower plants; Model based controls; Optimal controls; Run of rivers; Setpoints; Hydroelectric power"
"https://www.scopus.com/inward/record.uri?eid=2-s2.0-85124211638&doi=10.1016%2fj.segan.2022.100620&partnerID=40&md5=4d7f40941bec98e5f174db007d58c4d5","Electric vehicle parking; Imbalance indices; Imbalanced distribution network; Intelligent charging planning","Charging (batteries); Commercial vehicles; Electric power distribution; Electric power transmission networks; Electric vehicles; Vehicle-to-grid; Distribution network operators; Electric vehicle charging; Electric vehicle parking; Imbalance index; Imbalanced distribution network; Intelligent charging planning; Parking lots; Power grids; Vehicle parking; Vehicle users; Profitability"
"https://www.scopus.com/inward/record.uri?eid=2-s2.0-85127305968&doi=10.1016%2fj.segan.2022.100706&partnerID=40&md5=c159b659874621f08715bbf8c857e24e","Day ahead scheduling; Distributed generation; Distributed system operators; Distribution storage; Energy management; GUROBI; MATLAB; Micro grid; Planned islanding events; YALMIP","Commerce; Cost effectiveness; Cost reduction; Electric power system control; Electric power transmission networks; Energy management; Energy management systems; Operating costs; Renewable energy resources; Scheduling; Cost effective; Day-ahead scheduling; Distributed system operators; Distribution storage; GUROBI; Market participants; Microgrid; Planned islanding; Planned islanding event; YALMIP; Distributed power generation"
"https://www.scopus.com/inward/record.uri?eid=2-s2.0-85122810698&doi=10.1016%2fj.segan.2021.100536&partnerID=40&md5=dd58f9281aa393560204e309f2eef7f4","Frequency transients; Power imbalances; Power system dynamics; Primary frequency control; System split","Analytical approach; Distributed power; Frequency dynamics; Frequency transients; Power; Power imbalance; Power system dynamics; Primary frequency control; System split; Time offsets; Electric power system control"
